id,user,timestamp,commentText
Ugwnkkha7yeT5R3Vlyp4AaABAg,The Sun,1535207755302,I love your lipstick!
UgztJet56-aqc-hq6hp4AaABAg,I have no name,1535207755305,Ahhh safiya your poor skin. No no no no.
UgyBWTUJuIPxwFzcAMt4AaABAg,livnlf2thefulst,1535207755314,"Interesting, informative, and a fresh idea."
UgwDsRHh0dCr0PUY4hd4AaABAg,Alondra Crazy-Impala67,1535207755316,Her hair is growing so fast!
UgyZyQ7w9DcaqfKvRfN4AaABAg,・Sadako,1535207755321,"What brand is that Venus pallet
I never heard Safiya pronounce her own name??????"
Ugx6shlMerACh34wO114AaABAg,Rock Wolf,1535207755330,I was eating when I was watching this!
Ugyxll3bFh4b15p97jR4AaABAg,UnicornLover 678,1535207755333,We love a scientific sister don’t we.
UgyQenuhxOn_YcPrg4R4AaABAg,helenmirna,1535207755341,You'd need lenses about 400X more powerful than the one you used to see any e. coli. Just saying :)
UgydShEb0YGfUaKu9-J4AaABAg,FayAndLD,1535207755346,"I was hungry before I started watching this... thank you for saving me from late night eating. It was gross yet interesting, and for that, we thank you."
UgwBGnEE9IygjH1nPj14AaABAg,Jemmy 109,1535207755353,You should see if you can grow some bacteria from the real v fake.
UgyP-OeiHoOlylVnOah4AaABAg,Emma Walton,1535207755363,You should try them swatched on paper so you just compare the makeup itself and not against your skin
UgySU5CgS4SofYjw8VJ4AaABAg,- Hugheser,1535207755366,"When I noticed the chemical smell in my makeup, I stopped wearing it.  Your skin takes in all of those toxins like a sponge.  No thanks! :)"
UgzhKNA_M1JsE-fWgOh4AaABAg,Rachel VegetarianFoodies,1535207755377,"Interesting. I'm not into make up so comparing real with fakes just made me back away from it more 😅
Very informative, either way"
Ugwb24kG0p8PcYQsitd4AaABAg,Lexi Hall,1535207755381,The lips on the real lipstick side looked like a brownie. 🤣
Ugx55kIeEY2OwyugA-t4AaABAg,K_BEAUTY 06,1535207759296,OMG what is your lipstick it’s beautiful it’s teal like WHAT
Ugxl58C2bK6jYl8SzD54AaABAg,femalecenobite,1535207759309,"I adore your content and always look forward to your videos, but when I saw the title I hesitated just because I’m not a huge fan of these microscope videos. But yet again, you made a potentially mundane concept so intriguing! I really liked your take on this and I’m super glad you did it!!"
UgzVl3aRd9U0gzbpy954AaABAg,RandiPoitras,1535207759319,"Saf the Science Queen (srry cristine) hahahha also,  “ horeshoe” XD loved it XD❤️🇨🇦"
Ugz3hJd_y04ttptTAIF4AaABAg,Alexandria Nye,1535207759376,"Follow me on Instagram, I have 6 at the moment. Plz send help. 😥 @alexandria_nye"
UgzcnBASpvWo92w08Xp4AaABAg,Tracy Lea Beauty,1535207759382,Your cheeks look like “a frozen lake” LOL 🌺🌺🌺
UgzNy-2bfnOr7yTPcYR4AaABAg,Lila J.,1535207759391,I love you
UgwysHvvAMALsFmC7754AaABAg,Janette R.,1535207759404,And Right Off The Bat
UgyrRh3si2O1z-jKnZp4AaABAg,Charity Talbot,1535207759412,"This was awesome! :D I wish you could find a way to test the makeup for nasty stuff, lol. That would be very interesting!"
UgyXJaPedhJGB1-cxsZ4AaABAg,mockingfay,1535207759423,I like your videos but I can't help but put the playback speed to 1.25x every time I watch them.
UgxeLB3KacLLmq_S-9h4AaABAg,Bella Shay,1535207759430,Instead of Make up it should be fake up😂
UgxHl8fvKxFW5lfbEp54AaABAg,Mariel,1535207759438,"Why buy counterfeit when is so questionable and can harm your skin, hell nah I rather buy elf or wet n wild is cheap and is not as bad. And is not tested on animals might as well. Your skin will thank you."
UgzDmw1CHF1bdpgp6hR4AaABAg,Jaz Intro,1535207759448,When are you starting your own makeup brand thooo?
UgzeJE0pI-TiMA64p1V4AaABAg,satisfactionstudio,1535207759453,YOUR LIPSTICK
Ugx0cnS89oP8okF1nh94AaABAg,The White Wolf,1535207759462,Anastasia...you know it's fake if the box isn't holo.
Ugz61bTIsgLq9cwnf014AaABAg,Sesi Figueroa,1535207759472,"The "" Callejones"" 😂✊"
UgwV_9IBlTpdss8dQGB4AaABAg,Alexander Wings,1535207759482,"🔴🔵🔴🔵🔴🔵🔴🔵🔴🔵🔴🔵🔴🔵🔴🔵🔴🔵🔴🔵🔴🔵🔴🔵🔴🔵🔴🔵
🔵🔴🔵🔴🔵🔴🔵🔴🔵🔴🔵🔴🔵🔴🔵🔴🔵🔴🔵🔴🔵🔴🔵🔴🔵🔴🔵🔴
🔴🔵🔴🔵🔴🔵🔴🔵🔴🔵🔴🔵🔴🔵🔴🔵🔴🔵🔴🔵🔴🔵🔴🔵🔴🔵🔴🔵
🔵🔴🔵🔴🔵🔴🔵🔴🔵🔴🔵🔴🔵🔴🔵🔴🔵🔴🔵🔴🔵🔴🔵🔴🔵🔴🔵🔴
🔴🔵🔴🔵🔴🔵🔴🔵🔴🔵🔴🔵🔴🔵🔴🔵🔴🔵🔴🔵🔴🔵🔴🔵🔴🔵🔴🔵
🔵🔴🔵🔴🔵🔴🔵🔴🔵🔴🔵🔴🔵🔴🔵🔴🔵🔴🔵🔴🔵🔴🔵🔴🔵🔴🔵🔴
🔴🔵🔴🔵🔴🔵🔴🔵🔴🔵🔴🔵🔴🔵🔴🔵🔴🔵🔴🔵🔴🔵🔴🔵🔴🔵🔴🔵
🔵🔴🔵🔴🔵🔴🔵🔴🔵🔴🔵🔴🔵🔴🔵🔴🔵🔴🔵🔴🔵🔴🔵🔴🔵🔴🔵🔴
🔴🔵🔴🔵🔴🔵🔴🔵🔴🔵🔴🔵🔴🔵🔴🔵🔴🔵🔴🔵🔴🔵🔴🔵🔴🔵🔴🔵
🔵🔴🔵🔴🔵🔴🔵🔴🔵🔴🔵🔴🔵🔴🔵🔴🔵🔴🔵🔴🔵🔴🔵🔴🔵🔴🔵🔴
🔴🔵🔴🔵🔴🔵🔴🔵🔴🔵🔴🔵🔴🔵🔴🔵🔴🔵🔴🔵🔴🔵🔴🔵🔴🔵🔴🔵
🔵🔴🔵🔴🔵🔴🔵🔴🔵🔴🔵🔴🔵🔴🔵🔴🔵🔴🔵🔴🔵🔴🔵🔴🔵🔴🔵🔴
🔴🔵🔴🔵🔴🔵🔴🔵🔴🔵🔴🔵🔴🔵🔴🔵🔴🔵🔴🔵🔴🔵🔴🔵🔴🔵🔴🔵
🔵🔴🔵🔴🔵🔴🔵🔴🔵🔴🔵🔴🔵🔴🔵🔴🔵🔴🔵🔴🔵🔴🔵🔴🔵🔴🔵🔴
🔴🔵🔴🔵🔴🔵🔴🔵🔴🔵🔴🔵🔴🔵🔴🔵🔴🔵🔴🔵🔴🔵🔴🔵🔴🔵🔴🔵
🔵🔴🔵🔴🔵🔴🔵🔴🔵🔴🔵🔴🔵🔴🔵🔴🔵🔴🔵🔴🔵🔴🔵🔴🔵🔴🔵🔴
🔴🔵🔴🔵🔴🔵🔴🔵🔴🔵🔴🔵🔴🔵🔴🔵🔴🔵🔴🔵🔴🔵🔴🔵🔴🔵🔴🔵
🔵🔴🔵🔴🔵🔴🔵🔴🔵🔴🔵🔴🔵🔴🔵🔴🔵🔴🔵🔴🔵🔴🔵🔴🔵🔴🔵🔴
🔴🔵🔴🔵🔴🔵🔴🔵🔴🔵🔴🔵🔴🔵🔴🔵🔴🔵🔴🔵🔴🔵🔴🔵🔴🔵🔴🔵
🔵🔴🔵🔴🔵🔴🔵🔴🔵🔴🔵🔴🔵🔴🔵🔴🔵🔴🔵🔴🔵🔴🔵🔴🔵🔴🔵🔴
🔴🔵🔴🔵🔴🔵🔴🔵🔴🔵🔴🔵🔴🔵🔴🔵🔴🔵🔴🔵🔴🔵🔴🔵🔴🔵🔴🔵
🔵🔴🔵🔴🔵🔴🔵🔴🔵🔴🔵🔴🔵🔴🔵🔴🔵🔴🔵🔴🔵🔴🔵🔴🔵🔴🔵🔴
🔴🔵🔴🔵🔴🔵🔴🔵🔴🔵🔴🔵🔴🔵🔴🔵🔴🔵🔴🔵🔴🔵🔴🔵🔴🔵🔴🔵
🔵🔴🔵🔴🔵🔴🔵🔴🔵🔴🔵🔴🔵🔴🔵🔴🔵🔴🔵🔴🔵🔴🔵🔴🔵🔴🔵🔴
Like if you can see purple 💜👍"
Ugwj7rZn67atx_BuMHJ4AaABAg,ffliberty,1535207759491,not a very interesting video
Ugz_x29cbT0O51qdqMx4AaABAg,Little .V,1535207759502,I would rather buy cheap drugstore makeup (that actually looks nice and not to mention safe) than fake makeup 💀
UgwoHTS5up24i2RO5h14AaABAg,Nor,1535207759512,Safiya the science kween
Ugxk1SO0SopxfU1ad5h4AaABAg,Cate Huguet,1535207759517,boring
UgxBdD7ohdRGym9yYpF4AaABAg,Super crafty,1535207764514,"Love you safe...youraman personality is so cool..

Btw I am a small youtuber"
UgwIY6wf5YVM7r-1mXt4AaABAg,Rumi Das,1535207764525,Hello
Ugy-Q-CjXM52wPl5Ctp4AaABAg,ShirsVoice,1535207764528,"I love when she says ""Alright"" its so soothing. Is it just me?"
Ugzcx57GIznoW3qNH5V4AaABAg,hana Brook,1535207764540,Girl I love you but hun... do ur eyebrows
UgwkLJ5GIr4NToz53qJ4AaABAg,yara hamed,1535207764550,"tries not to gag im actually going to gag when you put the microscope on your skin, why did I bother watching this video"
Ugx618h5aYeytbqfAhp4AaABAg,Kawaii Kookie,1535207764561,When i saw the eyeshadow named peaches and cream it instantly reminded me of namjoons part of blood sweat and tears
Ugx3Kdr0oKeabwnps054AaABAg,Isabel Sanchez,1535207764573,Love the cards against humanity box
Ugxkx5cR0_N1QOb-yCF4AaABAg,Erika Asefi,1535207764579,When she did a really zoomed close up of the foundations I was literally a bout to die it was so disgusting
UgzRoyCyGK1IW-y0NqZ4AaABAg,Krizeah's Crown,1535207764586,😇
UgxhbNNGEnqzUbXtt_14AaABAg,Deana Marie McCabe,1535207764596,"""Nightmare Before Pinkeye"" lmfao 😂😂😂😂😂"
UgxPqO__kitqzDi-33l4AaABAg,KaKathuWa,1535207764608,@safiyanygaard can you do a video where you send these makeup to a lab test to see what's actually in the ingredient and how it will affect  or damage our skin?
UgzeSf4oI_za-mifhNd4AaABAg,Queen Queer,1535207764620,I’m so grossed out bro... like all of the hairrr 🤮
UgwZLdiGCmgm02OtT7J4AaABAg,spidermiss2426,1535207764631,I was hoping you would view the applicator of the fake kylie lip before you applied it to your lips.
UgxlwNokxEn2GRa7dqN4AaABAg,PastelPeppermint,1535207764643,#TINASCOPE
UgzSelSCy7BwcK0uZ2d4AaABAg,Angela Campbell,1535207764648,"“Purple horeshoe” 🤗 awesome. At first I thought that is how they spelled it on the palette but nope, got a good giggle out of it."
UgySAjihV0a0G-Pq0tN4AaABAg,Lana H,1535207764659,Honey is the new Audible lol
UgwTxipoHFXZGN9D_Al4AaABAg,Grease Monkey,1535207764672,Butt scrub ok not going to ask
Ugwu7Zo2LNfwF5szmcJ4AaABAg,Esmeralda Blanco,1535207764692,Wow!!! Loved loved loved this!!! Always entertaining and always so creative!
Ugy24WA7GlR6zSbPANl4AaABAg,Abby Schneider,1535207764702,"safiya, maybe this is too personal but were you ever in speech therapy b/c u super over annunciate"
UgyOM5fgPok2yVGnwFl4AaABAg,Abrar Amralla,1535207764713,please throw the fake ones away and dont hoard them
UgzrOyBLw763GeZyrMF4AaABAg,Mindy B,1535207777434,When I was watching from 17:38 on my fiance happens to walk in room and he was like what in the world are you watching 🤣
Ugzz4ieD1vkPK4ukzoJ4AaABAg,JkIt'sKay,1535207777446,why aren't they calling it fake up??
Ugzq_7alIuhxM538oqV4AaABAg,kize32,1535207777454,Not my proudest fap
Ugx7QlOSYl5kKfu-Re54AaABAg,Robyn Peter,1535207777462,You should do a dupes vs real version of this video
Ugx-4ukn_QDZa3eecoZ4AaABAg,Kylie Lode,1535207777474,Next you should get all of those fake makeups tested for the real ingredients and any bacteria that’s also there
UgxfOvyh0C9zTT50GnB4AaABAg,Rhiannon May,1535207777487,Yo thanks for crediting your inspirations !!! That’s super cool of you. :)
UgxCRlyv6dXgnrTPO_14AaABAg,Jessica Louca,1535207777499,You should do a video of getting a dermaplane treatment it will get rid of all the 🍑 peach fuzz and leave your skin glowing
UgxINcqzgrTZcpSCKrt4AaABAg,J Alvarez,1535207777511,Hey isnt honey sponsoring Mr Beast 😑😐
Ugyk7JZ-hQYU7mu_9CZ4AaABAg,Impatient Loiterer,1535207777523,wow this was literally so good
UgzbEM_nFIMLfrwppLJ4AaABAg,Alyssa Delgado,1535207777536,You should get an eyelash lift
UgzqMvhIEeveymFTWKh4AaABAg,Ily Frost,1535207777550,"""It's like looking into the eye of a giant squid"" Tyler is such a Prince Charming!"
Ugy2bpjxTw4nPuPOzzN4AaABAg,Weirdness,1535207777569,"Safiya does not care what ppl think, and I LOVE that about her! <3"
Ugwa1RShFKfiyNP-1sx4AaABAg,Björnkram,1535207777581,You're so brave. i would not have put that fake stuff around any of my orifices after hearing what could be festering in there.
UgyOCbddJnnWAdOkVd14AaABAg,Andrea Louise,1535207777595,"""Like the Nightmare Before Pink Eye?"""
UgyGq4TilTgi7Q8pMT94AaABAg,Estella LeBlanc,1535207777606,SAAAAFFFF IS A LIZZARD (sing this)
UgxXYcZV-fSHdg2xvEx4AaABAg,Rach Rules,1535207777613,did anyone else wanna projectile vomit everytime she put the microscope to her skin? craAAAZY man
Ugyasez6DvmICnSAEDV4AaABAg,Kayde Blake,1535207777620,Honey I a way to save money
UgyRlJc9G_ZZTxiwwTZ4AaABAg,Laura Jean,1535207777630,Cool video! Thanks Saf.
UgzgwFkd0pucUiuUwp94AaABAg,Honey Webb,1535207777640,You’re welcome for me sponsoring this
Ugwifx-sZ56IcPW_uGJ4AaABAg,Becca the Bargainer,1535207777649,You are so hilarious!!! 😁
UgzBp1wqAqBdalgTulZ4AaABAg,Jumaanh Abdelkader,1535207778564,Saf ya speller horseshoe wrong you silly goose
UgzZOMWP7H_CpuE0HVp4AaABAg,rat,1535207778575,why does the “fake” side in the thumbnail look like beans
Ugz8cuhUQuE9V2q7NuF4AaABAg,M.A.G. Visions,1535207778587,This is cool and scary
UgyVnECYSBULoCjjNVB4AaABAg,xxaesthetic msp,1535207778598,"I am so surprised...
I wonder if the makeup I use is fake! O_O"
UgxREU1Vd9GwfrLGnLN4AaABAg,Zombie Kitten,1535207778601,Trendingggggg
Ugxak9gXBQRSDZAJj2x4AaABAg,UglyPanther,1535207778612,my typrophobia.
Ugx7hKrO_12L0BxNuFV4AaABAg,Back Pack,1535207778623,Ahh i hate microscope videos they freak me out but i love saf so i have to watch
UgxuXaOYYU5507mwvCR4AaABAg,Arman Baghgedjian,1535207778633,OMG yesssssss!I love when you try something a little different!But the thumbnail of the video does not look like a saf thumbnailButtscrub is a thing?i need that!!!saf looks so pretty without makup!
Ugwfo7uJgB4qWuEjy_h4AaABAg,gz.natalie,1535207778642,nikkie tutorials has to try this
UgxPQyh2N0JVAwHfhD54AaABAg,Aoirsae,1535207778647,5:14 text says your microscope can zoom 1600x but there's no way that thing zooms so close.  At 1000x you can see nuclei of cells...
UgzbzdMNZDMYHmTJTg94AaABAg,justaperson,1535207778655,I don’t understand why they put fucking animal shit/urine in the fake makeup lol I get the cheap chemicals because you’re trying to make as much profit as possible but wtf does animal shit add to the makeup? Haha
UgzqB8cV5-Pewc7sFbx4AaABAg,Ella Maternick,1535207778665,You should make a highlighter franken-makeup to add to your collection!!
UgyAcL5ECMf_OGKJt294AaABAg,Nightmear Wolf,1535207778672,"I watched this as I took a bite out of my burger....

I threw it right back up..."
UgzavxIDE05OHyXramV4AaABAg,Jami,1535207778677,my only takeaway is skin is disgusting
UgwZ7GuPPoYkbKxcmsF4AaABAg,kelly McGregor,1535207778701,"If you want to do good bad science go to a toxicology lab and get the fakes tested for lead, and other fun stuff. You could also swab a few Petri dishes with fresh fake, fresh real and a well lived make up. I would guess the fake make up would have more bacteria than the real due to less stringent sanitary protocols."
Ugzk3bsiPG7EKzUNKQ54AaABAg,Shiba cares what you think,1535207778717,7:57 real be lookin like a whole damm patio
UgyMIzwhXtr9PnnQcvp4AaABAg,Yasmien Tumambing,1535207778738,"Try to make bad makeup science using fake products 
Like if you agree 😊😊"
Ugw0JstuXAWbJzPF0IR4AaABAg,I like the rain,1535207778761,"Jesus Christ,you have some balls to be doing this. With all of the toxic things found in fake makeup,I wouldn’t even want it to be near me"
UgxvDvyNBh5Wq0Gwc2d4AaABAg,GamerRey,1535207778772,Do a vid destroying the fake makeup!!!!
Ugw1UfBx1qQmKGIiYVd4AaABAg,Emily A.,1535207778784,This was disturbing in every way.
UgxDVmpOkRv_IqtWGSt4AaABAg,Sofia Gilmore,1535207782910,Safiya u are so close to 6 million
UgxAseAJ8A_TcWiuqhh4AaABAg,Bell Lecca,1535207782921,I have an urge to see my pimples thru that microscope 😂😩
Ugy_42ieD3_xVNgAGfR4AaABAg,P Mac,1535207782933,"I understand the appeal of this video, but on a serious note--this is so disappointing watching you put this fake makeup on. Knowing you have so many young watchers, this is such a bad example to show everyone. I know you mentioned your ""disclaimer"" in the beginning but you still actually put your hands and face in this makeup throughout the entire video. Truly disappointed in this and hope you don't act so stupid next time."
UgwbrX2Wccv_FYEiXyl4AaABAg,Chloe Vlogs,1535207782960,Wow the differences are very surprising
Ugy9wFmfqvh1znOK_EN4AaABAg,Faygo_cupcake fashion,1535207782977,The circle on safs face
Ugy8vOKA5v-ppDIBqBV4AaABAg,Gianna Fruit,1535207782992,I love the cards against humanity game
Ugx-KndqfVentZ6vPUt4AaABAg,RyRa,1535207783017,Don’t put those things on your face!!!! Omg no
UgxVkiuLFPQY5vcDD8R4AaABAg,Jackie Bakelaar,1535207783028,safiya: combines two really popular youtube videos and puts it into one . ME: WHY HAS NO ONE ELSE REACHED THIS LEVEL OF GENIUS ON YOUTUBE YET C'MON PEOPLE?!... OH YEA SAF IS GREAT.
Ugz4fQkEDs6XQ12646p4AaABAg,Yessenia,1535207783040,gotta promote my girlie heyitsfeiii for making a video like this but with face cleaners!
UgyyWD1nN7oOcUaN9BJ4AaABAg,Katelyn Wooten,1535207783053,the thing about partnerships with honey is i dont know which creator to support :-///
Ugwhit2brippRlJUOp94AaABAg,Jayley Bruh,1535207783066,45 on trending YOU GO GIRL
UgyghAMh2nnPOfx9vjl4AaABAg,Brooklet Noelle,1535207783080,Oof this must've been a hard video to edit
UgzQSSqlCa8rrKS7XPV4AaABAg,Shadow Walker,1535207783101,Waittt...is that the teal ish color she made in her mixing up the colors in the one lipstick pallet??
UgwcwsxcNYWr_Wxx3nF4AaABAg,Ju lia,1535207783113,"""onwards buttercup! there's f**kery to spread"""
UgwQZSV7XlGgdUM8KD54AaABAg,Geordine Fasiki,1535207783137,That why  I don’t like foundations 😭😭😭 doesn’t matter if it’s fake or real foundation will destroy your skin
UgyGUq4HNepaQ8gS23t4AaABAg,Charlene Gibson,1535207783148,Damn once it got to the foundation i was too grossed out to watch more
UgxPAQ682NGFZhtO62h4AaABAg,Sam Temple,1535207783161,11:51 When Santa finds a cookie from last year in his beard.
UgzdhOkwl0kW45sTxbd4AaABAg,kitsie,1535207783178,my favorite part of every Safiyah video: the “alright~” after every jump cut 😹
Ugy-KJHxj2ak_ADObTl4AaABAg,ツjerdynn,1535207783190,i fell asleep 8 minutes in and all my dreams were about me as a ghost trying to find someone watching it so i could see what happens
UgwayBqNoUJdaQn9Sh14AaABAg,Alicia Torres,1535207783205,Any updates on the pink eye 👀😭😂🧡
Ugw0DswV8DF5wYfJb6x4AaABAg,Amanda Roesie,1535207788319,It would be cool to see what skin would look like under the microscope after one of those facials with a razor that takes off the hair and dead skin
UgxrQjIRf5ACgC2TvFB4AaABAg,Bianca Angel,1535207788332,You should do a frankstain makeup in the microscope video!
UgyqHwyjqmIiT-r2jph4AaABAg,Your Best Nightmare,1535207788354,“And animal feces.. yUM”
UgzmiJrv9zNAoaGr48x4AaABAg,Alexandra Adams,1535207788368,Heyyy safia!!!😅😄😘😍😘😙😥
Ugyv__oqLoNJo5-TWvJ4AaABAg,PreciousBundlesNursrey,1535207788379,I can tell this is going to be a trend saf.
UgxI6f_GX4as72p4IqN4AaABAg,Chloe Brand,1535207788384,That's was kinda weird but I wear makeup sooooo ya good video
Ugw8vgmqT_lKJYpz0rJ4AaABAg,Kiara Mackenzie,1535207788394,"i absolutely don’t like safiya’s eyebrows, yes i am subscribed to her and watch her videos but her eyebrows always distract me"
UgxaaDzArHeKMCxLnHN4AaABAg,Denise McAllister,1535207788409,Lol I love your videos
Ugz0ZAm6CJWZeQeGoJ94AaABAg,Raisa Malik,1535207788420,PLEASE PLEASE PLEASE do a video of a full face of children's make up.
UgxPINyJCx5ks-Daspt4AaABAg,Honey Savage,1535207788442,My name is Honey
UgyFV0O7RYF8w98O_TB4AaABAg,Bea Flores,1535207788453,i thought heyitsfeiii started the trend
UgwYSZ3SYqlk-QAG3zp4AaABAg,Dusk,1535207788464,Looking at the eyes pains me
UgzRUgMeG7gd5bift7Z4AaABAg,Charlie Courreges,1535207788469,can u look at the frankinmakeup under a scope?
UgyT4My4qbtsczZBiU94AaABAg,Dazzle shoe gaming,1535207788487,What abot the cover eviex dupe that u have
UgwO1TEv1x43kIJaRwh4AaABAg,samaira saini,1535207788492,🍯 honey....save me some money
Ugw8WS_32VMmCvVFdCV4AaABAg,Clorox Bleach,1535207788513,i would rather buy local made
UgwEn12p_NVWbGhnlrt4AaABAg,han nie,1535207788530,"I remembered a girl from school 2 years ago bragging about her Kylie Lipkit 😂 turns out, it's that lipstick Safiya is using and it's fake 😂😂😂 like that girls personality 😂"
UgzZjyTW2BhwJyaShGt4AaABAg,Bob TheBuilder,1535207788548,"I see that makeup organization video really paid off! Loving the blue lipstick you’re wearing Saf, I look forward to seeing you try more different makeup colors! :) (Since you seem to have quite a lot haha)"
UgylGsvMBF9Hgg1ixRR4AaABAg,Crystal Ramsey,1535207788554,"Oh god, Saf! You're brace!! lol. Thank you for ""taking the bullet"" for us😘"
UgzohU-m08Q_dZE-eRF4AaABAg,Myla B,1535207788570,Would you believe me if i said those tiny spots on your eyelashes were bugs?
UgzFVPB79opLYcX__Lp4AaABAg,KayRocker,1535207793712,At least Safiya doesn't use thumbnails in a major clickbait style. She could have pretended to find a living thing on her face haha
UgzhCMBs4fr53d74e614AaABAg,Mr Fenty,1535207793725,BEWARE OF HONEY! The same night I installed it my eBay account got hacked and started buying designer handbags!
Ugw1gZ_wPrtz1JV0E8J4AaABAg,Hayley Lijewski,1535207793748,Safiya back at it again with creative videos
Ugz_KNg_u39z2GTI9TN4AaABAg,Hannah Canute,1535207793759,"I have a suspicion that the glitter in the fake makeup was not safe to use on eyes, and that’s why it’s so chunky"
Ugx5yEQdtIpRgLCEKl14AaABAg,Anaya Ryan,1535207793770,Today is my birthday thank you SN 🎁🎂🎉🎊
UgxsY1fY7_dlf3CDipF4AaABAg,Wyvrenne MacDaniels,1535207793784,Find the BEST BLACK lip covering please!
UgwDGuscQz3S_YVSuWd4AaABAg,Sincerelyy Eccentric,1535207793796,I think a lot of these are just replicating the packaging not the actual product.
Ugxcli6yrs9gP6Ay0Sx4AaABAg,simply summerlogical •,1535207793812,I love how she avoided using Manny's video as an example in the beginning
UgxLYKN1y-ST7OOlSkZ4AaABAg,taehyung's boxy smile,1535207793834,"3:41 peaches and cream ,sweeter than sweet,chocolate cheeks and chocolate wings"
UgxGyAV7H37LYFI5Ckx4AaABAg,Brently Dixon,1535207793838,I HAD TO QUIT WATCHING DURING YHE FOUNDATION BRO THATS GROSS
UgxmadCHPmpReVtTN9F4AaABAg,Ariel Clark-Berroth,1535207793849,THAT FAKE KYLIE. 👀
Ugyg_sg5Jq_ky5Ee08p4AaABAg,Jada Mosby,1535207793859,I was waaaaay more into this video than I should’ve been.
UgyGqdlgDpXf-Ol1Arx4AaABAg,Emily Draper,1535207793870,"Saf: ""I look like a lizard person""
Me: *Mark Zuckerberg 😂"
UgzPr41LsDJHBTZ1FoB4AaABAg,Noora Mohammad,1535207793882,"WARNING
DO NOT WATCH WHILST EATING ,HUNGRY OR AFTER EATING"
Ugw_PbNoivxG2TcP4E54AaABAg,Tamzin Carter,1535207793893,Any fob fans instantly say am I more than you bargained for when she said that’s more than I bargained for ????
UgzjCVJa00WhUwlzhzV4AaABAg,Lauren Davenport,1535207793904,How about a close up of your skin after using different kinds of makeup remover? Would be interesting to see how much makeup was left each time!
Ugyqu1fNZZpNFzk5rOd4AaABAg,JesseJesso,1535207793916,"This was so interesting!!! and quite scary, the entire time I was thinking omg i hope you take off the fake make up soon so you won't get any skin irritation ... uughhn"
Ugx854VsVlcWPH7lgF94AaABAg,Raven Starr22,1535207793927,"The fake looks more matt than the real make up



PEACHES AND CREAM
SWEETER THAN SWEET
CHOCOLATE CHEEKS AND CHOCOLATE WINGS



SRRY, I FOUND THE OPERTUNITY AND TOOK IT"
Ugy6Hak0-oCvaaSA02V4AaABAg,dreadnoctus,1535207793930,I know I'm not the only one feeling personally insulted by all these microscope videos
Ugw5QzILGe2z0R_yraR4AaABAg,민 소금,1535207793945,"This was both nauseating, and fascinating."
Ugz8rk21C02QRXcMKvh4AaABAg,shannon kaplan,1535207799047,But I'm surprised that she can pull off that look with fake makeup but still look so good omg I wish I was you
UgyJXLIOFwSczqH4E0h4AaABAg,Alejandro M.A,1535207799058,Obviously the package of the real highlight is holo and the fake not
UgwEcg06OfIpXUBEgi54AaABAg,Park Jimin Asthetic,1535207799061,"Peaches and cream sweeter than sweet


I’m sorry but once I saw it I had to you would know if you are a ARMY from Bts :3"
UgzATQrDAMHleJ17qaJ4AaABAg,EmilyDoesMakeup,1535207799072,"honestly, putting fake makeup with potential faeces in it on ur face? especially the mascara? brave as fuck. next time you could try to do it as a blind experiment where you don't know which is real & which is fake. that'd be way more scientific  & there'd be no bias for you based on knowing which one was real! why am i taking this seriously like it's a real science thing? i don't know but whatever."
UgxzjZQ1VJv7g1Kbokp4AaABAg,Tonia M,1535207799083,@makeupbypita
Ugz_-58KB1UeOSIMm2F4AaABAg,GalaxyWolfGamer,1535207799120,how does her skin never break out after doing these videos?!
Ugw4JhyjLTd53X1QkRl4AaABAg,babyhols666,1535207799132,NIGHTMARE BEFORE PINK EYE
Ugxymb2aSHM3vL3DItp4AaABAg,Kartoffel,1535207799144,The mirror is just stood on cards against humanity
UgyPjTbF4wVFUa2yWfp4AaABAg,Zineb Amrani Joutei,1535207799154,You're such a creative person you always came with  original ideas love your channel and keep up The good work ❤
Ugx1czBds0csBACQ66F4AaABAg,Hildy van Hefeweizen,1535207799167,"I remember buying my first MAC at a Macy's but thinking it was a fake. The smell...and it was like using a crayon. Well, I learned to love that formula (retro matte-Ruby Woo) but they still smell like cheap vanilla to me."
UgwteRJuSrZGKo50Cj94AaABAg,Ivy Elizabeth Music,1535207799178,Such a smart idea!
UgyeFbkCyg4Bwa3cHR94AaABAg,Hannah Houston,1535207799189,"Why did both texts say Purple Horeshoe at 13:38? Also, this really grossed me out and I was eating food while watching. I regret that."
Ugx2Ti_TdDH6dKNsXN94AaABAg,Zira Angel,1535207799199,the fake that you're more worried about poo than the actually poisonous things makes me uncomfortale
UgzUTSovQQi8JHUnuWd4AaABAg,An_insane_crybaby Edits,1535207799207,Right off the bat
UgzMVFMu3fhwxXAIYCx4AaABAg,Audrey Nguyen,1535207799221,"""horeshoe"""
UgwCwDoFJBocY7U4bBh4AaABAg,Phoenix ••••,1535207799229,“Purple horeshoe” 13:30
UgxHRORy-VDo24odxvN4AaABAg,Aleigha Smith,1535207799239,Hahaha terrifying.. but ONE HELL OF A THUMBNAIL 😂😂😂
UgyhM3R0cDl_pBAFjGx4AaABAg,Ashley Lynne,1535207799249,Homey is the ish.
UgxVyYPi6oI-4-FmDZp4AaABAg,nochu_ comethru,1535207799260,4:12 PEACHES AND CREAM SWEETER THAN SWEET CHOCOLATE CHEEKS AND CHOCOLATE WINGS
