id,user,timestamp,commentText
Ugx_dHM2ShXCX_pIdTl4AaABAg,Skippy Meer,1535208094338,Watch this https://youtu.be/HyE5fGGvKag
UgyrLyafuLQ-Ph9FCm54AaABAg,charly mathews,1535208094343,so i can try it out
UgzhrCBx4trihq7t0D54AaABAg,AbsolutChibi,1535208094354,Butt scrub..?
UgyY32LRzI3Kd1QyaUR4AaABAg,Clarice Victor,1535208094365,Download Quidd! Beast was here
UgwnOaApF25FJCp8zdl4AaABAg,THE CHLOBO,1535208094368,Christine the science quee-... wait wrong channel .... safiya the science queen
UgzF7S7c3d7kb6LsZC14AaABAg,charly mathews,1535208094379,hey i am trying to start a youtube channel of my own i was just wondering what video editor you use.
UgzzHqwTyXwIwaWX30p4AaABAg,Jess_Marie_G,1535208097413,"""Like the Nightmare Before Pink Eye?""  Tyler never disappoints with the zingers!"
Ugxfl4s3vcnWbftNLEZ4AaABAg,Brittany Camp,1535208097416,Why is this even a thing? They are different products... Of course they are going to look different close up. What was the point of this?
UgzGQgvOfL8XGH75Lyp4AaABAg,May Simpson,1535208097429,Oof Me
UgyV1PT5gzsowEizpOR4AaABAg,Emily R,1535208097439,Mad respect for you risking your face for makeup science ✊🏻
UgzFIhaz2kIAOluIo-h4AaABAg,Senpai Jecho,1535208097449,"Saf being brave enough to test fake makeup, what a queen"
Ugy0LY9sRFIbmafv8Tp4AaABAg,Clayton Shannon,1535208097461,"Haha I love these types of videos! there’s just something kind of fun to see skin so close. If you’re bored, or needing a video idea, would you consider shaving, or popping a pimple under a microscope? Sending all my love from the 19th state, Indiana~~•~*~***~•🌽"
UgzmQUqTHyTHW1jCnbd4AaABAg,aud,1535208097472,a science kween
Ugz_Wqep18RoMgS0EJJ4AaABAg,η,1535208097484,13:23 gotta love some horeshoe
UgyocnKIicbv92-ofHJ4AaABAg,Jasmine Walls,1535208097496,Where did you get that lip color?!?!
Ugydlsscj2RowjmUltR4AaABAg,Victoria Hughes,1535208097508,wow that kylie lip kit looked like 100 layers of lipstick
UgxguRTmsdddYJ1_vEd4AaABAg,Rubaab Fatimah,1535208097518,Yassssss
UgzBXYjWAULXRTcQmBF4AaABAg,Ultronix Extreme,1535208097522,"Just imagine if a guru was saying trash about Fenty beauty foundation, but they actually got a fake and think it's real. I think thats mostly the problem."
Ugyz7PHDmA2zJtpqVBV4AaABAg,Michelle Leung,1535208097532,Yay! Tina!!!! 😁
UgwTfBNTcEtcf4p7F_14AaABAg,Talia Chase,1535208097543,That’s one kickass lip color on you Saf!
UgyNUveEVgG_F_J68Lp4AaABAg,Mex Kern,1535208097555,We love a credit qween
UgwMr1BErCLwOHbGDQR4AaABAg,Lemon Snow,1535208097564,This is gross but fascinating
UgxdsIMrbRSbbCQlnj54AaABAg,Kulsoom Shoukat,1535208097569,I have been refreshing my home page to see a new video from safiya. And finally😭😭
UgzoGQ7x8y6zGGfWkfd4AaABAg,TheSamm092,1535208097579,Make sure you throw away the beauty blenders that touched the fakes!
Ugw1UK9iXR-eA93WDnh4AaABAg,Liah Marquez,1535208097589,"""Freudian slip of the brush""! Lol!
🤣🤣🤣"
Ugzphgr3oazQ1aJTx6t4AaABAg,Ladylolo,1535208097591,Say crack again
UgxNkrCPd70n8plYeA14AaABAg,imratehear,1535208103438,I’m so glad you left buzz feed your creativity is so original I’m glad your free to create your own stuff
UgyvbxznVkbgn-euQOp4AaABAg,kyun sun,1535208103448,I was eating while watching this 😐😳😳
UgxJlRIxNE5ufJussnt4AaABAg,Mars P.,1535208103452,please add captions to your videos
UgyY69T9zovV9Oel87B4AaABAg,Đặng Minh Thành,1535208103462,i cant watch
UgxpA_n8G8R3O6QrVGh4AaABAg,I should kill myself,1535208103466,Does this make anyone else feel a bit uncomfortable? 😅
UgyJBA1kCZa9FWXlFkx4AaABAg,Summi Yau,1535208103480,is it just me or was the 'alright' at 7:14 the cutest thing I've ever heard
UgyK6WQCFrtS8XA_u094AaABAg,01.59am _,1535208103488,watching while eating m&m's...yummy! haha
UgyMBCAo5EEQNVAYCU54AaABAg,Maddux PHILLIPS,1535208103504,if it smells like butter bear then it’s a good lipstick
UgzmwZphgMJYEYv38r94AaABAg,Panda22 Prusse,1535208103510,Work the green lipstick sister!!
UgwyKmPJlJKR10YLrG14AaABAg,Navaya B.-D.,1535208103516,"I wanna know if you where to do a full face of make up with brushes and a beauty blender, to then cut it in half but look at it using the microscope?"
UgzhMApN_M31gpIAqW54AaABAg,Kitty Rainbow,1535208103523,Hi friend ur cool
Ugx-WMHsKpJPxbINi2Z4AaABAg,Katelyn Loves Bunnies,1535208103532,We love a science sister
Ugzt9knWPG-Z8C9QCz14AaABAg,Aliya Gill,1535208103544,I can watch her videos allll dayy
UgwNWcl4EXqMMgP2Az14AaABAg,Viktor Chmiel,1535208103549,"Sometimes these fake make ups aren't necessarily fake, they might be factory rejects that factory workers had refused to throw away illegally. After all most of our beloved makeup brands are produced in China anyway."
UgyQr51mH-iJkhhOANB4AaABAg,Josh Mason,1535208103559,I pay for premium to avoid ads- I hate when you tubers includes promos.  I get it they have to get paid but I pay so I don't have to. now I don't even want to watch it
UgzLuddWY94WMziRq6F4AaABAg,Hannah,1535208103564,Oh nooo why did you choose nude lipstick💩💩💩
Ugx5o6PxEFlpPx29YMV4AaABAg,Savannah Beal,1535208103573,You should do a “I buy the first five things from Pinterest ads”
UgxeCmKa2fe3fgQxz3h4AaABAg,Sam&Colby,1535208103582,I’m late bc I didn’t get a notification before now 😫😱😭❤️
UgyrYX3WQp9MO7ArZlV4AaABAg,Sallie - the joyful potato,1535208103594,Late squad where you at?!?!
UgxxVvPE3wX937ikcH14AaABAg,Epic Gamer737,1535208103604,lipstick Bruce is that you have u come agian?
UgxChnvDp4UhdDpiQeV4AaABAg,Ecko Jackson,1535208107481,i feel like the real highlighter looks like unicorn skin......................... anyone? no okay i'll go
UgwVPnyDKaB10dP0df14AaABAg,Hanan Balushi,1535208107484,I SMASHED all the buttons
UgzkXDKzYwnaZ-E1XaR4AaABAg,Laura AK,1535208107493,Oh oh you should look at your Frankenmakeup under a microscope!
Ugxn4jt85y1Yv1bwHmt4AaABAg,420 subscribers with no videos challenge,1535208107496,i love that at one point in editing you guys were like ''we should really put in a disclamer saying what the butthole is''
Ugzyk_TafswYve1LKUZ4AaABAg,juhlizza,1535208107506,I’ve received that fake “better than sex” mascara before... and yeah it smells AWFUL. It smells like oil paints..
UgzyF3m10TBqYNUo1xd4AaABAg,Mexi Nail,1535208107513,i would love to see the residues left  by both real and fake makeup!
UgwN_d6-OhNMk7Ys8494AaABAg,乇乂ㄒ尺卂 ㄒ卄丨匚匚,1535208107519,I’m always so ridiculously excited when I see a new video from Saf!!
Ugy3Pbn0yMDQsCVP5RR4AaABAg,bluiiy,1535208107529,"Do ""what a full day of wearing makeup looks like under a microscope""!"
Ugzw_dhlOeIcfbpFmfF4AaABAg,BCJH Characters,1535208107539,"I love your vids, Saf"
UgyLmE8IxufbzPd2KUZ4AaABAg,VictoryanBladeFair,1535208107542,0:13 accidentally pausing at the right time
Ugx6segUSIEJPBZVQpF4AaABAg,Aminah ox,1535208107552,i love you and your videos! all your videos are so unique and different!!😇💕
Ugx8DbcbhfL_txJFDnB4AaABAg,Em Ortega,1535208107555,I reaaaaally like your videos 😍
Ugx9u7MfuB912rtNeJh4AaABAg,Laraib Hanif,1535208107563,Am I the only one who thinks fake makeup looks better? Oh ok.
UgzrZOzo98DW2vAA9Wd4AaABAg,Maliha,1535208107568,Love you so much Safiya and all your amazing videos!
UgwyoEZDDoRypO2zSk94AaABAg,Yi Xin Wang,1535208107577,"Honestly, I don’t think it’s gross"
Ugx0hm_-2ThbCw4TZP54AaABAg,Precious Mangalino,1535208107587,Early squad hahah
UgytCvgmaexzhbIieJR4AaABAg,MaqṨ,1535208107592,"I'm cheap, broke, and a student. I buy makeup on wish unironically. I am coming out"
UgxKpLw4rQA0I4SscX94AaABAg,420 subscribers with no videos challenge,1535208107598,:dead serious speaks about ''butthole area'':
UgyjLM7_A2P7KOosPcJ4AaABAg,Irina Tsay,1535208107603,I want to buy this and inspect my blackheads lol
Ugz3FuorWcCqHJcZs294AaABAg,Ginger Ninja,1535208107610,I LOVE YOU SAFIYA
Ugxck-VPa2HI_UuqtwZ4AaABAg,star baby,1535208108751,the scariest thing to me about fake makeup is that it is sometimes found in high end stores like ulta and sephora (rarely but it happens)
Ugzw-Y3M5n84ZqUe_Zh4AaABAg,cranberrycrimson,1535208108760,"What if there were lead in the ""fake"" makeup?"
UgxNYhVumgVYZ_naIU14AaABAg,daisy roses,1535208108768,Hola saf! I love ur vids! Man my comment is so original 😂🙄 but girl u r always so enthusiastic and happy and just entertaining 🤩
Ugyr1fyRYDs2hM__t214AaABAg,Britney A.,1535208108774,lets all say a prayer for Safiya's face T-T
Ugz3jflNOh7kWV_j7q94AaABAg,Hanan Balushi,1535208108780,Creative and unique ideas as usual 😍👏🏼 don’t let anyone affect your creativity
UgxpIqf9j7NmI0WmN1p4AaABAg,CosmicKitten,1535208108787,Welcome back Bruce 😂😂😂
UgyCTPnb1YiqOZER38R4AaABAg,Carmelle747,1535208108792,"As soon as you said ""see how it looks on the face"", I started shouting ""NOOOOOOOOO!"""
UgzC4MiEzTqc4sjtAqZ4AaABAg,jessie carter,1535208108800,Hi peeps
UgwxXEjRPST_O2q51o94AaABAg,Mao Yang,1535208108805,Queen of quality content!
UgxjAKOv4WUOjsWii5F4AaABAg,Alyssa Malloy,1535208108816,You've always been one of my favorites. I love your approach and you guys are funny <3
Ugyg_FaKfZoHK2df-U54AaABAg,Kristen Powell,1535208108824,Are you wearing the mix lip  palette? Cuz you are rockin it!😙
Ugxf1grj9IrOo52ZV8p4AaABAg,Kittikat4124,1535208108832,Now take them all to a lab lol
UgzHeKWAiBJz7LdExbp4AaABAg,D M,1535208108839,"You just said fake make up might contain SHIT. And you PUT IT ON YOUR FACE. GURL. Test it on a swatch! Your arm! ANYWHERE ELSE BUT ON YOUR DAMN EYES.

second, why are you using the microscope on your eye. you're literally shining a light into your eyeball. and your skin is contaminating the sample. just put the palette under the microscope wtf. 8th grade science"
Ugzg5vIihEQkir1Fd8h4AaABAg,Megan John,1535208108846,What lipstick are you wearing?
UgxTwHTTsIdLdd5nz_R4AaABAg,Girlfriends 4Life,1535208108853,"Safiya if your skin is so oily, why don't you take a paper towel and stick it to your face so it will absorb all of the oil"
Ugxn32pxM2ozaexYdNR4AaABAg,Ash Leeé,1535208108859,I don’t  actually own any  fake makeup  but  but  I  want a hand held microscope now
Ugw0RVGM-VYB6jtyyDR4AaABAg,Dderyl 0710,1535208108868,rIgHt oFf tHe bAt
UgwrB4baE3zQngKtKMt4AaABAg,Erin Leigh,1535208108909,This was such a interesting video Omg!
UgyXW92iCVavfJAoa7h4AaABAg,sophie barnes,1535208108920,when you put it up to your lips it looked like close up broken eyeshadow
UgwaDazKlLOO4jYNK694AaABAg,nariman s_m,1535208108931,4:57 I SEE NO DIFFERENCE
UgxDgkCPZF4M-wncwdZ4AaABAg,Aj Acar,1535208111292,damn fenty foundation is dry af
UgzKZ3Cs7-nBqTDjEl54AaABAg,Lakeisha the Hufflepuff,1535208111304,"Early squad, where u at?!"
UgzTiP7kE2z-N9-mHON4AaABAg,Ellen M,1535208111314,I can never get good butthole coverage from my lipsticks 😞
UgzJ-9KdE8DTdffT9Dh4AaABAg,Fiorella Barbieri,1535208111320,Honey is bomb!!
UgwHcZLNsOLBcxzwldt4AaABAg,Tophat Peasant,1535208111328,If safiya’s ill tomorrow we’ll know why
Ugy3TiYe3tsoqhoZaJt4AaABAg,Jessie Shaw,1535208111339,Hey can you do a full face of  your Frankenstein make up
UgzWToDRFqO2B2qN0254AaABAg,Mxddie Bxby,1535208111350,Notificationsfam
Ugy8nN1iejsRyyJgQU14AaABAg,Donna Fox,1535208111360,I watched thre video that you got your makeup professionally organized and i decided to do the same
UgxpIPIDSmTs5BfT5lx4AaABAg,Lizzy Kehlor,1535208111369,"oh yeah there are little teeny tiny mites that live on your eyelashes 



just a fun thought"
Ugy8so0IqoKzTECJ-C54AaABAg,Holosexual,1535208111377,Tyler aka the flopping fish 😂
UgyravJPjKDuIdX17Bh4AaABAg,Milli Monroe,1535208111390,Wah
UgyfXPqA_Lran8wjKFF4AaABAg,driven _15,1535208111399,That honey app is cool
UgxbQAdJ2t-BxyB6KYR4AaABAg,Emme Madelle,1535208111409,"I love Saf, she has the most intresting video Ideas and she takes a trend and puts an original twist on it."
UgzSGA7wQzWzpXqCXTh4AaABAg,Michelle Barrow,1535208111421,It is my bday thanks for posting today Iove u bye🎂🎂🎂🎂
UgywRGW8rfuriIZJu114AaABAg,ladaphone scott,1535208111432,Hi
UgwNLt3HWc2BM9jyRhN4AaABAg,Callie Heddings,1535208111435,This is probably my favorite Saf video yet
UgyNKr0EIMnRsf6ab114AaABAg,Kookie MMD,1535208111445,A new BTS song uploaded and so did Safiya? This is the best!
UgyZep95CmzfxKtHCRh4AaABAg,Merrin Clarke,1535208111450,This was disgusting...but I just couldn't look away....
UgxeEYftQjRNV1MfT394AaABAg,Maggie Rose,1535208111459,Woo!
Ugz4BPuLGhh_OoyA4wV4AaABAg,Jenni-Lee Silver,1535208111499,"Didn't really get the point of this whole experiment, but watched anyway."
UgxJhSRjJLktuRQ-N694AaABAg,shinycosplay,1535208115953,This video was kinda gross but I still loved it
UgwRhvWVHJoklUKyk_l4AaABAg,Alstroemeria Rowena,1535208115963,early agggaaiinn
UgwGAnS1T7jLcUyc5Xp4AaABAg,Angela Conningsborg Axencrone,1535208115968,you danish??
UgwPbT_oQQu-cN_OwG54AaABAg,Mt23 Tesla,1535208115977,Cristine the science queen is shaking
UgzFUMJ0Wjh9x2J5Kfx4AaABAg,Brittany Jade Horn,1535208115987,"hi, I'm awake. I live in Australia and noticed that you uploaded this 40 minutes ago. I'm hardly ever awake when you post. You post great content! have a great night. im slep now bc I pulled an all nighter aaaaaaand im not going to enjoy waking up"
UgzapFQoDm2lqBDcd9p4AaABAg,Genesis Mann,1535208115996,I love your videos saf you're hilarious and so real it's awesome!!!! 👏👏👏👏
Ugz1hB4R4opxOSzhkjt4AaABAg,maria paz mendoza,1535208116006,"Por favooor, me gustaría ver la comparación de skin care products, greetings from chile💕"
Ugz-RTL5NPcTg-O7lUR4AaABAg,Jennifer Espinoza,1535208116014,Send it to a lab see whats in the fake products vs the real ones
UgxzWrdovd4oYCqanLV4AaABAg,Monique t,1535208116023,The zoomed in real lipstick shot is how I actually feel whenever I wear matte lipstick (dry af)
Ugy4uns1g_PbeE2ad_F4AaABAg,Swauvette R,1535208116032,"Ugh! YouTube unsubscribed me from you!
But you were still in my timeline of videos to watch!
I resubscribed! 
Congrats on almost reaching 6mil!!!!"
Ugw8mm7WBMYSCYhf_tt4AaABAg,It's Sophie O'Reilly,1535208116038,OMG I wouldn’t know what to do if i got dog shit on my lips or eyes i’d actully vomit everywhere ahhahahah 😂😂🌸
UgwIL1qusSijoIr0uq54AaABAg,Laura Brady,1535208116045,"Safiya I love you so much your the best if you could reply it would be amazing xxxxxxxxxxxxxxxx
🦄💙💜💜💜🌹🌹🌹🌹🌹🦄💙💜🌹🦄💙💜🌹🦄💙💜🌹😍"
UgzDjymGz6nGITI9RuR4AaABAg,I like snails and potatos when they poop,1535208116055,We love a shister scientist 💖😚😻🔥🔥🔥💖😍😻
Ugw7kpVuYG40ZFH5m8B4AaABAg,Hey_its_al_5 Gagne,1535208116066,I love this video
UgzDvBuzDEMZrAMKMKx4AaABAg,Tori Martin,1535208116072,content queen
UgyETctkJ5iDt6u2zU94AaABAg,Opal Animations _LM,1535208116079,Terrifying but a great thumbnail 😂😂😂
Ugw5C2zwnKLZuT-QqJd4AaABAg,Sarapatchkid18,1535208116085,I’d probably blind myself with the microscope light trying to see my eye
UgzEgIykddCu6VIJmIp4AaABAg,Nina C.,1535208116094,"I swear in the future when a news report says ""Cocaine found in counterfit makeup"", I will not be suprised."
Ugx1WIkh5LP9KroVUrh4AaABAg,Freja Madsen,1535208116100,I just watched a short film that made me cry I needed this
Ugy58Urua2S75CTzCRp4AaABAg,mannanen,1535208116107,"Love the typo in Purple Horseshoe 😂👌🏻 jk, amazing video as always 👏🏻👏🏻👏🏻"
UgwmN5vd8gt8DMV_gBd4AaABAg,Chelsy Messer,1535208117657,I always look forward to your videos! :)
Ugwg1o19PBYSTKyMVU54AaABAg,I'm a unicorn 02,1535208117669,YUM! 1:26
UgxctcFUXKtgC5wHlap4AaABAg,Ainsley Richter,1535208117679,This is one of the coolest things I’ve ever seen :)
UgzfEpLxSbsLvOi35P14AaABAg,Katarina Brankovic,1535208117689,❤️❤️🌏ily
UgyDnmzzIghzU4pfod54AaABAg,Tiffany Eichmiller,1535208117700,I've gotta point out that feces is spelled wrong 1:24 love you Saf!
Ugxrh99j7LdITPyvnpd4AaABAg,Ashley Hogan,1535208117711,I love the fact that Saf put her mirror on a Cards Against Humanity box it is an actual look
UgxZcQp4SlLw68HILmZ4AaABAg,ii_katt,1535208117722,How am I early?
UgyhjaZy5eggABCYwtZ4AaABAg,Camilla Delano,1535208117734,"i mean isn't it a possibility that some of the fake make up are ""bad batches"" aka. make up something went wrong with so they scrapped it"
UgyPV54T1HpNHyrsIFF4AaABAg,Annabelle Agosta,1535208117744,U should do a vid where u buy cat toys off wish
Ugx-xlLhXifTniRloGV4AaABAg,ana fran,1535208117755,Kiss from Portugal!
UgykaPRKqKrw0PH7R3p4AaABAg,XxAlexEatsPies xX,1535208117758,I eat money and honey.
UgyLho3n_b0kkAvW31l4AaABAg,glossbones,1535208117769,This is so gross but I love it
UgyPkO9T2WYO4v0LhoZ4AaABAg,Maria,1535208117773,Tbh the fake dolce k is prettier as a colour than the real one lol
UgwVrfLXDCkTtlPShE94AaABAg,Leslie,1535208117784,Scientific Sister
UgxJVMnqdIi-qSN4W2R4AaABAg,Hannah Gainor,1535208117793,You should use a sponge applicator
UgyNVtBDITToyxdmkyt4AaABAg,Tiffany Riggle,1535208117801,"#makeupbypita

Awww I'm happy you used a clip of makeupbyPita! She is such an awesome person everyone should check her out. Shes a breath of fresh air in the beauty community"
Ugx6_pI3Whtc7_XJRol4AaABAg,james w,1535208117808,Was anyone else thinking of brownies
UgwUsbioIA5UQDA6YlV4AaABAg,Eve Helin,1535208117817,I absolutely can not stand gross stuff but I still made it through the whole video... I feel like a champ
UgyDBOHYvonB6iZYhCB4AaABAg,NikkiCarolDani,1535208117828,you always come up with the most creative ideas! loved this!
UgzQ7gPNibrjtcRv_CR4AaABAg,Moxie Beast ASMR,1535208117838,CONTENT QUEEN!! And this is why!!! ❤️❤️❤️
UgyE7LMRszFn1HmgjZN4AaABAg,Jillian Howell,1535208119345,"HELLO SAF I have two video suggestions for you:
1. Trying to recreate asmr videos 
2. Wearing these for a day http://redneckbootsandals.com/"
Ugx7hwYVtPCwMSrbVR94AaABAg,Bobbi Obanion,1535208119353,"I would end up destroying my face with that microscope, imagine finding  blackheads so much easier."
UgwzZoAjLKoOOdAeRyZ4AaABAg,Adilene Aguilar,1535208119360,"I was eating when this was uploaded and decided to wait. 
I am glad I did."
Ugyad3wOcwJ9fqW2W4t4AaABAg,Rob Brooks,1535208119367,"""Fakeup"""
UgytiFqlgIs-gloqLW14AaABAg,jimmy,1535208119376,im crying why would safiya PUT IT ON HER FACE 😭😭😭😭
UgwXI2rN_0HGBRckMrt4AaABAg,kpop lover,1535208119386,Lol I watched this video at 20:58
UgzdfVabonfIYL-1dFF4AaABAg,Martha Ghebrealfa,1535208119393,Who watching before 100k views
UgyI2gnF4jEfGZULyH14AaABAg,Prickly Llama Productions,1535208119400,Im dissapointed that you're doing this trend. But im still gonna watch this cause i love you and your channel
UgwEHkLuF9E9tVKEuSZ4AaABAg,safia bano,1535208119410,Hi😀
UgwZ12FgRYX6tc3_J_J4AaABAg,Unicorn Puppy,1535208119419,"Those white things are eyelash mites. They are tiny creatures that live in eyelashes. Every person has them, and the reason you can see them on the fake side is because that mascara has less coverage."
UgyS-OYKfVKRkFFvK3R4AaABAg,BOB THE CAT IS WEIRD,1535208119422,More explosions? (Hehe)
UgyT-wheBQqWkkMw2-Z4AaABAg,Abigail Feller,1535208119431,You should get the makeup you used at a clinic so that you can see whats it it!!
UgyDcFJZk6zDB-5OHLZ4AaABAg,Abigail Pantoja Coyt,1535208119439,I want to see the Frankenstein makeup under a microscope!!!
Ugxm7_O9nykEHgPUXQp4AaABAg,sabah igoui,1535208119443,"Safiya's like:
The fake makeup might contain cianyde or arsenic... LET'S PUT IT ON MY FACE! 😂😂"
Ugy3kQeh8mKaFdqwIYh4AaABAg,Colleen Elizabeth,1535208119453,"Ok but you should never ever put fake makeup on your face, especially on your eyes"
UgwKzW1p9D8jixS3UH14AaABAg,Lauren Majar,1535208119456,Buzzfeed will steal this in like a month
Ugx_OxUY2GXEOKc2dgx4AaABAg,SailorMoonLoveDarien,1535208119466,You should take them and get them tested at a lab since you have the products on hand now.
UgzpvS6vixIIrGbqkbR4AaABAg,Abigail Feller,1535208119475,You should get the makeup you used at a clinic so that you can see whats it it!!
UgyxAQCo0bHxhLpf25p4AaABAg,Miss Fizz,1535208119480,"How to make a good thumbnail:
Put your face + a kylie lipkit + the word ""fake"" ... THIS IS HOW TO BE A SUCCESFUL YOUTUBEUR"
UgwRoO0cgMnbqP7ZPzh4AaABAg,Gül Göktuğ,1535208119488,Yaaass! I’ve been waiting for this video for too long
Ugxg58azxfT4v4Las0x4AaABAg,apple drip,1535208123642,♥️
UgwAp5d812HwDUHZcp14AaABAg,me,1535208123649,My blind grandma says I look like you .
Ugy5M7Vx_MH073oNdx94AaABAg,Lexi,1535208123660,I feel like Saf only does orange eye looks on camera??
UgxMj5bfj62CNXkkU754AaABAg,Lewbella,1535208123670,"The ""fake"" ones could also be stolen."
Ugzvv9z7ieul_cw4uLd4AaABAg,Olympia Vasilas,1535208123680,YES New video
Ugw1ZgNHdHMqVTt8VdB4AaABAg,Maddie Joy,1535208123690,These microscope videos make me feel like I'm seeing something I shouldn't see.
UgwavTHVlk853uuzVDV4AaABAg,Beauty Unboxed,1535208123700,"if you have already the fake make up lying around, maybe to some chemical testing on it? testrips can be bought online. that might put people off investing in fake make up."
UgznS1p3FWJDvohW8pd4AaABAg,It'sJustAlicia YT,1535208123709,NOTICE MEEEEEEEEEE
Ugzc_-JrrY_VYe0OQih4AaABAg,Okurrr,1535208123715,I was hoping you would do one of these
UgydsbkC0KTwL8asQhJ4AaABAg,rainbows,1535208123725,"I want to know the green lipstick she's wearing  !!!

I ever get bored of her videos.. 
Her voice is kinda soothing 🙂.."
UgxXxwKmTNSFRsGKkFp4AaABAg,harnoor rakkar,1535208123736,"1- I got a dig bick
2- You that read wrong
3- You read that wrong too
4- You checked
5- You smiled
7- You are wondering why you’re still this reading this
8- You saw that mistake... right? (On 7)
10- But did you see that I skipped 6?
10- You checked
11- And saw you that I doubled 10 and skipped 9
12- I said saw you, not you saw
13- I also skipped 2
14- You got tricked
15- I’m just waisting your time, I deserve a like for that, go back to reading the comments"
UgwFRu0qu2dtqnC0xZZ4AaABAg,Francesca B,1535208123746,13:27 “purple horeshoe”
UgyHANBzQ60EOtJ0MAx4AaABAg,Nikki Evans,1535208123757,Kinda weird but I LOVE seeing how hairy Safiya is. It makes me feel so much more normal about my furry self.
UgxEwWblobmNx4NK-sx4AaABAg,lis dc,1535208123765,I have the HONEY APP and it never finds me any code available that i can use.
Ugxg_vrZRYHYkzT-vTt4AaABAg,Min Suga,1535208123774,Tina yong love you Tina yong
Ugzfk3Zly5krZGyUUAx4AaABAg,Libby Nowak,1535208123781,love the lipstick on  you
UgxaJuheXs1BpbdBC714AaABAg,racerx1207,1535208123786,Yass
UgzTd_hwO8P8p1rUJGR4AaABAg,Zulfiqar Ali,1535208123793,I absolutely love that dark sea green lipstick she has on that is all I got out of this vid😆
UgxytEMKQqjz5UYkimt4AaABAg,Makeup Addict,1535208123800,Whassup content👀🔥
UgwKTwN1YU9QkCZHfNh4AaABAg,PhoenixQueen 06,1535208123807,"“Do I have hairs on my eyelids?”

Me: DAMN THAT SLIPPERY PLACENTA!!!!!"
Ugwxc5qWGWdbi62GeFV4AaABAg,Reb and Vodka TM Call me Ella lol,1535208127639,Early
Ugxk-UlTmXyNGbuUjwF4AaABAg,Dollar Menu Hoe,1535208127647,Am I the only one who thinks fake and real mascara looked the same?
Ugyh5wcy3RgxzEwD5HR4AaABAg,Barbie-tastic PRS,1535208127655,I love your hair and I love your videos they are super interesting
Ugyr789kdi1crTCZhJB4AaABAg,Kirstiela,1535208127666,... couldn’t you have saved your face and checked them out in the pans? And then on paper or something? 🤔
UgzcDjJpSp55xsvXU014AaABAg,Maxximum Rockatansky,1535208127678,The stuff in the eyeshadow is probably a filler like Cornstarch. At least that's my hopeful guess.
UgwkDdzzO4832uXwBjB4AaABAg,Priya,1535208127695,my anxiety kept on telling me youre mixing them up
UgzEa9hWG2a-YpOdhX94AaABAg,Lulu Music,1535208127702,#earlysquadwhereyouat
UgxoJf-E3HHa33kZ_1N4AaABAg,Charlotte Dane,1535208127711,Ly Safiya
UgxDAXFl_W_8EYt5_Ix4AaABAg,Nicolette Ho,1535208127726,Can you do a full face of the new Crayola makeup.
UgzYHjGq0I0b35sNnfJ4AaABAg,Ikra Hussain,1535208127732,Is it just me or does your hair have like a reddish tone to it?
Ugw9So3Tpz7t7mQwGgh4AaABAg,Bella is Artsing,1535208127742,She has a circle where she put the microscope on the foundation
Ugxy9TWQkMQeTJhCfzh4AaABAg,devon in heaven,1535208127753,Get these tested at a lab for us! Not knowing what's actually in them is the lost ingredient to this vid
Ugx_JZz5F0eZ0N3y-bZ4AaABAg,Miranda 13,1535208127760,Who else thought of RM when it said peaches and cream 😂😂
UgyuUxfFekeyVbwzPm94AaABAg,kassafras04,1535208127772,Lol “purple horeshoe”
Ugxvc2CqsTM4FyAhNzF4AaABAg,Alexi corn,1535208127778,Your awesome 😁😁
UgzApzayGIRlQoPb4Kt4AaABAg,Magic Unicorn,1535208127789,I been waiting for this video!
UgxqiZTw8z_Ceb_qwCZ4AaABAg,Emily,1535208127801,"This was super cool! Thanks for the awesome content, Saf!"
UgxU67QGFTf7pOJpzA54AaABAg,Rana Hanna,1535208127811,WOW! I'm amazed!
UgxF4SI06teETcwk_NN4AaABAg,sophie.louise.c,1535208127823,I'm so curious about whats actually in those products!!
Ugxe3ARi_Qhz4W4ij5l4AaABAg,Min Suga,1535208127835,I love Tina yong
UgwW-Sd_a7-Q2OhMDEt4AaABAg,Zhayra Castillo,1535208132770,Quality content at it's finest<3
UgzZPfEixGnzMfB-hip4AaABAg,MilkTears,1535208132781,Im too broke to buy real makeup 😭
UgyDb7-TE0kcBwbhBX94AaABAg,Milton M.,1535208132791,About to reach 6M subs!
Ugyij2YUkV_rsKkMxrl4AaABAg,Derpy Frand- RBX And More,1535208132831,"fsafsfafsfafsfafsfassfafsfafs




Does anyone know what those letter spell? :P"
Ugybgipg4pXwxSpK0iF4AaABAg,Aluminum Shadows,1535208132843,EARLY!!
UgxBYSueQxCwUKeHopR4AaABAg,Alshaima Saqer,1535208132853,Yaaaasssss
UgyNFYHTPPelQBiTOih4AaABAg,Crimson Feather,1535208132865,Congratulations. You've just supported organised crime for a youtube video. Hope you are okay with the pain you've just paid forwards to POC in other countries.
