id,user,timestamp,commentText
UgyBg03Nw4teX5OAkSt4AaABAg,Safiya Nygaard,1535207189822,"HELLO FRIENDS!! ah yes, another gross microscope video to add to the list.... what do you guys think of these products? I would say ""would you try this?"" but I don't want any of y'all using unregulated fake makeup!! But I do condone the use of a microscope in pretty much any situation. xoxo, saf"
UgyfHab5EjJNiAmvj5F4AaABAg,- Vikki -,1535466329836,Video about the best cheap makeup brush sets!?! I need new brushes! Help please! 💃🤷‍♀️
UgxvIHyxRCPkBITvHJ94AaABAg,Jaimme Pineda,1535465969850,"Did you know that there are microscopic things living in your eyelashes to clean your eyelashes
This is 100% true now you cant unread it"
UgzkdvuDMgdsCElfOsB4AaABAg,Gaby Ward,1535465069869,this grossed me out sorry boo no hate
UgyWTLEoLtj2c3B5HDp4AaABAg,Maddie -,1535465009882,Oh this is so much more interesting than what simplynailogical did
UgwBJgYFKz_VhLhzC6l4AaABAg,Steve Polychronopolous,1535464049894,They both look equally shitty because your face looks retarded
UgxM_00uXAVjMCcv8454AaABAg,Mandy Cheang,1535463629906,"the amount of ""right of the bat"" she said"
Ugy-NwAzJCfGC5Dar8J4AaABAg,alyeexa yeeed,1535462789930,10:17 noice
UgztGdg1jIIoctjVNmh4AaABAg,alyeexa yeeed,1535462789950,0:24 ayyyy
UgxjEqleCzgZ_7yrB_h4AaABAg,Herfcanskerfcan W,1535462789967,Fakeup
Ugxe435e3ubZEeON6Ux4AaABAg,Doodles by an Emerald,1535462789984,Wow you’re 27 on trending in Australia! Good job!
Ugw-IL5whvqy0_o70lJ4AaABAg,Charlotte Levine,1535462789989,Hi saf!! You should try this clothing company called zozo they send you a bodysuit that scans for your measurements and sends you clothes!  Would be perfect for a video :)
UgyHj-vCWHXeB0vsDPJ4AaABAg,Emma Nakamura,1535462790002,"Hi Saf I made a ship name for you and Tyler.There are a 2
1.Tyliya
2.Safler
I hope these are good ship names!
LOVE YOUR VIDS!!!!!!!!!
LOVEYA"
Ugwy2Jslar9MESqiehd4AaABAg,Sarah Boniface,1535462790014,yum
Ugz9CzZ5UtpLMDFTgJh4AaABAg,NOBI HOSSAIN,1535462790024,look at her eyebrows
UgzFyUakyG9FY0SUpkt4AaABAg,Irfa Begum,1535462790036,"Can YouTubers just get over this microscope trend!? It's gross ,like I dont want to watch ur skin in a microscope! EW!"
Ugxehs0v48kSxMa8NtR4AaABAg,Tagan Ortega,1535459190049,Fake Frankenstein makeup
Ugzb84-DZWUKVfZzNNN4AaABAg,Jessie Kelly,1535459190062,"SAF 10:37 in i was like please PLEASE lady can you put the fake side cut out on the side of your face where you are doing the fake side etc. Desperatly hoping someone else has left this comment. 

++ come to Sydney Australia before March next year. I have a travel company. I’ll show you around. 
J"
UgyrWEHXqvFlcrZ-2kN4AaABAg,Carol Widenhouse,1535459190074,Please try zozo!
Ugx8j_loNEKB5G8xuzF4AaABAg,Amanda Apps,1535459190085,#27 on trending 😍😍😍🤗
Ugz7Sg8rgRFFSsVRN1x4AaABAg,Imbecile Imbecile,1535459195738,I love your lipstick colour!
Ugxt4dFNfO1KdEeeAAd4AaABAg,Sophie Lou,1535459195751,You should do a video where you try a more androgynous/gender neutral style! I've never really seen a video like that and I think it would be really fun!
UgxFhPQyZayJzdCWItR4AaABAg,Erick.um15 Mitlo,1535455595769,For your next video dressed like a gypsy for a whole week I m a gipsy so if you could dress like a gipsy that’ll make me happy For me to learn more about my culture
UgxzgeoDM8HIHTAkeu14AaABAg,noot noot,1535455595773,Saf sacrificed her face for us 😭
UgzYMR03cXO6ZCUfjuV4AaABAg,Catspaws Minecraft Gaming,1535455595793,why is this gay shit on trending
UgyRhxyfWQ6z0xyhrlt4AaABAg,Silver Sword,1535455595799,She should try reviewing makeup removers with the microscope
UgzYVFIrF12WzBk_V-t4AaABAg,Hope V,1535451995811,Do this with high end v drugstore but please use the drugstore stuff u know is good x
UgzTHIP5EAWQdBO2j-V4AaABAg,MrSpeedDemon72,1535448395827,"Real makeup, fake makeup, what difference does it make?  The minute you put any kind of makeup on you’re making yourself look fake.  Ironic isn’t it?

Why don’t you women just be yourself?"
UgxUxl0CEqYTS7GwY6B4AaABAg,CuteNerd,1535448395837,It’s 4 am on a school night.... 😴
UgwGoTZVEP1WzFlNF_x4AaABAg,Luna Sugar4,1535448395859,"""I hope there is no.poopoo in this pallet"" I'm pretty sure mascara had bat poop in it"
UgxFWvF1rbS2Huz7C8d4AaABAg,RP `,1535448395871,if you can't afford expensive make up just by cheap make up from a trustworthy brand like NYX or Elf....not worth buying fake make up to look cool .
Ugzl9DIOHJWMMhhE81R4AaABAg,Poppydoll216 MSP,1535448395874,I have the same fake two faced pallette😂😂
UgyJT8o-lHFhbVMqhzN4AaABAg,Tya Amir,1535448395889,"OMG!! Thank God I always picky in buying cosmetics. I have OCD so I always scared of this kind of situation. Looking at your video just made me feel ""fuhh thank God I didn't use any of fake products"".. 😅😂😊"
Ugw_m5RWke40ERjVsvl4AaABAg,Bella Hudson,1535444795898,You look like the girl from digrassie x
UgwmyoFiyNPV6L6JQa54AaABAg,unicornkittycateavan squishies,1535444795908,Wait you're form buzzfeed 😰
Ugy1HRvMs_tRIDCmWgx4AaABAg,Taetae’s Kookies 2,1535444795921,4:10 “peaches n’ cream sweeter than sweet chocolate cheeks and chocolate wings” if you’re a BTS army y’all know what I’m talking about
Ugx4fh83ekll1Ecvi6l4AaABAg,sn-LovemakeuP-sn,1535444795931,Makeup with primer VS makeup without primer!
UgxTOCR31YxidtPStZB4AaABAg,Khb 888,1535444795944,2:08 That booty tho
UgzMZYbM8IBEitCstqh4AaABAg,Mari S,1535444795957,You should mix all your blushes together next!
Ugzmtp2AvJklSNMHAgp4AaABAg,Jake Does America,1535441195980,"Want a chance to win $5,000? All you have to do is vote on my picture, and reply your vote number https://wyng.io/SqCDcz"
UgyeX5G0sRVSllz03XB4AaABAg,Reem's Dreams ll ريم حازم,1535441201783,I like it 🌷
Ugzml3hus-dh3VMfqgB4AaABAg,CharLotte Mund,1535441201790,This is the first I'm hearing of fake make up
Ugw59BNVsoAVldnBeUx4AaABAg,Zac,1535441201796,D I S G U S T I N G !!
Ugx0ZlgOyOukQGQyCWV4AaABAg,taylor Shaw,1535441201805,"Help me how does safiya do her makeup so pretty and have her face prettty without the makeup 
Love you saf ♥️"
UgyNV2Kd1cuE6gWbZ2l4AaABAg,VideosWith Kinzee,1535441201815,34 on trending safiya
UgzSsmpXTJHzBf8M8zx4AaABAg,ShanG,1535441201818,Apparently bugs live in our eyebrows and lashes but we don't see any under that microscope?
UgxNhPbDDHkrE36ywOR4AaABAg,Stephanie Ott,1535441201829,what is butt scrub
Ugwy21nm5zzmIYP6O0p4AaABAg,Green Adventurine,1535441201833,"Mix every one of your makeup products together into one, and wear it!"
Ugzb70PL_y7T0jKXgnt4AaABAg,Belinda Short,1535441201842,I wish I understood why Honey sponsors so many people when Ebates is SOOOOO much better because you get the same discounts AND cash back.
Ugx5qyxH7dZEfScp5PZ4AaABAg,Sophia Agag,1535437601846,"5.9 MILLION!!!!!



ALMOST AT 6 MILLION!!!!!!!!"
UgyJcNBuqDSRKgsJHj94AaABAg,gemberryy gbug,1535437601855,"""That was more than I bargained for"" FALL OUT BOY FANS QUAKING"
UgzugFx2nxhxGVdTzKp4AaABAg,Staci S,1535437601865,“Look closely are the white specks moving?” 😂😂😂😂😂
Ugxs_27mllKFu1IO03t4AaABAg,Stray Kids,1535437601868,Okay don’t eat whilst watching this it’s disgusting 😣
Ugwp0qRys-1gSdNBzM14AaABAg,Millie Q,1535437601877,"Take a shot every time Safiya says ""right off the bat"""
UgxcmM2hssbldxDJT_Z4AaABAg,Mel Marie,1535437601881,Mix every color of hair dye.
UgzWKF2cTbYhQi8hxjZ4AaABAg,Help Me.,1535437601890,She had such a Shane Dawson worthy thumbnail.
UgxgA9zGlBlxvOr_oTN4AaABAg,Fake_Girl TDM,1535437601894,EXCUSE ME. IM EATING NOW IM GAGING
Ugxrm5bsLcQUVUfdIYh4AaABAg,Nuts of heaven,1535437601904,Peaches and cream?! Im such a bts trash...i need to StAhP
Ugx9wPyaea6eRy2Ygjx4AaABAg,Tin Bernas,1535437601914,Hey guys! You can contact brands and work with them for free at Phlanx.com
UgxxKVI2R-TfYP53jbN4AaABAg,[YT]OpRage27,1535437601918,Just a male passing by
UgzJByQFPpx7jYwksqd4AaABAg,makayla white,1535437603646,love how safiyas mirror is on top of a cards against humanity box
Ugy35lqqniQKMuL-F354AaABAg,Mega MindyLou,1535434003658,Can’t wait to see what you’ll think of next to use your new microscope for. It’s a ‘no’ for me about your blue/green lipstick. Was hoping Tyler was CPR certified.
Ugx1vlPWJhqIm1DyXZl4AaABAg,Beck Lane,1535434003667,you should see about having those fake makeups tested just to see. itd be cool.
UgwjO07cS5OPgnUFHnF4AaABAg,daan michiels,1535434003673,usual instance dry file defendant compensation meal attempt ever jail.
Ugwrh14WNX_EMysA-R94AaABAg,Elizabeth Shaw,1535434003690,I like the fake Shimmer eyeshadow better than the real. Little turd shape! LMFAO. There is feces in everything that we purchase. I prefer a L'Oreal lash Paradise jet black as blackest black will flake. I keep getting confused if it's the jet black or the blackest Black but I just looked at mine and it is jet black I'm going to go research. I like the fake pale color better. The white stuff in the eye shadow is most likely talc. I had to look at cadavers under those microscope in medical school.
UgzIzBDzt1L2BxDgAfV4AaABAg,Coffee Bean Gamer,1535434003697,You should try food subscription boxes!
UgxKQSI4Xo1Te6BOP7R4AaABAg,Kierstyn Wiandt,1535434003703,"Didn’t realize I needed this, but I’m glad I have it! Lol thank you for making this video! Definitely never buying fake makeup 😂😂"
UgxJPUPTtnxCXRdCvER4AaABAg,Daisela Raine,1535434003715,You should compare name brand products to drug store products under the microscope
UgyM5lrjTUe_IIrSC854AaABAg,Elizabeth Shaw,1535434003718,We are mammals we have hair.
Ugyfs9EB5wl3UvXfGBp4AaABAg,Edith R,1535434003729,Can we get a video of you getting eyebrows done and eyelash extension please some pamper self love
Ugy8W_KPvMAvqNVlouZ4AaABAg,Elizabeth Shaw,1535434003739,Those aren't wrinkles those are skin cells all of your skin cells are shaped pretty much the same way.
UgzqhFuLsQvvg7_msvh4AaABAg,Elizabeth Shaw,1535434003749,You can go to Morocco where I used to live and was held by France until 1959. You can buy Chanel makeup and perfume for 1/10 the price that it is in the United States and none of it is knock off. My husband at the time purchased me a large bottle about a pint of Chanel Chance for $20 u.s. money. I was stupid not to go online and open a store.
Ugy5N0Up6ox2zT1sZfN4AaABAg,Amaris Hernandez,1535434003752,13:23 purple “HOREshoe”
UgwN9fSm0Kkp1kqXZg54AaABAg,Tanya Bailey,1535434003762,You should have Tyler do makeup on himself because he said you got mascara on your eyelid and he should try
UgxYZ-W43v5cn0BBbyl4AaABAg,ZERO,1535434003765,"I only came here to ask, How the fuck do you have fake makeup?"
UgyytgSABioiung4bmF4AaABAg,Justin Y.,1535434003775,"she looks horrible with the makeup on in my opinion. though i always thought makeup was ugly, i prefer a more natural and imperfect look. i know im weird tho lmao"
UgxAr187V1idGSptOAV4AaABAg,L. Richards,1535434003777,"that's funny, i just used honey five seconds ago buying product from pixi beauty"
Ugyc6dUz1y3Z5BzOPPt4AaABAg,•essabs•,1535430403788,Severely disappointed Safiya didn’t say fakeup instead of fake makeup
Ugw0UYV7hr10k2ddvNJ4AaABAg,Blue Knight,1535430403791,Army
UgxUhnU_iMHHjzQtiy14AaABAg,Danny,1535430403801,4:11 sWEETER THAN SWEET- im sorry
Ugw9XErxbkX5Uqlm-wp4AaABAg,RandomOneGamez,1535430405433,is anybody else looking at her lipstick instead of the video
Ugxx_K7_L4htIsGUPSx4AaABAg,Alex Giroux,1535430405447,"So interesting! I won't buy fake makeup because of you :P 
Hey, can you tel Tyler we miss he's video too please? :P or videos that you made together? <3"
UgzmuAWaLmH1KYS2z454AaABAg,Emily Andrews,1535430405459,"Stop it, Cristine!"
UgwU7XRKuLmsGL8iN4h4AaABAg,darcyjohnson957,1535430405469,Eeeey trending
UgxYQxzRMjY0iOj6BNd4AaABAg,Zandra R,1535430405479,This grossed me out so much but someone tell me why I watched the whole 20 minutes 😩
UgyKuh4a0CjalbfETQd4AaABAg,Jayden 101,1535430405485,SAFIYA IS ALMOST 6M
Ugy7VKPh4rlIGm2NeRB4AaABAg,Spooky M,1535430405494,FOLLOW @esqeii ON INSTAGRAM FOR FOLLOW BACKS AND SHOUTOUTS https://www.instagram.com/esqeii/
Ugw7EX3jpW2skqJOFsp4AaABAg,Tyler Hallman,1535426805511,Is that highlighter or are you just in need of a major oil cloth.....
Ugyv6PsoW6Rp4i3BbSx4AaABAg,ur a meme.,1535426805523,I got honey and I saved 30 bucks on one of my orders. I recommend it
UgxSV4TR7K0A0uV05tJ4AaABAg,Madeline Clark,1535426805532,Did anyone else notice “horeshoe” when it should be horseshoe 😂
UgxSN_lwpMbLUTqNF414AaABAg,Bethany Jenkins,1535426805544,It's so cool yet so creepy
Ugzq-qknmvITu8mMvcJ4AaABAg,The Chicken,1535426805558,Your so pretty
Ugza6RGF5gPlFHu3pGd4AaABAg,Uta,1535426805570,Your butt scrub? Did you just expose Ty lmao
UgyEypmLB8FpKN5A5_J4AaABAg,sarah nelson,1535426805582,You put so much love &energy into your videos... thank you 💗
Ugwe183wPPa9K9IA2b94AaABAg,pink angelwings,1535426805589,OMG U WANT TO PUKE
UgwH6xorsDHqYyqdQG54AaABAg,Faith Zurowski,1535426805607,at 7:30 (the real one) your skin kinda looks like those mattress patterns lmaooo (not hating)
Ugw9bjytzYhv6V32N_54AaABAg,Lauren Poulin,1535426805621,You should try a personalized makeup box like Ipsy!
Ugy86xpSLAWTBIOwJ3l4AaABAg,Boredom_Is_My_Motivation,1535426805632,the fake lipstick kinda reminded me of deadpool's skin
Ugz4KnT1ee5uYWQO-Nd4AaABAg,Sarah Scronce,1535426805636,"saf: starts putting fake makeup on her face 
me: OH NO BABY WHAT IS YOU DOING"
Ugxw6qGPDRVi_GSqA6l4AaABAg,Meghan Melise,1535426805646,I have that hair tie! A friend brought it from Hawaii  😊
Ugwclb36JV89h0AwXBd4AaABAg,Jay Jay,1535426807769,34 ON TRENDING?!?! you go girl
Ugxz5bFoci0heaYvYjN4AaABAg,Chloe salsedo,1535426807781,Please tell me I’m not the only one who sings the intro with strange mouth sounds
Ugw34RvOLnuGHK7-Al54AaABAg,Jasmin Mendoza,1535426807793,Come back when your eyebrows aren’t caterpillars 😂
Ugwjy5SZz-Z4RSFxtwN4AaABAg,ActuallyAshley,1535423207807,Can you do a video where you go out for a whole day with body paint? Pls do!!!!!
Ugyyi0ai8nT82g6-NZ14AaABAg,Nowshin Talat,1535423207819,The circles all over her face xD
UgyZRfDmfrXdSQAnGBV4AaABAg,Nicollet Laframboise,1535423207831,this makes me not want to wear any makeup lmao
UgxuLe1EQwdEJeq1l5d4AaABAg,emily m,1535423207837,Okay but this was a genius spin on the microscope trend
UgzBxZtYRs2Vp1WH45l4AaABAg,Sukablood,1535423207848,That fake “Moon Child” is not real HOLO!
UgwwL8U4alGSONPPcBh4AaABAg,J.W. Higgs,1535423207856,Disgusting
UgxlG0MDtCGjyee4kYp4AaABAg,Tatjana,1535423207865,Saf should do a video where she buys the first 5 things off of shopping channels like QVC!  Like if you agree.
Ugw4qdR7Fn40auemWph4AaABAg,Morgan Althouse,1535423207878,I was eating some chicken quesadillas and you know that probably wasn't the best thing to do while watching this video
UgzsEzGpglM1NRHg4T94AaABAg,Magpie,1535423207885,Ngl I cried at her makeup mirror setup because I did that for three years in a dorm lol
UgzVXVu4ff5tSVLFYoV4AaABAg,Mama T NY,1535423207894,No to the lipstick choice 😢
UgxLwoz2Kox-7xw2BQZ4AaABAg,bbyskittles91,1535423207903,Got a chemical burn under my eyes from fake nyx concealer. I thought I was allergic to nyx until I noticed the liquid lipstick I bought did a weird magnetic thing where it would attach back to the lipstick in the container. Don't trust hair beauty stores.
Ugxn4ahYQIN32VWX73F4AaABAg,Bigotemushroom,1535423207916,When you run out of make up ideas-
UgzvwtH7XS7Esgoo1Yd4AaABAg,Fernando Salazar,1535423207927,"You can't discriminate homosexuality,  because it doesnot exist, is only a fake form of acting, homosexuality doesnot exist, there is only Male and female in all mammals,  all mammals,  because there is only 2 chromosomes that make up the gender, male is X chromosome,  and female is Y chromosome,  there is no other chromosome,  so there is no homosexuality,  is not nature, does not exist, is only those idiots who are acting that way trying to make that lie seem natural because they want to pretend to be victims of something that does not exist,  all homosexuals are haters who only are out there to injure and cause damage to others, all homosexuals have to be exterminated now"
UgzAge-KnyMXmhkC4D54AaABAg,Shelby Huckleberry,1535423207937,Anybody else find this trend repetitive and boring
Ugydf-GHc17xmH1WaLZ4AaABAg,JulsieMusic,1535423207941,these closeups give me anxiety... maybe it's like some weird mutated form of trypophobia. also love the cards against humanity cameo... hidden collab? #ad ;)
UgzBYPQu3wQL_6kwIaV4AaABAg,sunvzii,1535423207952,who are that gurl
Ugyl4HQavZ76KxyPDpB4AaABAg,Genesis Flores,1535423207962,Safiya’s inner corner on the real side looks like a colour pop highlighter😂😂😂
UgyPAA2aotwZZkvvLU94AaABAg,Hot Cheetos,1535423211942,U have nice bobs
UgxDEFt1-csnvrA5Z8p4AaABAg,Shaknowa Ferris,1535419611948,"You are the prettiest lizard person , I have ever seen!...:O"
UgxTgyqB95Xksuovvmd4AaABAg,Rei Joon Y,1535419611955,"Thanks to your video I found out my Naked 2 palette is a fake and I tossed it cuz I got scared, lol"
UgyXnNGHVB_t5V2vpUV4AaABAg,Abigail Mcgourley,1535419611962,Love the liquid lip 😍
UgzYKiy23lN5t48PNDl4AaABAg,Chel Hinkle,1535419611967,The green eyeshadow looks like a moss garden
UgzWz0do_E-RYU8GGoR4AaABAg,Whatdoyouwant -,1535419611976,"“I’m going to go in with peaches and cream”

My brain- ...s w e e t e r  t h a n  s w e e t"
Ugyq7vATLjHrKKrcizB4AaABAg,D. Lj,1535419611988,So  creavite
Ugxw0Sz5prKEg-fD_3l4AaABAg,Monse Esparza,1535419611998,WHEN YOU NEED HUSH CODES
Ugznytghkdld6muU9jF4AaABAg,Mrs. Tuan,1535419612013,I sped up the video to 1.5x and it sounds like a normal person speaking lol You speak very slowly Safiya.
Ugzvqd62VG5oZhxBVt94AaABAg,Quxxn M,1535419612025,yesss tinaaaaaa!!! Thank you for crediting her
UgzqkUJpgdZdFHW1n5l4AaABAg,Dylen Emos,1535419612033,"I think this one is real🙌
http://hustle.im/HdUgzjeG"
Ugz4hTz1ZOWCzSAGumx4AaABAg,deathlock deff,1535419612041,Most women look ugly under all that
UgyecfQSlo8xStQ_H0N4AaABAg,Chulabebe Glamarie,1535419612046,This is my first time seeing her and I love this girl already TYSM for doing that you are a champion 😍
UgzqoCWOgkxwJ15wRLd4AaABAg,Jessica Marie,1535419612052,I love your content!! But also I really love how you edit your video!! You make them so easy to follow and dont miss anything in showing and explaining!! Love love love
UgxmOCIG45B-qYyfBMN4AaABAg,Elizabeth_ Gonzalez,1535419612060,Can you do wish home decor???
UgywwIYiqNDnG22djUp4AaABAg,Dj Anjel,1535419612065,13:43
Ugwq0CbC9EPJ5Otg-P94AaABAg,ColletteisaBear,1535419612073,13:24 HORESHOE HAHAHA
UgxN8QATJKVghC6Y0N94AaABAg,Jennifer Olabode,1535416012083,I watched this while eating and I gotta say it was an interesting experience. 😭 But I really love this makeup science videos!!!
UgzSutTtZto_Jgjl6lB4AaABAg,Zeal 201,1535416012091,If women didn't have make up majority of them would not get boyfriends
UgxGm6eGqw5Z9-UV8Pp4AaABAg,Jantje Jemoer,1535416012102,What is her ethnicity
Ugwm1Sn0TPvIln0Bvkd4AaABAg,Sara Hamad,1535416014836,i had such a bad day today..... my hart is really broken but watching your video make me forget what i'm going through
Ugx-URyLOLZRYZ30CHJ4AaABAg,Eren Jacokes,1535416014852,"Some of these have feces in them
puts feces on face"
UgwkvkOAPZSbrDieX0x4AaABAg,Tinkers Tales,1535416014858,https://www.redbubble.com/people/tinkerstales/works/33030418-safiya-nygaard-style-challenge?asc=u&p=womens-relaxed-fit
Ugw2TBL3YS6DOzsspRN4AaABAg,Erin Peterson,1535416014876,"Is it just me or are the inner corner and central eyelid views of the fake eye shadow the same video at 7:00? At 8:12 it seems to be corrected... I love Safiya's videos, but that little detail really bugged me"
UgxDBOvErZB8iUY0Cpt4AaABAg,Crazydaisy143,1535416014890,i have a really good idea for future videos can you do the no mastic challenge sorry for bad spelling
Ugwc6AOZ0KXvSwGd2yd4AaABAg,Andrea Clawson,1535416014901,I loved this video❤️😂
UgwSV6KBr2JXeW2evaV4AaABAg,Briar Proud,1535416014912,What if you only lived on buzzfeedtasty videos from Instagram for a week! Like if you agree
Ugzhza2sKySSpfB10ZF4AaABAg,Cadence Shepperd,1535416014922,sis almost at 6 mil
Ugxw-XM3ZHprfDsQdMt4AaABAg,AnnChx,1535416014929,"Great video, just don't eat while you watch it especially at 10:40"
UgwkwIS234s0GDKtxyx4AaABAg,Sylvia Osullivan,1535412414939,Only started watching Safiya and I can happily say I'm obsessed 😫😫
UgxNQGYRkTm4lRJaA7Z4AaABAg,avengetheginge,1535412414948,Has anyone ever noticed how much Safiya looks like Fiona Gallagher? Or is it just me?..
UgwVX4nWVFDfu3ujuXx4AaABAg,Kj,1535412414951,You could review toilet paper and I would watch.
UgxUR8WNoFTjyq6-JLl4AaABAg,Mel:ssa 03,1535412414962,I love the “hellooo” part!! 😂💕
UgwQrd23lk5BMOXaAv14AaABAg,Akame Cup,1535412414966,But all make up is fake!
UgwKaK-V5w4LVKlq6Pt4AaABAg,Ben gaming smash craft,1535412414975,Ummmm.... why did she say die right into this????
Ugzq-jXwdcRZmhNb_ZB4AaABAg,Zoey's Review Corner,1535412414985,You should test the crayola makeup line
UgzGz00KQ1rOPPrhQcF4AaABAg,V,1535412414989,YOUR TRENDINNG
UgwkM0-QWIzB4AFJgMB4AaABAg,Lena's world,1535412414998,Try to shop from home plz saf ❤
Ugxh69USWhFDxPGnTGp4AaABAg,Luka Jared,1535412415012,Nice! But sis those lights behind you need to go
UgwEISBkjCjDlOjzkT14AaABAg,Jessica Sanchez,1535412415021,My favorite YouTuber
Ugx4LtmaGhFaiiChQKN4AaABAg,Creative Wolf,1535412417639,Do you work at ladylike?
Ugx8921AWLDEf5F-zbl4AaABAg,Mallory,1535412417650,why tf does her face look like that in the thumbnail.. like girl chill
UgxV32QZJIsNz_zbush4AaABAg,Malia Certeza-Baker,1535412417656,How do you know it's fake make-up?
UgyUhZgQ-_mswp42lDJ4AaABAg,Elizabeth Emel,1535408817667,14:54 that mark from the microscope
UgwKL-6g92_Qs6n9Pb14AaABAg,Empinapple,1535408817678,"Yay, I missed the bright lipsticks"
UgxDfDR3JEBEVKrJXjR4AaABAg,Eliezer German,1535408817700,The “real” makeup in the thumbnail looks like a milk chocolate brownie
Ugz53ZTyQYb62bNMOal4AaABAg,Brianna Gulchuk,1535408817725,EEEWWWWWWWWW
UgxZwiwMAc4RRtDDqAt4AaABAg,Aura Bear,1535408817746,I love honey 😍😍
Ugzv9zYfq0lJjZs4TKR4AaABAg,Rabia Shah,1535408817758,That fake highlight though 🤩 blinded me for a second lol
UgyupQ1OQ0W-2J3pgOB4AaABAg,Lunar Eclipse,1535408817772,your vids were the only thing me and my cuz would watch in FL
Ugx9wcY_mol4YIPrJFB4AaABAg,Lunar Eclipse,1535408817797,ur my fav youtuber
UgwYGyAr3gdtUri-P9N4AaABAg,Kate Marsh,1535408817829,Our skin is so weird. I think that was the first time i've seen skin magnified like that
Ugw9mk-UrWmSlOOeId94AaABAg,Amethyst93,1535408817840,I wanted to see that dark blue lipstick under the microscope too
Ugwrj5n96Yqvt7eSklx4AaABAg,KittenToco,1535408817845,Your videos help me fall asleep... you have a soothing voice
UgzSF64KbMhzqa4GMx54AaABAg,Chandler Moyer,1535408817856,Love this idea!
UgyFIiwAgJHM9aFzVgt4AaABAg,Mina Dia,1535408817866,"Hold on.........wait a minute ..........

butt scrub is a thing?? 😩"
UgzqM1b7W4Jmdza-Slh4AaABAg,Lyndell O,1535405217871,"🛑 Make an Extra 5K A Month on YouTube Without Posting Videos
http://bit.ly/1000ADayCapture

🏠🏦🏝#1 Work From Home On Youtube http://bit.ly/MoneytatHome

⌛Become a Member Now! http://bit.ly/CheckoutTime"
UgyJkmS6CZ1yk7KLIyB4AaABAg,Emily Bishop-Lester,1535405217880,“Turd Shape”. I died!! 💀☠️🤣🤣🤣🤣🤣🤣🤣🤣🤣🤣🤣
UgzZBr2Nodrdw_Z0R414AaABAg,Hot StepDad,1535405217891,Does anyone else think that you sound like Fraiser's ex wife?
UgwA0wl6LTqQE0L05hZ4AaABAg,Melissa Rodriguez,1535405217902,You should do a full face of makeup with tiny hands trust me it’s hard af
Ugy2nFEm90Q1WNmYMHx4AaABAg,Agne Paliunyte,1535405220245,I like to stay natural for many make-up bases contain bat guano that means bat poop=_=
Ugxb6t9rOXH96TpNI-l4AaABAg,Agne Paliunyte,1535405220250,I like to stay natural for
Ugx4JH5O7GTPTW73II14AaABAg,Celinezarb,1535405220261,Is that a jeffree star lippie I see? 😍
UgwfHBOuqXfocvTORGB4AaABAg,2 Cute a Charm,1535405220271,Love your videos
UgwI3V3g-6svt2BJ6Wx4AaABAg,Jungle Girl,1535405220282,My tutorials on hikes are real af
UgxJlfIQsXrld9317yN4AaABAg,purple potato,1535405220286,Safiya is insanely pretty
UgzvTzfAzsZMajAd_zd4AaABAg,NekoDaisuki,1535405220298,"3:41 Is it just me , who thought of RMs part in Blood, Sweat& Tears?"
UgyOB94IVF_cf7juQcx4AaABAg,Kate Williams,1535405220355,the circle on her left cheek :)
UgxzoxEUI9rT3WMLo3B4AaABAg,jisselle m,1535405220367,"https://abc13.com/bacteria-and-feces-found-in-fake-cosmetics-seized-in-la/3342874/

I will leave this here. This was in the news back in April talking about how bacteria and human waste was found in these fake-ups in the fashion district 😭😭😭😭"
Ugz8LoiurNYs7QBpT6x4AaABAg,Brenda Le,1535405220377,bold blue lip!
Ugx6aTPCn-qy-r61OZF4AaABAg,Ninja,1535401620383,Omg these girls with  makeup stop you can die
UgyOq7CWNfpiMgrW6PV4AaABAg,v e r a,1535401620392,"those white dots from the fake eyeshadow palette could be talc powder, I bet they didn't bother too much to blend out that formula 😂 both sides of the foundation looked pretty nasty under the microscope but other than that it was fun to watch 🤪"
UgwBn4US7DmTzA8Xas14AaABAg,non oui,1535401620401,Does anyone know what lipstick is she wearing? 🙌🏻
Ugz-cSdAVLXM4jeAYwt4AaABAg,Shyann Cersine,1535401620410,I like her voice
Ugz9FsGsitq1_tb6vnt4AaABAg,A Dude Called Jude,1535401620419,TERRIFYING BUT ONE HELL OF A THUMBNAIL IM SCREAMING
Ugxwpc-u--AIz84kVQh4AaABAg,Grace Shards,1535401620424,That was surprisingly gross....
UgxkxAMloVgLQYEl8xJ4AaABAg,Rebecca Jean,1535401620434,the fake Kylie Lip Kits are sticky and clumpy. the real stuff if definitely worth the money.
