id,user,timestamp,commentText
UgyNWorHele6f1_ugWN4AaABAg,firstpersonvideoable,1504484973826,"Sir you moved me tremendously, I am going to sign up to your patreon. I have been watching this series on Personality for a few hours every day, and I showed your lectures to a friend in Russia who is now addicted to your lectures. You are a gift to humanity. Thank you for helping me to change my life"
UgzxewTCVi7_cmE0N5x4AaABAg,DreadPirateRoberts,1504484973837,Wonderful
Ugx1JSv0sdVy-WbVsNp4AaABAg,Tech 52,1504484973842,What a remarkable thing to have suffered so much and to have arrived here before dawn on a Monday morning.
UgzReuZ7lsSJ3H4h3i14AaABAg,Enthos2,1504484973854,"""Be yourself! What you are at present doing, opining, and desiring, that is not really you.""

This quote gives me chills. It makes me want to get up and be productive and take on challenges"
UgxoPuyRWU7kQvgg1oB4AaABAg,Alexander Brandt,1504484973865,"We hear a lot about the psychology of liberals vs conservatives, but not a lot about individualists vs collectivists (which I don't think really correspond with liberal or conservative) anyone know anything about this?"
UgyUjSau8ITdNO25HRp4AaABAg,Mark,1504484973871,"1:10:30

While adressing the problems of the 'here and now' may seem more important than adressing the problems of 'the afterlife', consider the following:

1) If you actively start working on a better afterlife, and not passively wait around for it, you'll probably get there faster than if you constantly try to solve your short-term problems. There will always be more problems in the short term, that's what the legend of Sisyphus tells. 

Those who chase around their momentary problems (the fix, the game) end up costing time and energy of those who are working on the better future. This results in a negative attitude, with fatalism and shifting the blame in the mix. Because, when you find out that you can't solve every problem on your own, you might tend to blame others, instead of yourself. Resulting in violence, in words or in deeds. Slight nod to WWII here.

The Christian faith combats this by telling people not to WAIT for heaven, it tells people to actively WORK TOGETHER on making the place that they inhibit more Paradise-like. Working together requires coördination, compassion and some sacrifice, resulting in peace.


2.) Don't forget that Nietschze was probably a very unhappy person most of his life. He did a lot of drugs, was never married, and suffered a mental breakdown at 44. His life story seems to not have been a stable, and it's important to take this into consideration when you contextualize his work."
UgxeOaRmO0Vb2ODfaDx4AaABAg,cccalhoun,1504484973882,"I do not believe in the possibility of man-made utopia, but saying that man is a piano key — that freedom is only ""the freedom to say no"" is to equate freedom with rebellion. That is not the only freedom. There is also the freedom to say yes, and doing so does not compromise your freedom... unless you're a hippie ""doing your own thing"" or Frank Sinatra who did it ""his way"" or a teenager ""looking out for number 1."""
UgwQ6KPEokCxCqsy_8t4AaABAg,TDawg736,1504484973896,"For a good ""meditation"" on the need for limitations, watch the Twilight Zone episode ""A Nice Place to Visit"" (original series Twilight Zone)."
Ugz1l9mosaTTmUe4hqZ4AaABAg,PedroAguirre,1504484973908,1:22:10 that girl is touched by Fíodor..
Ugz0Eyye0Wd5f1MdWZx4AaABAg,Anthony Bias,1504484973918,"35:51 ""If you match your behavior properly to the phenomena, then you can master something like fire."" 
I was hitting a bowl as he was saying that. I guess you can say I've matched my behavior properly to the phenomena of fire."
UgxfGEwBfGAo3ISW9eJ4AaABAg,Tsu Sugawara,1504484973930,Skinner may have starved the rats but please don't starve your kids lmao.
UgzuqG93nOdT0r0ItUJ4AaABAg,dawzo,1504484986518,"Peterson is a master in floating the critical area between chaos and order. I really recommend reading the entropic brain theory by Carhart-Harris and colleagues, which combines physics, neuroscience, psychedelics and psychoanalysis. And guess what... It heavily utilises the chaos-order dichotomy. Well worth the somewhat long read!"
Ugw6QramHbJSFCIfj9p4AaABAg,Chainmale,1504484986531,Peterson is a rockstar professor
Ugy_Op76hVaQmsuehWF4AaABAg,Todd Auston,1504484986543,so worth watching
UgzxN4Vxi4qRzpMh9Y54AaABAg,Todd Auston,1504484986555,Thank you for your insight and allowing those not in your courses to view your lectures
UgwgEcVzJXjgM2z5-l94AaABAg,Java Monkey,1504484986566,"Something I find profoundly sad is the fact that the popular notion of Nietzsche's philosophy is essentially the exact opposite of what Nietzsche actually believed and wrote about.

This is partly, I suppose, due to the meddling of his appallingly malicious and antisemitic sister and brother-in-law's handling of his estate (to whom, in life, Nietzsche wrote many a strongly worded letter of condemnation). 

It's also partly due to the fact that his points go over the vast majority of people's heads - particularly the edgy teenagers who purport to be his devout followers.

One of the worst misunderstandings is that he's seen as the father of Nihilism (when, in fact, he was warning against its impending advent). The other colossal misunderstandings - which is perhaps much more damaging - is the concept of the Übermensch. Most people take it to mean that the strong, ruthless, and amoral are superior and have free reign to tyrannize everyone else - the Üntermenschen. In reality, he saw traditional morals and values rapidly decaying with the belief systems that held them in place, and that one must craft their values for themselves. One of those he thought up for himself was the (metaphorical) notion that time is circular, and that he should live his life as if he would have to relive it in the same way endlessly - so he should avoid actions that would result in suffering or regret.

A brilliant man, misunderstood by the masses."
Uggd34qZFoMcuHgCoAEC,CaptainCakebit,1504484986584,"Speaking of fear, why do some people treat me like a predator?
(Being stiff and nervous)"
Ugjw4eRV0uLQGngCoAEC,Forms In Space,1504484986595,no mention of emmerson?
UggVc-HmbG1j23gCoAEC,ZenWarrior5,1504484986617,"What a blessing to be able to find your youtube channel, best content on the internet 💯"
UgimnBxNUMdF-3gCoAEC,1nzi,1504484986631,1:11:05 Islam maybe? Islam puts a lot of emphasis on the idea of the afterlife even more so than modern day Christianity or Judaism.
UggE6H3e1Iz383gCoAEC,budsyremo,1504484986644,what is subjective experiences?
Ugge_cYcSw9c8XgCoAEC,The Morris Channel,1504484986655,seriously would love to see him and Alejandro jodorowski have a discussion. curious about Petersons thoughts on the movies el topo and the holy mountain. even after hearing commentery from jodorowski.
UggH8or812Ayd3gCoAEC,MissPopuri,1504484986668,You win or you die. That's how you play the Game of Throwns.
UghyygfWuq5llngCoAEC,mrssalina,1504484986680,Man must worship if faith in God is abandoned then people run into the arms of their new god - the state!
Ughsrl-zFCDcbXgCoAEC,Michael Camerino,1504484986693,This has been one of my favorite JP lectures. Anyone who wants get a quick overview on existentialism needs to watch this.
UgjXBHnlgb9Rs3gCoAEC,Michael Camerino,1504484986705,1:22:00 is gold bloody brilliant
UggDfXabBJ8OsngCoAEC,gammypage,1504484986719,Amazing.. !
UghWhZX89yr-8XgCoAEC,Fearsome Pony,1504484986732,"Mr.Peterson's words is what really  helps me ways to help make my life more meaningful that i was completely oblivious to before. I was always interested in art and philosophy, and the fallenness of the society as a construct and the  predicament of living and desperately trying to thrive in its consumptionism stricken reality. I suppliment my search with videos of Eric Dodson and reading Anthony De mello's Awakening, and  all of this combined teaches me to first observe and dissect everything i come in contact with, including myself and my reactions, emotions and psychological patterns, and only then form an opinion and an approach to it. . So far i have only come in contact with existentialist philosophy, but i  find it very difficult to believe  that i'll ever find a branch of philosophy more fitting for my life ( and im sure many of us feel like that, given that the universality and relevance of a work/idea system in lives of many people is a telltale sign of it's ingeniousness) I truly would suggest taking a deep, inquisitive  look into the amazing, elaborate scope of views and analysis that Mr.Peterson presents us with in his videos. As a prospective 21 year old university student from Poland , i can only say that at this point it is my greatest dream to sometime get a chance to listen to Mr.Peterson's lectures in person, preferably as a psychology/philosophy minor at uni of Toronto :)
On a side note,  that girl on the very far right of the  classroom with curly auburn hair has the most delicate and alluring beauty :)"
UgjkgHRV6w1DiHgCoAEC,Jebadia Fallen,1504484986744,"1:10:00
i thought of todays political drama and sjw.theyve lost hope in america today and want anything even if its end of freedom."
Ugix52hqa4wENHgCoAEC,Alexander Svozil,1504484986757,"This was the best lecture so far. Some of those quotes are so powerful, I had to run to the store and buy a notebook to write them down. Thank you!"
UgiPWQqfs5THeXgCoAEC,uniikkiz,1504484986769,1:08:26 that woman was not ready for Nietzsche and Peterson
UgjcfGjtLGqiE3gCoAEC,HYEOL,1504484998026,"a baby was born, an the circumstances there formed a person, that might be you."
UgiaIiAv4gRI_3gCoAEC,Juan Sebastian Echavez,1504484998037,"Your videos are informative and direct. They have been very entertaining as well, and is safe to say you are an awesome professor."
UgiAJGXLjblztXgCoAEC,Deathstroke OG,1504484998048,God bless Jordan Peterson.
Ugj16sVOD1hYUHgCoAEC,puhfrugherter,1504484998053,"Though I am currently studying linguistics in university, I can't help but be attracted to philosophy and psychology. 
The way in which the historic philosophical figures write is so captivating, despite the fact that due to my lack of knowledge on the subject it may as well be gibberish. 
I would like to one day sit down and have a real look into the history of philosophy and philosophical theory."
UgiGqVzvUXC9vngCoAEC,Alexander Munro,1504484998062,"Jordan, I replaced Spotify with your lectures not because I wanted to go to school, but because I wanted to make sense of what the hell is going on in this world-  THANK YOU!"
UgjooiUIpubdf3gCoAEC,SK Mike Murphy,1504484998073,"""Joan of Arc was not stuck at the cross-roads, either by rejecting all the paths like Tolstoy, or by accepting them all like Nietzsche. She chose a path, and went down it like a thunderbolt. Yet Joan, when I came to think of her, had in her all that was true either in Tolstoy or Nietzsche, all that was even tolerable in either of them. I thought of all that is noble in Tolstoy, the pleasure in plain things, especially in plain pity, the actualities of the earth, the reverence for the poor, the dignity of the bowed back. Joan of Arc had all that and with this great addition, that she endured poverty as well as admiring it; whereas Tolstoy is only a typical aristocrat trying to find out its secret. And then I thought of all that was brave and proud and pathetic in poor Nietzsche, and his mutiny against the emptiness and timidity of our time. I thought of his cry for the ecstatic equilibrium of danger, his hunger for the rush of great horses, his cry to arms. Well, Joan of Arc had all that, and again with this difference, that she did not praise fighting, but fought. We KNOW that she was not afraid of an army, while Nietzsche, for all we know, was afraid of a cow. Tolstoy only praised the peasant; she was the peasant. Nietzsche only praised the warrior; she was the warrior. She beat them both at their own antagonistic ideals; she was more gentle than the one, more violent than the other. Yet she was a perfectly practical person who did something, while they are wild speculators who do nothing. It was impossible that the thought should not cross my mind that she and her faith had perhaps some secret of moral unity and utility that has been lost. And with that thought came a larger one, and the colossal figure of her Master had also crossed the theatre of my thoughts"" ~ Chesterton"
Ugg_p9xUH5HOG3gCoAEC,SK Mike Murphy,1504484998083,"""All is Grace"" - said Saint Therese of Lisieux, (1896) whose short life was drawing to a close from TB at age 24. The 33rd Doctor of The Roman Catholic Church."
UgjL7798-Hg3lngCoAEC,Wolf House,1504484998094,I'm not smart enough to understand Nietzsche. I certainly understand nihilism tho.
UgjgkzXeja6VingCoAEC,Wilburious,1504484998098,"Three of the greatest thinkers of all time, brilliantly broken down by the greatest living mind. Thank you, sir! :)"
Ugipq9wEtIhAjXgCoAEC,hutchsawyer,1504484998110,and dostojewski said: 100 million dead would bring some kind of relieve for those left behind and the ones passing... so who is better off?!
Ugjea60kdIFruXgCoAEC,Juan Correa,1504484998118,"I'm a huge fan of your lectures, but I notice that you disregard USA's genocide of the Native Americans. I believe, regardless of ideology (Western or Communism), we are destined for nihilism or totalitarianism. What 'killed God,' was not a conscious effort,  but rather by the Church's own effort of attempting to prove their leaders divinity through scientific inquiry. If we're searching for the smoking gun, all we have to do is look at Descartes - it was his philosophy of doubt that caused us to search relentlessly for something that wasn't there. AND WE CAN NEVER GO BACK. So I think it's a bit disingenuous to say that this is a war between ideologies, which, in some ways, it might be. But that only distracts us from the real issue: all paths lead to the same place."
Ugjy46jBgrHA7ngCoAEC,Marky Sparky,1504484998129,"Nietzsche was a lazy bugga, ""write a book....fuck that! A sentence...yeh, that'll do!"""
UggmU55v4a1chngCoAEC,Sandra Anderson,1504484998139,"Blaise Pascal could face his ""throwness"" because he understood and believed Psalm 139 For you formed my inward parts;
    you knitted me together in my mother's womb.14 I praise you, for I am fearfully and wonderfully made.Wonderful are your works; my soul knows it very well.15 My frame was not hidden from you,when I was being made in secret, intricately woven in the depths of the earth.16 Your eyes saw my unformed substance;in your book were written, every one of them, the days that were formed for me,    when as yet there was none of them.17 How precious to me are your thoughts, O God!    How vast is the sum of them!18 If I would count them, they are more than the sand.    I awake, and I am still with you."
Ugjtk2s9pWG0ungCoAEC,Nathan Sybrandy,1504484998144,"Psh, Insidious JBP,  first dubbing in applause - and now even laughter at the end. The nerve!"
Uggg8rTZgL9wvngCoAEC,cjpo,1504484998155,"This is my favourite so far as I go through this series of lectures. Jordan's farewell, 'See you on thursday' had me clapping in my seat at the screen HAHA!! somewhat sad, but it resonates, the collection of thinkers into a somewhat unified direction to look at and ponder. A lot to take in."
Ughu_EvMYp5LCXgCoAEC,Ry Rez,1504484998165,this is dope
UghiAp5Xg1m0ZHgCoAEC,pretorious700,1504484998176,"Some of these students are obviously not even listening, much less absorbing anything."
UgheWt4_A4EImXgCoAEC,DimensionZombie,1504484998188,"CAN WE ALL AGREE....

I LOVE LICKING MY GIRLFRIENDS ANUS"
Ugia_vCgPre-IngCoAEC,Zachary Cieszinski,1504484998199,interesting to see that nietzche praised artists
Ughh54lrGAacRHgCoAEC,Zach Van Zant,1504484998209,Anyone else sing his name to the tune of the intro music?
UghwfJjEq_hK9ngCoAEC,Virgoan Fool,1504485007861,"What is with people watching hours of YouTube videos of someone talking about great men's work , but yet shy away from actually reading the men's work which he references? I find that nobody is actually doing the real work involved and that is much needed for true understanding. Is this not troubling for anybody else? ""No sleep because I am watching YouTube videos."" Is this helping you guys? Really?  I assure you that if you took 30 min to read one of the men's work he references in these videos that you would not have trouble sleeping and most importantly have an actual individualistic view on the subjects. Are you people hearing what Jordan is actually saying? What is the problem with implementing the things that are discussed here? All I see within the comments of people in these videos are people unable to implement anything. It's sad really."
UgjThKOL2x2xSHgCoAEC,Noah Rauch,1504485007872,Thank you for bringing the eyes of men into focus.
Ugjnb419eJVZJ3gCoAEC,RK rk,1504485007881,Thank you
UgjUy-hAOSFIzXgCoAEC,WeirdWorld,1504485007884,"So, im watching psyche lectures, and my weakness right now is executing my craft, which is music, wow. looks like my other weakness is procrastination too."
Ugj-MxRfVZsLYngCoAEC,cecilyt006,1504485007895,"Nietzche's prediction of Nihilism for the 20th century could have been spot on were it not for the rapid gains of industrialization and technology. That, and the possibility he was giving humans far too much credit? Advanced technology placed in the hands of the same simple monkeys has kept them (for the most part) from looking within for the truth."
UgjkPFpS3Kpzd3gCoAEC,The Marco,1504485007905,Thanks for your perspective doctor p
Ugjff62LUPyp7ngCoAEC,Mohammad Rashed,1504485007910,I wish I paid attention in my classes as much as I am paying it watching Dr. Peterson.!
UghLgQYWT6orF3gCoAEC,Dark Sun,1504485007919,I love how Nietchze says Christian's love of the world is impotant
UgjVm7lTz2UDc3gCoAEC,Limitless 1,1504485007929,"genius genius 
i tell you he is a genius brilliant 
Jordan Peterson you are brilliant"
Ugh3mGT1AtkZeXgCoAEC,Alistair B,1504485007932,I always find it strange that students sit there on their computers instead of giving him full attention
Ugj0nPVVBf7tbngCoAEC,Thang Tran,1504485007942,Amazing lecturer.
UggAyD2jC81GFngCoAEC,Yosef Estill,1504485007946,This is the best discussion of existentialism I've heard.
Ugg1N98g3pFBu3gCoAEC,MicheleAntonio,1504485007955,"""There's more to you than you know, and the way you call it out is by challenging yourself voluntarily, in as many directions as you can manage.""

Brilliant."
UghabeuL5Rqw93gCoAEC,iturtlehd,1504485007965,1:30:27 This part just blew my mind
UgjzKLI3RrAZs3gCoAEC,Dennis Stillings,1504485007968,"Not fear of death; fear of the most radical changes imaginable or, rather, unimaginable."
Ugh6TOxbn5D8lXgCoAEC,TASHHHH,1504485007978,"It's probably gorillas you're referring to, who spend all day chewing leaves. Chimps actually eat a lot of more easily digestible things like fruits and proteins."
UgiX0bIQ-SYAz3gCoAEC,Rentaghost okish,1504485007988,Dr. Peterson is Canada's biggest national treasure since Wayne Gretsky and Dan Akroyd
UggerQGqMZZGzHgCoAEC,LonelySpice Junkie,1504485007991,lol at him mentioning the comment from the previous lecture XD
Ugh71orWUjgo3XgCoAEC,Florin Amariutei,1504485008005,Thank you
UghqF1L2ejOUQ3gCoAEC,Augustuvi Primce dea.V.,1504485008015,"1/4 chinese dead in the mao time, that's the reason many chinese don't have one of 
 grandparent today"
UgjFwmAPKHObrXgCoAEC,Augustuvi Primce dea.V.,1504485013130,"mao killed 100 billion people, he is the reaper and blackdeath deus,  he is worshiped by indians in many states"
UgjqC9Lmuc4JtXgCoAEC,g r,1504485013141,"when I first heard of Peterson I thought, who is this idiot? that's bc I heard him talk about MGTOW, while being critiqued by Karen straughan (who actually admires him). I stand speechless and satisfied and I stand corrected. no one is a god. human all too human but bloody brilliant mate and pleasure to listen to on a rainy Sunday in the safe territory of my century old house"
UggI6SID8DbuIHgCoAEC,Sean Mcneme,1504485013145,"my favorite part of notes from the underground is where Dostoevsky says that an apt name for humans is ""the ungrateful biped."" there is such profound truth in that statement alone"
UgjMAcFQLj_d3ngCoAEC,pissedoffdude1,1504485013155,"Damn, every single kid has a laptop now in these classes.  Heh, I feel old now"
Ugj2BQx3eggofHgCoAEC,Squee505,1504485013166,"Hitman Absolution. (Sorry to post this in a philosophy video) The other reason Anita was basically right, or at least more right than you guys, Oh the punishment, the game is punishing you for killing the innocent civilians. We're talking about a game where you can change into the clothes of anyone you kill, by killing a person, you are literally and directly rewarded with a new costume. It encourages you to kill police, it encourages you to kill chefs, it encourages you to kill literally every person in the entire game, it gives you a war arsenal of impossibly powered weapons, which according to you I'm just not supposed to use, as you stealth your way around killing nobody but your target with fuckin poison in his food or something. You completely missed the point of the game, do you know what the game encourages you to do? It encourages one single perfect playthrough where you kill only your target, to maximize your unlocks, then it encourages you to replay the level and murder everything that moves with an SG552. Constantly changing between the costumes of the different people you've been killing to keep the heat off. You people pussified that game, you convinced the developer of your bullshit and now they think they're making a stealth game. It used to be darker than Grand Theft Auto."
UggNR84nUhhhHXgCoAEC,Squee505,1504485013176,"Great video, really enjoyed it."
UgjgAIxMmJ77SngCoAEC,James Richardson,1504485013179,What is his opening music?
UgiB4EauzstNaHgCoAEC,Waylon Flinn,1504485013189,"Great lectures. I'd like to challenge the idea that conflict resulting from assertiveness training is always indicative of a resistance from family members. I submit that agreeable people frequently lack the skill of being cordially disagreeable. 

While some men are tyrants (it's an archetype for a reason), it's easy for humans to see all women as victims and all men as controlling abusers. When we do so, we've fallen into the same trap that has so firmly and perniciously ensnared the modern left."
UggAQMP_Yw9B1ngCoAEC,Nic Sunderland-Baker,1504485013193,How many people in the world could give a lecture like this?
UgjYwMR4mk0ZtXgCoAEC,Renoir,1504485013205,Thank you for sharing.
UghCwyCsEWCgj3gCoAEC,Kyle,1504485013215,"That was a really good lecture. I have an exam on mental health a week from now and although 'anti-psychiatry' (as in, not categorical diagnostics) is suggested as a viable argument, it wasn't covered much in the course, so this was really helpful and informative. It was a strange accident that I even stumbled upon this video (I found you through the controversies that are going on).  

Are the 'existentialist explanations'(?) regarding Terror Managment Theory and behavioural learning your own? Are there any publications that I can read?"
UgglTv8Fk5RLpHgCoAEC,Gabriel's Movies,1504485013221,1:21:31
Ugj_cEnNWzqsPHgCoAEC,Gabriel's Movies,1504485013228,31:45
UgibrZXopU5CM3gCoAEC,Gabriel's Movies,1504485013235,24:14
UggMCqzLhZM-oHgCoAEC,JRB,1504485013241,That beanie is utterly preposterous
UggXDz-2eAvjIHgCoAEC,vaginismus,1504485013251,"""BuyBull"" that stupid book is a morons slavery manual. i bet you fail those who don't belie the bullshit you speak. What about Women Teachers & 1 Timothy 2:12 KJV ""The Legal BuyBull""? what about Romans 2:11 KJV & your ""Cult of Personality""? a PERSON is a surety bond AUTHORED/FATHERED and signed for by someone else! a person is a corporate slave ffs.

 I UNDERSTAND NO ONE... I OVERSTAND THEM. THEY HAVE NO AUTHORITY OVER THAT WHICH I AUTHOR/FATHER."
