id,user,timestamp,commentText
UgwlBkvL0YEoKJkDTDV4AaABAg,Carl DDoT,1522801686305,"I think I heard a question at the end of the lecture about pain and what it is. I have thought about the nature of pain a bit but I doubt that thought is worth much consideration. Even so, I wrote a few lines on what I think pain is or at least what some part of it is. Here goes:

Pain is that thing which distances oneself from all that is good and enjoyable. It precludes all good. No food tastes sweet; no music moves; no caress excites. It is a form of death.

I know from my own experience of severe pain that nothing that I normally would enjoy or crave or phantasize about is worth a damn. 

Ok, so now I have thrown this out. Probably not the smartest thing I have done today but it’s not like I have worse things to do and it might spur a conversation. If not I’ll risk the projectiles flung toward me."
Ugx6Wa0eEjaF37mBGrF4AaABAg,Josue Roberto,1522801694782,Saving video to watch it at midnight
Ugx2ptyh5oF9U7CmALV4AaABAg,Jarod Johnson,1522801694793,You give in to loss and ultimately pure individual suffering becomes the litmus test for life and death cosmology.... why would a mythological underworld be necessary unless the trauma of the past was clearly a misjudgement of the future.  Or whether a misjudgement of the past was just a nominal scapegoat for annulled future endeavors... We can't accurately bridge timelines without cosmological birth and death cycles...  3..6..9...13... 23... 33... 72.... 3;6;9... We... Find... Us through all iterations of time
Ugz4Ew-kHKN6wabLLVN4AaABAg,Carl Harmeling,1522801694797,The life experiences of various people are not at all equal. Some are born to a charmed and carefree life and cannot imagine anything really bad ever happening to them or their loved ones. They are horribly shocked if anything tragic happens. This was not supposed to happen to people like them. Others are born into immediate suffering and privation and spend their lives very differently than the privileged ones. Looking directly at life many cracks and faults are apparent but looking at life as through a faulty glass the beauty and nobility of the human being is wondrous.
UgyfM7NkQ0eD64GhuWd4AaABAg,Steven Rhodes,1522801694808,How is this man so grossly underestimated
UgwlE7Uu0Xml8XRs5Z54AaABAg,Matheus Benites,1522801694818,"I'd like to know Peterson's thought on Viktor Frankl's logotherapy and ""Man's search for meaning""."
Ugw2PT-CCkL4GSEzdVN4AaABAg,Christopher Rivera,1522801694822,"The Pascal quote could just be described as ""apperceptive"" ( =fully conscious perception). But Existentialism is just a conflation of pseudo-intellectuals, obscurantists, neurotics, and pessimists with some valid philosophy (if you can sift through all these flawed pseuds playing the book selling game through entertaining phraseology nonsense) all thrown into one category.

A.K.: According to encyclopedias, Kierkegaard is supposed to have been the first ""existentialist"" philosopher. But what does that even mean? When was there ever a philosopher who didn't concern himself with existence? That's all that philosophers are concerned with! because they are concerned with everything, and there IS nothing else apart from existence! Do these people who create these utterly retarded labels ever read anything? All the issues with which K-man was concerned have been mulled over by philosophers for millennia, and if you look closely enough you'll not find a single idea in him that had not already been explored to one degree or another by numerous previous thinkers (and in plenty of cases to a much greater depth than him). There is no ""existentialism"", there are only a bunch of mouthbreathing subhumans who are too stupid to deal with the actual issues at hand, and who therefore prefer to make neat little bunches of them by blanketing them with retarded makeshift labels, and then proceed to juggle those instead so that they won't ever have to think about anything. Even ""postmodernism"" is a more valid label than existentialism, and that's saying something!"
UgyO_g6curnV9WeJnkZ4AaABAg,Meow Mix,1522801694832,How do you teach someone with a genetic marker “ does not learn well from mistakes”
UgwUKI5Jgd9w26VIZYl4AaABAg,Ok Gaming,1522801694843,"Yet another amazing lecture presented by Mr. Peterson. As always, amazing analogies and amazing explanations."
Ugw1DZmnR76AyaPEVMF4AaABAg,kot0564,1522801694846,"I was just thinking about the same thing that Dostoevsky was talking about in notes from the underground when I saw the commercial for a desk that pulls up so you can stand at it... people look for difficulty to make life pleasurable, in fact, can pleasure exist without difficulty ? Reminds me of a saying that I heard at work, “People aren’t happy unless they have something to bitch about.”"
UgznCwCe96Sipl1Vatp4AaABAg,KingMinosxxvi,1522801694857,this is the worst lecture on nietzsche ever
UgxMCE2MuP4RC8ABwxZ4AaABAg,Bookwyrm,1522801694868,Dammit put your laptops away and just LISTEN!
UgyEr6gR7e9IwMutEnZ4AaABAg,Pedro Ricardo,1522801694873,"Mr. Peterson, I wanna quit Pedagogy and starts Psychology with you, sir"
UgwBB5VDsXmtVTVEpR94AaABAg,Mountain Home,1522801694883,"👊😂""it's just how it is, deal with it."""
UgxmuaEIlLbukOAShCB4AaABAg,Tiktaalik,1522801694894,WHY would anyone believe this putrid imbecile and lie machine knows anything about existentialism?
Ugy3dPvqCqe3kWs7Dut4AaABAg,philip pocock,1522801694898,"how does one talk to a crowd about individualism? It begs the question and assumes the individual exists. seems tautological and loses heidegger's poetic intimacy and the pain of innate difference, why we hug. individualism is not so much a solution as it poses problems, © alone"
UgwnbvXUvjRsLXgkGi94AaABAg,TTT,1522801694908,Westworld explained o.o
Ugx5ZettOU_nG569tqZ4AaABAg,chavruta2000,1522801694920,"He is overly negative for me. Too much Western philosophy does that to people. He says life is steeped in misery, and I and many people just don't believe that."
UgzfaP_fCNCadG1P0zV4AaABAg,Chilli Mac,1520123294931,https://www.youtube.com/watch?v=wM1fJF7IIUs&t=1430s
UgzFtoUOC7vA5axnukR4AaABAg,o C,1520123294943,كسول مرتاح
UgwcttYa2fihUxWCUkZ4AaABAg,D Glen,1520123295005,"He should be Canada's next PM. Correction, he should be the current PM."
Ugyetrm0XvAGOO_Ca1p4AaABAg,mjcard,1520123308415,I have attended univ. lectures at the end of which attendees spontaneously applauded. It's not so totally unique.
UgyPqxlotqMuaDzWEtt4AaABAg,Chris Brown,1520123308422,That was captivating.
UgxtHTzw2z3HqVp5DDF4AaABAg,Pertained Orange Man,1520123308435,"320,000 views on a college lecture video"
UgzoW7o9vF2I8THxMSp4AaABAg,Jon Lynch,1520123308448,"""What the hell are you gonna do with 6 bees.  They're not going to do any good on their own, are they??"""
UgyrRwWyIEot6-YL3hp4AaABAg,Dylan Flanagan,1520123308454,#ChimpLyfe™️
UgyVheVl6SI3hUEtRhN4AaABAg,scott banta,1520123308466,I am enraged at being for the state of being which allows for the unfair advantage that this ethnically diverse class has been granted the educational privilege and advantage over me of being seated in a class where they can be wholly enlightened by one of the greatest minds of our time. ;-)
UgyJJz5KLn_fuaZyVOd4AaABAg,Von Schwetz K,1520123308478,"51:12 He said women outperforming men all the way from elementary school through university now is an absolute catastrophe. I know he meant the cause of it is the catastrophe, not the fact that women are doing better. But he needs to phrase it properly, coz its very off putting when he makes statements that seem like he want to help men in expense of woman."
UgxzA3AUULl65V4QHsR4AaABAg,Biopsychosocial,1520123308489,"Dr.Jordan Peterson,THANK YOU!"
Ugxv5vYHfcH8c-38DfN4AaABAg,S&DH,1520123308492,Jordan gets Nietzsche completely wrong. Naive. Like many he likely succumbed to Nietzsche's mesmerizing gift for rolling metaphor and so misses the yawning abyss of pitiless nihilism that Nietzsche opens without any redemptive purpose whatever.
Ugy0Qs1NbNNZ_cbpDBF4AaABAg,John Kness,1520123308504,"How bout it's not what I say,  but it is what I do ?"
UgwcTY8JbbSNjmSgO5B4AaABAg,Andre Costin,1520123308515,You can't be dead though.  That would be non-being.
Ugxvnq7WdIzo0Qpvq5h4AaABAg,Don Binkley,1517704108526,"My brain is Dr. Peterson, can I stop listening now? Could you just read me a story?"
UgyvQfCnQRVqlUaE2QF4AaABAg,Oliver Ruane,1517704108532,"1:22:10 Girl getting her mind blown. :D
Very nice lecture."
UgxfXlAmV24AZSaauRh4AaABAg,وشل خال,1517704108543,Those applause are well earned sir. thank you for everything you do
UgwuR0rOakxYgAEgbaF4AaABAg,tyler millaway,1517704108554,The difference between order and chaos is adorable to me for most people.😆
Ugy9VUxGQOU6uioTmQl4AaABAg,Ma Gumi,1517704108558,"The observation about the unbearable burden of material utopia was made as early as in ancient Greece, by Homer in Odyssey, when he puts Odysseus on an island with Calypso, with a promise of immortal life in eternal bliss, and as late as in the first Matrix movie, in a scene where Agent Smith explains  to Morpheus that the first Matrix had to be destroyed, because human brains were unable to cope with a perfect, flawless world without any suffering. :)"
Ugzw6XcD86Xaog_RiKx4AaABAg,Amanda Walls,1517704108569,anyone else mosh to the intro music everytime?
UgyK42NJjlCy2UmmY754AaABAg,Speedy Gonzales,1517704108580,I am fascinated by the graveyard of teaching apparatus on the left-hand side of the stage. Where old equipment goes to die.
Ugw_2qp6adrguxVVQRp4AaABAg,J M,1517704108592,The elevator is a great metaphor.
Ugwj2_xGKWL3o0Y0x394AaABAg,Helena Chase,1517704108603,Wow 13  minutes in . We are afraid of isolated being... perhaps more than death.  Deep
UgzAgccggRCeXjIyCA94AaABAg,Jiyva,1517704121598,you said that a man predicted communism and fascism but that history is irrational and can't be predicted? that's an interesting confict
Ugx5T-GShxvbMMT9Cjx4AaABAg,Danica Dujakovic,1517704121612,Thank you Mr. Peterson!
UgzByohSM--Zdx7c0KF4AaABAg,coscorrodrift,1517704121622,"By the way I'm not sure if agoraphobia is what you say it is, Mr Peterson. AFAIK what you define is claustrophobia, agoraphobia is kind of  the opposite, being afraid of wide spaces with lots of people (from the greek Agora, the big central square with the market and all that in the polis), and those people AFAIK can't really get out of the house, and order all their food online and all that. But the point is made, just wanted to clear that out"
UgzXYWkcvAkPMGIhEt14AaABAg,Ludwig Beethoven,1517704121640,"""Time is a flat circle"", welcome back? uh? True Detective Season 1 OK!!"
Ugx8nhyvqrUf3wFVWCx4AaABAg,Hiro Nakae,1517704121653,A really good heart attack lol
UgxfNb499VolnW9M7Zd4AaABAg,Queen Faithfulness,1517704121664,I just ended a 9-10 year relationship with Alcohol & anxiety.... I am gonna be 25 on the 31st... It's a powerful force. A very powerful realisation & I am the 1. I am the circles of this universe. I can't wait to die so I can go to my higher Realm. <3
UgymslLLoPE_sOLNDtN4AaABAg,the guy,1517704121679,"""it's better to anxious than to be in pain or dead, even though it's not so good to be anxious"""
Ugzh2CpPO5CfSQUGWex4AaABAg,Roddy Dykes,1517704121692,"The point he is making around 10:00 in, about the bizarre fact that we are who we are now, and not in the infinity long void of time in the past or future, is one I’ve been thinking about a lot lately"
Ugx05_ZISMWR-hqOPK14AaABAg,John Lara,1517704121707,he seemed kind of out of breath in his first few sentences
Ugw4GARgjLqjRFaYKiV4AaABAg,Bryan Barrett,1517704121719,"Existentialism = The philosophy of facing reality as it exist.

Postmodernism = whiny progressive liberals who are so irrationally ignorant and opposed to logic and truth that they deny reality as it exist and in fact unconsciously create their own reality oblivious and in denial of rationality, complexity, and unpleasant existence."
UgwRGzL79Wldo6Shp1Z4AaABAg,Ms K Jones,1517704121730,quasi permanent negative emotion. Oh shit - BINGO
UgxBENUpeAL68VnnxBB4AaABAg,Angel O,1517704121744,"All of a sudden, for some reason, after 1 hour and 23 minutes of watching this, all I want to doo is watch Judge Dredd..."
UgxcTflbNOWyYc28g554AaABAg,Sheridan F,1517704121755,"Roughly speaking. 
I f***ing love you JP.

The true SJW. In the complete opposite scenario of the modern ""white privileged"" SJW. Fighting for ACTUAL justice amongst us all. Meritocracy. One word. If you don't like it, sorry."
UgyR1rE4LKf2KZikw154AaABAg,tezzo55,1517704121765,":-) Who is the sex indeterminate, stupid hated, growth stunted, being on the far left (funny that!), playing with it's mobile, while the Person machine is in the house, in full flight? So many people would love to be in that room, with the great man himself, and this en-tity is playing Pokemon on it's wanka-phone. Wake up little dudette, you are missing the world. Love ya, XXX :-)"
UgwKyFfqpRajz-pHorh4AaABAg,Frank Olm,1515025721772,Excellent insights...
UgylmUML2hxCzLksIxp4AaABAg,peterboy sonicat,1515025721780,Why isn't the amalgamation of socioeconomic classes pertinent in this lecture of philosophers?
Ugy2YzVU5uRMTHFVUNZ4AaABAg,mitch57293,1515025721839,6:37
UgyJYlVFvTgSFAMzZXR4AaABAg,Vince Lang,1515025721850,"It occurs to me that, as GREAT as my professors were back in University, and I had the priviledge of having some very, very good ones, I really only needed one teacher: this man, and his distillation of those great thinkers into a coherent whole.

There is great sadness in coming here at the age of 50 but, as with the individual in the coils of the dragon of chaos, therein also lies the GOLD of opportunity.

Could have been worse: I could be watching this at 80 . . ."
UgxF7OEoaKLYOUM-4DJ4AaABAg,Edelmond,1515025721863,am i the only one who did not understand the lecture from the first time ?????
UgwHrqe_DR-FPGbdkS94AaABAg,alessandro lazzaro,1515025721875,"i've been following this channel, the lessons, the speeches of mr. Peterson and all the debate for more than a year now, even though i am in Italy, the lessons are the best, i would have liked very much to be in a class like that, more than half of my teachers were dumb as f* - and i'm not even so much interested in the skills of psychology or therapy - but i think just this attitude is the key, it makes things so easy to follow. i can't come to Canada to meet this man but i think it would be beautiful to thank him and shake his hand in person, i don't mean to be over the top, but this is a giant work in proportion of my classroom memories, or maybe i am grown and more open ""roughly speaking"" to attend a serious lesson. and by stretching my mind to catch the meaning of his words, my english is getting so much better. so, i wish that this amount of work could be available forever, and for everyone. this is like discovering a treasure inside a dusty attic."
UgwOGtxaeAYgt4vAyG54AaABAg,Johnwaynelsd25,1515025739327,"Loved this dude when he first came out, but hes a bit of a preacher, and hes very religious, although he tries to downplay it. I would love to see him debate hitchens, sadly we will never see that."
Ugz5EbYZNH8Aqn6v89V4AaABAg,zvolencan1,1515025739335,"So utopia of having everything without effort leads to catastrophe, but still in every election we vote for those, who promise that. We vote for having everything, and having no problem to solve. But can you imagine voting for someone who will tell you ""you will have prosperity, but you will have to do something for that""? Nobody would go for that. Therefore I think we are doomed in this system. What can be done about it?"
UgwzVkTpnualvMebaLJ4AaABAg,Mr Sunshine,1512347339346,"You're a hero, Dr. Peterson. You speak the truth, as best you can. In the Empire of Lies, speaking the truth is a rebellious act. You're a good man."
UgzFlOm5t7oHFw7iuj54AaABAg,Frank,1512347339358,You have to watch this at least 5 times to really even begin to comprehend the depth of these issues..
Ugxf6ijmi61yKGIn-114AaABAg,Luke Lloyd,1512347339370,"Truly a top class dissemination of the iconoclasts of the past with intermittent injections of psychological insight. 

Thank You"
UgygqH7fhqcmzptUal14AaABAg,No Zack,1512347339381,1:22:45 Kierkegaard is a fucking comedian; who knew?
UgyMA26DjaaNwv8--dl4AaABAg,Lots To Learn,1512347339392,1:25:35 - so this need for difficulty results in the importation of hordes of illiterate unemployables whose task is to bring western civilisation to its end.
UgxMOmjLj4fs71qpu3p4AaABAg,John McLaughlin,1512347339397,"I wanna go back to school. I wanna take Dr Peterson's courses in Toronto. So sad, I am."
UgwHSS9K2mQciIAgIpB4AaABAg,254k 254k,1512347339406,"Beauty of philosophy, was drunk  and down looking for a different perspective, glad to have landed here."
Ugw3ELJBBTlrpDFH8yF4AaABAg,ThePhilosophyDoctor,1512347339417,"“I wish it need not have happened in my time,"" said Frodo.
""So do I,"" said Gandalf, ""and so do all who live to see such times. But that is not for them to decide. All we have to decide is what to do with the time that is given us.”
― J.R.R. Tolkien, The Fellowship of the Ring"
UgxVO8lQWJt3qV6pUkd4AaABAg,nordrume,1512347339428,"In the last half hour of the lecture everyone stops smiling, laughing and taking notes, and starts chewing/picking their finger nails and touching or covering up their faces/necks. Girl on the right is so uncomfortable she crosses her legs, hugs herself and covers her neck with her shirt. He has the whole class on the verge of PTSD, and then they APPLAUD his making them feel so uncomfortable (and making them braver). Well done, Dr Peterson"
UgzLNa8v6nz0C5LZEf94AaABAg,He Was Fuzzy Wuzzy,1512347339437,"Profound, in every sense of the word. My consciousness has been cracked wide and deeply opened."
UgzpCvuHwkdoX1IP7qB4AaABAg,1234Daan4321,1512347339443,Students actually clap for professor Peterson..🤣 amazing
Ugz5OVEV0zGt_oF8GvB4AaABAg,Face Bookman,1512347339456,Why does it seem people are more likely to believe what they are told over what they see with their own eyes
UgxKtB18_aOG18Z5rmR4AaABAg,Chris West,1512347339466,"I really like this talk but I'd like to nit pick about the chimps and leaves...leaves have HIGH NUTRITION, but LOW CALORIC CONTENT...The more calories we were able to eat by minimized chewing allowed us more free time to build more tools, social structures, etc...at least that's my perception"
UgwwP0MjorrB0f56lDp4AaABAg,j0nnyism,1512347339470,I think the trial would really complement notes from the underground just dont read them whilst youre dealing with the irs or youll end up concocting all sorts of paranoid delusions
Ugz2y5XMy7FI0d1Iaol4AaABAg,j0nnyism,1512347339480,Christianity may be a lie but we live in a world where many peoples needs are not met so maybe a futile hope in an afterlife is a compassionate lie as long as it doesnt prevent us from trying to improve the here and now. The problem is that christians will often accept their lot in life and look to the next one in hope. I think hope is mans most dangerous emotion. Man would walk through the gates of hell because of the slightest of hopes.
UgxYwHTYRHayJxePv4x4AaABAg,j0nnyism,1512347339489,Hes very good at making this stuff digestible. Sign of a good teacher i suppose
UgyqvD25ZH_zkR67Xv14AaABAg,Roberto Sanchez,1512347339497,"20:28-20:52 Dr. Peterson basically explains President Obama's ""magic wand"" comment in response to Trump."
UgzGeiErlLTLi7EPOQp4AaABAg,Georgi Dobrev,1512347339503,"That was one good lecture, even as Peterson lectures go."
UgxE_oKWAtifqHnwt1p4AaABAg,Scott Rose,1512347356983,preach!
UgwDTSSpkZGC5icN9nF4AaABAg,Krasbin,1509755357005,"In response to:
https://youtu.be/4qZ3EsrKPsc

I believe that people are not rational, but rationalizing. Als long as a story is believable for us or others, we apply it as if it were true. Proper emotions(whatever that means) are crucial for rational thinking. But if we say emotions are irrational, rational thinking is fundamentally irrational. Therefore we can only approach rationality, but never reach it. It is a theoretical extreme. But creating stories about what you did and why is much more believable as a theory, and that is rationalizing."
Ugx-UAkZbicRl9_uEk14AaABAg,Count Rufus,1509755357030,"Both Dostoevsky and Nitzsche wrote about how religion is daying in Europe. And both predicted correctly what will happen. Hitler and Stalin happened. And greatest catastrophe in history. 
Both Hitler and Stalin were Socialist.Their version of Socialism.WW2 was revanchism and domination of Europe and world.
Hitler wanted Poland so he can take on France.Then France so he can take Europe.Europe so he can take Russia.And finaly an all-out War against Usa and Uk
That was his goal.Im half German and i speak the language. If only people knew and his insane RETHORIC. Anti Capitalism and Anti Communism were just propaganda for War of domination and conquests."
UgyKSTLB4meIKiGHYCN4AaABAg,horsemumbler1,1509755357050,"The closing remark reminded of low energy Jed ""Please clap"" Bush.
Le virgin politician vs the Chad professor."
UgzgSavo_GeCbd7CruZ4AaABAg,Radel Dadel,1509755357064,calm rat = comrad?
Ugwly__33zyKnbJuGRt4AaABAg,Boky Channel,1509755357069,Isn't Irvin Yalom an existential psychotherapist?
Ugyk1J5jZDxDNPoVG1V4AaABAg,fluffykittynoodles,1509755357079,"I really feel like he's addressing me in this lecture. I'm on my third listen, now.."
UgyB8uY3h8YpDK0rpSx4AaABAg,J Mo,1509755357090,The skipping makes this unwatchable
Ugy6zZOWtTvH4TsE9WB4AaABAg,yon blek,1509755357101,"Speaking of nihilistic characters,GG Allin is an interesting example."
UgxTqy-5Bcr7xSnLjRd4AaABAg,Rikishade1,1509755357112,Favorite Peterson vid right here. Behind Huxley and Camus I'd probably list Dostoyevsky as the novelist whose influence was the most active in shaping my outlook on life.
UgyiR3ywr3jw6UHuc4d4AaABAg,Apollo,1509755357116,I want to inject Jordan Peterson into my veins
Ugz5t0exUKCiGbregdx4AaABAg,Alessandro LinuxBSD,1509755357127,"I'm curious to known what Jordan B Peterson think about this philosophy:
Ayn Rand, What is the Difference Between Objectivism and Nietzsche's Philosophy?
https://youtu.be/U6gV1MUSXMg"
UgxX4PBF_avvizE_3Yh4AaABAg,Gavin Palmer,1509755357140,Magnesium helped me with heart palpitations.   Magnesium deficiency is real!  Taking a good daily magnesium supplement also lowered my stress and anxiety.
UgzR07p0nKySrKWZlk94AaABAg,Marcus Tullius Cicero,1509755357158,48:00 I'll be back.
UgzSJTk7-rmyBR1PMJt4AaABAg,Vic Snaggletooth,1507076957171,"Though i am listening this fantastic and profound lecture on YouTube, but i am totally transported in the classroom. The oratory magnificence of Mr. Peterson on all topics and ideals are not only meditative but also equally equipped with all sorts of easiness to realize, understand and think upon them. It's always like a open door. Respect goes to him for breaking down the valuable insights of Existentialism and it's impact with relevancy of Neuro psychology. My horizon and dimensions broadened upon listening this."
UgzMvGXSX278QNv33qF4AaABAg,Wesley Stuer,1507076957177,I would love to hear what JP has to say about Spinoza.
UgxgfJmkWZPkHIbJpwp4AaABAg,KuroBatora,1507076957197,What it do?  I'm here to increase everyone's suffering and you will all thank me alright?  Make sure you thank me as I couldn't do it without you.
Ugxi8rpDqWVzwYeEecp4AaABAg,Whitey Limpstock den Galne,1507076957210,The existentialists worry about the dumbest things.
Ugwr9ol4iZ2GZfqxEg54AaABAg,Miguel morrison,1507076957226,Great explanation of Nietzsche
Ugx71xu6Xw5ph-24LfF4AaABAg,Miguel morrison,1507076957243,I've been waiting for something like this for a long time.
UgwAISjJIZpWQtanzhx4AaABAg,zerothehero123,1507076973711,Chimps dont only chew leaves all day. They are savage hunters.
Ugy8jIwtQfLvvRBkAxx4AaABAg,DubskiDude,1507076973732,Calm rat? More like comrade amiright bois?☭☭☭☭☭
Ugzv5EHhii2Glx05Ufp4AaABAg,Max Purcell,1504484973747,"I watched and listen to the entire course over this summer and, inspired, i managed to get into a Dostoevsky course! The whole thing is Dostoevsky!"
UgxZGwPt1v192knasHt4AaABAg,Alice Eliot,1504484973768,"35:09 And that's the explanation why vegetarians are stupid.
I always ask them: why do you think is it that cows and gorillas have such huge bellies?
And they always stupidly ask back: are you saying that cows are fat?
Then i always have to explain the difference between being fat, and having a huge belly like a gorilla.
They never get. ""You can get all the nurishment from a vegetarian diet"". 
Yes you can, with the intestines of a cow. Do humans have them?"
UgyaqR6mFh40z1M8Tlt4AaABAg,Jimmy Jimmy,1504484973780,"""You're going to have to stop doing that, someone accused me on YouTube of dubbing in Applause at the end of my lecture.""
Hahhaaha"
Ugy8DuEa2vNHYRkk-Wt4AaABAg,Deedless Deity,1504484973791,"Can self-sabotage, in some cases and to a certain degree, not just be explained by self-hatred or despise, or the subconscious understanding that the current occupation is of no positive future and a waste of energy and stress, but also as a means to create difficulty when things are too easy?
Seeking out the troll, the unbeatable baiter or idiot, just to have that endless stressful battle?"
UgyUWQtatAp6onndSSh4AaABAg,Deedless Deity,1504484973801,"I just realized; all the narcissists I knew also put on the same flabbergasted and lost face, like a toddler not knowing where mommy's gone on a wide open field, when someone pointed out a flaw of theirs."
Ugww4oGotrUQmCg9TL54AaABAg,Pareidolia,1504484973805,Thank you
Ugwp3EkALGO_XD9WiAd4AaABAg,Ed Metz Jr,1504484973820,"Those readings brought tears to my eyes, simply beautiful."
