id,user,timestamp,commentText
UgwRrLHOsY9vcG8ja5V4AaABAg,ghostofkrows,1528071976549,"I am another broken man washed ashore at the foot of the lighthouse of Jordan Peterson. Here is my dirty laundry I wish to be rid of it. Leaving it here will not help me, but it may help someone else.
I was born into a terrible situation, a marriage already being torn apart by a workaholoic, alcholoic, abusive, absentee father and a mother who fled with me and my sister into a religious cult. Me and my sister were raped. My mom abandoned us with my father, got a divorce and became transient only to show up into our lives to make empty promises and cause drama. We were poor. We farmed and hunted our Grandfather's land while living in a two bed camper trailer. We bought unlabeled dented cans from the super market. Before school age me and my sister would be molested by other people again. My dads brother was drunk piece of shit he would show up molest my sister start fights with my dad and usually get his head busted open. My earliest Christmas Memories were of my uncles head getting smashed through the glass door on our trailer. My dad was a harsh man and hard to get along with but he rarely beat us just yelled alot. He always used a belt even though it was metal studded. Things actually got worse after I started attending school. I was given an I.Q. test and turned out to be a genius. While all the other kids were let out to recess me and a few others were hauled into the library to complete extra assignments. I was doing 2 page book reports by second grade and read the lord of rings trilogy and Moby Dick in 5th grade. My behavioral problems started manifesting early and by sixth and I was already out of control. I was selling cigarettes and booze out of my locker by seventh grade and was in fights daily with every clique in school. I still hold the record for spending 193 days  in school supension   i.e. study hall, detention. I had tried to hit a student with an unopened can of Sprite but almost got a teacher instead. Soon my run ins with the law would start. I was hated for my intelligence and my awkwardness. Constantly being bullied at school and abused at home. I had two misdemeanors and a record before turning sixteen. I worked but couldn't keep a job for more than a year at a time. At this point I was a drunk. I ran away at seventeen 3,000 miles away and lived in a flop house with a revolving rouge's gallery of kids and misfits. We would constantly have the cops called on us. Trust me we were deserved it. A gang moved in and started bullying us. I watched as they drug my friend down the sidewalk kicking and punching him till he quit moving. We rushed him to the hospital he stayed there in ICU for five days. I was forced to ''work'' for the gang. The ''jobs were not pretty''. I still think of those people I hurt trying to save my own worthless hide. This went on for a number of years. Moving back I screwed living with my dad lost my girlfriend and ended up on my transient moms couch begging for death. I was 22. I had tried to hang myself a few years before so this time I tried overdosing pills and booze. I ended joining the military with the thought that I would be worth something to someone if I could just hold it together long enough to get killed in combat. I tried to join the infantry but after my ASVAB scores came back my recruiters would have none of that. I joined as an electronics engineer with a secret clearance. I thrived in the Army doing well at first but the strain of P.T. began tearing my body apart. I knew I could be put out if I said anything so I just ignored the pain. I eventually deployed not knowing I was about to turn the darkest corner of my life. I would be witness to several individual murders and two high body count massacres. One of those was the Hassan Fort Hood massacre. I got an honorable discharge and moved on. I worked whatever jobs I could. I ended running a afoul of a reproductive abuser who raped a baby out of me and tried to kill me more than once. I ended up in the glass house (Mental Ward) I was diagnosed schizo affective Bipolar disorder aggravated by PTSD. I was given pills and a small check and booted out onto the streets. I lived in homeless shelters and veteran programs. One night I had a flashback and broke a window on a house trying to get in looking for a radio to call for backup, backup that only existed in my mind. I caught a charge and became a felon. Nobody would hire me. I exiled myself to a shitty apartment only interacting with people through my computer for the next six years. I tried to kill myself two more times after that. Don't worry at the tender age of 35 my body is to broken to be threat to anybody. I live a lowly existence with no money and no prospects. I am the wasted potential. I am not a victim I did all this to myself through poor choices. Last year and this year I have changed all that. I reconciled with dad who quit drinking and subsequently became less of a prick. I work everyday 10 hours or as much as my body can withstand (secretly alot more than I can stand) on his land for room and board. I quit drinking many years ago. I saved up my little check and bought two acres of land and financed a portable building. I own my own land a ''house'' and a truck that I lovingly put lot of work into. It has given me the confidence to even try to talk to some ladies. I am now ready to grow up. Don't be me. Think hard before you act."
UgytlPpA_g1sybbwJFZ4AaABAg,mirster90,1528071976560,It's not often that at the end of a lecture the students clap
UgyaPNTnsDVuFdPp9tp4AaABAg,Oscar Geronimo,1528071976572,22:05 important remarks about studying as a useful parenthesis.
UgzuYGVqTzUljNeuwi54AaABAg,Vincent Benjamin,1528071976584,"This is so subjective and relative and why would anyone care what others think as the masses are very seldom right for whatever that means. It is all about the establishment trying to ""CONTROL"" the masses."
Ugz_F5NMvLmVnp9456x4AaABAg,Simon Myers,1528071976588,"Jordan, you probably wont read this, but I listen to these lectures when I'm doing my ironing. I used to hate ironing, but because of you, I genuinely enjoy ironing. Congratulations"
Ugxv6AsiSqqkY_O8Gu14AaABAg,X4ShoOt3X,1528071976598,Is there any difference with the personality lectures from 2015/16/17?
UgwFq3l0lRWdSE3ueMJ4AaABAg,thewewguy8t88,1528071976612,at 2:29 i actually agree since a good example is that we can each create or own micro unisverse that is infinite just inside our own minds.
UgxL3RU8EwwK60KZG5l4AaABAg,Bro Swirski,1528071976624,"How can there be more patterns of connections between the neurons in a brain than sub-atomic particles in the universe if each neuron (and their connections) are made of thousands of atomic particles which are made of thousands of sub-atomic particles, tho... ?

Isn't that like saying: 'There are more silver ingots in the world than silver atoms'?"
Ugx6bwYurq_vGm6j3BJ4AaABAg,J. Milanoff,1528071976645,I love this guy for so many reasons. One of the top ones - he talks like Yoda: 4:45
Ugz6qtgQ6Nr1AgSvO7R4AaABAg,Normandy Wiegand,1528071976658,Read as if it matters! @40:20
Ugyrvotdw_2qNhFMIsl4AaABAg,NEEL Madhab,1528071976666,One of the most intelligent persons in the world. He is a genius. Any suggestion on how to download the transcript ?
UgyuBb6yo8LeKUCgV3J4AaABAg,Crushinator192837465,1528071976682,I learned more stuff about being successful in school in 30 minutes then I have in 12 years of schooling :/.
UgzdWoX5-F3W_xNw6Rt4AaABAg,Neurotic Trader,1528071978541,An absolute legend. And those late comers clearly dont know what they are missing out on.
UgzwREiZ7M5Rwe2c98p4AaABAg,7seednew,1528071978566,what year was this given?
UgzTO6Mrh-63rcJkdmp4AaABAg,Darth Bunny,1528071978582,"Binging Dr.'s talks. Would binge Netflix, but I'm pursuing what is meaningfull, not what is expedient"
Ugy569QX_EEJvuhQQUx4AaABAg,Ygor Rachid,1528071978598,Obrigado por compartilhar tanta informaÃ§Ã£o. Aprecio muito o seu trabalho.
UgxvLcoubvKlurPu4NV4AaABAg,Cody Hunt,1528071978619,How can there be more connections in the brain than there are subatomic particles in the universe?
UgxjoSz1NmGX4IU5Ltt4AaABAg,Gabriel Quezada,1525393578634,Who did the editing?
Ugxp54qgLSIjBsiC2Ut4AaABAg,joel olivares,1525393578646,I am agreeable with people as long as they follow the rules or are moral about their request. But I am competitive with myself ..
Ugwz_G173Jm-3dAtd194AaABAg,joel olivares,1525393578663,2:15
UgylLQcdnh1lc9pI9Ch4AaABAg,Chris Cabral,1525393578679,puts up hand is it okay if I do an audit? :D
UgwPv58FFbMeGmbH6q14AaABAg,JammerrrJammm Jams Ajpw,1525393578694,"The students donâ€™t even offer an apologize for arrival later, I feel really sorry for whoever will have to hire, married, or interact with that group of ingrates entitled little asshole."
UgyXItgVbLu3hNIlSRJ4AaABAg,JPM g,1525393578709,http://jordanpeterson.com/classes/psychology-2301/ the web address given for the syllabus is defunct and we can not find the Reader. Help?
Ugz7yv5wx2TWqh8tZNl4AaABAg,Michael Go,1525393578722,Re-watching his entire series. Fascinating.
UgyJ2pIwstCHP0O1LpB4AaABAg,Jonathan,1525393578734,"10:30 ""It isn't obvious to me that memorisation  constitutes knowledge"". Worth listening to the lecture just for that nugget."
Ugy7bzxdVDyf0kuvE9R4AaABAg,Devo Castler,1525393578756,"I have no training in psychology so I might be ""reinventing the wheel"" here, but:
Considering that humans are (very) social animals and that people drift without an aim to serve their communities or humanity tend to swirl into depression, could it be possible that industriousness is somehow correlated to how people are socialized or at least to their conditioned or hard-wired social lives?

Context:
I am a very asocial person by nature (I avoid crowds and social environments as if they were a threat to my life, this has brought a great deal of remorse and melancholy to me) but at the same time, I have an overwhelming capacity to admire, love, and care for people (my friends) individually and when it comes to getting work done I almost can't because I hesitate like mad until it's almost too late and my desire to do but inability to trust myself to (do) tears me apart so I spend most of the time getting to the work than the actual work itself.

My scores @understandingmyself.com:
Extraversion: High (moderately) â€” which, if I understand, implies at least the desire to socialize
Conscientiousness: High (moderately) â€” I usually know exactly what, when, and how it needs to be done, I love constructing workflows / plans.
Industriousness: Low (alarmingly!) â€” and this I think stems from my confliction with the desire but inability to socialize. This score completely sat me on my ass.."
UgwNv_4Q44rMz4yXut94AaABAg,Justin Taylor,1525393578768,"Here is a thought regarding the great mystery! time frame: 19:45 - 20:17  (Prov 30:24â€¯Four things on earth are among the smallest, But they are instinctively wise):.. one example, the Ant... if, IF they were created, maybe they were programmed that way?  I am currently researching psychology, Thank you for your post."
UgycVFAoQM5g3SoWLUx4AaABAg,Ross Whitlock,1525393578790,Thanks for posting these videos for us JP ðŸ™
UgxYsbK5GNb__uydoTJ4AaABAg,Dawn Chattin,1525393578804,So much respect!! I feel like I am growing wings.
UgxoNIhGgaJrs-zr3yd4AaABAg,seporokey,1525393578817,"Is it normal to clap at the end of lectures in Canada? Not trying to be an ass, but I've attended 3 Universities in the United States and no one has ever clapped at the end of a lecture, taped or not. Nothing wrong with it, I just find it interesting."
UgxMjKfLSPCknvmxaXd4AaABAg,Azlorn Magus,1525393578830,"Could you imagine Jordan Peterson just talkin shit to someone, cussing at them and putting them down? i bet he'd tear souls right out of their sockets. =)"
UgwJTB38_5mvye-qXvV4AaABAg,K. . .,1525393578847,I really hope Dr. P is still teaching when my kid is old enough to attend college.
UgyqKyWjImPIEErifed4AaABAg,Craig Jones,1525393582218,"More potential patterns of connection between neurons than subatomic particles:
https://en.m.wikipedia.org/wiki/Gerald_Edelman"
Ugx2CRPS3x4nv9JQLSN4AaABAg,Andre Pavlik,1525393582232,"I share this lecture with anyone that doubts Peterson as an individual and as an academic worthy of serious study. Regardless of what they may view him as, this is a primary source, without political opinion, without polarity. It is his study, his expertise. Listen, actually listen, then judge. I urge this upon those I share this with. Ignore the buzzfeed articles and the fox mini clips. This is it. The rabbit hole is here, I just ask that you plunge into it with an open and skeptical mind. Discovery awaits!"
UgzuGkV1G2Z5GcVrQuV4AaABAg,Heloi Maciel,1525393582249,Salve do Brasil!
Ugx4R4_n8Kb6448kscN4AaABAg,Archmage Alodi,1525393582268,"Your students are lucky to have you , such a great class and presentation."
UgyrNoFpUXqy4dVTlXB4AaABAg,Mehrunes'Razor,1525393582277,bonding ......:***
UgzufTTPl_4Igug0e7p4AaABAg,tahseen bhutto,1525393582294,"Truely awsome, i would love to watch every lecture"
Ugx2kN_2puN4gp-EsHt4AaABAg,tahseen bhutto,1525393582307,"Truely awsome, i would love to watch every lecture"
Ugx2LwajRaBW1fdQxd54AaABAg,Skeet skeet Brapp brapp,1525393582320,Peterson should ban devices in his class look at the sheeple browsing
UgynAI2Bb63oATbp8Tt4AaABAg,Richard Muthamia,1525393582332,I have never been this enlightened since i started watching your videos. Thank you
Ugxv9rOCmXwEc4tKEFJ4AaABAg,Jhean F. Scott Fitzgerald,1525393582344,READ AS IT MATTERS!
UgzJwqwk6LcNZET9hQ14AaABAg,Jeff Yeh,1525393582357,THAT CARDIGAN THO
UgyjrgDnaZ1vggrccN94AaABAg,darkdimensionz,1525393582364,thank you Professor Peterson
UgxXZL98VxBVfaHods54AaABAg,bramble b,1525393582379,*desire to clean up room and sort life out intensifies
Ugzz5826sE1GHMj1FGZ4AaABAg,Sarah Eichelberger,1522801582394,"No, and yes.  Science entering into the realm of the scared where science has no beginning yet they persist in building upon the scaffolding of transcendence as if it were something they can engineer and erect. and or dismantle.   It is true as the good book tells us, as the twig is bent so grows the tree, so we are all pruning ourselves, or not, and others, or not.  I would consider those studying personality study a type of horticulture, man being a vine so to speak."
UgwvF6CAOWVJcKRva8B4AaABAg,Hakan KaraaÄŸaÃ§,1522801582406,i am annoyed by that fat girl who keeps opening the door behind at the second half and during the end
Ugwg_SPqsS-cqm8ts8x4AaABAg,G H,1522801582430,But Jordan Peterson demands to read a lot. Does the enthusiast people who acclaimed these lectures go through the hard work of reading what is 90 % of the course ?
UgzpRiORT4QokGht34p4AaABAg,Raymond Hogue,1522801582453,Thumbs up if you never had a dad and you believe this is him...even teaching aspect alone gives me the wisdom and strength I need and or needed.
UgyfxYb4luoMrtzdaVF4AaABAg,Xristofer Bker,1522801582465,Never been able to figure out if I am an introvert or extroverted. I have great people skills but tend to be a loner outside of work
UgwJPfsCijvFZ1PNGNp4AaABAg,Metaphix11b,1522801582471,"Im so glad i found this playlist, wow."
UgyD09AhHm1vcR7tf1J4AaABAg,Ryno R,1522801582497,"does it drive you nuts that people walk in late, but not just late like 20 minutes late?  When i give briefings, if a person walks in late, i tell them to leave and come back next time."
UgwCiZk7EPWkJl_p_pN4AaABAg,anticul 23,1522801584237,Tnk u ... realy ..tnk u
UgxnaeSGM44Xh3nOr154AaABAg,mydearpeers,1522801584257,52:36 How I Talk to people...
Ugyklq-1GuiiNScHmWx4AaABAg,mydearpeers,1522801584272,49:10 Honest between 2 humans can produce personality transformation-- LISTEN
UgwQv3As7j6SdS_e9Rh4AaABAg,Andres Bernys,1522801584294,I also clapped at the end of the lecture!
Ugy9hR3ZQjRzOucc8Q14AaABAg,Austind799,1522801584313,"A lot of the social conditioning things he talks about on here, they are the same concepts that the RSD instructors teach"
UgzNoGtccWKiCDWsnkl4AaABAg,Shelby Haupt,1522801584330,1:06:00
UgyMd5c-sCyWdzAArnN4AaABAg,Xoxocube,1522801584350,"Cunts pay thousands to go to school with heavyweight intellectuals like JBP, born into a modern western society with all the trimmings. 

Cunts are still 5 minutes late to class."
UgymXrPOaZCRUp3_3pd4AaABAg,Lynn Fux,1522801584362,"Dearest Dr. Peterson, Your excellent lectures have given the final bit of courage my Nichiren Buddhist practice did not to climb that mountain of fear and see over the top. You have changed my entire life and that of my family and friends as well. When we change from within we change our environment and you have given me the self knowledge to do just that. I have no idea how to thank you unless my assurance of going on to be all I can be and help others along the way qualifies as a payback. Thank you so much for MAPS OF MEANING. Your knowledge is life changing and of course world changing."
UgxwTRYbKQtDfwt5AiZ4AaABAg,dabartos,1522801584375,https://www.youtube.com/watch?v=ZKpqpBRVr8Y
UgwS7BEqgcaOOpW_mft4AaABAg,SÃ¸ren Markov,1522801584395,"There are more connections in your brain than subatomic particles, im not drinking the cool aid on that statement"
Ugw89JNoVhnSgHc5wCR4AaABAg,Matze Herp,1522801584410,hi :) i cant find the Book required online can anybody help me?
Ugz_TZluDoAsje-9FmN4AaABAg,Dylan Weinand,1522801584432,this dude came in at the 20 minute mark smh
Ugx-FLuLGW0ySRR2zs14AaABAg,JonFrumTheFirst,1522801584453,Note to self: Lock door from inside before starting lecture.
UgynhSVzNkO6w4F8CdB4AaABAg,TayLybb,1522801584466,Peterson is a truth seeker and a truth teller.  We need more of these people.
UgyBNmhhbg4VTqlUdz54AaABAg,DrOmegaBattleSphere,1522801584489,Is that how Canadians ( or Americans) normally say niche?
UgxM8g3XAoZQhteN-UR4AaABAg,Sang Nguyen,1522801584512,"Thank you so much, constantly finding little passage of your lectures. Now I donâ€™t have too and no commercials!! You the real Superman Jordan Peterson"
UgxRxSj3vibC2pFIZYB4AaABAg,Sean Hurlburt,1522801584534,Gerald Edelman http://www.digitalnpq.org/archive/2004_summer/edelman.html
UgyZeBAzYr6MoOeTtIN4AaABAg,mydearpeers,1522801584557,17:37
UgzQYjfvRj0zAOZDUAF4AaABAg,SuicideDioxide,1522801584567,"I've found I'm very agreeable with friends, but very disagreeable with almost all else"
UgzjR1Ie3xJzQfGMall4AaABAg,Jeff Porcaro Groove,1522801584589,Professor Kingsfield would never allow students to walk into his class late!
Ugwl1556QQu0nYXGuAN4AaABAg,Lars Eriksson,1522801589675,fucking show up on time
UgzYVbkpYySe-j5xH7N4AaABAg,Tim Buchanan,1522801589697,Jordan Peterson for President..
Ugy6olxzEE03BETZK6Z4AaABAg,Nicki St.Louis,1522801589714,I wish I'd had you as a teacher when I was at Uof T...
UgzicIA1i765pcXxEth4AaABAg,victorAPR96,1522801589730,"amazing lecture, I'd just like to point out, so that people dont leave this video with a misconception, that what Dr. Peterson said about the human brain having more conections between neurons than there are subatomic particles in the universe is not quite accurate. The human brain has more POSSIBLE conections than there are ATOMS in the universe, but nobody has anywhere near the maximum number of conection, that is to say, nobody has each neuron conected to every other neuron directly."
Ugwp19r4HMxYkpQpmE54AaABAg,Trey Kilgore,1522801589743,Thank you so much for these!
Ugyk5KneRGMIviiMOWF4AaABAg,dpasek1,1522801589757,"Apparently, you have reorganized your web site. The URL at the beginning of the video no longer seems to work unless I have made a typo. I found your site, but /classes/ is not there. I found parts of this lecture series on your youtube channel. but the list is incomplete. Please fix. Love your lectures, TY!
Oh, I think I found it:
http://jordanbpeterson.com/classes/personality-and-its-transformations/
by looking under the ""more"" tab on your home page."
UgzofDAprrDcM8NZOtx4AaABAg,Joel J,1522801589769,"how lucky r these students to have JP as a teacher. take notes and get it signed after class, it'll b worth a lot of money later. lol"
UgzN2-u8Fn0TktutQuh4AaABAg,Kevin Rowe,1522801589790,"Peterson is a very smart person but he needs to quit telling people that there are more connection in your brain than subatomic particles in the universe. It isn't true by a long shot. It is in fact true that there are more sub atomic particles within a single neuron than a neuron has connections to other neurons. Meaning that there are more sub atomic particles in your brain than there are connections between neurons in your brain alone. I believe that the original quote is that ""there are more connections in your brain than stars in the universe"" but even that is not true because chances are that there is a lot more universe out there than we actually know. To say that the number of connections is larger than the number of currently visible stars may be true...maybe."
UgxGfy0E3FzVb180D6p4AaABAg,Don Wald,1522801589797,Look at all those white males in the classroom.
Ugyi-wgtQP_QHB8uzHt4AaABAg,Wilsmeister Wilsmeister,1522801589814,Never have i enjoyed and had the pleasure to be so fortunate as to be able to hear mr. Peterson speak his mind. My my what a joy it is.
UgxftDDd2-s8rNYUm6x4AaABAg,Robert John,1522801589829,Thank you. You are providing a real educational service to humanity by providing this material.
UgyiId9oiUS7eh1t8AR4AaABAg,Thomas Ptashnik,1522801589841,"Hey everybody, I have been taking notes on this lecture series and compiled them into a google doc. If there are errors or important points I missed, feel free to make comments in the margin. Happy learning!
https://docs.google.com/document/d/1MyaF_i5OGpmaqnemoRbIs1-_9Cce6WHJ3v1qsAwZC9k/edit?usp=sharing"
Ugx4GHQHJ_aGkJIOtUt4AaABAg,G H,1522801589854,Thanks to Marcus Aurelius Antoninus for his dedication to translate into Russian. Ð—Ñ‚Ð¾Ñ‚ ÐŸÐµÑ€ÐµÐ²Ð¾Ð´ ÑÐ²Ð»ÑÐµÑ‚ÑÑ Ð¿Ð¾Ð»ÐµÐ·Ð½Ñ‹Ð¼ -Ð‘Ð¾Ð»ÑˆÐ¾Ðµ ÑÐ¿Ð°ÑÐ¸Ð±Ð¾ (Ð¸Ð· Ð¤Ñ€Ð°Ð½Ñ†Ð¸Ð¸).
UgyKlGLkqqkEw5rc8Xh4AaABAg,Helester Anon,1522801589867,"Its so funny, my uni teaches me nothing, I currently learn what I have to know for my Physical Chemisty course through you tube and by teaching myself with books. I also learn Spanish on Duolingo while I ride the Bus or am on the toilet and I watch this while I clan the house and do the dishes, I have never been better educated. I love the modern world."
UgxahqiKSgx24zz9qLR4AaABAg,Michael J. Legare,1522801589888,Professor Peterson is one of the best professors of psychology I have ever listened to. He has the ability to hold one's attention to where the listener doesn't want to miss a single word he says.
UgwU0H8B7K3JjTvSN-p4AaABAg,Jake Horvath,1522801589901,">No students asked a single question during the entire class.
Never gonna make it."
UgxWoVfriFTfTNYZLzh4AaABAg,CredibleCommenter,1522801589914,I am from small village in Indonesia. We are so poor. Everyone just eats rice. My uncle was a cannibal because we were so poor. But now I have so much education because of Dr Peterson. I feel like I am rich! I know that I can succeed in the future!
UgyYXcZrX5CS0nLx1yN4AaABAg,Bookwyrm,1520123189927,Goddammit turn up to your lectures on time!
Ugz9zHK9v0yDVNSzqKR4AaABAg,Vincent Kinney,1520123189943,I've listened to about 200 hours of Dr. Peterson's lectures. I feel like I've gotten the beginnings of a legitimate psychological education. I'm doing some of the readings he requires of his students. I'm also getting a copy of his book 12 Rules For Life. He's so brilliant and he has changed my life and outlook on that life.
UgzM3swTT6JgFtpMmaF4AaABAg,Private Account,1520123189952,"I am so grateful for your life Dr. Peterson, I hope to meet you one day in Australia or Canada!"
UgyXjThFa-Zw9sr8jdp4AaABAg,Biopsychosocial,1520123193476,"At 53, I'm not seeking a degree to hang on the wall, I am listening to all of JBP's lectures for pure pleasure."
