id,user,timestamp,commentText
UgjNw2T_kErusHgCoAEC,iwtommo,1504485307649,"The anecdote about your disagreeable friend is brilliant. The difficult truths, especially the ones that hurt peoples feelings, are sometimes the most valuable!"
UghKJY9yapbQdHgCoAEC,George Soros,1504485307661,"What does he say at 17:53 ""I'm actually quite the agreeable person much to...?"""
UgiN5Yb6H9nlc3gCoAEC,Chris Oaks,1504485307674,"Could you break it down a little how a gaussian distribution implies tradeoffs?  Intelligence is also normally distributed.  Sure, over the greater span of all animals intelligence has clear costs, e.g., prolongation of infancy, more mother deaths when giving birth, and greater nutritional requirements.  However, as articulated elsewhere in this series, high intelligence confers tremendous lifetime benefits.  Then you are suggesting that an IQ of 80 grants the same fitness as an IQ of 120, which means that humans would justifiably be indifferent to having one or the other."
Ugg3-Rhk2Y9eRngCoAEC,Alias deAnonym,1504485307687,"9:49 In my opinion, neurotisizm should be shared equally among all identity groups in proportion to their percentage in society"
UgjizMNOhRTcD3gCoAEC,Karol Jeske,1504485307702,lnteresting l missed the whole socialisation thing because of my parents work. the first non adults l met was when l went to preschool at the age of 7 . lt did not end well for me. good thing my aggression is limited to self aggresion
UgjIKheFDWboWngCoAEC,nothing to see here,1504485310812,"It's weird how I act like my personality traits suggest.
Too bad the world isn't designed for me. I guess that's my fault :|
and i gotta sort myself out like the others who have the world built for them."
UghFWjGJEjjNu3gCoAEC,Theodolphe,1504485310823,Something tells me that agreeableness is not distributed evenly among races. I will look into that.
UgiaZ3AYdUSZ3HgCoAEC,Noissapmoc Ⓥ,1504485310836,"What do you do if you're high in agreeableness, high in neuroticism and low in conscientiousness but have a very high IQ?"
Ugh4Kxe5TBaB6HgCoAEC,Daniel Nilsen,1504485310848,"43:33

The world when perceived/simplified by the traits:
Conscientious: a place to go out to and work
Agreeableness: a place to go out to and establish intimate relationships
Openness: a place to go out to discover new ideas and do artistic things

How do neuroticism and extraversion view the world?"
Ugh_wL6aOS8pPngCoAEC,Luke Mosse,1504485310859,"I read today about studies showing that women are more likely to have liberal views when they have a low income, and that their tendency to vote conservative increases when they are married to a partner who earns substantially more than they do. Also - a couple's tendency to vote liberal increases when they have a daughter, and decreases when they have a son."
UgjHSEKb1YDL_3gCoAEC,Dat Tilson,1504485310870,I actually want to study psychology after addictively listening to like 15 of his lectures so far.
UgiZ0l8jY_ec6HgCoAEC,Dat Tilson,1504485310885,Are all professors/lecturers as interesting to listen to as this?
UgjqLj0qAFs_FngCoAEC,asderc1,1504485310898,I knew I was somewhat too agreeable but it's really chilling when JBP goes into detail about how that has and will continue to impede me in life. Too fucking real.
UggZH_XbtlQCnXgCoAEC,alex stark,1504485310918,Looks like 5 year olds are more civilised and intelligent that today's college students.
UggBdNks0jwjh3gCoAEC,MrTrenchcoatguy,1504485310936,"Apropos what Dr. Peterson says about disagreeable extroverts, today I harnessed my powers of extroversion and disagreeableness to antagonize five people in the span of 2 minutes. 
However, my charm carried the day. :)"
UggnM91QJzdLcXgCoAEC,vaultsjan,1504485310950,Superb!
Ugi0DeizH5slM3gCoAEC,Michael Doyle,1504485311024,Is there a way to take your Personality Test? It sounds really interesting.
UgjcE-mr5JPIOXgCoAEC,Capt. Cutler,1504485311047,"JBP is Jonah, spit out from the whale, who headed into the city to tell everyone that they're doing it wrong. Deus Vult."
UgjouNe5ViLHwHgCoAEC,nagasako7,1504485311058,See you all on Tuesday!
UghkL3ogE9rVcXgCoAEC,sintetsu2,1504485311071,after 50 minutes I have immense confidence in raising kids
UgjUJK0MX_yjNXgCoAEC,TKB arts,1504485311085,Hi jordan. I'm very interested in this personality test. is there anywhere i can go to take such a test? have any links you recommend ?
Ugjzrr8tIkz1BngCoAEC,Gaelic Belgae,1504485311105,What is the name music at the beginning of every presentation ? Darude - Sandstorm but who composed it.
UggmvcoMtvqwHXgCoAEC,Nick Bultman,1504485311117,"Dude Jordan is a fucking hero. Not only is he so carefully articulate and with every word, he's able to cover every perspective base describing his points. 

I also don't understand why people aren't more interested in personality. It's blatantly obvious that our beliefs and paradigms of the world determine how we will act. It's the ultimate predictor/measure of how people think and act. It just intrigues me, I love this shit so much"
Uggs32jD_3qoA3gCoAEC,wahr01,1504485311131,"About 2/3 of the way through this lecture I realized why there was opposition to women voting (including from other women) - ""agreeableness"" has very little place in power-politics and even less place in geopolitics.
Interesting how science is bearing out what was earlier repudiated as merely ""imposed by religious authority"" as based in quantifiable truths of human behavior.  Religion served as an efficient means of carrying forward the most important human wisdom, and abandoning it has resulted in the dystopia we have today."
UgibdK6-hR1R5HgCoAEC,Michael Froelich,1504485311153,"I'm highly empathetic but when I perceive wickedness I never shrink from conflict.   I would not harm or kill an animal because I'm always wishing it well and hoping it's contented.   But if I perceive someone as monsterously wicked I have no problem imposing terrible punishments on them which I perceive they deserve.   And I'm thinking about their malice and cruelty to others, such as the animals I feel for, when I'm torturing them.  Therefore  I'm not sure the framework here comports with my experiences or observations.    I think the problem lies in grounding traits in evolutionary biological terms.    I think the development of personality isn't determined by evolutionary factors.    Humans exist on a different level of consciousness than animals, truly.   For example, I know a lot of women indifferent to others, including their own children.   I think if females show up as more agreeable on tests it's because of their need for acceptance.   Females will become fractured psychologically if they feel unworthy or not accepted.    Their agreeableness isn't empathy, but a strategy for finding acceptance by not wanting to stick out.   Young girls who are gifted and therefore different will hide their giftedness and exceptionalism so they will fit in and not be resented by others.    Boys would never do that.   Neither do boys starve themselves because they perceive their bodies as unattractively fat, or misperceive themselves as fat when they are not fat.    These are not founded in evolution but in the independence vs. dependence variation, with girls being completely dependent on their peers for emotional contentment whereas some boys want to be independent and stand out from others as exceptional.   As well there's confusion here about the traits of criminals.    Among professional criminals and those in prison there is wide variation.    There are predatory personalities and also empathetic personalities.     The most successful criminals are those who care about the well being of others, and therefore gain a reputation for honesty and fairness.     Only the born to lose idiots who never succeed at crime are the ones Peterson is describing here.     That applies only to the criminal world, which is actually a community.    On the other hand sociopaths who cheat everyone they encounter do not live in any community, but in large cities or they travel from place to place cheating everyone they meet.    Those are the people who cannot thrive in the underworld, and in the underworld those kinds of predatory individuals are loathed.    If Peterson understood criminality better he would view it as the economic and financial system it is rather than as an antisocial phenomenon.     Criminals are people seeking to find money.     And one last big thing.    Peterson's observations about the importance of socialization among peers for young children only applies to this culture, where children are thrown together in class rooms.    That is a very recent phenomena.    Until a hundred years or so ago children were not in groups of other children.    Children used to be socialized into their family or community in which their age group peers were not the determining factor.    Peterson's description of this purely recent, and frankly strange, way of treating children as a basic human condition is way off the mark.     I think the truth is that children were never intended to be socialized with their own peer group, and doing so has created these stresses and issues only recently.     Children should not be permitted to form their own cultures apart from that of their adult communities."
Uggj70_PXdIMnXgCoAEC,Annette Adler,1504485315123,Ohhh that was beautiful :). I absorbed a lot of data from that. Thank you so much
UgjmJHfH1n9ukngCoAEC,MajesticDemonLord,1504485315131,"My God - this describes some of my Best Female friends, to a T."
Uggr64quymjcbngCoAEC,Joey,1504485315141,"I related to so much of what you said in the last few minutes. As a 25 year old, I've done the cross interest thing and I'm already tired. Going back to school to pursue computer science like I should have. I had some great opportunities and make good money, but it's not worth losing my sanity."
UghbT9KpQFA2ingCoAEC,pw3uk,1504485315146,"0:30 Jesus, please don't die on us now!!!"
UgjjPiB1o8nJWHgCoAEC,Kissing Bandit,1504485315166,Thank you.....another great lecture!
UggjjO-XekvdfngCoAEC,jsbrads1,1504485315177,"Once a child has Not been socialized, would it be best if he was placed with other unsocialized children? perhaps they can succeed in finding a secondary state of socializing and at least have peers who have no alternatives."
Ugg453FDax7mfHgCoAEC,Vali Saxonian,1504485315181,Thank you for making this available to us Professor Peterson.
Ugie-x4iTI_8LHgCoAEC,hfyaer,1504485315192,"I have this weird feeling that the diffusion of this content is artificially slowed down. And i've evaluated the target. It's much bigger than 200 000 subscribers. It almost took off at some point but didn't. There's a glitch somewhere I can't figure it out. I've seen a lot of channels take off and I've become used to it. I can feel when it's going to explode! There is a big problem going on here, this is absolutely weird. This plane's got its wings cut off. 
There might be a natural reason. The target viewers cannot form a sharing network outside of the content environment. But It would be weirder than a' external will acting on purpose."
UggP1grnYR3w8XgCoAEC,Smoothbluehero,1504485315214,"So far I'd judge I'm:

Very low in extroversion
Very high in neuroticism (according to tests) but I honestly I probably a little higher than average.
Very high in agreeableness (I have a lot of trouble looking out for my interests)"
UghEzRU7VSUf_ngCoAEC,Lindy,1504485315225,"Dear Dr. Peterson.  It appears some people such as intellectuals and gifted politicians have read Brave New World and 1984 and thought, ""good idea, how do we implement it.""  And copies of colorfully illustrated Animal Farm have made it to SJW's who think this is all a damn good idea, too.  

Let's bring Harrison Bergeron into this, why not, because I know a few SJW's who'd make the best Handicapper General the world would ever see.

I always wondered how language affects our thought process so I learned the most radically different (yet useful) one I could.  Finnish.

If you change the language you can change how a person thinks.  I will certainly fight this in my own head when I do not accept it."
UgitRt9ZXMXojngCoAEC,Chad Semeniuk,1504485315233,"I actually feel like i should be wearing a monicle after watching this. i feel so smart after listening to all this. it makes so much sense, and makes me think about things in ways ive never thought about them before. Absolutely Incredible."
Ugg_pSwAhAPl_3gCoAEC,Alan Schildroth,1504485315241,The rhetoric of question deals with the tenacity at hand; this deals with the decisiveness of perception . . . can one coalesce this in understanding?  . . . One deals with purpose within a glandular activity . . . if one perpetuates this first one is what?
Ugg90IwHYHDetXgCoAEC,Andrius Krajewski,1504485315249,Tom Segura is the Undisputed Water Champ.
Uggyw-mHON_j6XgCoAEC,John Howard Henry,1504485315259,"Oh thank goodness, I was jonesing hard for my next Peterson fix"
UgjgjLq1Mdt7pngCoAEC,Clint,1504485315268,I'd love a dark triad lecture from JP
UghJIDuH43LvKXgCoAEC,Björn Neumann,1504485315274,"I have a question about the connection of Agreeableness and Neuroticism: I am pretty agreeable (mostly polite, but also rather compassionate) and very low on Neuroticism. So what I think that does for me is that I'm really compassionate when somebody is telling me about a real problem that they have, but not at all when I consider the problem a stupid one (which is the case for many things because they would not affect me that much). Is me being low on Neuoticism really the reason for my reaction in these situations (is there a connection?) or am I just not as compassionate as I think?"
Ugihi3iJldPh5XgCoAEC,Scott Brown,1504485315282,Why wasn't this guy my professor? I feel cheated. That's what education is supposed to be IMO.
UgjCg9qvOoayj3gCoAEC,Kekistani refugee,1504485315290,Can you make the personality test public I am usually not interested in such things but this video has peaked my interest
UgiPr11h47AwjngCoAEC,Oteatos,1504485315300,5:12 Why it matters if a significant part of IQ is genetic.
UgicAMmItkM18HgCoAEC,John Doe,1504485315326,I love your content Mr. Peterson <3
Ughc2m2FXcaY7ngCoAEC,TimmacTR,1504485320369,"What I don't understand is I got a very low agreeableness trait in the various tests online I could find (similar questions as seen in presentation) however, the description and behavior mentioned doesn't correspond to me..

Basically I have empathy for people in the sense that I all the time ask myself what others think, but I don't give importance to it unfortunately, and I find myself in this weird situation where I tell truths to people's face but I still am conscious that some of it are going to take it really bad.."
UgjxKSoWkZZqengCoAEC,Shaun Harvey,1504485320381,"My question would be to ask if there is a common personality trait found in professional politicians, across the political divide, and does this help to create the conditions that result in people complaining ""they are all the same""? To my knowledge this a complaint that has existed in Britain since WWII, with fleeting exceptions (Atlee and Thatcher) and probably pre-dates that."
Ughgy7Xfl4VGUngCoAEC,AKADart,1504485320403,These lectures are making me very curious about what my Big 5 look like. i gave a quick look on google and there seem to be more online tests that you can poke a stick at. Are there some that are better than others? any suggestions? (Free or not make no difference)
Ugi97Ia2TQwKkngCoAEC,Chloe7 Seven,1504485320470,so Son of a Bitch in this instance is really in the literal sense.
UghYOLFq69iI5XgCoAEC,InProgress,1504485320482,This is simply fucking fascinating.
UgjKDdGi21GOA3gCoAEC,Chloe7 Seven,1504485320503,Thank you SO much for this!
UggoQjjxhIJZ6HgCoAEC,Victor Rand,1504485320515,you mean treat with ratilin
UgjLv_xxN_oKZHgCoAEC,a.e. h.m.,1504485320522,a maze thing !
Ugg_cHD6IemllngCoAEC,Elude Stalwart,1504485320532,"@Jordan B Peterson I have a question: Can a person ""switch"" or ""change"" between agreeableness and other temperaments depending on their surroundings or environment (maybe even without them knowing or realizing it), yet always see themselves as agreeable all the time even when they may not be?"
UghIDIVQtbiml3gCoAEC,Luke Blunton,1504485320550,man this lecture is so freaking useful!
UgzVqEWyICpqNMeaiKB4AaABAg,AlfredoGuako,1504485320563,"hi jordan, loved this lecture and many of your other videos. what possibilities are there aside from criminality for someone who is low in agreeableness and consciousness?"
UgyS9Iqq7DKSF5q-LM14AaABAg,mark boggs,1504485320574,People tell me I am disagreeable but I disagree with them.
Ugy-Vz0WOsShgwSIekB4AaABAg,Wymorek,1504485320586,Love this lecture thank you Dr. Peterson XD.
UgyjGawh-LZFXeukdTd4AaABAg,Minase Bahamonde,1504485320591,"Sometimes while I'm watching these videos, I pause and pace around my room, thinking about stuff, before continuing."
UgxkK2oL25889Z0awQB4AaABAg,Mark Walters,1504485320612,"Finally! haha, I've been itching for my Peterson fix"
UgwbFuxVOoESDuGq7Vx4AaABAg,Andrew Nock,1504485320625,"to what degree can agreeableness fluctuate, or can it flux between extremes?"
Ugz9OX3J_qHPn1iMSTx4AaABAg,Glacial winds,1504485320635,5 people dont know what gender they are
UgxEWCP7AHTYIC8ThE54AaABAg,Fred Derf,1504485320641,"yeah, quite a lot covered there prof!! hope you're not going anywhere! not sure i have the energy to watch another such video today, but, good video - there's a lot of, as you say, contentious stuff.. I'm glad to have discovered JP's voice, and, am particularly keen to hear of anyone who puts other frameworks as appealingly !! (?)"
UgzqEQl2MqmAPc8KRd54AaABAg,Austin Horton,1504485320650,"Dr. Peterson,

Do you think that people that are high in agreeableness or low in agreeableness have a higher propensity to lie? 
I can see arguments both ways in that lying can help to avoid conflict but it can also be used to manipulate people."
UgwDQNNvdTkqqaVZ18d4AaABAg,gnarly sniff,1504485320669,I wish I could like more than once
UgxIQwn9DeMZ8u2YYYx4AaABAg,Frank Valderen,1504485324335,So basically...there are 2 kinds of Feminism.
Ugy6mcrHkHWTcuGQLlN4AaABAg,Jan Martin Ulvåg,1504485324354,He is talking about himself I think.
UgzeCNp3u_j4EnGVWe14AaABAg,carlotapuig,1504485324365,I already watched this lecture in the past but can't wait to watch this new version. I love his lectures about The Big 5. Amazing stuff to understand other people and yourself better. Thank you Professor Peterson
UgzRzW_sZ3_j8p9aG354AaABAg,Some guy,1504485324380,200K subscribers! CONGRATULATIONS YOU ARE A TRUE META-HERO!
UgzhK-PltR_KkN7c3sh4AaABAg,Adam Rockett,1504485324401,Does anyone know where I can find the personality test which is referred to in the video?
UgxDL15Z9Qf3MV6mKdd4AaABAg,Jan Martin Ulvåg,1504485324414,Why does he speak aggressively? Almost angry................? Is he angry? An angry view? Who is this horrible little monster he is talking about?
UgxbRZGybVfKJHZt4ZR4AaABAg,Damnation Forsaken,1504485324430,"haven't watched the video yet, but i don't think agreeableness or compassion has to do with cooperation, agreeable people are not cooperative but, maybe cooperate to bring everybody down to doing nothing

what common purpose can aggrable people work towards when they see their peers and mostly themselves as children, being acted upon with no agency
, now if you define cooperation as non conflicting then perhaps but, that's not cooperation

if cooperation is working towards a common goal i don't think agreeable people will beat disagreeable people at that game..... for example soldiers, police, company directors and such staff even scientists perhaps

well the thing is the more competitive you are the more cooperative you are, to compete you have to cooperate

Moreover men are much more cooperative (by the definition of working towards a common goal) than women, well there could be other explanations for that, but the highest difference in trait aggreablness is among gender would support that the higher disaggrablness is more cooperation 

i don't know which"
UgzVPoxK8utBFx8mpwh4AaABAg,David Guffey,1504485324446,"Women also are more likely to attack with weapons in domestic abuse situations. The theory that they are more aggressive because it ""matters less"" doesn't hold water."
UgyiKKHsdF-sPtvn5t54AaABAg,rexel666,1504485324462,This is absolutely fascinating.
Ugxy4_O1LkUUWLzLkDJ4AaABAg,Stephen Jay,1504485324475,Here I stand in the light of day...
UgwUORVBSRFhFQQ-2Z94AaABAg,Jan Martin Ulvåg,1504485324489,women are more agreeable.........really? No just more dishonest and fake
UgysT8jJ39qj6YjcNGV4AaABAg,Richard Nixon,1504485324503,Outstanding
UgxjA6B3chRklaIRZ0t4AaABAg,Adrian Amundsen,1504485324514,"Your a genious! At the very least 100 times smarter than one of my teachers who litterally believe in more than two genders. Crazy teachers has made me believe in robot teachers, they are much better since they are not prone to personal bias unless you program them that way."
Ugy_Ft2zGLBsXNpZSB54AaABAg,Steven Bartelli,1504485324527,"Is sociopathy a function of personality, or does it exist independently of personality? It seems contradictory to me to have an agreeable sociopath. Am I wrong?"
Ugzy6-5A7u1Sk-4_hNh4AaABAg,Psychomachia,1504485324557,school time
UgwseXBAETP4u40uxlx4AaABAg,key buckley,1504485324565,I don't agree with this
Ugy1B3oTRp1qVF7mZg94AaABAg,Xsavior,1504485324583,Is there a difference in personality death and ego death?
UgyLFrj--cUBIlwBvMh4AaABAg,Tim Wijnant,1504485324601,is this filmed by someone pointing a camera or do universities have some kind of automatic system that follows the speaker?
UgxZKFliXtWObkAwQht4AaABAg,Vivek Barnva Synanndi,1504485324622,"i scored high in above average in openness,  low in conscientiousness, and every  very low in agreeableness. But im a pretty right wing guy who sees value in traditionalism. But according to JBP i should be a left wing hippie,"
UgyDM62_hbUuZ8chf7V4AaABAg,Clutter Possum,1504485324640,I wanna see the Run Lola Run GIF.
UgzcqXYWVbb-QOT1zqd4AaABAg,Adam Blade,1504485326811,"""If you wanna be criminal the best way to do it is to be really low in agreeableness and really low in conscientiousness"" As someone who witnessed his mother (a highly agreeable and conscientious middle-aged woman) getting exploited, robbed and having her career completely ruined by a male colleague of hers who was just like that, this is incredibly accurate."
UgyZBsuMIMVlxszlGUR4AaABAg,Ogilthorpe,1504485326825,Claps in the end. That's weird for a class.
UgyPHW73a1vAqh9GFBR4AaABAg,lady sage,1504485326838,When you put everything you are doing on hold to watch the new JP video...
UgjeKoUKambgbHgCoAEC,Dan Baker,1504485326850,Excellent! I've been waiting for this.
Ugz6mYmP2A_0TLb1dAR4AaABAg,KROOL,1504485326869,This https://www.youtube.com/watch?v=CuJggRWUAfQ woman is not afraid of anyone.
Ugwejj2VfF5P2NBgVpZ4AaABAg,KROOL,1504485326886,People with anxiety disorders should train martial arts.
UgzbWt-ZFiq51niT4fZ4AaABAg,Dan Elvey,1504485326992,Is there a link or webpage to give that questionnaire he uses at 2:14? I'm intrigued!
UgwB3jYnqkmQdji7-5l4AaABAg,Jesper Jansen,1504485327029,AW YEAH
UgwM-RR9aSY_o19YmBx4AaABAg,Levi Barton,1504485327113,YAYYYYYYYYYYYUY JP FOR MVP
UgxBzu_9JYFlGinVo7B4AaABAg,MadWillyLove,1504485327125,you're the western guru of our time.  the guru of thinkery.  the sultan of thought.
UgyJs2pjQMCQztqV2PV4AaABAg,Marijuana Merlin,1504485327129,this explains so much of my childhood and how autistic/ retarded my parents are.
UgwAzys6zM9I1WyiaIt4AaABAg,JarrodDSchneider,1504485327144,"A kind of beautiful irony has emerged during my own implementation of some of Peterson's self-authoring ideas. Each morning I ask myself what things I don't want to do but need to do in order to solve the myriad problems I have brought upon myself; taking this into account, I then write down my vision of heaven and hell for the day. Heaven is the sense of utmost accomplishment I would have were I to optimally address my problems. Hell is the complete abandonment of my goals and the backslide into depression and anxiety that would occur as a result. The thing is, I always fall short of heaven- I always fail to optimally remedy my problems to the height of my own satisfaction, and yet I still manage to slightly progress and climb a little more out of the hole I have dug for myself. Although this technically constitutes a series of failures, more times than not, I still manage to rise above hell; so, in this sense, these series of relative failures incrementally build toward success. 

Another thing I've noticed is just how similar this aforementioned concept is to making art. I am a painter, and I find painting to be just like this; it is a series of failures that end in success. Each session I am generally displeased with what I've painted, but, in modifying and layering these failures atop one another, I eventually end up with an image I am satisfied with. I am beginning to realize just how similar life is to art- that one's life really is like an art project of the most dramatic, challenging, and profound degree."
UgyZlCPWXflP-6OayTt4AaABAg,Eric Vrenios,1504485327158,can't enough of this dude.
Ugwo3xD4MRBLlFjgqqV4AaABAg,Mark Goodman,1504485327174,Notification squad.
UgztISIRvbE_C_ER6Hl4AaABAg,Harry Hhhhjtfhn,1504485327187,Jordan Peterson is the man with the plan he's going to save Western Civilization single-handedly down with the marxists
Ugx8T9tWr8n0OPQOUKl4AaABAg,C,1504485327200,This gave me a whole different perspective on life.
