id,user,timestamp,commentText
Ugz3gAtSBHtC4iCEcm14AaABAg,MindTraveler,1504485327210,"I'm more agreeable than disagreeable and I'm not politically correct in the slightest. If something is true, it's true, and if it isn't, it isn't. This isn't some personally held philosophy of mine, it's just...uh...the way the world works?

No sense trying to argue with facts unless you want to weave a permanent web of illusion. I wish the PC types would see that the emperor will never, ever have clothes even if we all believed he did."
Ugwbzg7b8rTvFS7Sa_l4AaABAg,u6q57,1504485327231,"I work my ass off all day producing JBP memes - It's tough work, but an honest job! This is the only reward I require for my toil!"
Ugzfvay1i1X-beXIpY54AaABAg,Supernada,1504485327250,"Dr. Peterson, congratulations for the unspeakeable amazing work you've been doing. I can say that your lectures were a true life-changer for me (and I'm sure so much people share these feelings with me!). I really would want to know your thoughts on Pierre Bourdieu and his social fields structures concepts!

Again, THANK YOU SO MUCH!

Now, excuse me, I will come back to sorting myself out haha"
UgzQiLbT5xk-o_LVuqd4AaABAg,Travis May,1504485327258,"Hey jp, I don't think it's technically correct to say all the most agreeable are women.. bc normal distributions go on infinitely in both directions so they do overlap at every point. Am I missing something?"
Ugx4DzaS3Ef1Nm0R6g14AaABAg,StatelessPerson,1504485332324,"Excellent. Summary of traits generally characteristic of each of the Big Five. Thank you, Dr. Peterson."
Ugxg3zI0mhaPy6a-Wyx4AaABAg,Cheryl Lynne,1504485332338,"Those who are PC are hardly agreeable. For further, utter anything non-PC in their vicinity."
UgyZlX9ly_ss5VaYYr94AaABAg,Annette Adler,1504485332360,HAPPINESS = NEW JBP LECTURES
Ugw44ZpNaUyVQq9Y4md4AaABAg,New King James,1504485332372,"We have a New and improved subreddit dedicated to Dr. Peterson! Join the discussion at:

www.reddit.com/r/Maps_of_Meaning"
UgxwKP20smfIr-NzpKJ4AaABAg,M Seaborn,1504485332385,Congrats on 200k subs.
UgwGoHixnLpmzzE742J4AaABAg,MrWadeBarrett,1504485332408,The only hero is my potential-self
Ugx0qfQ3TWPjEAhxEg54AaABAg,Ry P,1504485332422,"With shorts lectures, I go full screen and then ""watch later"" on the top right corner,
'member, it's important to check the video length before making your PB&J."
Ugz2tpYAtT34lWCys1F4AaABAg,Matthew Homan,1504485332434,DJP when are the Bible vids going up???
UgyevH5NnQ6vpPsNyo14AaABAg,alexzag,1504485332451,"Time to sit back and soak in the knowledge. We truly appreciate your work, Dr. Peterson. Thank you!"
UgziIq2FMwmrzCWgceZ4AaABAg,E. R.,1504485332466,I replaced porn with J.P.'s vids.
Ugxv0GEKFpPQN5JwZWB4AaABAg,Superzaldor,1504485332481,"Dr. Peterson, do you accept the concept of autism-spectrum disorders, particulary the high-functioning ones, and is there a utility to these diagnoses?"
UgwbsLyn7IV3yy_R2R14AaABAg,Davis Campbell,1504485332504,JBP is my hero
UgwFKdCFrtSRbEml6_14AaABAg,Carter Cole,1504485332526,second
UgwFOUMHzwWmcJ8N_fh4AaABAg,Matt silo,1504485332602,No views