id,user,timestamp,commentText
Ugxdc49bnzTeNykkGo54AaABAg,Anton Canberra Aquarium,1535502868989,"11:39 Actually Professor! You are WRONG, Kangafucking roos do not punch, nor are they people. Everything else you said is right, as far as I can tell."
Ugzta522Tj3-zBMOXGJ4AaABAg,Tamara LeRossignol,1535416469021,I would be interested to discover the relationship between agreeableness and resentment.
UgzzHYCZAiryTHCxSQR4AaABAg,Dinosaur Trees,1534811669042,Roughly speaking. ♥
Ugz6JGWWLS7Rr1tSR_F4AaABAg,SE9,1534811669058,22:50
UgxSKXSs1WL10fhEJz54AaABAg,PoLoBreak,1534811669072,"0:00 Agreeableness explanation
23:16 Unagreeableness and criminality, and regulation of aggression
36:22 Personality trait and political belief
45:00 Overcoming personality disadvantages"
Ugz-eexE_f-CqmCLxhJ4AaABAg,Christina Roberts,1534811669084,"I literally laughed at 'disagreeable people won't do a thing they don't want to do' -- because I got 88/100 on the test for disagreeableness, and I knew it beforehand, and I do things I don't want to do ... but not often and I have to really like you and care for you or have a good reason to do so... I have things I need to get done and my day is planned out and I don't want to be interrupted, so unless you're my best friend, my husband, my mother, or my cat, I do not like to be interrupted and do things I don't want to do."
Ugy5BsW6oKRqw3c9Mvh4AaABAg,Alaric11,1534811669177,I’m disagreeable and low in conscientiousness. Luckily I’m also introverted so I’m not charismatic enough to take advantage of people.
UgxZQOG641gfXfIUJzp4AaABAg,Johnny Eclectic,1533342869192,I feel like I was never socialised :B
UgyND-VdvO6278Ctf6t4AaABAg,Mike,1533342869212,You are a brilliant man Dr Peterson and I am grateful for your work.
UgzMffRIPNFH0VSwfAp4AaABAg,Kasper,1533342869225,Who farted 40:57?
Ugw4osvCpQsw4fH9H5V4AaABAg,Alan Thai,1533342869237,Jordan peterson saying son of a bitch is as satisfying to me as samuel l. Jackson saying mother fucker is that weird? Haha
UgwBjdyPByxmAZbOJfZ4AaABAg,Esteban Henao,1530664469259,Took ALL the whole 24 minute as a kick in the balls/wake up call. ..
UgwXx2qulPfO5Uus4DZ4AaABAg,caio francisco,1530664469271,"Hey fellows, did someone knows the name of the music in the beggin of the video?"
UgwAfBxnNCNrFIeJ9Jl4AaABAg,Khan Skywalker,1530664469290,"I like how he links Political alignment to Personality. In the end, everyone is not so different from each other. And we can learn to observe the other end of the personality spectrum and assimilate, the world will be a better place."
UgwO0izHJWQbvcjgDsh4AaABAg,Roman Villegas,1530664469304,17:58 Que relevant Donald Trump soundbite
UgwkcjY6Cj7HS9ciP2h4AaABAg,Melki Hassa,1530664469321,12:49 now I understand why women are over represented in Yandere
UgxYxWojBOCgXxmi46x4AaABAg,RBelschner,1530664469340,6:00 agreeableness
UgxSgX3-HzfxISbkM4p4AaABAg,Cody Bartlett,1528072469359,Jordan Peterson saved my life and other peoples
Ugyesj0bXgtnhWZCZT54AaABAg,Nik,1528072469379,"Why does he almost always disregard females in these discussions? Obviously they're much less likely to have these disorders, but they do still have them."
UgwHqa3_CiZ5zTOgTip4AaABAg,ZigZag,1528072469407,"Increíble video. No se como llegué acá, pero si alguien mas llegó, tengo que decirle que tenemos suerte"
Ugx0oWe2X99FzCxMKVB4AaABAg,julio villa,1528072475842,Someone ripped ass at 41:00
UgxdDtt4fKKukyepJa54AaABAg,Bree Dhanraj,1528072475853,This lecture has changed me. Thank you Dr. Peterson
UgzUOV0fP2ycUK0GA_N4AaABAg,Grigori Rasputin,1528072475868,"Somewhat a load of inaccurate information Jordan.
Only in the area of ""antisocials""
You should specify the actual diagnosis: antisocial personality disorder (there is a difference), you know this.

There are more than enough ""antisocial"" people who are not aggressive/violent
Even those who, like myself, are misanthropes.

You are putting out the idea that all (men mostly) who prefer to be alone, are likely to be dangerous.
Thus, you are spreading this inaccurate assumption to groups of people, as well as along ""social"" media.

It would be nice to see you restructure this topic.
I mean, it is not so much that this is ""misinformation"", rather more that it is delivered in a way/context, where it can be easily misunderstood.
Which can then lead to inaccurate assumptions, by those who take it in."
Ugw5JUZDNkuXICa7Nfp4AaABAg,Shekhar Kumar,1528072475878,I thank you as a father of a 2 year old.
UgxP-kbOzF81UnQAppl4AaABAg,omar radwan,1525394075890,So whats the solution for an anti social male to become socialized among peers/society?
Ugw5pJ_39oxAqd0Bw9V4AaABAg,Michael J. Legare,1525394075904,A + Brilliant!!!
UgxZsPmad2ob8A6OTZ14AaABAg,Infinite _ Eve,1525394075917,what if youre antisocial and agreeable :/
Ugz3k9BntJrQyyztDih4AaABAg,mrnaizguy,1525394075930,"this guy completely shifts my perception of myself, others, the world and the human experience in general"
Ugw5nUQeapigvEI1SQV4AaABAg,ForsakenSavior,1525394075942,Jordan man what is up with the weird video thumbnails? You are crossing clickbait territory and is intellectually unlike you...
UgyihDA6TmPoCVBFoEx4AaABAg,Leonard Milcin,1525394075956,"I am extremely grateful that this is available, openly. When I watch these lectures I feel like various avenues of thinking where I got stuck long ago, suddenly unclog and I feel this rush of sudden understanding. Thank you."
UgzgnbqLhCpunUG3AUR4AaABAg,sean brennan,1525394075972,Brilliant
Ugzcyn73qC4OTiHCN5V4AaABAg,Josue De hoyos villarreal,1522802075985,Wow awesome just loved it all. Thank you!!
UgzgYHhMm9FR9SZiMax4AaABAg,Langkopf Kopf,1522802076005,"Please, Jordan Peterson, dont talk too much. dont drive it too far and dont become dependent on your fans, stay the way you are and listen to yourself and others!"
UgypSWANbUIcg18zikd4AaABAg,Ezra Mitchell,1522802076029,"""Try not to hit other kids over the head with a truck any more than is absolutely necessary"" -JP ;-p"
UgxzWd8wL_uZY8Zi15Z4AaABAg,Biopsychosocial,1522802076040,"According to JBP, the class ratio is 80% females and 20% males. The  males, I've noticed ask questions way more than females.
This must be because women are higher on agreeablness and consciousness than men."
Ugy2pan24vOsBos2Ejt4AaABAg,Big Moish,1522802076050,Anyone know of a good book on the Big 5 personality typology?
Ugz-VVEMYoK0AQDGcKZ4AaABAg,HeraklesK,1522802076062,Well... I am highly agreeable and extremly conscientious. Good thing I am not planning on working in an environment where I could be exploited.... because I actually feel like I would. Haha.
UgwiUGz2d0M5xM2PXOt4AaABAg,Brandon-Todd Hutchinson,1522802076074,I believe I’m overly agreeable but I feel like the drive behind it stems from elsewhere. I hope I get the opportunity to bring up this idea in a more formal setting
Ugz3-uCq4rA3xOpYRol4AaABAg,Hawk Sandwich,1522802076085,"11:40 ""We're not the only people that punch"""
UgyF7QvybCM2ebFz6-x4AaABAg,Mine Slicer,1522802076098,"I love the description he wrote for this one, haha"
Ugx_mB9zocjJC11SPW94AaABAg,Sam Lee,1522802080846,"Who thinks the ""friend"" he's talking about at 16:45 is himself...? 😂"
UgwyQmHd5XzLqxD6OvN4AaABAg,Pachi3080,1522802080859,"26:17 - 26:33 ""civilized little monsters"""
Ugw5DdBErB_B6pLMm8h4AaABAg,keepinitreal,1522802080866,"Im a woman and scored low in agreeableness, that's a bit concerning! haha i'm less than average even among men. A bit confused how that happened. I'm average in the compassion, but low in politeness. I am straight forward, and will stand up for myself, but I wouldn't call myself impolite, harsh or rude, i'm polite to people around me. Also, the questions he brought up related to agreeableness, I mostly answered towards agreeable, so it's a little strange. I was conservative with my answers though, never marked strongly agree or disagree on any. Any other women score low in politeness?"
Ugy9XZa8UjM_FoLSABR4AaABAg,46n2,1522802080879,Priceless to be able to hear this.
UgyPd56eQbXcM0M04_F4AaABAg,Colin George Jenkins,1522802080891,Ti me up Dana is round at da cup?
Ugwx8_airOsy0g21oy14AaABAg,Peter Armstrong,1522802080905,"How is it that I'm 40 and I'm just finding you, Dr. Peterson? You rock, seriously. I'm learning so much. Thank you."
Ugwg7wVMLynspb1RnVh4AaABAg,William Wallace,1520123680920,"Modern liberals match his description of conservatives, and his description of liberals matches modern conservatives"
Ugxn9kwSJF0wXRXO9GR4AaABAg,Levi Wekesa,1520123680932,I think I'll get a degree in Psychology right here in YouTube....
UgyQIwfCefqDr7TZ3vt4AaABAg,Kendra Fleming,1520123680942,so grateful for this.
UgxBupxjhVs3MzvVGpV4AaABAg,Jackson Elmore,1520123680948,"I feel so antisocial but don’t know how to fix it, I can be social, but when I do, I’d always rather be somewhere else doing something productive rather than sit around and waste time with people, the only people I actually enjoy being around are people who share my same goals or if it’s a woman I’m trying to sleep with, aside from that, I hate people in general, and idk how to fix that bc it alienates me from everything"
UgzGrBsrSbkGFNcg8p94AaABAg,Marilyn Barker,1520123680958,This clears up so much of what goes on in relationships!
Ugyr3UU82_eyk_7qFkV4AaABAg,annihilationHaven,1520123680968,"How is any young person supposed to know what they want from life?  They don't have enough information because it isn't taught to them by anyone.  So as far as I'm concerned there are no disagreeable people in the whole world.  True, criminals might be low in conscientiousness and low in agreeableness, and might gravitate towards political life as a result, but it can be argued that those people are the most agreeable people after all because they just obey whatever money chases.  They simply replaced people with money in terms of what they trust.  On the other hand, if we replaced money at the heart of our basis for trust in the world, we would see ""disagreeable"" people change their tune in a hurry.  We could do that by replacing the monetary basis with a chain of personal trust, demanding that each person have a personal contact with whom they wished to enter into a mutually trustworthy relationship with - linking every person to the top of the social hierarchy.   We should be able to realize that there are more productive motives than profit, and JP even admits that this is true for young men in general, however he quickly proceeds to contradict himself by stating that there's only one alternative to not playing the money game, and that's rotting to death by doing nothing.   I couldn't disagree more."
UgyMFR9wJLcBzpBwITd4AaABAg,Henrique Henriques,1520123680973,What a GREAT Lecture!!!
UgxZrAR_LpXXPxhSOS54AaABAg,João Gabriel,1520123680983,23:00 Psicopatas
UgzvPqWnHp-aZI3wz9J4AaABAg,tbaily24,1520123680994,In all my classes I've ever had in college I've never seen a class clap like that at the end of a lecture. So awesome
UgzhF3XsHVk0nUl1RAF4AaABAg,Trance State,1517704481014,"These are fascinating lectures. It's the insight which continually staggers me. Agreeableness is very energy intensive, as a neurotic I am many kilocalories removed from it!"
UgwlHkbJwt98G0o8qSR4AaABAg,Jeremiah Katz,1517704481030,"I doubt I'll get a response from the prof himself, but here's my question: Do the children of highly agreeable parents tend to be more aggressive? I could see this coming about as a result of a decreased incentive on the part of the parents to impose their social norms on the child."
UgwSa0QK2aUq8bHM7fx4AaABAg,R J,1517704481041,Does a women's inclination for agreeableness have a genetic origin?
UgxlxUiDO73WBZRMbIp4AaABAg,Mayverek,1517704481052,I'm high in agreeableness but low in concientiousness so I feel I'm trying to be polite most of the time but in reality I'm rather rude :(
UgwzSwpqKLy7c8zkVCl4AaABAg,Caroline Cunha,1517704481064,Thank you so much for make me understand myself better.
UgyjHFBAbQrRAarYUbd4AaABAg,Meesh,1517704483833,"I love to learn so thanks, Dr Petersen for these videos."
UgwlSuOafBTRo4n8Ve94AaABAg,Amore Psyche,1517704483844,I really needed the part of being agreeable helped me understand 90% of my past problems. Does he have a professional email? I would like to ask him a question.If someone knows please tell me.
Ugz7YA65-di_1EVpNKV4AaABAg,Peter Davies,1517704483856,I have always been poor at negotiating on my own behalf and have paid the price in lower salaries and more work compared with other colleagues. I have always done twice as much work for half the price.
Ugzny1UPIl_fYK7-GwN4AaABAg,Will Wilson,1517704483864,If Cathy Newman had watched this lecture before interviewing you she wouldn't have given you such a hard time and embarrassed herself. Then again maybe she would have due to her dogmatic adherence to her ideology...
Ugx-cayrZ_rS_3Ct5PV4AaABAg,Geoffrey Harris,1517704483874,Actually being compassionate is disavantageous in dealing with people who tend to be cold-blooded heartless and exploitative.  Being polite can be problematic as it is misleading and can encourage people to get involved with folks with whom rather they would rather not?  Also are people who conform to social norms agreeable or conscientious?
Ugyw5gq56-GSEMOeYhF4AaABAg,Geoffrey Harris,1517704483882,"Neurotics tend to be weak phobic chicken shits who have temper tantrums. Disagreeable people tend to be cold-blooded exploitative, hostile, paranoid, selfish, hyper-aggressive sadistic males."
UgzZSJi7H1jkytpjXVV4AaABAg,Carol Thompson,1515026083893,"46:36 Wisdom for life right there, Prof."
UgyW_364Lbqc4rCksjl4AaABAg,Jesse Gardner,1515026083908,"Holy fucking shit. About 32 minutes in has one of the most profound concepts I've ever heard. Wonder what can be done to effectively counter this pattern as an adult. Knowing why is cute, but results are all that really matter."
Ugw4C1tI7KLeikgQvc94AaABAg,Mr Dr Sir,1515026083919,I feel like as a really disagreeable person I have to be really morally principled because I really just want to tell people to fuck of a lot
Ugz32HIylyPQVsDLwNJ4AaABAg,ThePatarack,1515026083935,"I'm trying to fact check what he said about physical altercations, but it looks like more women are abused than men. Does anyone know where Dr. Peterson got those statistics?"
UgwU6egPeJx1n3rLPtR4AaABAg,Music Videos Master,1515026083947,I agree.
UgyZhbKvWIphgQ0b_oB4AaABAg,MakeSense,1515026083959,I'm so amazed that these are online for free. <3 <3 <3
Ugx9RBDq2JMrVPJIioN4AaABAg,Katy m,1515026083973,16:56 is he talking about Steven Crowder?
UgzIuL02aGAlsc6CZpJ4AaABAg,Dylan Beard,1515026083984,"44:15 Interesting that agreeable people have a proclivity to divide the world into defenseless infants and predatory oppressors,  psychopaths also like to divide the world into predators and defenseless prey (identifying with the predator of course)"
Ugxnyw4WH6U_2uaA7VF4AaABAg,Both Eyes Open,1512347683999,XOX
Ugzc-AU0tf1xexoOp2N4AaABAg,Maxim Kind,1512347684021,6:50 Salary negotiations and how to ask properly. As highly agreeable person (I took his test - HIGHLY recommend it) his suggestions are very helpful. I used it - and now make more money :)
UgzRdz2QRvXjBOWHIHZ4AaABAg,scott sanger,1512347684033,"if womens biology is to take care of children.... the biology that is not conducive to a business' competitive' environment and allows the system to exploit them, why rock the boat.?"
UgwUUQDdXRmAEPg3thJ4AaABAg,Michael H,1512347684046,"As a moderately-agreeable person (also much to my own chagrin) watching 
this is immensely helpful. I feel a lot more conscious of my own 
potential pitfalls, so I want to thank you for that!"
UgzgmHCCqTCE9DFMIHt4AaABAg,Dronescape,1512347684065,"I was born just a few days before JBP, not far from where he was born, and we even grew up in the same part of northern Siberia I mean Alberta. Wish our paths would have crossed at some point. Would have been cool to see what he was like as a kid."
UgwmyTVQpAZFitg7lx94AaABAg,Asda Asda,1512347684077,time to sit back and wank to my fantasies about wanking to nothing
UgyGnwbPH9GWBGKjlzN4AaABAg,William Cheng,1512347686143,"What is JP conveying when he says ""that's nasty"" at 20:30? Does it mean it's hard to compete with middle aged women at work because of how they are, (as in ""the competition is nasty"", ie. crazy high)?"
UgzHaK398pGE9jyDSpx4AaABAg,whatcameofgrace,1509755686165,"Doc P's lectures are the easiest lecture to want to listen to because everything he says is absolutely fascinating and useful to know!! 
Thank you for making these free to us!

Three cheers for the People's Professor! 

Let him that has ears let him hear!"
Ugy8nHWOlzr-P_OYTit4AaABAg,Kyle Lund,1509755686180,I think it is absolutely unbelievable how much wisdom can be jam packed into a single lecture.
UgwJOjj7ef4meIh3IBp4AaABAg,Alessandro LinuxBSD,1509755686195,"There are different points on this video where I don't agree.
Politically aspect.
------------
A light government that value the individual is democratic, the rest are socialist.

PC liberalism is an oxymoron, since can't be exist liberalism under the PC ideology (1).

If you open the border of the State you known exactly what happen for several reasons as:
- incompatible culture with the hosted Nations
- benefits without productivity and without time limit
- etc.
Welfare (beside bureaucracy), the source of all evil,  despite the fatal attraction that promote. 

---------------
Aggressiveness.
On children is just a primordial instinctive response to define a hierarchy.
A children must be educate to convey his energies on a manner compatible with a civil society.

---------------
The major difference between a civil democratic society and a don't liberal one is the lack of freedom of speech. 
The speech is an instrument used as substitute for the violence between individuals, so a speech can be harsh, don't respectful, etc..Now if you want an higher probabilities to change other opinions is better use a polite form, nothing more, nothing less.
Exist other points but perhaps I speak later about that.

1) When you impose (as legislation, rules, etc) how you must speak and later on which argument can be touched, you use the violence of the State, so you no longer live in a democratic society and you have no more freedom of speech."
Ugw9oFx41bCnq4rivVV4AaABAg,Jeebus,1509755686213,JP needs to justify how he can use the term Liberal in reference to the Left /re/progressiveist and simultaneously refer to pc/authoritarian.
UgzDQoEgt7qQLhi6GI94AaABAg,CAWAxMiliM,1509755686224,"if i go to the shop with someone and he asks me do u want this ? i immediately answer yes. sometimes no , sometimes IDK .... maybe. 
being agreeable ain't easy , sometimes i wish i die ."
UgyaKXSg2tAf0XR96mB4AaABAg,Hr. Fannar,1509755686234,Reading List dose not work for me :(
UgzfByoUSqbrq-38rl54AaABAg,Ryan Freeman,1509755686247,"Thank you so much Dr. Peterson, for this video and your dedication to researching our psychological differences. I was wrestling with my own personal agreeable tendencies and your observations brought a whole new light to the matter that had a positive impact. Your work WORKS!"
Ugy4dvCOv5gjN-uSGHt4AaABAg,2martino3,1509755686261,Upper body strength for grappling too - oss
UgxprlwU7tZuWLrduEJ4AaABAg,CmoIsDaNam3,1507077286274,"I legit started crying around the 9 minute for some reason and can barely stop just to type this message, I don't even know why, but every time I think about him saying this I feel like he is reading me like a book and telling me all of the ways I am, its so weird, and I don't even really know why I'm crying.

Maybe its because I had a disagreement with other people about the passions I have with my stuff, like making music, videos, drawing pictures, and more, and feeling like maybe I'm just not as good as I am, and trying to argue about these things to prove I am, but ultimately making it worse, I have zero clue why, and maybe I'm over thinking this, but honestly, I feel like these first 9 minutes are so me, and for some reason it makes me sad.

Makes me more sad because I'm not even a woman, I am a male, maybe its because I have a higher amount of estrogen in me (I have natural man-boobs that are pretty notable tbh, so that's why I say that) than most males, I'm not sure.

Maybe its because I have aspergers?  I am still not sure, or maybe I'm just over thinking it, I really don't know, but whatever the reason, this video is striking a cord with me, and while I'm still crying, and probably will cry some more once I watch more, I thank you for making this video.

Keep doing what your doing Dr. Peterson, I wanna see you in real life some day.


~Marlin"
UgwkEFEOCrlFhfYi1Ux4AaABAg,cobby407,1507077286285,"My friends tell me I'm weird for watching uni lectures during my free time when out of my free time I'm listening to lectures at uni as well. No tests for me, no homework. Stress-free learning. I'm happy."
UgwQgWjk6LjKna1uvFl4AaABAg,E M,1507077286300,"Today's men DO NOT get what Peterson is saying. My father attacked me in a sexual manner, and my son doesn't see it as problematic AT ALL. These men are twice my weight and both have more money than I do. It happened 3 Oct 2016 and was followed by a week of stalking. I will live the rest of my life in perfect isolation. NEVER AGAIN! (My husband died in an accident on 13 Dec 1986.) ⚜️"
UgzCT8Wd1xAqJhoD-wN4AaABAg,E M,1507077286318,"If you're agreeable, cut it out! My face bears the boot prints of every person I've ever met."
UgyoKk5aufWahnNMuV54AaABAg,Bella,1507077286334,"First time I listen, I hear it.  Second time I hear it, I listen."
Ugx_k6okph9yEiFRnmV4AaABAg,Timothy Pennix,1507077286347,"At 22:25 he speaks on a great point. People high in agreeableness have difficultly determining what they want. Those lower in agreeableness are quicker to say ""This is what I want, and this is how I'm going to get it."" He doesn't dive into how to solve the issue of agreeable people not determining what they want. I'm sure he has been over that somewhere. Has anyone come across a clip of him discussing that?  Thanks!"
UgxCHW9ZwDw_MvmevOp4AaABAg,Klwir Qldf,1507077286361,"We need a solution for physically (hitting, shoving) and verbally (gaslighting) aggressive women that attack men in their homes.
These men suffer from the cortisol that is released from the massive stress and that leads to severe damages, physically as well as mentally."
UgwT5qrVRk65N_ip6xt4AaABAg,sibeliandrift,1507077286376,"38:58 - ""the things you're keeping in there are getting stale and old and maybe we need some new ideas and new people to rejuvenate the situation!""  - There ISN'T anything new in Islam.  We know about it already, we have done for centuries.  There's nothing Islam can bring to the West that isn't a warmed over version of something we've just finished spent centuries on pulling to pieces and ending up REJECTING."
Ugy6H8JvHgTpV8y8IsB4AaABAg,Sheila Allen,1504485286389,"When he's so eloquently finding his words, he looks up to the sky/ceiling and it's like he's plucking them out of the air or like he sees the words above him being given to him as he's speaking. He's truly a messenger of some sort. Alien or angel, I know not."
UgzLDXilJxw-iAqcUhh4AaABAg,Deedless Deity,1504485286411,"36:45 Mr Peterson, by your own description of how Conservatives operate (putting things into inviolable boxes), the Social Justice-Left is truly in no way liberal, but completely conservative in its classification of people into castes by their superficial traits; just as the racist or otherwise chauvinistic (in the literal meaning of the word) Conservatives did.
The only thing that differs is that they allegedly do not wish to see borders towards Chaos at large, but in truth they set them up in the small: Their safe spaces are nothing but artificial paradises supposed to keep the unwanted threats of their perception out, while also setting up their own classically chauvinistic borders towards their chosen combinations of superficial traits to be inferior to all the rest of humanity as they define it.
The Social Justice-Left is the least liberal and most conservative movement that existed for decades.

Their ""Gates"" are simply elsewhere."
Ugydfe-aD2vFFBAr5nV4AaABAg,Deedless Deity,1504485286423,"How can you be both, extremely high in agreeableness and extremely high in disagreeableness, and get out of the strenuous misery that produces?
For example, if you are naturally high in disagreeableness, but all for some reason you succumbed to all forced socialisation towards agreeable behaviour and seeing the world in that way."
UgymowAWGJnATZxqKDJ4AaABAg,Deedless Deity,1504485289497,"Claim: Groups with high levels of agreeableness and high quantities of underperformers lead to nepotism and exclusion of the high-performing or even performing people, should said underperformers be in control already, which excludes any chances of performing disagreeable people getting in charge to clean up again.
Examples: Marvel Comics, BioWare Montreal, Google & kids."
UgysPMOrYWXjxJJ7ABF4AaABAg,leo sky,1504485289501,"""Agreeable people often dont even know what they want,  cause theyre so accustomed to living for other people that its harder for them to find a sense of their own desire of how to move through life""

fuck me man"
