id,user,timestamp,commentText
UgyLzenYSCi2PP3kTQl4AaABAg,Alberto Martinez,1535761569281,What's with all these looses arriving late? Don't let them in!!!!
UgyiZ23DZZ-0YWYzElR4AaABAg,Caleb Fletcher,1535502369289,Just finished 2017 Maps of Meaning. Jumping right back in. HERE WE GO.
UgxXihtdMWxjEZsdIaV4AaABAg,carson kik,1535415969300,"Mr Peterson, I am in the part of your lecture where you talk about industriousness and how those type of people are very good at using schedules and intern at managing there time. Personally, I find that I can manage my time quite well but I always forget about schedules; instead of a google calendar, I just use my brain. Now, this limits me to think on a week by week basis but it has worked quite well throughout my high school career. Do you think that my way of managing my time will inevitably be my downfall in post-secondary school?"
UgyOTQk-s-YK65M1be54AaABAg,Vinay Dawar,1535415969312,fortune enuf FORTUNATE ENOUGH
UgwLzf62Z8JbxMpSJ5t4AaABAg,KonyHawksProSlaver,1535415969317,"30:16 in ENG subtitles the unintelligible word is ""Oedipal"""
UgzfINdlw3Dmh1ydz594AaABAg,marlene elia,1535415969325,"I'm 60, my daughter recommended Jordan Peterson, my goodness, awesome lecture."
UgwUeuroG3PnlhOH86x4AaABAg,Donagh Cronin,1535415969330,So many people who are enthusiastic students of JP are also enthusiastic students of the Enneagram of personality types. Many people would very much like to know what JP thinks of the Enneagram of personality types. Please JP we await your insights.
UgxAA0XReL24k-dhgfd4AaABAg,Nothing,1535415969340,"In his personality test I came up REALLY high on neuroticism, high on agreeableness, relatively low conscientiousness and highly introverted, I also come from a single parent low socioeconomic childhood and almost failed to pass high school. Somehow, despite all of this I have a high paying job (software dev), am happily married, and just bought my dream home. I honestly cannot figure out how it happened, by all accounts this should not be possible, It's just fascinating to me."
Ugys0EWU6yd_YRpCPM14AaABAg,Cyril TV,1534811169351,Why is nobody asking questions?
Ugwxg7As9fUtSRlLiAZ4AaABAg,Antony D,1534206369361,We got our industriousness from plants
Ugz1TNMIJarMxz5yt5R4AaABAg,Baleur,1534206369364,"19:40 maybe industriousness is a random ""lucky"" mutation that happened thousands of years ago (closer to 20.000 years if we adopt the new discoveries in GÃ¶bekli Tepe, the water erosion of the Sphinx basin, and others), which in turn lead humanity to spark civilization.. Perhaps the animal kingdom doesnt have the same form of industriousness as we do, and thus they never spark a civilization, because no matter how intelligent they may be, at any ""free time"" after taking care of survival needs, they merely play or rest as this is most evolutionarily beneficial, to stay safe and rested.

But humans, we have an urge to build, to expand, to reach higher, for no other reason than because the urge exists.
Sure one might say there is a civilization-aspect of darwinism where the urge to develop civilization and technology IS beneficial for the species, thus could be included in an even longer-term overarching meta-darwinism theory, not entirely based on organic evolution but also social/technological evolution.

So its interesting to think about. I mean lets take dolphins, what if we gave dolphins arms, hands, opposable thumbs and the ability to be amphibians (survive on land, for a time). Would they use their supposedly near-human intellect to suddenly give rise to a new civilization? Or would they merely do what they already to, but on land?
My point is, the level of intelligence and the possession of tool-using limbs isnt necessarily automatically sparking civilizations.
It may be something else, a random ""spark"" in the persona of the species that is needed, such as industriousness.
Some new seratonin-trigger that has nothing to do with pure organic darwinian survival, but some random lucky mutation that leads to a reward stimuli if something ""productive"" is done, which in turn over time and in larger scales lead to civilizations.

This almost echoes some old Star Trek episodes, where you had whole species of humanoids of distant planets living like primates, but in complete bliss and happiness, without any comprehension of WHY anyone would want to explore space, develop a civilization or even build cities. Their brains simply weren't wired to comprehend those concepts or even desire them.

This is something difficult for us to imagine, because we're so fixed in our own perspective (obviously, we are what we are).
But as a random example, what if another interstellar civilization came across our planet and were absolutely gobsmacked, surprised and in complete disbelief of what we were doing.
Because, perhaps we had no expression what so ever in our entire civilization of something that THEY have always considered absolutely vital and important for their entire existence throughout millions of years, and in their own self-centered view they assumed that any other intelligent lifeform must also adhere to the same concept.

In that light, heck, perhaps industriousness is NOT needed for a civilization to start.
Perhaps, as unlikely as it seems to us, even interstellar civilizations can arise completely devoid of industriousness, due to some lucky accident in their society structure or way of being, that simply inevitably leads them to build ""up"" and explore space.
Not due to industriousness, diligence or curiosity, but just out of pure automation of striving for the survival needs of their species.
Its easy to think of an ant-hive in this example, but perhaps something with more individuality is also possible in that sense."
UgxARIk6_B6pl0ay3354AaABAg,Charlemxgne,1534206369374,Those late students are disturbing my dog with the squeaking. Shame.
Ugy8qSApVjvKbEDvRjN4AaABAg,Richard Canning,1534206369384,Thank you for the knowledge ðŸ‘
Ugx8wvj8EBCeYjZGL-94AaABAg,Jonathan Dunn,1533601569391,"But why does JP say happiness be extraversion? Introverts are likely to be just as happy, if not more so."
UgwdWpSZbnmWRlo9MBl4AaABAg,Hubris Logic Checker,1533601569401,Where can we buy the book?
UgyRqDFF74TA3Yze0Mx4AaABAg,no 1,1533601569411,this is what you last the last educator alive - he studied his subject and hasn't fallen victim to capitalism. jagmeet singh will make him a minister
UgxOush69LuT1dK31Dd4AaABAg,claudius corry,1533342369421,If i had PP instead of the marxist dickheads I had I'd probably have stuck with psychology
UgwUnP0GYf1-UwZAi8F4AaABAg,blagh mrblafh,1533342369432,OH god 22 lectures... wish me luck!
UgxCqSkG3MmRYVXBVS54AaABAg,TheEfficentPiggie,1533342369437,SOMEONE FIX THAT GOD DAMN SQUEAKY DOOR
UgxHARJ9bbxxjJyZ_RJ4AaABAg,Andrey Rezende Soares,1533342369449,Thank you.
UgwhC8w31FI9SPcjeA94AaABAg,Erick,1533342371443,It's an honor and privilege to have a seat in your class professor. Thank you for this series of lectures.
UgxfeWPVGPRZBqP2XyR4AaABAg,Dooode McBaggins,1533342371453,I hope once i can get to college i can be in his class I know i fit into the statistic of 80% males at his lectures but from what see Dr.Peterson is a highly intelligent person and I don't doubt that those males that attend his class look up to Dr.Peterson as a missing authority someone who I personally wish I could've had around as i was growing up. He's the ultimate father figure the ultimate mentor and leader for young men i may be wrong but this is just my opinion.
UgyEQkS-MccU-O6do_J4AaABAg,colin latimer,1533342371458,Very interesting presentation  Thank you
UgyHFzIlUqwc6DY4t3t4AaABAg,beau ferguson,1533342371467,"Mr Paterson , you have renewed my faith in our species!! I grew up in the TRUE south, i.e. poor people  need our help. In the form of 'housing vouchers, magnet school &  white privilege make live easy for the ppl white were born to northern European ancestry!' I hv read 90% of the Cannon & lived is 23 countries. At my merger 43yrs old I feel you are the crestline voice our world needs, to stave off the regression of our evolution!! ðŸ‘€ðŸðŸðŸ‘"
UgwoRCS-WQ5NOfZIr254AaABAg,Amine Drhourhi,1533342371478,"The way he articulate his ideas is sharply intelligent , it takes a golden intellect and a flexibility of neuro-processing of ideas words visions to reach this unique style of speech... what s intriguing is how easy he structure these brilliant talks that relate many fields of study matching synchronically psychology ...   ''' JORDAN PETERSON is life changer ! ''"
UgziCl54ZBlpDvbHQtt4AaABAg,Bill Davis,1533342371481,He somehow has the ability to not be bothered by people being late. That would drive me crazy.. I had to watch the start 3 times to not be distracted by those people who can't use a clock. Lol Jordan is what Ive needed my whole life. Such insight
UgyUv2vihb4MWRu_V114AaABAg,Pat,1530663971501,"Loved the lecture, but he's made a mistake in his statement that there are more neurons in the brain than sub-atomic particles in the universe. Since each neuron is made from multiple atoms, and each atom is made from multiple sub-atomic particles, it's impossible for there to be more neurons than sub-atomic particles. Maybe he meant more neurons than stars."
UgyePl_HAAWpS0lgNmd4AaABAg,Wouter Damen,1530663971513,"I think the way he pronounces 'niche' is kinda funny.

You have certain nitches!"
UgwCqEZ1s7El2eEWwfV4AaABAg,Edgar Madariaga,1530663971524,The Title of the Book is....
Ugw7rAt3XWKFiSh1bQJ4AaABAg,Rick D.,1530663971527,"Cobinatorics and networks is the idea that a relatively small group of interacting agents can recombine in a surprisingly large number of ways. Space is not an empty stage and it is not an ether it is more like a nested hierarchy of action. The discrete bits are precise ratios of a quantum of action. Dimensions don't exist before action and not all dimensions are equal. This must be some kind of decision engine generating novelty with the fuel being something like the difference between harmonic regularity and self referential noise. Every engine takes advantage of a difference and we may not be able to name this difference. The big bang could be a large scale phase transition in state space. Each step in the process has some range of choices and when the choice becomes too fine grained (criticality at the edge of chaos) it is the chaos that drives the choice one way or the other. This is a random walk, the testing of state space, the measuring of value.
All value is not equal and it is the network or range of associations that controls or decides what is valuable and what is not. The result is increasing levels of sophistication. The idea that value exist in state space and must be measured and located for some purpose suggest consciousness is behind all of this activity."
UgzYAKqWB_tudM02J3J4AaABAg,Ralkuth 1456,1530663971537,"30:16 (unintelligible) is Oedipal, I think."
UgwJT1saEQz7NyCozvV4AaABAg,Kundalini Kundalini,1530663971548,this dude is a genius .
UgyOGVqiIKjmtTTy2L14AaABAg,ehsan hosseini,1530663971552,The number of connections in the brain cannot be more than the number of particle because all the connections are formed by particles.
UgwkvrpWT5whVnRnZdl4AaABAg,PonyLove,1530663971560,thank you
UgySM_NzdN1ZpsTec6V4AaABAg,Jay J,1530663971564,"You'll need a strong coffee for this, and a good nights sleep. I really enjoyed it, but it was a little taxing on my brain. I could listen to Jordan all day, so relaxing even when jarring, I often listen to him while I work."
UgxhlDp-krZTMJ_jFgV4AaABAg,Yisrael Dov L,1530663971573,"I can't believe that all the people coming in late is acceptable. I don't think that this would have  gone over when I was in school, although I did major in engineering, so the department as a whole may have been more rigid. I just find this so disrespectful and just stupid. You are paying lots of money for school why would you miss parts of it. If you paid for a movie ticket you wouldn't think about coming in after it was 1/2 over."
Ugz_D-a5uvfxVayTXH94AaABAg,Debbie Edwards,1530663971577,Crumb ...what a disgusting film that is
UgwANxmPxaMvwYT_qvB4AaABAg,Artur Babajev,1530663971586,"I am 17 and I've required guidance in this field for years, I am so glad I found out who Jordan Peterson is and I can't wait to bank up and reinforce my knowledge."
UgxdaVtbgRc-BRgOIpV4AaABAg,Peregrin Took,1530663971592,A lot of people criticize his brining religion into discussions but I think it's more than appropriate. There are comparisons to be made and while I may not believe in a God there are a lot of things to learn from various scriptures.
Ugw3oglNgoHANUvnE1R4AaABAg,Kay Bee,1530663971600,Does anyone have the module handbook and/or the exam papers? Thanks
Ugwg--ALYECkH9CmEhh4AaABAg,Towelie,1530663972958,"I'm so glad this channel exists. As a notorious underachiever with great interest in psychology but at the time bound to hard labour, being able to take a class with such a living legend for free and in the comfort of my home is incredible. It sure is a crazy time we live in and i'm glad i haven't offed myself. Professor Peterson, please keep on making the world a better place by providing imense knowledge to this absolute absurd amount people!
Greetings from europe, i hope your classes reach every corner known to man."
UgwDC6Z1qWt83XlDEhp4AaABAg,melvin palmer,1530663972969,i finished the biblical series.  having a degree in Social Welfare and had many very good professors.  this is my beginning in personality and it looks good too.
UgzdyPn-1aWYQTy04aZ4AaABAg,frasier crane,1530663972975,You can tell who is low on conscientiousness by watching who is late for class.Also probably low on agreeableness.hahaha
Ugw2Vun7lQY-pQQ1Gpl4AaABAg,Sardar jaiveer singh sidhu,1530663972984,5:51 they don't clean clean their rooms
UgxZV6wH9KBEVi2o4vZ4AaABAg,mrwhippy101,1530663972993,"So if to watch all of his lectures 
(which I will) would that grant one anything in terms of an academic title example a bachelors ?"
Ugy-ureI4QA07em7yMh4AaABAg,Penelope White,1530663973005,Visit the Philadelphia Zoo small mammal display. It's called Large Northern Treeshrew. You are looking at US 65 million years ago when the giant meteor destroyed most dinosaurs(birds are the only exception). Still believe in God? You should also visit the Permian to find our first mammalian ancestor called Thrinaxidont. It was probably a marsupial. REligion is the only perfect crime
UgwFIrBcAcFITZcxdM94AaABAg,hikmet muhammed hasim,1530663973020,what was the name of the book that professor showed to the class?
UgzJyYeIbuBY4w6LSkR4AaABAg,Super GANjaH LEaf,1530663973031,"It will be quite the tazk sit here and explain the thouzandz of reazonz why thiz little nook of the world, thoze 6 sidez in which contain so much wizdom are so important to me.  So i'll say thiz,  if we take anything from which we can take something tangible it would be thiz hypotheziz.  The reazon the collegez have become breading groundz for toxic radical idiology can be related directly to the lack of intrezt young people show in college settingz to studiez where All material prezented to the student iz factual and not so much opunion bazed.  In other wordz before you Mr. Peterzon the world waz in a disarray of ignorance running a muck.  And so after your online debu4e and your explozion it feelz like the peicez are falling back into place, a connection one might make iz  that all of theze people that have latched (im holding on strong) on to you are the onez who thought college iz a waste of time, becauze they were not in college or elze they would have known about you and alzo the onez that couldnt be forced to attend and thatz a huge number.  But the reazon why they watch,lizten hear, attend read what you say itz becauze itz factuall, it can ne weighted, meazured, touched in some  way or another.  And we didnt know how much of a school setting reprezentz an official sanctuary of knowledge and thiz eliminatez all doubt of credibility and we can learn with a silent mind, focuzed.  The correlation between radical sjw pc identity politicz run amok waz one can say or hypotheziz iz when the education level of the general population fallz    xx' amont of yearz behind  what the current level of education iz in the country'z universitiez  there will be an uprize in the agrrezivnez of demandz a small group of people will be making agianzt the majority of the population and to achieve that their demandz are enforced they will demand changez to a conztitution bazed on idiology and idiology only and make claimz of irrelevance on groundz of date.  The problem ofcoarze iz the radical media will exploit theze people have them do their dirty bitting becauze thiz small group of radical individualz they themslevez are ignorant in the sciencez of modern day institution, and people like that are motivated by ego and require will not prezent proof or fact, and that manifeztz itzelf in our world with the dizrezpect of an entire population without any precedentz, like we see today.  So I believe there can be valuable information if one can extract the proper data.  Becauze after you Peterzon I realized how stupid and lazy I waz mentally and im sure im not the only one.  So next time thiz happenz make sure you tell you other not so brave collegez that it iz there moral obligation to put an end to any type of ignorance that might be poizioning the country if one of the claimz being made by a radical group  contradictz factual knowledge.  Or elze why are thwy there (theze teacherz) if not to enforce education?"
UgzHRHWQ2QYckehRdBJ4AaABAg,Integral Stanley,1530663973041,"I have been loving taking this course and wanted to share my notes in case anyone was interested. Jordan Peterson is an interesting professor of psychology. He was formerly a professor at Harvard and is now at the University of Toronto. He is unusually well accepted by many people. He obtained a grant to film two of his courses and has over one million subscribers to his YouTube channel. He gives public talks. Tickets sell for $60.00 to $100.00 each and he sells out major venues.
       Jordan tells us our personality is extremely complex. We are likely the most complex thing in the universe. We will likely never fully understand such a complex thing as ourselves and psychologists have made a good start. In this class we will study many important psychologists such as Jean Piaget, Carl Jung, Freud, and the psychologists of humanism, existentialism, and phenomenology. Although these psychologists focus on different aspects of the personality and sometimes seem to contradict each other each one is useful because they address a different part of our complex personality. 
       Transformations are best understood as learning or the results of learning. They represent a significant change in our thoughts, attitudes, behaviors and ability to live well. This course speaks directly to educators. 
This course also includes the detailed study of the big five personality traits. These traits include:
Extroversion
Agreeableness
Conscientiousness
Neuroticism
Openness to experience
       In terms of education an important point to remember is to help students and ourselves to benefit from the use of our strengths and to develop our needs."
UgwyXzShu6GCxtgbZGt4AaABAg,robsycko,1530663973051,The most industrious animal is the Beaver
UgyXubIUMu2s_3JwQ9h4AaABAg,Claudio Trevisan,1530663973061,Does anyone have the book list he is talking about for this class?
UgyRg4utISGzJmmbHQN4AaABAg,Matt Miklas,1528071973065,"10:35 ""What constitutes knowledge is the generation of a cognitive structure that enables you to conduct yourself more appropriately in life"""
UgwwTnJvBGIN7QRe4ol4AaABAg,Nick Frizzell,1528071973076,"35:40 to 36:00 he discusses how if ""he told a joke and it offended people and therefore he, who told the joke, has something wrong with them in the way he conceptualised the situation""

I just find it ironic that in now day and age it is the person who is offended who has the problem"
UgwI4oGQEUy7ZGptA1Z4AaABAg,Annony Bro,1528071973080,"Hey Jordan, great video."
UgxxhWWeEx4O1cNRze14AaABAg,Evan Pham,1528071973090,"for all who are still wonder where to find the textbook, then they are all contained in his website :
http://jordanbpeterson.com/classes/personality-and-its-transformations/
click on the link of each lecture, and there you go.
 enjoy :)"
UgyEM8VR35hpZhbmYh94AaABAg,Sun Tzu II,1528071973101,"Wife: ""You like Jordan Peterson more than you like me!""
Me: ""That's right bucko!"""
Ugx7K7zOep0DvhcRZR94AaABAg,Dorohedoro,1528071973111,"As a mere human beings  I am constantly  engulfed with famous people mainly sportsman, As Jordon Peterson has explained many times the basic requirements to achieve happiness and many of the elite sportsman have everything on that list. How would you construe  there life in the grand scheme of personality?"
UgxRDRvLfAiCcwOdBwx4AaABAg,PlaylistMaster131,1528071973122,I like his sweater
UgxLU68Tp8YZLrQAZDd4AaABAg,92AlexanderS,1528071973128,"Are there differences between the Personality 2015, 2016 lectures, and so on? Should i start with that? Or is it better to start with the biblical series?"
UgxQEJodIaodFLldVIx4AaABAg,Charles Babu,1528071973169,"Oâ€™ Captain, My Captain! 
Anyone else wish Doc could be the next President of the USA?  
I feel like it would be the closest the human race could be to world peace. 
(Unfortunately for this dream, US Presidents must be born in the US according to the law.)"
Ugy9eqwsr6T6eXW7Y2Z4AaABAg,Serclf s,1528071976469,"The transcript for this video is incomplete, would anyone have a full reading of what was said that we may use?"
Ugy0kBcap8wOYq6Zznt4AaABAg,MellowProductions,1528071976486,How dare you show up late to a Peterson lecture!!
Ugwya4T5MgMOQ_spWrF4AaABAg,Norm De Plume,1528071976500,"By the way: I could help you break down ""Industriousness"" using my system. Do get in touch."
UgxlXkCCbudPzSmJmFZ4AaABAg,Norm De Plume,1528071976510,Nitch? You mean niche. Which is Neesh.... ;) nice lecture.
Ugz3YoNTbEJOdKhflSh4AaABAg,Farmer James,1528071976513,Time to lock doors for disrespectful late students. Unreal.
UgxCS5xyTc-7uBUenjx4AaABAg,brandonrynka365,1528071976524,kids coming to class late  while JP conducts a lecture; jabrones
UgxCl9FZphNBv0TGj9B4AaABAg,DarkRanger919,1528071976535,Man this is amazing. Where is the second part I need to watch more!
Ugzlr_oMV-CplvyRdzV4AaABAg,P.A.N.D.E.M.O.N.I.U.M.,1528071976539,Where can I take the personality analysis?
