id,user,timestamp,commentText
Ugz4-4FHp05SCIsxDY14AaABAg,Psychonaut,1535959649581,Lovely series. Thanks Jordan for posting these lectures.
UgwvHOWVlHDZRDlmCrR4AaABAg,MetallicOpeth,1535761649592,this is fantastic. great to listen to at work
Ugz8zaLJM9zdb5t9Pcl4AaABAg,Alex Archuletta,1535761649602,Yeah I am more lazy than I am timid
UgxoRtkHP4J7RF87Aqx4AaABAg,peter soakel,1535761649613,kangaroo chasing cat)
UgxytKUMB1mbxtT6BVF4AaABAg,Robert Santarossa,1535416049625,"You soon learn to scroll ahead to a blue screen with text, listen for a minute or so, repeat. Otherwise, numbing."
UgwX8vigYBz5iftDTop4AaABAg,ZCubed Music,1535416049636,"So many of these thoughts on crowds remind me of Gustave Le Bon's book ""The Crowd"" from the 1890's. Some really deep things to think about when it comes to understanding moral values and fear in this video, I can't get enough of these philosophy/psychology combo lectures."
UgxcaByw2hhgVsjvCZJ4AaABAg,EJ,1535416049648,"This is all well and good, fun to think about and so on, means nothing in the real world.  I know, I have a degree in philosophy from Umass, Amherst. Those in this class who are not majors will forget most of it, and the ones that are Philosophy majors will go on to be professors, lawyers or salesmen....basically."
UgyvGukwyWEgMcSIV-B4AaABAg,Arkenholm,1535416049661,Brilliant lecture by a brilliant man. I cant describe the amount of value I get out of these.
UgyIDVQZ0wtQeEFg_iB4AaABAg,ForceField9,1535416049669,Why isnt this captioned?
UgxdjfP6MwchtuxafUx4AaABAg,LEVERETT MARK,1535416049727,"I like results, better than actions or words."
Ugz2_T2zHHOi7jMOSKh4AaABAg,Isis Adger,1535416049745,"Professor, take your applause and suffer them with some measure of civility! Good job."
Ugz8_Uf97PaDUUbf-XZ4AaABAg,Jason Abbott,1534206449755,"That was incredible, Dr. Peterson!"
Ugz50ByKjSrQ5h_LlLN4AaABAg,AK,1533601649769,this man is brilliant. what a wonderful lecturer.
UgyZL3PN5zHJwGNxSll4AaABAg,Kanishk Gupta,1533342449777,Absolute MadLad!
Ugymdf9Koeg5E6wk5Tt4AaABAg,Kent Nauman,1533342449789,"Concerning evil and the purpose of our existence, God is good and takes full responsibility for the creation of evil. Isaiah 45:7 I form the light, and create darkness: I make peace, and create evil: I the LORD do all these things. Proverbs 16:4 The LORD hath made all things for himself: yea, even the wicked for the day of evil. And God promises to completely remove evil.  Nahum 1:9  What do ye imagine against the LORD? he will make an utter end: affliction shall not rise up the second time.  Revelation 21:4 And God shall wipe away all tears from their eyes; and there shall be no more death, neither sorrow, nor crying, neither shall there be any more pain: for the former things are passed away.  Evil is temporarily necessary for us to have the free will necessary to create our own soul, personality, character. Evil and Hell are simply the absence of God. God = fiery, love, light, good, truth, life Deuteronomy 4:24 For the LORD thy God is a consuming fire... hell = fiery, hate, dark, evil, lies, death. 1 Corinthians 3:13 Every man's (spirit, mind, consciousness) work (soul, personality, character) shall be made manifest: for the day shall declare it, because it shall be revealed by fire (God); and the fire shall try every man's (spirit, mind, consciousness) work (soul, personality, character) of what sort it is. 1 Corinthians 3:14  If any man's (spirit, mind, consciousness) work (soul, personality, character) abide which he hath built thereupon, he shall receive a reward. 1 Corinthians 3:15  If any man's (spirit, mind, consciousness) work (soul, personality, character) shall be burned, he shall suffer loss: but he himself (spirit, mind, consciousness) shall be saved; yet so as by fire. 1 Peter 1:17  And if ye call on the Father, who without respect of persons judgeth according to every man's (spirit, mind, consciousness) work (soul, personality, character), pass the time of your sojourning (temporary residence) here in fear: Hebrews 9:27  And as it is appointed unto men (spirit, mind, consciousness) once to die (separate from God like Adam), but after this the judgment:(the Krisis of rejoining God) Revelation 20:14  And death (separation from God) and hell (negative God) were cast into the lake of fire (God). This is the second death. (separation from an evil soul, personality, character).  Revelation 21:8  But the fearful, and unbelieving, and the abominable, and murderers, and whoremongers, and sorcerers, and idolaters, and all liars, shall have their part in the lake which burneth with fire (God) and brimstone: which is the second death.(separation from an evil soul, personality, character)  Revelation 21:4  And God shall wipe away all tears from their eyes; and there shall be no more death (separation from God), neither sorrow, nor crying, neither shall there be any more pain: for the former things are passed away. But Matthew 16:26 For what is a man (spirit, mind, consciousness) profited, if he shall gain the whole world, and lose his own soul (soul, personality, character)? or what shall a man (spirit, mind, consciousness) give in exchange for his soul (soul, personality, character)? Mark 8:36 For what shall it profit a man (spirit, mind, consciousness), if he shall gain the whole world, and lose his own soul (soul, personality, character)?"
UgzkFnD1n47-nEHCxLJ4AaABAg,GuerillaUnderground,1533342449801,"Communism was a cattle pen run by tyrants; Europeans have been spending their idle time as the seasons allowed without any landlord or boss of industry to demand their days be spent in drudgery, until the wars of the 18th, 19th and 20th centuries created the war machine which made production and consumption the only ideals to be sweated, strived and sacrificed for. There is much to be said for collaboration in the arts of cultivation, mechanics and architecture, but at least half a man’s life belongs to him to pursue whatever gentle folly she may find desirable."
UgznVPicb6efEUG1JBx4AaABAg,Hideo Kojima,1533342449814,"Such a fantastic professor so interesting and inguging,  I'd say he is a national treasure but he'd probably be humble."
Ugw6Z6KlX6IJBh3drxV4AaABAg,Youtube Video Ranker,1533342449825,Well done. For the keyword: 'existentialism' you currently rank #7. You are almost there.
UgyFFqJRtn1Y6Y-gCf14AaABAg,Deku,1533342449836,Did he seriously dub in applause at the end of his lecture?
UgzJpj4O7slQoDSpAel4AaABAg,White_Shadow_59,1533342449847,JP's laugh is the most underrated thing
UgyQ1FHdEqGKtrXjwlh4AaABAg,Kino Zomby,1533342459521,How are students assessed?
UgwAeBKfFI4VUDX5CRh4AaABAg,Simon Shaninga,1533342459534,"THE CONCLUSION IS PROFOUNDLY AWESOME. ""Love, be font & embrace suffering"". I love Philosophy, at least it makes me question my attitudes & engagement of life. I am at least a little more aware of myself and my life, particularly after I discovered Nietzsche, Schopenhauer and Ernest Becker a year ago... Jordan Peterson is a modern gift from the heavens.... I love your Videos Sir."
Ugzu3zf1g-XtT0e9dF94AaABAg,Eryxias,1530664059551,"29:16 Everything smells good for dogs, may be in a similar way to people that can find everything to look good (i.e. interesting). Smelling things may be a reward in itsself for dogs."
UgyHwu_AOwR2Gn3DFbt4AaABAg,Ladenstar,1530664059564,This is my favorite lecture.. I’ve watched it probably 50 times by now.
UgysxOEOwPxuZ5cHkHx4AaABAg,frogg616,1530664059578,"1:08:08 - Can somebody clarify what he said? I heard ""Children who were abused as children abuse children but children who were abused as children do not abuse children"""
Ugwbbo79TU5gR-arjIR4AaABAg,ethan quirke,1530664059590,This is so fucking lit why am I studying mathematics
UgxincaB99eLNS9OAo54AaABAg,Vollick,1530664059609,"I love that I can learn new things not only about great men in history and our species, but about myself, and why I do the things I do. It's very enlightening!"
UgyVVqqhchPR7OAom094AaABAg,talkshei,1530664059624,Useful
UgwW46fSLsff_UqsS5x4AaABAg,Luna L,1530664059636,"""if you face what you are afraid of, you can find what you need"""
UgwnhZ30vXQN-8iMsBJ4AaABAg,Luna L,1530664059646,"""in the depths of your existential terror the wisdom to cope with that terror will be found"""
UgxOjCIZ8PNpYhXkU2d4AaABAg,Luna L,1530664059658,"""you maintain your emotional stability by staying where you belong"""
UgwxQzO6R5W838zCuI94AaABAg,Bengun67,1530664059674,"Maslow's came a little later, but  a little less guilt driven, he he he"
Ugyzx1W2l6Q3AFY5wXZ4AaABAg,Jonathan,1530664059684,It seems to me there are 2 Petersons - 1 the great psychology lecturer 2 The guy who sells sort-your-life-out popular philosophy and picks dumb fights with lefties.
Ugx-VBOhAPd1YIK4t1x4AaABAg,pen0rprick,1530664059696,"so much for white male privilege, look at all those girls and foreigners"
Ugx-3H-BZD4dTFTTEzZ4AaABAg,Lewis Fitzjohn,1530664059713,39:36
UgxvNkCTi5QekAiziw54AaABAg,Aldar Goa-Baden,1530664059723,"""bring how you act in line with what you say you believe. so that there's no discontinuity between your body and your mind. so that there's fewer paradoxes in the way that you manifest yourself in the world.""
Like how catholics SAY they believe in giving charity and helping the needy because they know jesus said to, but then ignore the homeless veteran sleeping outside their church doors."
UgyWPHDdldMY-mDsap54AaABAg,magicsinglez,1530664059735,"What the fuck is wrong with this idiot. .  i've never heard so many words uttered with so little meaning. .  wasn't it einstein who claimed that if one cannot explain something in a simple manner, they don't understand it themselves?

Nothing is on display here other than the speakers extreme mental illness. The speaker has deep need to have other people dislike him, thereby reaffirming his own low opinion of himself. . So this doofus references the book 'The Denial of Death' and yet somehow doesn't inform anyone of anything . . . it's not voluntary exposure that cures people. . it is understanding, or figuring it out for themselves. . perhaps this is because we have a deep seated distrust of others. . if we got this knowledge from others, we'd have a harder time believing it or accepting it. . if we figure it out for ourselves . . This could be because on some level, we understand what we think of others. . and understand this is what they must really think of us. .  we expect them to lie to us. .

This is an embarrassment to humanity."
UgxnOXv76kafnPJLitp4AaABAg,Boris B,1530664059759,"from second one he builds up, shoving stuff in like ""the existentialists adopting viewpoints"" (on the actuality of subjective experience), and it builds up and up just like someone forming his own opinion about it all. 
What we see happening here, ISN'T a teacher, showing his pupils where all the on topic information can be obtained; which works from all sides are considered relevant to the topic, AND, most of all: How to make up your own mind, form your own opinion RATIONALLY, without committing any reasoning _fallacies . 
Teachers are there to teach their pupils HOW to think; HOW to draw conclusions as rational and unbiased as possible, instead of telling them WHAT to think. 

This supposed cultural Marxist conspiracy he sees everywhere, seems to have turned him into a Don Quixote, fighting the windmills of a threat that ain't there, while totaly ignoring the one that does exist (namely: Subjective fundamentalist faith-based us against them beliefs, being far more threatening than anything else (polarization, in short, and Peterson, in his public appearances (as a book-salesman), is doing nothing but polarizing, using the same dreaded Identity Politics , he's at the same time supposedly agitating against.  (just like he's supposedly agitating against this dreaded PC, while being horridly PC himself. 
O well....  demagogues, oi? Wouldn't be surprised if he had political aspirations too...being as doomed as we are without his wisdom on how we all tick, right? (all because of Dostosjitsky, of course. Heck: One would think Jordan thinks of old Fyodor as Jesus' own second coming, right?"
Ugxa659GFrgCmdka52V4AaABAg,Alex Nim,1530664059769,do chinese people have slit eyes because they've been adapted to detect lateral movement ? (ffs i'm not racist okay? i'm bloody chinese myself)
UgyfpwkGsa5__wIJVzt4AaABAg,Aksel Reinholdt,1530664059782,"MIND BLOWN !!!  For all those who are luckily to be actually physically present during Jordan's lecture(s) are truly blessed to be in the presents of one of the greatest thinkers of our time. And speaking of Jordan B Peterson to be of such humble origins (small town northern Alberta; i myself have my roots in small town southern Alberta) and to have risen to such predominant staus within his field(s) of expertise is truly remarkable! Metaphorically speaking my hat comes off to you the great Jordan B Peterson.

You're lectures, interviews, and works have only in very recent time have come to my attention via Youtube, and yet have already had a massive enlighted impact upon my life!

Thank You,  

Reinholdt"
Ugxon8OsFtl68F51Sct4AaABAg,Robery Downy Jr,1530664069058,&&&&&&&&&&&&&&&&&&&&&&&&&&&&&&&&&&&&&&&&&?
UgzgFwWHdxcZDMsPNy94AaABAg,common sense,1530664069069,I like the Puzzle introduction
UgwVhRZtvyAIzsz7m1p4AaABAg,the guy,1530664069082,Why do they bother paying to sit there or even show up when they can watch and take notes whenever they like for free on YouTube
UgyQqjpbjFM0t3jb_EF4AaABAg,Douglas W,1530664069093,Amazing lecture
Ugxt2cS4GvbNzVHuCYp4AaABAg,Alastair Chong,1530664069105,"""Cats don't chase kangaroos."" Add that to the list of anecdotes lol"
UgxRJcbPoinffkIPhyd4AaABAg,manumaker,1530664069117,"hello, first I apologize for my bad English, I saw a couple of his videos and I found serious errors in several of them, in this (I think) says that the activating effect of cocaine occurs in the hypothalamus when it occurs in the ventral tegmental area and goes to the amygdala through the mesolimbic way, in another video says that when the intentionality of consciousness can not concentrate the person is schizophrenic. It is seen that he is an intelligent and very cultured person, I recommend that if he does not have serious knowledge of neuroanatomy, neurophysiology, endocrinology and psychiatry, do not get involved in those matters because he loses credibility. Greetings."
Ugy5ESlgrHS-nPiM9Nd4AaABAg,Goldie Tamamo,1528072069129,"Moral zoology, baby. It ain't a single unified solution, it's an entire ecosystem of relatively beneficial functions, with the compromise between the group and the individual as a constant matter of instinctive negotiation.

A functional Morality would look indistinguishable from good ecology. Circulation, flow, freedom of movement, perpetual growth and division and diversification, punctuated by very minor, controlled, predicted collapses and failures.

... the problem is that the direction of the absolute truth is a heading borne toward change, chaos, and collapse. God is a being of freedom, and order is the tool for pulling him up from the earth like a well-spun vase. This is why your absolute truth-seekers inevitably veer into a nosedive toward suicidal ideation and entheogenic experiences, before (ideally, anyway,) breaking from this trajectory and amassing their own set of relative, personal truths.

Some degree of loss is necessitated, which is why the greedy utopia cannot break free from the mud to begin with."
Ugy1CjN_fCUgjjZ5Fal4AaABAg,Terry Dillon,1528072069142,I am glad to hear behaviorism was good for something after all those tortured rats. I didn't want to study that in the 70's.  I have been a narrow-minded psychoanalyst.
Ugz0ye-T_JPRhf1hL4x4AaABAg,Goldie Tamamo,1528072069158,"Even life eternal is not time enough to see all the folly and despair of poor humanity. Waga nagl fhtagn--death will surely come, fhtagn--Dance and know that even death can wither and die!

shrieks like an idiot and then goes back to listening to A Shoggoth on the Roof songs while giggling about overly-morose existentialists like an evil cultist"
Ugw8s6q_cdi2OJLHemZ4AaABAg,akrasia1969,1528072069170,Is this lecture available as a podcast?
UgzDU1mIac510_pNHaB4AaABAg,richardshalla,1528072069181,I enjoyed this video immensely. I learned a great deal.
UgwmD44cCIpOM0qQrOl4AaABAg,RBelschner,1528072069204,1:06:00 lol Nietzsche what they can't say in a book
Ugz-gDOK0bC2zUd1gqt4AaABAg,George salafatinos_2190002,1528072069216,What the hell are you going to do with 6 bees?
UgzPLZc10yMODDa1-1l4AaABAg,RBelschner,1528072069229,7:00 unhappiness and Facebook
Ugyi5Nl-fFdlJgzllEd4AaABAg,Chris Parks Affluent,1528072069244,Only professor I know who gets applause after class lol
UgwAN1jx8rVcZ48zQC94AaABAg,Gandalf the Pale Pink,1528072069257,"“Like you get rid of a beehive and you only have six bees. What the hell are you going to do with six bees?”

The deeper questions...😂
 Dr Peterson is so funny out of context (which explains much of the coverage he gets)"
UgyDbmyAVwCd1o4H1-N4AaABAg,Super Frankie,1528072069275,"""What doesn't kill me makes me stronger."" (Nietzsche)"
UgxB-_auASwiQmoDVAR4AaABAg,Allen Mahan,1528072069288,"12:45 ""The Denial of Death,"" Becker."
UgwpCnj8KTkQ-Ys6hHR4AaABAg,5CHE1B,1528072069300,"kermit the frog, became a man"
Ugz-0EX_D91PpbuL2AZ4AaABAg,Frankie Panaia,1528072069314,what a load of waffle. Get to the fucking point and stop grandstanding.
UgzD-b7d43PsP9IFMCx4AaABAg,Maskof Trut,1528072075374,Must be so engaging to be there in the class
UgwSygJx3FTkqLX20dZ4AaABAg,Jorge Manzanilla,1528072075379,👏🙌👏🙌👏🙌 Peterson is the modern Messiah of the intelectual minds of our  times!!!
UgwAqShfE46rgqlIN0p4AaABAg,Jeronimo Tamayo Lopera,1528072075388,BRILLIANT.
UgxSa-wlxQaMShvvEXl4AaABAg,Jeronimo Tamayo Lopera,1528072075398,https://www.youtube.com/watch?v=QHpU0ZfXZ_g&index=2&list=RDMMqzg1H520yJ4
Ugy4pBnKF1z-LTkDLvF4AaABAg,G JuSt'IN,1528072075410,Name of Book again?
UgymngP9cunq4VNheTp4AaABAg,nyrtzi,1528072075421,Hmm... not just the terror of death but death as isolation? Isn't that one of the biblical metaphors for it? Being shut out of the city or the community into the darkness or the desert all alone where all you have left is tears and despair.
UgzM0GpycQyC6tGHtql4AaABAg,Nick Wiles,1528072075425,"""Understanding the Russian mindset"" on tube."
UgzATAxUQspvwojxab54AaABAg,Sung Joo Um,1528072075437,OMG slapped some sense into the realities we subscribe to😲
UgyWeFQ_6WcpepwnOAN4AaABAg,puru,1528072075449,Man... what I'd do to be Dr. Peterson's client... D:
Ugyf6-rAHO3LgUniw2F4AaABAg,Kirsten Elmes,1528072075459,Spellbinding
UgxEMhn80EinqRWEHb54AaABAg,Scythe 007,1528072075471,please someone add subs to this video
Ugzhr7VKwM05SpXM1nZ4AaABAg,Justin Ceneviva,1528072075474,"""The most fatal rubbish"" - hahaha I laughed so hard."
UgyulO7FiB0YUK9LQCB4AaABAg,Justin Ceneviva,1528072075486,"What the hell is ""an active Buddhism""?"
Ugy-qNiIfwQAkY7Ssf94AaABAg,Frederik Viddal Myhrvold,1528072075496,"Does anyone know if Jordan Peterson have ever discussed or commented Sartre's ""Being and Nothingness""?"
UgzqgcTlY0HU1jXKvs54AaABAg,MGTOW Lawyer,1528072075509,"when we reach full economic satisfaction people will want to engage in things difficult

so basically: when we reach the modern age ppl will ladder on video games for days LOL"
Ugy2AlZZeI8LSCJxH1h4AaABAg,Evanna Allen,1528072075521,Fantastic Content. Very inspirational to me. Thank you!
UgytNKPnD2hDtVtOs_F4AaABAg,Walter Peretiatko,1528072075532,"I think the existentialism is over emphasized -- besides no one talks about it today in relation to man's problems. It was a literary movement manufactured by tortured artists who had an audience among themselves in the 50s & 60s and complained about nausea, angst, boredom, etc. so that they claim what sensitive souls they were to bear the harsh absurdity of existence now that one of their own academic sherpa/guru had said, ""God is dead.""  The general public never really caught on to all the hype about God's demise.  It was a intellectual fad that had come and is now gone.

Religion is still in full force, despite the fears of secularization.  The 60s, of which you read Walter Kaufman, was freaked out about the decline in religion, especially Christianity.  There was the death of God religious movement in Protestantism, the atheism of Communism, the rise of secularism with the sciences, etc.  However, the death of God is overly exaggerated."
Ugy4G_GgGZo_Gqxp4aJ4AaABAg,Riley Chew,1525393675544,I always comeback for the last 10 minutes of this lecture
UgziTtsA2C2eNuaO4U94AaABAg,fikaso,1525393675555,"11:00 there is an answer to that but you still have to deal with that, ...how do you know that you are at the right place? Because you are. And it is for you"
UgyIDhQBQboz_8euunV4AaABAg,Joel Richard,1525393675566,Loved every second of this.
Ugxg3wOGF9dz0Iadvrt4AaABAg,soham chakraborty,1525393686117,This is the single most influential video that has impacted me ever
Ugxxzg1UteaubI4jG_h4AaABAg,Hesher,1525393686129,"Peterson entertains with philosophical concepts, he is very bad at making connections or actually presenting things in relevant manner. but for mass man this is just what they want. very low effort, weak intellectual making them feel smart."
Ugx4KEhgpVKv6cFidUl4AaABAg,Nathalie Ramirez,1525393686134,"The point made at 1:13:20 can be summed up by Walter Sobchak from the Big Lebowski:
 ""I mean, say what you want about the tenets of National Socialism, Dude, at least it's an ethos."" Well, there you go."
UgyOTPLndu-XQ5kS6_x4AaABAg,Cperambulator,1525393686144,I know it sounds stupid. But atm saving for  university is not in the cards for me. I can circumvent my yearning for it with videos like this and others though. JBP has definitely helped me though in more ways than one. In truth I'm glad he got so much flak for his views on the less than savory side of leftist ideology because I never would have found him.
UgxLVepyYw6iNBqPuwl4AaABAg,Eraj Ismatulloev,1525393686155,23:39
UgzKbwc77lDT79d8jRB4AaABAg,William K Boone Canovas,1525393686165,University of Toronto?
Ugw3UHR6Lu24v5wSTwR4AaABAg,MNN CH JI,1525393686169,Excellent. I really needed this.  Thank you!
Ugyg8H5iZQUX_q1w9gx4AaABAg,rupa fitzgerald,1525393686180,That dude over to the left of the screen is absorbed in a mobile phone screen. Pearls before swine!!!
Ugxm8-TGmSZ1RRet9iZ4AaABAg,Jacob Noel,1525393686193,And folk pay money to take this class....
UgwlbIIhFEzYIVLi53N4AaABAg,leslie sylvan,1525393686202,"Tried to use the restatement technique on a good friend and it worked wonderfully at first, then failed miserably.  I was irresolutley queried on another topic and felt like I was reliving the Newman inquisition of JBP.  Assumption after assumption without pause to get a word in edgewise.  And she has a 160 IQ/Mensa; never noticing the change in prior methodology of my new form of interaction. I always try to build her up due to her underlying cowardice and lack of confidence, masked by her unnecessary hyperbolic puffing of  ""facts.""  Until she met me, apparently got away with it. Perhaps others were more agreeable. I find it difficult to put up with such nonsense; a fatal flaw. Ahh! I'll try again . . . if I ever get the chance!"
Ugy7hVXlHfZY9XYGNCp4AaABAg,shodanxx,1525393686213,"So that is why in western countries, the basic starting point in life is ""free to starve"".

Like Skinner's rats, society knows that it will need to at least threaten with starvation (humans are smart enough that they'll figure out how to obey before they actually get starved) it's subject so that it will be obedient and could be trained for anything."
UgzOcNdpZ4omRVPzKwt4AaABAg,shodanxx,1525393686225,This is a resume of the efforts so far invented by man to justify the status quo of each individual (let's call it their degree of thrownness) and give them a reason to continue serving society (by not committing suicide for instance)
Ugy5S7xcs5kDdVjAlWZ4AaABAg,Josiah Abernathy,1525393686229,"Brilliant guy, needs someone to make his powerpoints tho"
UgxbmUIEoLmOX0STxtx4AaABAg,I'm a creep,1522801686241,Take a shot every time you hear 'roughly speaking'!
Ugxrm9EDiOXD9fNkBUx4AaABAg,LowBr4in,1522801686252,I looked at picture of an elevator and did not die!
UgyxTVqjzjTGV9DADYh4AaABAg,#1 Tako,1522801686263,When I was a little kid I stubled across this idea when I was pondering why my soul was housed in this body at this point in time. The idea was that my soul chose this body and that the purpose in life was in finding out why. I cannot help but be reminded of this when watching this lecture.
UgzXCG1iMz11dVq6-gB4AaABAg,Buysome Bitcoin,1522801686273,"TIL Students have to take a calculus class and get a good grade to be admitted into the Psychology program at U of T. I got As in statistics, would that count?"
UgzuFvRou-XccLto5jt4AaABAg,Sara Von.M,1522801686284,Absolutely fantastic.
UgwUP8TU_tKRuRfdgx14AaABAg,Mario 't Zand,1522801686293,If anyone would like to see how a utopia would look like I recommend reading Brave New World if you haven't already
