id,user,timestamp,commentText
UgyfxGuekbNAmvRPFvZ4AaABAg,leo sky,1504485289512,"Goddamit, this is simple but it explains so much about my life.

Only child, parents were always strict.
My mother always tells me how when I was very little I always ran around and was aggressive to other toddlers/kids.

But all I remember from my childhood is a constant sense of fear and embarassment in any kind of social situation, which I gather is due to a hyper-worried submissive type mother and a rage filled uninterested father.

Now I'm 23, been depressed since I can remember being conscious, have developed ADD and a complete inability to study, even though I was a super bookish child up to the first years of High School, so that I've ""lost""  my chance at being successful in the academical and work sense even though my entire childhood and teen years were dedicated to study (and trying to excel at a sport, thanks dad), with nothing else allowed. And boy did that ""paradox"" fuck me up psychologically
and I have never had a social life to speak of: all my experiences have been me constantly being aware of how I am completely inept at fitting in socially, up to constantly questioning my speech (and of course I have a speech impedment and cant talk in an assertive way) and posturing."
Ugy9v6byH-V49JVLBIp4AaABAg,Robgoren,1504485289523,"Agreeableness is a devastating character trait. In a world that's inherently antagonistic, adversarial and predatory, an overly disagreeable person can still succeed. An agreeable one, even one with great potential, has no hope in hell. Unless a parental or mentor figure intervenes at an early stage, they can essentially kiss their life goodbye. 

This lecture and Peterson's Ted Talk on Potential are his two most important and potentially transformative videos."
Ugzh44yYPmqsaLNoCYB4AaABAg,Thate Guye,1504485289533,So if you've fallen behind in social development are you basically completely screwed for life? or are there steps you can take to 'catch up'?
Ugxkjk9-5aNQOFxCu8R4AaABAg,middygreen,1504485289545,"I love rough-and-tumble play with ambulatory, puppy-like children"
Ugw2hgDg2spG-pi9qHJ4AaABAg,tim hood,1504485289556,"Just took a 300 question personality test. 95th percentile neurotic. 35th percentile conscientiousness. Below 20th percentile in openness, extraversion, and agreeableness. 138 iq. Anybody got solid job ideas for this personality type? Thanks."
UgxaNxhAncw9irWKd154AaABAg,TankCatIntoMordor,1504485289560,Life in 4K : Higher Resolution with Dr JBP
UgjOE9CuADBbSHgCoAEC,Nagassh,1504485289570,"""All of the most agreeable people are women and all of the most disagreeable people are men"".

I'm not sure I can agree with that statement."
UggMBUuEEa_JjngCoAEC,Doug,1504485289580,His fashion sense is getting better every episode.
UghdRGPmRMA9WngCoAEC,MissPopuri,1504485289584,"Ah, my nephew who is not quite two years old has exhibited some aggressive tendencies like dropping an object on a dog and laughing. My mother was not too happy about this phenomenon so she decided to pick him up and move him into the house. Maybe he is going to be civilized more or less by four, we could only take extra time to get into the rough and tumble play with him."
Ugh1Jf_sSbOgzXgCoAEC,Maja Biene,1504485289594,Hypotheses and speculations.
UghSFHRb_2NyA3gCoAEC,Maja Biene,1504485289604,"no, the politeness and compassion dont ""level each other out""! Compassion is a feeling, and politeness is a learned set of polished behaviors - not even necessarily representing true emotion of the person. Liberals are more compassionate. Period."
UghvsKaenN96THgCoAEC,Maja Biene,1504485289609,"Well, thank you very much: it means that (because women are wired to take care of an infant) women smooth the situation, avoid conflict by not telling the truth! This is a very nasty feature - it is a weakness of character (not only a weakness of bodily strength)."
UgiOYVSZ131NaHgCoAEC,Maja Biene,1504485289620,how can neuroticism be positive??? Neuroticism  refers to an individual's level of emotional stability..
UghUV9CSg-rEIXgCoAEC,Lasse Justi Andreasen,1504485289630,"13:30-15:00 
It doesn't make any sense that the way we treat women today or in traditional societies has anything to do with women's personality, evolution doesn't happen that fast"
UggN1xajBEd2i3gCoAEC,Green Deane,1504485289637,Why drug boys? Because education is a feminist hate machine. Female teachers and their eunuch cohorts can't tolerated normal boys. Thus they drug them into submission.
UgjPMDAD40B6c3gCoAEC,Josh the Mover ✓,1504485289645,"I'm high in agreeableness, which means:
1) I'm friendly and kind
2) My life is a painful directionless search for authenticity and acceptance, with constant bouts of self-deception that inevitably invoke subconscious self-deprecation and abhorrently harsh self-criticism, all while the tormenting reality of sexual deprivation sits like an anvil in my sacrum, effectively crushing and invalidating any unlikely little moments of self-worth I might be lucky enough to muster within the absolute warzone of my incessantly hyperanalytical mind



Agreeableness is a motherfucker."
Ugj2-g5c_DJvyXgCoAEC,DimensionZombie,1504485289656,"CAN WE ALL AGREE...


I LOVE LICKIN THE FEMALE ANUS


HIT ME UP LADIES"
Ugh1dnf-4l9JgngCoAEC,Herman Esau,1504485289665,"What a tremendous gift, and benefit, you are. 

Thank you very much, Dr. Peterson."
Ugg1ZEBRX95iY3gCoAEC,KROOL,1504485294288,My predatory instincts kicked in when I saw that baby in the thumbnail.
UghsgJAux_1BkXgCoAEC,k,1504485294298,#TYJP
UgjF7LXSiu8EKXgCoAEC,Miguel Galindo,1504485294309,"Can someone please tell me what JBP says at min: 17:54 ""I'm quiet a very agreeable person , much ???""  can't figure it out and is killing me, lol."
UggjunFr3zKI5XgCoAEC,k. g,1504485294329,"I really would like to know if my agreeableness is mostly genetic or mostly due to upbringing. I always thought it was part of ACOA syndrome (adult child of an alcoholic (father) and also in my case, a very very distant mother). But maybe I was just born with it? And yes, I am a bloody woman:-)"
UgjNu3t3UlVr5ngCoAEC,D. Falco,1504485294342,"My agreeableness makes my life so fucking hard. Damn it, I love you Jordan"
UgjfhSC_BssIeHgCoAEC,Aaron,1504485294354,"PLEASE KEEP THESE VIDEOS DOWNLOADED,DOCUMENTED, AND ARCHIVED INCASE THEY ARE ATTACKED BY BILL C16. Arm yourselves with knowledge and wisdom. Keep walking."
Ughz1KE--pxwm3gCoAEC,Limitless 1,1504485294365,"i have to work with myself
i have to demolish pices of myself
i have to rebuild myself"
UgjVQa6G7aRjVXgCoAEC,CEO of Opinions Inc.,1504485294376,"Open the gates 
Close the gates 
Who's right?
You don't know 
-JBP 2017"
UggOCJBdndG_R3gCoAEC,manictiger,1504485294382,"Now this is 'gender studies' I can get behind!
Psychology and biochemistry for the win!"
UgjM521n_JMSD3gCoAEC,Gmoney Inthebank,1504485294392,This video just make me realize that I'm a shitty person.  Unfavorable scores on all the big 5 traits.
Ughrwkpxk4cQJ3gCoAEC,Eric Sageser,1504485294400,My understanding was one of the best predictors of adult criminality was being raised in a single mother household.
UggMyiNB45VjRHgCoAEC,Joshua Bryant,1504485294411,peak creativity cuts off at 25? I am sad to hear that...
UghwP_4USliM73gCoAEC,Joshua Bryant,1504485294422,that is a great shirt...
UggIBcB3WTxku3gCoAEC,Degbring,1504485294434,40:57 did anyone hear that?
Ugiscci4FbDqYHgCoAEC,Ty Smith,1504485294445,he took 20min to call certain people pussys.
UgjPL29Ut7PTdXgCoAEC,Florin Amariutei,1504485294456,Thank you
UgiMzLhhfD_LQXgCoAEC,mikedabucify,1504485294465,👍😎
UggiFddTpXozIngCoAEC,RubyOnyxx,1504485294472,"I'm very high in agreeableness, the drawbacks have been pretty impactful and it's pretty depressing actually. Thanks so much for all your videos."
UghWwewt1o2VG3gCoAEC,Daniel Giuseppe,1504485294490,A good example of a well-socialized highly disagreeable and highly intelligent individual was the late Christopher Hitchens. Legendary man.
UghdnLsQw2YUzXgCoAEC,TASHHHH,1504485294504,"I think you are seriously underestimating the strength of a punch. True an untrained woman flailing her arms around probably isn't going to do much damage to a man of about the same fitness relative to his gender. But even a child can give a full-grown man a deadly kick to the balls. Striking with proper form, and having the intent to harm the other person is key. I think the reason why women hitting their husbands are less likely to cause them harm is because they are not punching them with the full intent to seriously injure them in a vital area. And here you could say that agreeableness contributes to the lack of intent to harm. On the other hand, agreeableness can also contribute to an overwhelming determination to harm, in the defense of family. I bet there are situations in which women defending their children have killed career criminals with their bare hands."
Ugh-dH0Dl18FFXgCoAEC,Ludmila Marešová,1504485297587,Damn. From this lecture I learned that I am most suited to be a criminal...
UgjpqOUchFBZ93gCoAEC,Nerian,1504485297595,The best thing about the intro music is when it ends.
UghU36_QAaDo_3gCoAEC,Haemor Rhoids,1504485297607,I'm very disagreeable in terms of logic but agreeable in terms of letting them be. I just correct fallacies in abstract.
Uggo5HM2VRDsPngCoAEC,Jane lev,1504485297619,"This is some amazing stuff, I'm so happy I found this channel. Wish I could attend one of your lectures!"
UgiZQMS00X-XY3gCoAEC,sweetodude,1504485297632,"Youtube fix your comment section, only positive posts, must be broken."
Uggqvhy5Atr3JHgCoAEC,vannallezzennogwat,1504485297645,"great, my father threw my away -.-' (in a swimming pool)"
UgiuPco6Vh14QHgCoAEC,Yuge Caulk,1504485297657,"This lecture describes me perfectly. My father was a smart psychologist unfortunate he died when i was 12 and from then on  I was raised by a totally agreeable mother which turned me into a pathetic agreeable young man with terrible social anxiety. People have taken advantage of me because of this,  it's hard to get raises and promotions im always seen as the hard working guy who will do all the hard tasks most people dont want to do, obviously all my  relationships end up in horrible places usually with a girl yelling at me  ""stop saying lets go wherever you want, no you say where you want to go, be a man and choose"" then i get my feeling hurt because im truly trying to be cordial and let the girl know its her world when she's with me and i put her first but i have learned its a fine line between being seen as a courteous gentleman or being seen as  a weak pathetic man.  Thanks for uploading these lectures it helps me articulate my old scattered thoughts and memories"
Ugj_dW9nghlf_3gCoAEC,Kirbyfufufu,1504485297669,I was not prepared for this --> 48:33
UghZwmW9ZigLSngCoAEC,bracken pops,1504485297676,His wife is very satisfied 😏
UghBE5mHNiUzz3gCoAEC,bracken pops,1504485297691,Does anyone now where I can do the 5 personality trait test?
UgjZHcS2lrIFI3gCoAEC,It's Matt,1504485297703,Jordan is fantastic but he's off base on the predictors of why men make more than women.  Negotiation of compensation barely makes the list of top 25 predictors of earnings.  Feminists love to cite this reason for why woman make less but ignore the twenty something other more important choices women make that are far greater predictors of earnings.
UgjIpa1ETohVl3gCoAEC,Daniel Walley,1504485297717,"""Not the only people that punch"", in regards to kangaroos. I think Jordan's gender identity is a kangarookin."
Ugi2iBy1Wzc8r3gCoAEC,JennK777,1504485297725,"4:01
GOOD GOD! MY EYES! Or, have I travelled back in time to 1996? The orderly graphic designer in me wants to tell you to never ever ever use that styling. Ever. I don't know what effect you're going for, but there's another, more aesthetically pleasing way to get it ... there's always another way. I guarantee you.

Otherwise, I'm thoroughly enjoying your lectures!"
Ugg_lFkHkRjDQXgCoAEC,Paul Purail,1504485297737,"I just received my advice of the month ""If you  unconscientious, write notes on google calendar and beat yourself on the back of the head until you are disciplined enough so that you can actually stick to something."""
UgjRvVEjy_rUrHgCoAEC,bad mojo,1504485297749,48:35 He does Miss Piggy as well!!
UggxYy-i9TlDLngCoAEC,James Wang,1504485297755,"Guys, if you are in high school, get good marks and apply to U of T. The school of Arts and Science there is really good, you can take a lot of different courses."
UghMuMO2lQ5pQ3gCoAEC,Michael L,1504485297764,"My god, this is practically blasphemous by today's university standards.  When I was in college, the professors tried to shove a social constructionist theory of gender down our throats - to even suggest there might be a difference between men and women bordered on blasphemy.  

Now don't worry - I knew these professors were batshit crazy and didn't take them seriously.  It's always been extremely obvious to me that men and women are wired differently, and are very different emotionally, for obvious biological reasons.  But to actually be able to talk about it at university?  That is profoundly blasphemous by today's politically correct standards.  Thank God you're tenured.  If the school knew you were talking about this stuff, they probably would've fired you years ago.  The truth is totally incongruous with their social constructionist ideology"
UgjyGVsvL8nQ7ngCoAEC,Minase Bahamonde,1504485297774,That thumbnail is amazing.
Ugg412Nev19yr3gCoAEC,Jarosław Cholewiński,1504485297785,"Professor, do you think that learning the Big Five traits analysis might be helpfull for sreenwriters to bild believable and coherent movie characters?"
Ugho4ElUGZlZ5ngCoAEC,Toxodos,1504485297797,that thumbnail is so jordan
UggULdUaECfJW3gCoAEC,Michael Mahgerefteh,1504485302737,Everything he says is so dense in knowledge. He's droppin bombs left and right.
UgjOT8x2q8WKK3gCoAEC,Travis Wilson,1504485302748,"The question is: what is left for high extraversion low in agreeable people? We like being around people, but we don't care about their problems."
Ugg6eOwFeuu3pngCoAEC,Nathan McGrory,1504485302759,Yes
Ugh9Quhf91tog3gCoAEC,Cathrine Lundqvist,1504485302772,Good stuff. Roughly speaking.
Uggzsp-mXT_dxHgCoAEC,Robgoren,1504485302784,"Women are only agreeable when you have money. When the money dries up, so too does the agreeableness. And I disagree with Peterson's assertion that women's agreeableness results in lower pay. Women are ruthless in their negotiations for money, far more than men in my experience. Try spending some time in a female-dominated industry like retail management, where female managers routinely engage in the most eggregious exploitation and abuse of male employees (firing without just cause, for example) in the interest of serving their own ferocious in-group preferences for other women. Other than that, this is another great lecture filled with pearls of wisdom."
UghoZp01WVpy6ngCoAEC,Pokhara Lakeside,1504485302830,"Psychology is post-Christian rubbish!

You speak and speak and speak all these ideas... you have a little study which proves it but does it make it true? Can you really prove these psych ideas in the real world like you can prove science? Like gravity for example, like electricity, can these ideas, these theories be proven again and again? I think not. Sometime it works sometime not. So what is the real worth?

They sound nice, it gives you something to think about. It is like saying 2+2=5. Yes you can bend reality sometimes because life is a mystery. But if you are building a bridge and say 2+2=5 you bridge will fall down on you!

What does psychology real do in the real world? Has it every really cured someone? Sure people fell better talking to someone about their problems. But what has changed?"
UggCDEfG_cNVEXgCoAEC,John Daniels,1504485302842,what is the study regarding the differential domestic abuse rates between married men and women? I've heard you mention that before but never a citation. Just asking because many people will foam at the mouth at the opportunity to refute that.
UgiNcN_eDFdD73gCoAEC,T44CGI,1504485302850,"The rape culture talk and crazy rape statistics I've heard of make a little more sense now, at least in terms of where it arises. There is female vulnerability and a high tendency towards neuroticism, plus the agreeableness which probably adds to the ""stop victim blaming"" and ""believe all victims"" mentality.  Or at least that's what comes to my minds first after listening. I'll need to do a lot more thinking on this.

I would also be curious to know if the trait distributions hold true for homosexual men and women."
UgjYcvnHvUfbEXgCoAEC,Jotto999,1504485302860,"I'm low on agreeableness.  It has serious drawbacks, as Peterson describes.  I constantly sabotage my own relationships, and always have.  People see me as argumentative, cold, and deeply selfish...eventually.  If I put in a great deal of effort, I can make it take a long time before they notice, but that's honestly difficult.  I'm only manipulative when I need to be, for my job and such.  I let my friends see what I'm actually like, as they would have to know in time anyway.  They are also disagreeable, though not as much as me.

My girlfriend happens to be very high on agreeableness.  It's a major theme in our relationship that ""the wolf needs to try not to accidentally hurt the lamb"".  What makes it hard is that if I try to act polite or nice, she can typically see right through it.  So we've had to set up little rules and practices, mostly to protect her."
UgiocMR1-86WS3gCoAEC,Alfred Shitcock,1504485302873,"""Agreeableness is a very difficult personality dimension to understand"" not if you have an oedipal mother"
UgjQf8TSRdxAqngCoAEC,KROOL,1504485302880,Being a criminal requires very low agreeableness and very low conscientiouseness. -   Thank you mister Peterson.
Ugisk2SweP5hY3gCoAEC,J William Pope,1504485302895,Mancheeze no likey.
UgitTgETW8Q_wngCoAEC,Smoothbluehero,1504485302906,Everytime I watch one of Peterson's personality videos I take another big 5 test.
Ugjk8dgxOtQKt3gCoAEC,AtotehZ,1504485302917,"+Jordan B Peterson 47:45 - 48:17 This really struck a nerve with me. 
I'm extremely disorderly with my home, I always have been. It was kinda beaten into me in elementary school that that was the way to go. Elementary school was so easy that I never did homework, I was actually reprimanded for making the amount I was comfortable with, which for math and native language class were the whole books the first day. I didn't need my books most of the time because in my home elementary school knowledge was common knowledge. I pretty much did what I wanted in school and had my own projects at home. As such I never really learned to form a schedule and stick to it. 

Now I've got a depression because of Asperger's Syndrome. I fight against my weakness of poor social skills and it takes a toll, but it's hard not to do it. All this makes my bad habits shine through even more, it's hard to find the extra energy to deal with something ""I don't notice, something that doesn't bother me""(48:06).. Living in an extremely messy home is counter-intuitive to what I want though(social equality between me and peers), so maybe I should pay more attention. Would love some advise on how to give a damn about it.

I'm not exaggerating about school and how it affected me. I've had my IQ tested and I'm north of 150, the only area the doctors and guys at Mensa could discern I'm even near average is the social intellect and that's a tad lower than average. Just like a psychopath you can meet me on the street and I can pretend to be normal, but get to know me and you'll see that I'm different, in good and bad ways. Like deliberately betraying someone's trust is a foreign concept for me, I've just never done it. On the other hand I'm so disorderly and unconscientious that I might not be able to keep a promise even if I both remembered and wanted to."
Ugi9JWM9W0wTDXgCoAEC,AtomikGround,1504485302928,This is one of your best lectures! So many pieces to the puzzle in just 50 minutes. I had a revelation for every 10 minutes watching this!
Ugi7P_O39vvGtXgCoAEC,Ricardo F,1504485302939,"The point at 35:30 of men being much more likely than women to be hunters made me think about vegans. Turns out in the US 79% of vegans are female, and 59% of vegetarians are female. Interesting."
UghuO8l7IIRIw3gCoAEC,-Legibus Solutus-,1504485302950,"I've just come here to say that for the last two days I was working on translating this whole video to Czech, so my family and friends could understand what Dr. Peterson is saying in his advanced english. I'd like to thank you, Dr. Peterson, for sharing your fantastic hypothesis with us."
UghxTTrsJ_BeVXgCoAEC,Andy,1504485302953,"If a child lingers unsocial and aggressive; and continues to act accordingly to their teenage years— unknowingly getting rejected and being lied to—does that mean the child/teen is predetermined to fail as an adult? living a life of hostility and antisocial? (yes, the definition of ""fail"" in this context is subjective)"
UghCwT5vYRHWQXgCoAEC,Darrylizer1,1504485302963,"Interesting lecture Dr. Peterson. I first became acquainted with your YouTube videos because of my fascination and disgust with the current climate of academe regarding political correctness, the strident SJW movement, 3rd wave feminism, and the abrogation of free speech by modern day Maoists of the Cultural Revolution variety. But your lectures re psychology are much more interesting and are really worth watching."
UggibjJ1LC37EHgCoAEC,The Thinking Moderate M,1504485302974,"Love this guy, breath of fresh air"
Ugge_hxk7lYpcXgCoAEC,KROOL,1504485307483,"Michael Dell, the CEO of Dell corporation, could be a corporate psychopath."
UgjDYQGYgAUQXHgCoAEC,vorval96,1504485307492,Did I just get shaped into a better human?
Ugh5krB_hX5-zHgCoAEC,Izzy Parker,1504485307502,Look at how cute that baby is in the thumbnail
UghRyM4WCz8a53gCoAEC,Dexi Antoniu,1504485307513,"Jordan, I just wanna say I love you. 

I wish there'd be a Jordan on youtube for economics, and for art etc. I've learnt so much from your lectures."
UgjzrJyOnOOW23gCoAEC,Music Bobo,1504485307522,"This guy is spot on about parenting your aggressive boys. You can make them valuable members of society, given their gift of aggression. They can be protectors"
Ugj32TdX8hHQ6ngCoAEC,Reid A Pinkerton,1504485307534,"Dr. Peterson, In the discussion of standard deviation modeled overlapping normal distributions, a graphic representation in your slides would be helpful (perhaps for a future iteration of this course). I think aesthetic representations could be added post hoc to your videos, as well. That would possibly further enhance the experience for your viewership!  Thank you for sharing these online, by the way. Most professors lack some combination of the vision, courage, and industriousness it takes to do what you do. I'll be a Patreon just as soon as I'm no longer a broke college student living in Texas.  Cheers - RP"
UgjbksZoOAGZsHgCoAEC,Walleye J,1504485307546,Check out- Prof. Camille Paglia (Feminist who agrees with Jordan Peterson!)
Ugjp04ch8KHw23gCoAEC,Higginsis,1504485307560,"Dr Peterson,

I felt compelled to write this comment to thank you. You came to my attention, like many others, through your free speech battles, but this series and your other philosophical work has given me profound insight into my psyche and given me tools and ideas to work on for my own betterment.

While I'm grateful for this, what I really grateful for is giving me the framework to help someone else, someone who I care very deeply about and love very much, my partner. She has suffered with depression since she was in her mid teens and had a quite turbulent child hood. In the past when she would have a bad time or hit a low point I could be there for her as at best a comfort, which of course has value, but thanks to the lessons I have learned from your lectures I have been able to talk to her about her feelings. We did what you advocate and spoke the truth and see what happened. 

What happened was we had an intense but deeply gratifying conversation. One that didn't just sooth her, but one I think will help her grow, and in that process I felt I have grown and our relationship has become stronger.

She will be seeing a counsellor soon but I walked her through the big 5 attributes and suggested some actions from the past authoring suite and she took to the ideas really well. She has a lot of baggage from her past, so facing these will be tough, but she saw the value in doing it.

So I wanted to thank you for giving me the tools to sort myself out, but also help my partner sort herself out."
UgiyPKeyutpJaHgCoAEC,Twinky House,1504485307572,It's pretty depressing how when you go into education there's a 90% chance you'l get a social justice academic fraud for a professor who will mislead you with their politics and a 10% chance a Jordan Peterson. or more like 5%.
Ugg2fp3qxHMEfHgCoAEC,WT_Neptune,1504485307584,"""If I really hit you, I might kill you."" -Jordan Peterson 2017"
Ugj2vPUpg2EVGngCoAEC,Stopaskingformyname,1504485307598,I scored low on agreeableness (21%) and high on conscientiousness (71%).
UggnJafq4NCwj3gCoAEC,Phat Spheal,1504485307608,"Wait, so when i hit ~25, i'll stop having to fix my sleep schedule because I keep staying up an extra 2 hours every night? Sweet!"
Ugg7UhAk_RnbAXgCoAEC,Zofia Mazur,1504485307615,I know that I want to watch this video again.  So much good knowledge.
Ugg32jmtnTFUrngCoAEC,khatack,1504485307626,This guy keeps awesome lectures. Everyone who is even remotely interested in anything should watch these.
Ugjm__2dP80TfXgCoAEC,Take me to your leader,1504485307638,"44:28 ""Well, any way's""....LOL ...is that all???"
