id,user,timestamp,commentText
UgzwGs9r8XXiEJNSFSF4AaABAg,Langkopf Kopf,1534798936404,"Fuck, that internet university sounds like future porn"
UgyaGUdAs1AzNzkphqV4AaABAg,darren. davies,1534744936410,"It's Utnapishtim and the ark in the original poem of Gilgamesh,not Noah interesting that one should not steal but bullshitting is OK"
Ugzy8HFZlXfARQ9Cf5F4AaABAg,Mark Caporale,1534561336416,"""The fundamental reality of things is complexity beyond comprehension... "" followed by an explanation of the importance of routine 24:38"
Ugz4eI9E8-s5lxFogJl4AaABAg,Mark Caporale,1534474936426,The importance of having a goal beginning @ 1:16:08
UgyFJYVlU0j_tXv7T5d4AaABAg,goldeare2,1534474936434,31:12 I find some similarities between how Dr. Peterson is describing the social interactions for maintaining sanity and how block chain technology works. I find that very odd
UgzkkpzE1hYzEb5-fMV4AaABAg,Rogue Jedi,1534302136440,"2:14:52 ""No one ever writes a best selling book."" Proceeds to write a best-selling book. I love this man."
UgxDyDQhTGlHReG7y8V4AaABAg,Pablo Valle,1534215736446,"So according to Dr. Peterson if you live with someone and you're not married you don't love the person enough, man that's tough to swallow, might be true for most cases but not all, anyway Peterson loves to make this kind of generalizations, he is one good provocateur"
UgzmzgGsCgqcVpb5H0h4AaABAg,wynotme dallon,1534215736456,"I told a friend about Dr Peterson, he said he would check him out.
I saw him later and he said,""he is a nut case, I can't understand what he is talking about.""
We listened together for about 15 minutes. He said,""See! What did he say?""
As I explained it, I realize he was not literate enough to understand the words, but he was intellectual enough to understand only if I interpreted the words into 4th grade language.
If you think Dr Petersen takes a long time to get points across, try using many words to explain each big word. Tedious doesn't say it all.
Thank you Dr Petersen for your shirt lectures."
UgyBK2zk_Ty44TfyDGd4AaABAg,Jamie Nelson,1534215736460,"2:18:25 YES! Seriously, yes, yes, yes. This could actually, literally change the world. Maybe start at 2:11:55.  An educated populace is a more sane, more stable populace that would stand a far better chance of acting in its own best interest. For example, voting in its own best interest, amongst other things!"
UgwUVR4-HGFgYq_NG3J4AaABAg,SeouL,1534215736468,"""Beware of wisdom that you didn't earn"""
UgwHTIH3tNzyaACHOIN4AaABAg,Edgar Perez,1533610936475,"Very interesting, why were the animals saved?"
Ugw99Hy4Y97_zoqHn5h4AaABAg,Jrock23332,1533610936526,"I received free medical treatment at a teaching hospital because of my rare case of necrotizing pancreatitis. Speaking of dmt trips, I spent 28 days on life support on propofol. It took a while to accept that the month of memories i have mostly never happened. Thank you Dr. Peterson for the help that you don't even know you're providing me. Getting back out in the world is very difficult."
UgwydVnPyxKo6B8uq4R4AaABAg,Oscar Geronimo,1533610936534,"He starts to talk about The Flood after 1:44:00. But is all justified: this whole lecture is not intended to be simply a retelling of the story of the flood... it is actually an excuse or pivot to lay the grounds for an embodied theory (or reflection at least) of existence from the philosophical, evolutionary and psychological data and knowledge accumulated, and to use that to understand how ancient mythology reveal that, in this case applied to the myths of floods as representatives of the nature of how desastres in human life emerge by the nature of existence (all decays on it's own, entropy) and helped by corruption in ourselves and our society.
Some personal notes:
48:03
1:25:47 ""The chaos is hiding in what is irrelevant"".
1:26:56 When relationships fall.  ""There are certain things that you can encounter that can basically unglue you"".
1:29:31 [...] Your performance...
""....You don't know: it's all of those things at once. Ans that's very stressful because all of those things at one is too many things. And that's the re-emergence of chaos. That's the flood. That's the return to the beginning of the cosmos. That's another way that it's been represented mythologically is: you voyage all the way back to the beginning of the cosmos when there's nothing but undifferentiated chaos. And THAT'S what you're confronting. And maybe it's too much for you and often it is, I mean, that can be TRAUMATIZING, it can HURT your brain, it's just too much for you to bare. it doesn't matter, you're stuck with it...""
1:51:40 Eliade's analysis of flood myths analogical with the maintenance of relationships."
UgxWb_CMIq1qoJxIhjN4AaABAg,Bookwyrm,1533610936540,"1:29:00 - that point where JBP almost goes full ""riddle of steel"" :-D"
UgzBJnWd-DLtyNgrah14AaABAg,jona nylund,1533610936549,"""Pain is inevitable, suffering is optional"". Tradegy is inevitable, it's up to one and other not to make it hellish."
Ugw8LoEcquRzsnGgqcZ4AaABAg,Ross McAlpine,1533006136555,"Dr Peterson, I’d love to see you do a similar lecture series on the importance of the works (particularly the non-fiction) of George Orwell."
UgywZ0ODK1VyoFciiZd4AaABAg,simonieux,1533006136562,"I would like to listen your analysis of the games of throne series, with the ""winter is coming"" resonates with the noah preparing to the end of the world . Thanks for these resources free online :)"
Ugx9siK5oWTvj0wWJLt4AaABAg,RBelschner,1533006136571,2:26:00
UgyJusq3MiNW0QKYXox4AaABAg,NolanEP84,1532401336580,"Just because someone doesn't want to marry another doesn't mean they aren't into them or don't love them as much as anyone else who does get married. It's a total non sequitur. Some just aren't interested in that institution or idea. One could argue that true love would be not to burden one another with a contractual restraint that basically says ""I don't really trust you to stay with me otherwise and this document says that you must."" Giving someone complete freedom to leave if they wish and to desire happiness for them without conditions of remaining with you, that's actual love, as well as respect of their sovereignty and human dignity. People forget that marriage was created minus the notion of romance, but rather was for practical purposes. It actually has very little to nothing to do with love."
UgzEtSeSRPPF6c9CryV4AaABAg,D MatLeo,1532142136587,2:06:00 (bm)
UgxxxNpUQFeOEJ6OrGl4AaABAg,Dick S. Ding,1532142140317,I love you Dr. Peterson.
UgwQz6KEybAzFEREs9d4AaABAg,FountainOf Light,1532142140327,I would be thrilled to raid Peterson's bookshelf. He's right though; the most stressful part of my day is having to figure out what to make for dinner.
UgyqVYoNeGajKf-WjrN4AaABAg,John Massari,1532142140330,48:30 - 50 Very profound. Very helpful.
UgyYxygRZn_LG8VFPNd4AaABAg,Nick Alexeev,1532142140339,I count Augean stables [one of the labors of Hercules] is an ancient Greek flood myth.  The point of the legend is that flood deals with entropy which had accumulated because of neglect.  Hercules uses a small-scale flood as a tool (whereas Noah is conscientious survivor).
Ugy9k6pVx0Vum33Vz_l4AaABAg,Ian Witucki,1532142140342,"JPB is genuine, sincere, honest, and humble. That, to me, is true honor."
UgyBq4n3HY58d8aAXex4AaABAg,Rodney Johnson,1532142140350,"I wish Jordan could teach about the psychology after Noah's flood without introducing so called billions of years of Evolution. It does nothing to help. I wish he would just use the words nature or the creation, etc.... Those words would work better."
Ugzpf1_v1RIKtBjslPd4AaABAg,Life was Given to us,1532142140354,"The way he makes a parallel with New Orleans and the Noah story is incredible.

Also, His online university sounds great, I hope it works out."
Ugyl53tWgUgRDmlEC1h4AaABAg,Wally Iverson,1532142140361,Going soon!
UgzwomQUCw7rWuFeMBR4AaABAg,Kawan Klump,1532142140364,"I watch a lot of his vids and he is very knowledgeable in his field and I like how he handles himself but he is out of his element when it comes to the Bible. You see, in order to believe in the accounts in the Bible you need a whole lot of faith! This is the first time of heard him state that the subject he was lecturing on was his opinion. Just listen to it again and you’ll here him say it. I hate to say this but it was hard to stay with him at times."
UgxhXHMfc_uK7Imorh14AaABAg,Tyler Scarborough,1532142140374,"Every story fits into Dr. Peterson's paradigm ultimately, because his thesis is that we are all built into the archetypal ""story."" So, while Peterson's (brilliant) ideas can be made to fit into the story of the ark, the story itself does not necessarily imply his ideas. It seems to me that Peterson reads his analysis into the story rather than letting the story say what it itself intends to say. For instance, from the Bible's point of view, the ark story is about how evil the world had become, and so God regrets making them. It does not seem that the reason for God's actions is the people's unpreparedness, while that would obviously be a useful didactic reading of it for the purpose of learning from past mistakes."
UgxhR5KkD2006tMngIN4AaABAg,Evan Nagel,1529550140383,"I am only just going though these. All excellent. I would like to focus on the hallucinogenic drug question. Jordan said that he doesn't know what to make of the research and subsequent documentation. In his possible explanation he stayed very scientific, but when he isn't sure of a particular explanation he says something to the extent of, this by no means exhausts the situation. I am an engineer, so I appreciate science, but might I suggest another possible explanation: There is a conscious entity outside of space and time that interacts with space and time."
Ugynax34u7kfBDsWctV4AaABAg,Lars Dols,1529550140386,1:00:00 is exactly what went wrong in my marriage.
UgwZ0P8zpd3qxOJpKQ54AaABAg,Mauro Goncalves,1529550140395,1:09:55 - 1:10:51  It turns out that Peterson is for more Diversity than anyone else :D
UgyezmciTc8i1R2Gtq14AaABAg,Leto Atreides,1529550140398,1830 please stop describing my life. XD
UgzkhabBScN-2_X8x0B4AaABAg,David Reed,1529550140406,"Happy birthday, Jordan."
Ugw18nTLd1-49aCxQ-B4AaABAg,Alex S,1529550140409,Love the humanities coursework idea
UgxM0_6g_wk6bVMZtz54AaABAg,Diane,1529550140419,"I'm not great at silent reading - I listen while I'm doing my job (I'm a self employed seamstress) 
I can't wait for your online university - I would like to study psychology (though it might be a bit late at age 53)"
UgwIl0WmYu9nZBuGVkF4AaABAg,SKMC69,1529550140423,You don't need to sort. You need to seek the truth. That truth may require you to live among chaos. God is not the author of confusion.
UgyhlH1k8qjMbCsFtSp4AaABAg,claycon,1529550140430,"Fantastic!! One of my favorites so far. I’m excited I’m only on #6. This is the best content on YouTube. It’s a free college course that is actually good, plus advice you can apply to your life today. 👍🏼"
UgyNiRSEBQfOT_hzJi94AaABAg,mary shaffer,1529550140434,The years it took Noah to build the Ark and stock it as he was surrounded by giants and people laughing at him because it had never rained must of been hard.
UgyNekm6Imo8IgJKMlJ4AaABAg,Devo Castler,1529550145670,personal marker: 32:00
UgyIrsnTXXkB61RfAbF4AaABAg,christine shah,1529550145681,"I just identified how I screwed up my kids.  They are great, so let's not freak out, but they are still learning to clean up stuff.  They are 12 and 9!  I never did the damn microroutines!!!!  I'm a farking moron!  I have a degree in dev. psych!  What the hell?  I feel SO DUMB.  We are doing the microroutines this summer and I planned that crap out but didn't realize the whole thing until JUST NOW.  Man, JBP, sometimes you hurt me in my presuppositions.  I'm feeling a bit horrible and useless at the moment.  Lol!"
UgwMe58OlADzEIKM-IF4AaABAg,James Tyler,1529550145701,"Just one little tenet that he gave me thats really helped, that I wanted to pull out for people listening  - When talking with my wife, our criticisms of each other have to be as specific as possible - so that we don't make arguments the other can't internalize, or work on. If your partner says, ""you need to rinse off your plate after you eat"" vs. ""you never help out around the house,"" you're saying the same thing - but one is a specific action to work on, the other is a world shattering realization that your partner hates you, lol."
UgwDPO1ugjW5LANW__Z4AaABAg,Jeronimo Tamayo Lopera,1529550145712,GREAT... TOO MANY PEOPLE GO TO UNIVERSITY.
Ugw1FFGZim6Nu33e0Yl4AaABAg,Frank Olson,1529550145724,Very Interesting.  I want to learn about these frames (prior to minute mark 1:25:00).  Any good links out there?
Ugz-uYgqMKnv7KXe7HB4AaABAg,joel olivares,1529550145733,I remember having a dream when I was very young maybe 7-8 .. before I tell you the dream let me lay lil perspective. At that age my grandmother owned a 3 family house. She lived on the first floor and me and my mom on the second floor and neighbor on 3rd. But from time to time I would stay with my grandma and she would open up a lil foldable bed and I would sleep in her room.  And she had the basement and there were 3 rooms in the basement that were rented out to people.. and I had a dream where I would go to the basement very consciously and I would open a door and the walls would have water on them like if it had just flooded and the water just receded.
UgwK4z_xYHRxQeu3dMJ4AaABAg,joel olivares,1529550145742,"Hey Dr. Peterson, what is your opinion on the Disney movie Hercules."
Ugzl7K_O1CPi9C79Te14AaABAg,no one important,1529550145752,"Dr. Peterson it you probably will never read this it would be cool for you to do second part to this going over other books like judges, proverbs, job, songs of solomon and some of the prophets depending on what you would see fit if you ever do another part to this"
UgxDeU7xgW0ZnCnZ3kx4AaABAg,Bachconcertos Whitney,1529550145766,"God anointed Jesus with the Holy Spirit (Power) and Jesus went around healing all who were sick and oppressed of the devil.  Poverty and sickness are from the devil   Jesus cast out the devil and the Apostles healed the sick, gave sight to the blind, crippled were healed, and the dead were raised in the name of Jesus.   At the cross, Jesus took all the handwriting of ordinances that was against us, that was contrary to us,  blotted it out, erased it, and nailed it to the cross,  and pillaged principalities, and powers and brought them to an open shame.  Satan was defeated at the cross.  Death and hell were defeated at the cross.  Jesus has the keys to death and hell.  We have been reconciled to God through Jesus Christ.  God in the riches of mercy, and his great love in which he loved us, even while we were dead in our sins, quicked us together in Christ, and made us sit together in heavenly places in Christ Jesus."
UgzLBOKZTLKgG-A6EXp4AaABAg,Holly Murr done,1529550145778,I wish I could see him in person..
UgzkZTTNHju8nxoGHoJ4AaABAg,Zombie Returns,1529550145788,"46:01 It's Sea Squirt, not Hydra."
UgwvwzC2EqOQ-l6gZLB4AaABAg,rockhard,1529550145795,"this guys going to leave a legacy on YouTube thats going to influence the world for CENTURIES 
MARK MY WORDS, THIS GUY IS IMPORTANT
MUCH MORE IMPORTANT THAN PEOPLE IMAGINE
   And in WAYS people dont imagine
for example, every academic in the world is going on youtube, THEY HAVE TOO!!!
THEY WONT BE COMPETITIVE IF THEY DONT, 
it wont be ""publish or perish"""" anymore
it will be ""publish AND youtube or perish""
students will go ""professor shopping ""  on youtube
just watch whats going to happen to U OF Ts enrollment
this is a revolution of the whole higher ed buisness"
UgxPpSX2-Zgdac4wDRR4AaABAg,Mr. K Dilkington,1526871745804,Scientology would have a field day at 52 mins 😂😂
UgxTQSE0cML2LOT7wXh4AaABAg,pianosRepic,1526871745814,"me to younger brother: 'run (set of micro-routines)'.. nope, doesn't work"
Ugz8-d-waV41LG_2KaF4AaABAg,RBelschner,1526871745822,49 mins lol
Ugwa0itROc9arEP1-nN4AaABAg,Cavin K,1526871745834,I'm so glad we mankind have such an intelligent man on the globe.
UgwmMrSvq3gqQbDWv6d4AaABAg,William Montgrain,1526871745842,"It might also be useful to note that the sun can be seen as a symbol of order, routine, consistency or predictability, whichever synontm you prefer, and order in the extreme can be tyrannical."
UgxEWD5SjKKxm1kL74Z4AaABAg,Felipe Beraldi,1526871745850,when i hear that intro i know ma boy it's about to drop some fucking knowledge
UgwMsJdOT1fmR5hcJAV4AaABAg,Maximilian Trompetter,1526871745859,"Hello Everbody, does anyone know the name of the neuroscienctist mentioned in the beginning of the video? Jag Peinzep, Jacque Peincep ... i m not able to find him. Would be great if someone could help out. Thank you"
UgwSoznMiPCvs2GvfWx4AaABAg,Andrew Krause,1526871745874,"The Neuroscientist mentioned at 2:35 is Jill Bolte Taylor, and she delivered a TED Talk on her stroke."
Ugz_ehjFzNqaJpFR2MN4AaABAg,I literally created this account to write this comment,1526871749164,"It's quite hillarious reading any ""hit pieces"" against Jordan Peterson. They never have any good counter-arguments and always rely solely on emotion, lies, and sometimes false science to do their bidding. Keep it up Jordan."
Ugzqsh670qdlcnXS62t4AaABAg,DrasticPurpleHippo,1526871749171,"lecture half done, still hasn't even touched on Noah"
UgxcdgDi_StCyXs2TYF4AaABAg,Rob Ray,1526871749182,40:00
UgxH6LeCLRMC-N80cNt4AaABAg,Jake Harland,1526871749190,Clean your order so you can start to establish dragon in your life! Go to the lair of the bucko! And you might well say NONTRIVIAL
UgwQpBvlv97wydFoj8J4AaABAg,Neilansh Chaudhary,1526871749196,"I want that quality education, Dr. Peterson. Please make it happen"
UgzZfGlIZTqtxO98K9B4AaABAg,Denis Santos,1526871749204,"01:44:12 then the name ""Noah"" comes up for the first time!"
UgzLxMNIN4WQOEi8gnF4AaABAg,Adam White,1526871749212,"""All is in all, that all is actually each."" - Aldous Huxley - simply means to me that we, each of us, share the same consciousness that is in all of us."
UgxJdjNIVYZxeScPUYF4AaABAg,Biopsychosocial,1526871749219,These valuable lectures are sooo much more than just biblical.  I'm loving it all.
UgxG6zG5dc3Ui6oLyrp4AaABAg,Adam White,1526871749229,"""An audit....  that's like a semi-fatal disease."" LMAO!"
UgyEqp9nk--KzQOqGl54AaABAg,A jF,1526871749240,"what does the expression/word ""~bear born"" or som like this  mean? He says it  a few times around 39:42. English isnt my main language."
UgwLZa8wdmJ7DqKR2pR4AaABAg,Patkmr Patkmr,1526871749248,"Have yet to be disappointed while listening to professor peterson's video's ( & I've watch maybe 2/3rds of his speeches ) just saying there's very few I would give that attribute to. Even the things I don't 100% agree with,I've yet to be offended by his presentation of those views."
UgxdQROEgNvvkFcU8vl4AaABAg,elio challita,1524279749255,"I was reading a poem today ''the lady of shallot '' and I was wondering how much archetypes she shares with this story (  the curse, the boat and the change that comes from) but the poem ends in a tragedy like, here it's different and that not something common in mythology (mythology are more pessimistic)...anyway professor Jordan Peterson gives a second birth for a meaningful life in the postmodern era."
UgzhsIPm8iaTqFkqIhh4AaABAg,Gregtice,1524279749259,who put Polish subtitles on here?  that's great!  Thanks Jordan if that was you.
UgzFsvxJTNfD-qFgDgZ4AaABAg,I G,1524279749266,"Mr Peterson,


....I gave you a fair listening - I actually payed attention thru the entirety of 6 of your biblical lectures - early in your lectures you posed the question along the lines that...you’re not sure if you’re a supporter of Judaeo-Christianity or a detractor of it - you, I believe are by all observations an extremely intelligent person and because of that you are one of This Way’s most destructive detractors due to the fact that you intellectually and very persuasively go after Judaeo-Christianity’s foundation - it pains me to see a man of your ability apply yourself to this conscious or perhaps unconscious path...take it from someone who till about 12 years ago has used your line of reasoning to undermine This Way’s foundation - friend, this way of thinking is a dead end."
Ugz_DsICO028QnsKhjF4AaABAg,Maxx The Bitheist McGerk,1524279749272,"""Put yourself in formation with the information.""..........................................Bloody brilliant!"
Ugwk2COrdxGu26NuI3F4AaABAg,Justin Myers,1524279749277,I would be absolutely thrilled to be tested on Jordan Petersons' lectures.
UgxtUtabGDPk1E2wZ314AaABAg,Mitnichten,1524279749288,"Q&A
2:11:55 How can Students get involved with the online university you are trying to build?
2:23:27 Psilocybin and thoughts about it's connection to religious experiences
2:29:57 Regarding a passage from Aldous Huxley's Doors of perception about the disconnect from the ego"
UgxmK8FCXYRHgj9plGN4AaABAg,Sonder,1524279749294,Thank you for the discussion after 2:10 about student loan debts and the future of education.
UgyXJcVu6pEvLGuJI0B4AaABAg,Arien Barley,1524279749304,wow for the university online ideawow
Ugz4V9N5xZFRHoxnVwF4AaABAg,Sarah Eichelberger,1524279749314,"Evolution is a story with no sound foundational principles.  Who are you going to debate about this issue?  Or perhaps you do not consider yourself an expert on evolution, you just know enough to repeat it as the story it is, as if it happened, perhaps you believe it is true in fact?  There is no dragon in the biblical sense that symbolizes the unkown; from where did you deduce such?"
UgwhcNMgh5LB1DgQSDt4AaABAg,MrJamjestteo,1524279754260,"Piona za tłumaczenie napisów na polski, duże wyzwanie, niezła robota, wygląda na profeskę."
UgzxqTKPyNf4uZHIzed4AaABAg,Aria A,1524279754269,"He makes some irrational leaps in his conclusions. Yes people need structure, but his argument that the structure MUST BE ""the patriarchy"" ie ""men in charge"" and that anyone who questions it lacks the proper gratitude, is completely absurd... and very self serving coming from a privileged white man of high social status and wealth. For the sake of ALL humans we should strive toward equality and true democracy in governance and decision making across all races, genders and beliefs. Also there have been huge periods of history where women were in charge, and everything worked out just fine... we don't need to bow down in gratitude to a patriarchy self-servingly abuses women and minorities."
UgwKqrTp98Luh8srXkl4AaABAg,jamie smither,1524279754272,a genius in full flow
Ugxx4MOHEOwOLBAUrfR4AaABAg,June Wheeler,1524279754282,"hi i am 67 year old grandmother , i enjoy your talks .thank you."
UgxMSVGeQo-9O6upPkN4AaABAg,Toasty Waffles,1524279754284,1:16:46 this is why sartre's absurdism is incorrect. Camus was right
UgwR5dvlBCYb5GxZqA14AaABAg,Abhishek Dhar,1524279754293,"""Bad boys... watchu gonna do?
When sherif John Brown 
Come4 u."" 🙄"
UgyT6GK2zeQ4p3QgJ3Z4AaABAg,Michael Pearson,1524279754296,"1:11:30 abstraction
1:13:00 jobs
2:10:00 education"
Ugw2s9eM31PQ1JMiKzF4AaABAg,Daniel Stevens,1524279754305,"2:19:10m great goal!!! As a 29 yeaer old who avoided massive student debt and got fed a healthy diet of Marxist equality of outcome , free education is a great goal. No more will I pay an institution money to learn something I can do with a healthy competence in critical analysis and YouTube! (Doesn't mean I can avoid it because curated sources are great to pay for, teachers do it all the time for lesson and unit plans!)"
UgyxkrKheyNlXLebLyR4AaABAg,James Herrington,1524279754308,"Dr. Peterson, About those 6 verses at the beginning, ""Sons of God and Daughters of Men"". What if those are like ""Males who speak the Word and Women who understand the Word"", like the distinction between Reason and Intuition. Like, maybe these are the words that they used to differentiate people who were creating language, creating the Word in reality, from those who were just regular humans who could take what others create and use them. 

The thing about language is that there's two sides, speaking the words and understanding the words. And some people are better speakers, and some are better listeners. Maybe at one time, it was all Sons that were good speakers, and all Daughters that were good at understanding. So when Jesus says he was a Son of Man, it's like saying he has integrated the masculine Son with the feminine Intuition."
Ugwjqr2dzVBcrH-RQ-54AaABAg,Fishing Rod,1524279754316,Well put! Amazing!!!
Ugz5-tamzeAxaP8IR0Z4AaABAg,shoconno,1524279754320,Busy cleaning my 80-ft Super Yacht.
Ugy6Hr5hIU9BDVEYrPJ4AaABAg,John Sinclair,1524279754329,"Christ stands outside of time. In the end days it will be like the days of Noah he said. God also said he would not repeat the flood. But what if the flood hasn't happened yet? In Blade Runner they made Rachel more balanced and easier to control by givng her her creator's niece's memories. In Revelations the dragon opens his mouth and water floods out to get the woman, her child had already been""caught up"" to God, and the earth swallowed up the flood. Is it so wrong to be human after all? https://youtu.be/zpdQQoc-gkk"
Ugy0W9WHM0QYEVeblkZ4AaABAg,E Loesch,1524279754334,"Question: What if your internal dialogue talks back to you? Seriously, I am one person, one mind, but my inner voice has a tendency to argue."
