id,user,timestamp,commentText
UgxMlSHOF-r0s0xmuut4AaABAg,vincent barrio,1516503893896,My God why have you forgotten me? Its Jesus that assumes the  groans of all human tragedy. When they felt neglected by God. But actually God did not neclect him. He is just silent.   He raised him up on the third day.
UgxGjP_hYnkUvHcaGSt4AaABAg,Yah's Salvation Is LORD,1516503893902,"No... ""My God, my God why hast thou forsaken me?"" Are the first words of psalm 22. Yeshua uttered these words because the Hebrews would have known that He was referencing that psalm, and in turn would recognize that in verse 16 for us (because they didn't have citations like we do) it says ""they pierced my hands and my feet."" And following, that they divided up His garments and cast lots for His vesture. He was directing them to remember the prophesies and witness Him fulfilling them. Go check! 😁 God bless!"
UgweQzHzygZBxpZFY2p4AaABAg,Chris Martin,1516503893908,How about a one minute limit for asking a question. Seems reasonable.
UgxJBk82O7o5AQk0Xkh4AaABAg,Joshua Cox,1516503893913,"""And when the sun was going down, a deep sleep fell upon Abram; and lo, an horror of great darkness fell upon him.""

I feel I can add some insight into the vision that Abraham had. I'm curios as to how many people message you describing religious experience, and how many of those you might write off as insane, though you don't strike me as a person who writes people off casually. 
So, I feel it pertinent to share one of my experiences. 
I was driving home after a 14 day hitch of 12 hour shifts on an oil rig in North Dakota. I was about 3 hours into the drive headed West outside Miles City Montana at around 10 pm Listening to the new testament. I came to the point where Jesus is talking about adultery (around Matthew 5:23). The gravity of my sins suddenly came into stark contrast. I know sins are forgiven, but so frequently Christ says go forth and sin no more. I had questions- was it one sin to marry a divorcee, or was I living in sin, and refusing to turn away from it? What was the proper course from there? A moral dilemma. After a few phone calls on the side of the interstate, I was no closer to the answer. I began to pray on the subject. 

I'll say now I never understood the idea of the ""fear of God"" before that moment. 
I was struck with overwhelming terror. I could feel God, the presence, the anger and the disappointment. The knowledge that I had failed in my test, was crippling. In that moment I asked to die. I asked to be forgiven and to die before I could make it home and continue my error. I asked not to be asked to leave, I'm not strong enough, instead I asked for oblivion rather than damnation. I wept. 
The next moment it was gone. The fear, anger and disappointment was replaced by a specific urge. I got out of my car. Not daring to resist, and crossed both sides of I94 in the dark until I came to a barbed wire fence. I climbed it. I counted paces then, it was dark, so dark I couldn't see my feet. 300 paces I walked, the number stuck in my head-  tripping over sage, until i reached 300. I knelt then, I was surprised at how soft the ground was. The grass I had come to, in a rocky area plagued with sage brush and thistles, I had come to soft grass. I knelt, I prayed, and I heard a voice. The elation and overwhelming calm that paired with that voice is indescribable.

In the dark, in a damn cow pasture on soft grass in the spring, East of miles city Montana I heard the voice of God. I was 25,
I was sober. No psychadelics required. I have only dabbled in psychadelics once and I wasn't told until afterwards what I had taken. They said it was mescaline, it was not at all simular, and it was 9 years prior to the event. In that light I wouldn't be as quick to believe that Abraham was intoxicated prior to his vision. 

You said in one of your previous bible lectures that if God was in the habit of making appearances there likely wouldn't be any problem with belief. The problem lies solely on one question.
 What if I'm just insane?"
Ugwdq9wOjgISrWxH7MV4AaABAg,pwnmonkeyisreal,1516503893919,I think it would be interesting to see JP interview a theologist about some of his questions about the Bible. different point of view might be cool
UgxLmxd2vtYNENeCFjB4AaABAg,pwnmonkeyisreal,1516503893925,1:28:50 was hilarious
UgzJG9nCU0LmZmkmba14AaABAg,Jay Williams,1516503893931,"""Resists not evil."" Every war requires an enemy. Unless the war ends there will always be one."
UgwOyqEzWTr_LBkQZQZ4AaABAg,John Smith,1516503893936,"Jesus christ, the questions last lecture were so good and theses ones are just dreadful."
UgwrdeFd-MNj4sr0ecV4AaABAg,Nick W,1516503893942,"There was a very important, universal, covenant between God and Noah (mankind); the Abrahamic covenant was more between God and a fairly specific concept of nation. St Paul/Christ kind of reasserts the universal covenant, as far as I understand."
Ugw9Gt2GjoRheFiKQWF4AaABAg,Eraj Ismatulloev,1516503893946,Thank you!
Ugzm2ARvljUKnkBjirJ4AaABAg,Leonardo Alexis,1516503893952,27:00
UgxXDKSB9Fz_IuhrE354AaABAg,Joey Mormann,1516503893956,"I was made so uncomfortable by the new age love question. Vibrations, chakras. Was she not listening to the lecture? I put myself in Jordan Peterson's shoes and saw myself letting her go on another minute and a half, then cut her off too apologetically then feel so bad about it and awkward that I didnt pay attention to the next question. Nice Job JP. As a matter of fact I'm still having a hard time paying attention. Im worried I've pissed her off and I didn't do anything."
UgzWBcRK6w_-XxU6Syl4AaABAg,Nicholas Hall,1516503893959,"“I didn’t really have time to plan for this lecture.”
Still blows everyone’s minds."
UgwrBkiTI4H4bLLxFWJ4AaABAg,Molb0rg,1513825493967,The last question - humans are the god.
Ugw9HLH0ibVjbon_x794AaABAg,hobbs burgess,1513825493970,1:20:10 That blew me away.
UgyYnaAfQ3RXb7vSiJh4AaABAg,Numira,1513825493978,"i hate these egoistic selfcentred idiots who have the chance to ask a question and then start a fucking tirade of his/her opinion about something and try to force it onto peterson and sells it as given. i rly find it annoying not only that they dont ask a question but also that they speak as some sort of messiah of truth, like the dude at 2:10:00 onwards. 0 selfawareness. even petersen sais in a lecture when a dude ask him, how he can articulate himself better, that he already did the first step in asking a good articulate question and not start a talking like many people do when they have the chance to speak...."
UgwRI3pA1pEPcuwtI6N4AaABAg,DJ,1513825493982,Being an INTJ brought me here.  Roughly speaking..
Ugz3r_jHO_-0-ZKZk754AaABAg,Horatio Redgreenblue,1513825499101,"Antarctic shipreck captain was called Ernest Shackleton, who was a British polar explorer. Each one one these lectures seems more profound than the last."
UgzHilB42tNmd__cX_t4AaABAg,Tyler HIckman,1513825499106,I NEED TO SPEAK TO JORDAN PETERSON.
UgzcrDEpB6d7nKf0Q_94AaABAg,Roxana Zamfirescu,1513825499113,"oh shit... oh shit...! He said it, he really said it. ""Perhaps we don't know how to access these states of consciousness anymore."" Yes we do, psychedelics, but we have lost the rituals behind that, which is why the experience is so chaotic and random. There are other methods, but they are very hidden and obscure and hard to find. He's right, as a society, we kind of lost that."
UgxW590KmA52c72V2pF4AaABAg,President donalj,1513825499118,I think Jesus B Peterson has converted me
Ugyaic2IYS8VPAY_uSV4AaABAg,Udrakan Morturim,1513825499126,"""Ghostly youtube people."" I loved that. A lot. Thanks JP"
UgwrDgyqYTqaZeHq65V4AaABAg,royhills,1513825499133,"1:59:30 Bruce Alexanders's ""Rat Park"" study in the late 1970s found pretty much the same thing.  Caged rats with nothing else to do will prefer opiates, whereas rats with better life choices will prefer plain water even if they've previously been exposed to opiates."
Ugz37FA-qjqr9nVU3mN4AaABAg,Josh Lambert,1513825499140,I want to see a discussion on happiness between Dr. Peterson and Dennis Prager.
UgzyKRQ0n3VOLIZf2y54AaABAg,Roland Rush,1513825499147,"The ""conscientious people have to be employed"" hit me hard. I am feeling that with my job reducing my hours."
Ugxh-N2BQ3tZD1XPKPl4AaABAg,WISE ARCADIAN,1513825499154,Google got  rescued from the deep and sorted out
UgztOmhmFEVnOuhULtd4AaABAg,Denver Property Investment,1513825499161,"36:00 waste it and suffer, that’s a bad deal. Haha"
Ugyho_CLV6s2Gd3JbwN4AaABAg,Cody McKibben,1513825499166,interesting to hear Dr. P mention the Club of Rome (I think this is the second time I've noticed him reference them)
UgxIB2ekVXx2ME_1CoJ4AaABAg,ross,1513825499175,jesus what was that first questioner on about!?
Ugz9cwtmJ__8_0ZvIE94AaABAg,WarhammerXLK,1513825499183,"You guys really need to listen other two amazing men, One is Manly P. Hall and other one is Bill Donahue,  understand the symbolic meaning of Christ and other interpretations. Each one of those men is a LEGEND and a fountain of knowledge in his own. 

https://www.youtube.com/watch?v=v5uR75rxgks  and 

https://www.youtube.com/watch?v=LLO-eGP4Dlk enjoy."
UgzTSTU0gm4FhQMp2eR4AaABAg,Timothy Hazell,1513825499195,Did Jordan comment on the interaction between Abraham and Melchizedek? I didn't think he did in this one.
UgyfwxLp8boTiYQKsWd4AaABAg,PlayGirl,1513825499207,"So the Question about Jesus last words: “My God why have you forsaken me” which shows me you have not yet gotten to Psalms 22, Perhaps read that and ask why was Jesus quoting someone else."
UgyE0GrLDfWp3rtnyLZ4AaABAg,PlayGirl,1513825499220,"The LOGOS is GOD, the essence of being, so if google can control the words and interaction aka taking over for GOD.  So obviously we need a platform that is not controlled and manipulated based on the largest $ provider or lowest people platformed with their specific intents.  So who can make a new internet platform.and video platform that is truly open to the LOGOS, unedited, uncontrolled, manipulated, restrained, availability for the pure form of the LOGOS.  Obviously someone aka Peterson is finally speaking the truth and everyone wants and needs to hear it.  There is no longer a published law so who teaches the people...Google. Even King Hammurabi had a Steele with the laws of his dynasty.  Who now teaches Thou Shalt not Kill, no one, think about NO ONE.  Read the Koran Hagar’’s lineage Muslims, be a martyr and kill the infidels so then teach religion is their law so now who teaches the law in the Western world the US.  How long will you go to jail for a speeding ticket, rape, murder, do you have any idea...no who is teach that any of that is wrong.  Think about it."
Ugy3JVP-sVLbDFcl1wl4AaABAg,Aaron Scholl,1513825499227,"I love how he stands up for his right to answer questions with “ I don’t know” it reminds me of Socrates, what I know is I know nothing"
Ugy1jnOpSu-QPNiK7S94AaABAg,Jeff Doe,1513825499236,One of his videos was deleted. The one after Jacobs Ladder.
UgyEL44ZpR9VGx-fUKl4AaABAg,James Gillot,1513825499240,"In response to question at 2:25:30. regarding the sacrifice. A critical element of the idea of sacrifice is suffering, ie, in the present for the future. If christ does not suffer the physical, emotional and most importantly existential suffering (why have thee forsaken me) that a human would in that circumstance, then there is no equivalence. As Peterson talks about throughout this series, what really breaks people is when they are betrayed . Assume God can and does understand suffering in every possible way, the greatest sacrifice, act of courage, and faith would be to willingly put your son through that same trial. Why? To affirm existence, life and humanity. As Christ is one also one with god (in the trinity), it is not only christ that suffers in this act, but also god. To assert for life in the face of suffering is faith."
UgznDRR2gDGd4dmuiXB4AaABAg,Majed M,1513825499275,Thank you dr peterson
Ugz2uTdEFjSb_yKq8GR4AaABAg,Rammevil Caballero,1511233506096,"You know, just to comment on my hypothesis over the last question about why sacrificing the son would be more important than sacrificing yourself, I think is also has to do with the fact of looking beyond yourself and your own existence and being concerned with the consequences of you future actions in the manner you express around  1:04:22 the fact that all the future that will sprout from you once you leave this life is more meaningful than your now-self. 
I hope I can express the idea correctly being non native english speaker, its essentially destroying the only thing that will prevail for 'perpetuity' once you're gone. All those endless possible generations and their meaningful actions never coming to exist. And your DNA never passing on through them.
Something like that."
UgwhVsZjdXFKAN4x7ut4AaABAg,Jared Robbins,1511233506101,Jordan “tie springs to rats” Peterson
Ugz6fsen0zPDX4WJkL14AaABAg,oldtemberfury,1511233506109,"One thing I appreciate about those oh so arrogant New Atheists like Dawkins, et al, is that they would have crushed that new age lady horribly and produced a great laugh at her expense."
UgynPtooIRNXZCn7Ux14AaABAg,lauq1,1511233506116,"The sacrifice of Isaac and Jesus are both an ultimate test of faith. You say around 2:24:18 ""You have nothing greater to give than the best of yourself"", and how it seems logical in your view that sacrificing yourself is the greatest you can sacrifice. However, I would argue that for Abraham, who's wife was barren, and who so desperately wants a descendant, and considering the theme/prophecy of the generations that will later reign in the land, his son is actually the greatest sacrifice. You could also see it this way; if you'd be an old father and you would have to choose between sacrificing yourself or your son, then the choice is obvious to me that you sacrifice yourself for your son('s future) - and that's why it seems logical to me that instead of Abraham is asked to do the most heartwrenching; the ultimate test of faith, since if it's true, his son would be resurrected.

EDIT: More symbolically speaking, maybe you could argue that during the first part of your life, you make sacrifices for your future potential, and as you grow older (and hopefully some of the potential has been realized) the future potential declines; however, your descendant is in some way your continuing future potential; just like with Abram! He makes great sacrifices, and only after 4 generations his kin would reign. Future potential; the higher good, the transcendent, is something you aim at for your life, as well as for your descendants."
UgyHW_5mlVsGQGDkyg94AaABAg,il2xbox,1511233506124,1:28:57 made me laugh
UgyAYgBtf5ctEGirgHx4AaABAg,jake michael,1511233506131,""" You bettter watch out for it buddy!"" most heart-warming threat in this chaotic world"
Ugxw2VQNFk9ECDHzE0h4AaABAg,Thomas,1511233506136,Is there a transcript of this? I'm looking for the Bible Series video where he's making the analogy of the goth/metal person telling him to go fuck himself. I found that to be hilarious.
UgyLBXguuJnaA4iC7QB4AaABAg,Kaustav Majumdar,1511233506144,"The anomaly of people not affected by fear of Death and the reference to people who run funeral houses and all reminded of this unbelievably well done HBO show called 'Six Feet Under'. Anybody who wants to see something meaningful in their scheduled free time should consider it.
Dr. Peterson, Thanks for doing this. It is a sheer joy to know you exist and hear you articulate Life's meaning."
Ugx0FWHi833CXXaQKgt4AaABAg,Michael Ibach,1511233506147,"Jordan Peterson, the phenomenon described here with Abraham are a phenomenon that still exist and occasionally occur with Catholic mystics, Saint Thomas Aquinas comes to mind for an example."
UgwCB6MtgcuA1oDl_wB4AaABAg,Darko S,1511233506153,"I don't think JBP completely understands difference between feudal  and  capitalist/socialist societies.  It's not just the means of production and what is produced. Societies are qualitatively different, from what they can accomplish to how they are internally orientated. Some parts of Christianity are deeply feudal and are not compatible with capitalism."
Ugxv3GdbBd_HpQ_H-zx4AaABAg,Amigo Delaindia,1511233506159,hejhej fellow psychopaths. jbp has hypnotized u!!!
UgwXaLRS1-64GTFq4Bt4AaABAg,Constantly Correct,1511233506168,"The""questions"" are VERY annoying. Cut to the fucking chase people. There's no need to qualify every facet of your goddamn opinion. DJP could get through FIVE TIMES as many questions as he currently does... if you frail weaklings could simply buck up and get the damn question out.

In your quest to to behave defensively, and not face the problem head-on ....You people are annoying MILLIONS. It's similar to bragging. The braggart feels like it's beneficial to do it in that moment. He tries to gain status or whatever it is... BUT to everyone else listening, the person doing the talking is simply showing desperation and weakness. So... especially to the jackwagon at 2:14:44... just don't be that boner, eh? By depriving others of DJP's precious time, you are literally making the world a worse place when you do that nonsense."
UgzsM2FdDgGeNzYVx3l4AaABAg,Dr Timothy,1511233506173,"Although I am myself a believer in god, I do not think that just because some bad things are stated in the bible is enough to dismiss the wish-fulfillment or death-anxiety or the control the masses interpretations of the bible. For instance: The devil and his realm to which the wicked are sent serves many functions to these theories: Its wish fulfillment to think those you hate will be punished, it alleviate death anxiety by motivating people to avoid dying when they're bad, and encouraging them to embrace death when they are righteous. If its to control the masses: then if you want to control the masses, make it so that they fear disobedience. Otherwise, disobey all you want you still go to heaven when the state kills you. 
As far as the ""realistic dealings"" and ""not everything going right when you obey"" If you believed in a god who only did good benevolent things and nothing ever went wrong when you followed him, then the slightest injustice or evil in the world would turn people away, I mean look at the amount of people who think there's too much suffering in the world for there to be a god in the bible's current state.
The commandments are enough to dispel the idea of wish fulfillment (some of them anyway), the death anxiety could be dispelled by the idea that the commandments are tough enough that you might never get into God's kingdom, the mass controller theory can be dispelled with the parts ware god denounced faith in princes and when he denies giving the Israelis kings, and when Christ continuously finds himself in trouble with the priests. Why would any self-respecting mass controlling state allow those kinds of verses in?

Also: Yes people can be cynical about music: https://youtu.be/oVME_l4IwII"
UgyFiYxVFFqDggKHDDh4AaABAg,Voin,1511233506182,"One important theme you see w/ God re-naming Abram to ""Abraham"" & Sarai to ""Sarah"", & you see this again w/ God re-naming Jacob to ""Israel"", Simon to ""Peter"", Saul to ""Paul"", etc, is God taking the role of a parental authority, & the ppl involved subordinating themselves to said parental authority. Think about it - who named you? Most likely your parents, who then had authority over you.

I think this is also another ""death/rebirth"" theme - the persona who went by the old name ""dies"" & is reborn in new dedication to God by their new name."
Ugw0G9RPw-9GNA2gg-d4AaABAg,-Cerpheseus-,1511233506192,The Jordan Peterson Question (((The JQ))): How rich and fulfilling could your life be if you only got your bloody act together?
UgwMzEeXbxGyyUCdz_B4AaABAg,Jim Canavan,1511233506195,Waft in some cat odor
UgzaysWqbzChqXRvMRF4AaABAg,Nameless •,1511233506204,The Ghostly YouTube People unite!
UgwtpeeBkpEbV8b16-d4AaABAg,R bere,1511233506208,This is the only guy I can listen to talking about rats......and stay interested  :D
UgwBtF_X_duzk9s8KOJ4AaABAg,DeMattMorency,1511233506215,I love this guy. He really knows he's addressing the world and not just his comfortable studio audience. I knows the game and stakes for which he is playing and he is not holding back. All in indeed.
UgwKPVv4-uAyhJpLKlJ4AaABAg,Native Wombat,1511233506219,This is the BEST lecture in this series so far. You really got on a roll.
UgyBpnL7LkfZGm5svOJ4AaABAg,Viggo Smiles,1511233510112,"How can anyone dislike this? Even if they disagree, they can clearly hear and see his thoughtfulness, passion, and his humanity. Sort yourself."
Ugx7XsatxOcsgiH2_pV4AaABAg,primpal08,1511233510117,"YouTube wants to bring in YouTube TV - basically an internet cable channel. They're going after all the content creators that aren't going to be part of it - a small handful of preferred content creators & traditional TV shows. Unlike with Facebook & Twitter YouTube isn't just going after those indulging in wrong-think. It's a disaster of a business decision but that's what you get when you have an SJW running the company. It has inspired the creation of things such as CRTV, The Rebel building an app, etc.
 
Andrew Scheer is a disaster. He's pandering to the mainstream media & come election time the knives are going to come out & they're going to cut him up like a Christmas ham. Trump may not be your choice but he was the only hope against a badly rigged system putting Hillary at the helm. It may not be a pleasant thing to realise but unless you're willing to take on the mainstream media you have little chance of getting elected & no chance of making any worthwhile changes.
 
Loving the series."
Ugz-x2Yxs7aJ-R3NA2F4AaABAg,Kyle Ganse,1508555110124,"Im starting to see Covenant/ contract as a commitment to higher self/transcendent self

raises hand at end thank you JPeterson!"
UgymajKR0JYyqrUqKOB4AaABAg,Hans Wurscht,1508555110154,47:03 lol! Awesome content spiced up with just the right amount of humor. JBP is probably the best speaker I've ever listend to!
UgwY9z5SkQvd1Tr34J54AaABAg,Deedless Deity,1508555110164,"At present, YouTube is run by an aristocracy,
out of touch with its plebs."
UgzI3dg0YEsSaVyFdhx4AaABAg,Deedless Deity,1508555110173,Relying solely on 3rd party hosted platforms for the core tools to run your life… what does that mean? What does that make you?
Ugx9KuLyw8GRCS8b8l94AaABAg,now im going to starve.,1508555110178,God bless you Peterson
Ugz0znHb-InrsDiFiiZ4AaABAg,Ryan Schriner,1508555110186,did not expect him to swear lol
Ugx4x0JOkAHhNQRX5eZ4AaABAg,Nohan Zainudini,1508555110193,Does anyone know the name of the painting on the thumbnail?
Ugy79QPnyaO4bGITGBB4AaABAg,SquareRootOf2,1508555110198,Abraham? Isn't that the cunt that almost killed his son because he heard voices in his head?
UgyFoaFmLbivs1-T2R14AaABAg,Ransom Bits,1508555110204,"I'd say cutting funding to a university as a penalty for oppressing freedom of speech is okay, but not to control what is taught. Freedom of speech is fundamental, it's more than a right, it is required."
UgxNBp35u1BrLquAkDJ4AaABAg,Jonas Damion,1508555110210,can i get some timestamps for the points where he actually talks about the stories? this is an absurd amount of reading into the stories
Ugy2IK068rZoqwYUfjJ4AaABAg,Karen Wong,1508555110218,"In order to impose tyranny, the communists first had to destroy the family unit which is the main biblical structure of the way the world works. The husband wife is the first structure and then upon that we add the children. That's an equilibrated system. The communists and in the same way also, the fascists, turned the children into spies against their parents and disequilibrated the system."
UgxtDfujlzI88Qc03oh4AaABAg,SK Mike Murphy,1508555110225,"When is the next Biblical Lecture happening?
Christ through a monkey wrench in the whole thing huh?"
UgwY7dfeW5c3as41iuZ4AaABAg,SameBasicRiff,1505963110231,kind of wish he followed through more with the love question. it has a lot more room for articulation. i can see why he would deflect it a little bit though.
UgydKBFSrqwRIyBNXZZ4AaABAg,Gee Jee,1505963110238,google becomes a tool of shadow social engineering crazies who run politics...it is known for years now
Ugy-6euodp2llLbRw4F4AaABAg,deb spence,1505963110243,Abraham is also called the father of believing. It is a promise that the messiah would come from Abrahams bloodline and Christians are believers
UgyiUM4jEPrzmvQSrjJ4AaABAg,Giampaolo Mannucci,1505963110250,"Well, fuck them all, I'm downloading the whole series on my local drive."
UgyJTFStIDC55je156F4AaABAg,gantmj,1505963110255,"There is a piece of art I haven't been able to find on the internet.
It's a Czech painting called ""eating ice cream with the aid of the secret police"".
I don't know the name of the artist, and the translation of the name of the painting might be off."
Ugz1e957jfdBKi4tqDl4AaABAg,SameBasicRiff,1505963110264,I like how intelligent Jordan's YT comments section is.
UgzI07DWywkNh9Kz0DJ4AaABAg,Andrea Lewis,1505963113880,"Regarding the question that was asked about Jesus crying out in the book of Matthew ""my God, my God, why have you forsaken me"", he is quoting the open line of Psalm 22. This psalm begins with this question of despair, however as you read on, a theme of trust, hope and praise emerges. It is worth having a look and could provide insight into Christ's quote at his hour of despair. Dr Peterson, this is why I think it was not edited out :-)"
UgzJ3U2svwSATghYu_p4AaABAg,camilleelizabeth,1505963113889,1:39:01 - gave me chills...
