id,user,timestamp,commentText
Ugj-GGuqqWnpJngCoAEC,Artemirr Lazaris,1503284628118,"If, you tell a human at a stage in their life, that is meant to distort the truth then it can create ruin.

For instance, telling a female that they will be raped at every corner, regardless if its true or not. Will have a significant impact on that society. i.e. societal chaos. For before hand the female never thought of this, naive, to the underpinning of goodness. Just asa male in the same circumstance of words. This is the power of the words, is giving or creating ideals or theories never congruent to the mind. SO contaminating or removing the innocence of the mind in ways to act un accordingly, by prognosis to fear. Thus, a malformation as disease exists.

Now, if a sect or someone that perpetrates these words and you battle against the rhetoric or lies or nonsense, and are demonized and hated.. you hated not first but hated for your truth, as the words have become the belief in which they want.

Then we have a massive theft of over several thousand years, trillions upon trillions of assets out of the house of knowledge the house of rebellion, in which does as it pleases on the earth, without law or regard, as long as it can feed itself, thus steals the brilliance of others. Ie, ferrilli, Taghauer. Many companies in which have committed acts against others, by war and or lies. Thus quickly build the world using money as a portion of the ruin they cause. So its a endless snake eating nonsense, in which the world exists in chaos, because order is not in place or stability. Since logic is removed to the pursuits of people .

The land I live in is a shit hole. there are many other pa lies worth while working, such as in the south, Italy and manny others, or navy, since in this land I live in, removes the structure of society, by claiming victim because they are told they are a victim, and thus the words... are the ends. to meet the means, in which destroys the very society. It's a really strange world.All things of this world are of the world... People ignore all the mannerism of present war of the world... and the lies in which the world exists. Yet, th thieves and or liars take what they can use to mislead and then steal the public purse, its al la mess..."
UgiCJQ23gvce3HgCoAEC,David Martinez,1503284628125,"Jordan ""roughly speaking its so cool"" Bae Peterson"
UgigPkFTSgIr43gCoAEC,Ethan Jensen,1503284628129,"It's sad to me that Jordan Peterson respects the Bible so much, and acts as if God exists, but doesn't believe in it!"
UggGsF2Wonp5THgCoAEC,FRAIL-T,1503284628137,Awesome.
UggHyeZmWbcf0XgCoAEC,Cooper T,1503284628141,I like it when Dr. Peterson talks about America. You can tell he's not from the South when he misplaces New Orleans.
UgjNM1mM6fnHUHgCoAEC,Van Darkholme,1503284628147,"GPS doesn't solve problems, it solves the same problem over and over again because it's a computer. Does Jordan know nothing of computer science?"
UghydcSVsr43P3gCoAEC,Spook Flytalker,1503284628151,Peterson University!
UggzzSV4h0K0_HgCoAEC,Joe Fletcher,1503284628159,"Doctor Peterson, you said that a structure must remain subordinate to what ever creates or maintains the struct UNLESS the structure perfect. That isn't necessarily true, if what ever maintains structure A also controls structures around structure A like structure B etc. in other words if the system of structures rely on each other none of them can surpass whatever maintains them all. This is important and I don't know if I'm right. I know you have thought about it more than me so I would like to hear your thoughts on the idea of transcending the originators of structures (gods) because if we were made perfect like the bible claims, the lie of the serpent would actually be true, that we could transcend God in our perfection. Thanks for reading."
UgjQEtNNtSFkd3gCoAEC,nicovideotube,1503284628163,"@8:47 ""so… alright so so ba..back to stories, so…"" (((counts to eleventy11!))) (((tells you why all stories everywhere were told and written))) MFW Ó_Õ"
Ugi4r771ONM9xngCoAEC,Robert Tunstall,1503284628170,becoming a Christian through drugs? thats awesome!!
UgieHbvFcSlfsXgCoAEC,Brendan,1503284633961,"15,859,533 views now. Very well done Dr. Peterson!"
UggCeVNDsKCAuHgCoAEC,cooper chauvin,1503284633967,This lecture is my favorite so far. It seems to me as the further we get the more logical and motivating the message is. Keep up the good work!
UghyhCwoz3oDzXgCoAEC,Hunter Velicky,1503284633974,38 people have dirty rooms
Ugic5G15qkeNvXgCoAEC,serilus4life,1503284633979,Brilliant.
UghOUXkdwS2rlXgCoAEC,phantomkate6,1503284633987,"PSA for people who might want to attend in person: there is a 50% discount on tickets with a student card, and that also applies on the already-discounted season ticket. At least as of last week, you can still buy season tickets which take into account however many lectures are left in the series."
Ugh0KOnTgUm8KHgCoAEC,Chase Herrington,1503284633994,I think I may be in the default position. I feel like I can relate to Cain too much
UgjXZtYbVWpX73gCoAEC,RatherBeAnonymous,1503284634003,"New Orleans is in Louisiana, not Mississippi
Where did you go to school, Winnipeg, Alberta?!? 

LOL, JKJKJK"
UgizQI0TbL_mzHgCoAEC,Ian Webster,1503284634014,"Around 2:28:30 JBP says that a rock concert can be like a religious experience ""without the dogmatic overlay"". This tells me that JBP has never been part of the metal scene."
UggDi1ceJuD1GHgCoAEC,Mitnichten,1503284634022,40:00
UgiyelIqPqmDJngCoAEC,Frank Remele,1503284634033,Does anyone know the title of the intro song?
UgiKFInMSVanjHgCoAEC,MayorMacDeath,1503284634043,"Jordan, my man, the hallucinogenic madhouse never ended. The tripping out never stopped. Instead it seems to have broadened. I highly recommend you check out erowid-dot-org. It'll blow your mind."
UghTJpTDg1BQZXgCoAEC,Kaiser Mertz,1503284634050,"My room is spick and spam in cleanliness, now to sort myself out!

Roughly speaking."
UggBnJ0sAKcQy3gCoAEC,ThePeaceableKingdom,1503284634058,"""the clearest answer to that is that it's a story, that you live inside the story""

And... 
4 minutes in Dr Peterson acknowledges that he IS a post-modernist! (As someone's been sayin' all along...) 

As the Doctor said - not Dr. Peterson - The Doctor, ""the definite article, as it were""... ""We're all stories in the end. Just make it a good one.""

Then follows (naturally) a whole lot o' good stuff, def worth the listen. But like a good ol' Baptist preacher, he continues to dangle in front of you a way out of all the calamities he conjures, if only you sign on the line and put a penny on the drum.  To do otherwise just wouldn't be appealing. Well, convincingly dangling shiny objects is an admirable skill - it's why Baptist preacher only have to work 1 day a week!... But the real meaning of the Flood stories, as Utnapishtim could have told Gilgamesh, is that there isn't a way out. The task of philosophical psychology is not to solve a problem which isn't solvable in the long run, but to come to peace with its existence. 

Without the secret of immortality, and losing even the gift to be made young again, Gilgamesh must return to ordinary life, to enjoy celebrations every day of his life, attend to his practical concerns, cherish the little ones who hold his hand, and make happy the spouse in his arms. And that lesson hasn't changed a lot in 9000 years..."
UgiMndkyaJR_DHgCoAEC,Gerard Mulder,1503284634062,This was enjoyable.
UghoHSkV-ongRngCoAEC,Robert,1503284634070,doesn't it bother anyone that the story of the flood was lifted from the Zorastarian Epic of Gilgamesh and predates Noah's fable by 1900 years?
UggBfbNpKWA6B3gCoAEC,Michael Morris,1503284634078,1:18:15
UggfbsYHeIlRAngCoAEC,Brother Delphi,1503284634082,"Probably the best lecture yet because JP has introduced the philosophy of Kant's ""Critique of Pure Reason"" at the very beginning.  i wish JP had covered this ground much earlier because it explains the roots of Post Modernism. If anyone is too intimidated by CoPR then Wittgenstein's pop version ""Philosophical Investigations"" is more digestible ;)"
UghKz8oDGXAAG3gCoAEC,shopgirlseeks,1503284634092,Does anyone know where to get copies of the slides in the Bible Series?
UghNdsE-RiBs73gCoAEC,WT_Neptune,1503284634096,I feel like this is the video I've been waiting for my whole life.
UggzbWR57QQCHHgCoAEC,Minase Bahamonde,1503284634103,"I love the guy, but it's been an hour and 15 minutes and I still haven't heard a single word about the damn bloody ark."
Ugi1-0M8D1wGMHgCoAEC,DLJ,1503284639806,The Ubermensch needs no routine.
UghSkvMtLYhbt3gCoAEC,tree pteradactyl,1503284639812,Steer clear of bitter  foes whos minds are closed.
UggknKYMiyvWv3gCoAEC,Jackie Greene,1503284639818,"Man, these lectures are excellent.  It's so exciting to watch. I feel like I'm witnessing a modern-day Socrates, or something like that."
UghVnTyutOPTzXgCoAEC,nms499,1503284639823,The world needs more teachers like you.
UgimbflZ_OSPmHgCoAEC,Adam Evans,1503284639828,Celebrate Canada150 and July4th by cleaning ya damn rooms! Lol
UgjvPPDNd9ARbHgCoAEC,Cleffa168,1503284639834,"Another episode with Jordan Peterson, another day for me to sort myself out."
UggarW1cIYZN1HgCoAEC,belleobscurytee,1503284639840,When I was young I thought freedom meant to do what I wanted. When I grew up I learned its in doing the right despite what I want.
UggUY2_oUqJOlHgCoAEC,Russell C,1503284639846,"Dr Peterson (circa. 5:15) - re: ""Hemispheric specialization"" etc. 

I realise this is the conventional orthodox model and language description but given your emphasis on the 'truth/facts' it might help in some cases to reframe the descriptions of the brain around the biological evidence. The biological body is based on the dividing of cells and there is an isomorphic mapping across the vertical midpoint line. We have two eyes; ears; hands; legs; ... etc. Not two half-eyes; 1/2-ears etc. In fact I'm advised by medical people to whom I put this point that there is even such a line running through the heart (or 2 conjoined hearts). 

In 'reality' (i.e. truth/fact) we have two brains crammed into one head space normally conjoined by a hyper-link called the corpus callosum. I would suggest that this arrangement is augmented by a '3rd' brain complex associated with the gut and the vagus nerves (x2). 

This degree of specificity in language/definition is not material for general run of the mill medicine - as complex math is not necessary to buy and sell apples. However, it becomes more meaningful when a complex systems perspective is adopted in areas of research into systemic disequilibrium such as autism and perhaps even some forms of mental health triggered by stress.

The PC notebook I am typing this on has 8 central processors coupled in a homeostatic arrangement to produce a viable (mostly) working system known as (identity) ""Windows"". We can also note the similarity between the three-brain model of the biological body (2-head + 1 gut) and the trinitarian model applied in some religions -- e.g., Christianity and Hinduism.

My interest (and implied question) relates to how (if any) a more accurate grounding/mapping of the theoretical mind-brain model and language onto the actual biological evidence would facilitate new thinking and insights into complexity and inhibited harmonious development?

There seems at brief glance to be very little research literature on this area -- apart from, perhaps, ""split brain"" topics. 

Do you have any thoughts on this area and/or suggestions on how to progress research etc? 

As a side-note: I'd suggest the perhaps the archetypal struggle between 'brothers' (Cain and Able) can perhaps be also understood as part of this emerging 'single' identity (in most cases) from two head-brain systems. The 'problem' I have with the dominant hemisphere model is that it assumes, a priori, a very 19th century 'flat earth' model of singularity in identity when in fact the evidence suggests a more dynamic emergent model is relevant for 21st century challenges."
UgjO9snsyssEB3gCoAEC,BrokenSocialCompact,1503284639851,Woo!
UgjRTYbqTZspm3gCoAEC,William Thompson,1503284639856,"I'm having a ""sorted affair"" with these videos"
UgijrkyUQckP0ngCoAEC,*Der,1503284639860,"This is a bite sized quote worth of a tattoo:
2:09:22"
UgiSPwa0BNs9VngCoAEC,Zach Moody,1503284639866,I slayed my father and cleaned the underworld. Thank you Jordan Peterson
UggcnQJgFTanaHgCoAEC,Sandra Anderson,1503284639870,Isn't it curious that there are more than 200 Global Flood legends in cultures from all over the world that had not been influenced by the Judeo/Christian tradition. Perhaps its true!
UghF3dr6f39OTngCoAEC,RubberKidney -,1503284639875,My lobster is more dominant than your lobster.
Ugi6Gva_RBb1ZHgCoAEC,Omikron,1503284639882,"He gave upon us the flood because we was too sinful, and then say he never do it again. But now when you look on the planet and the state of humans, we are even in the more sinful state than ever. Now it is on the whole planet in the Noe time that sinfulness was not on the whole planet.
IF God knows EVERYTHING, what is the point give upon us the flood, if he KNOW that does not change anything. And people will be even more sinful.
WHAT IS THE POINT OF THIS? If he know everything, that doesn´t make any sense."
UggX7SKCNuR4ingCoAEC,Louise Belcher,1503284639886,"This series is easily the best thing that's ever happened to my faith and reason. Thank you, Dr Peterson, from an estranged believer."
UggU-X6wGta5v3gCoAEC,AJ Ellis,1503284639891,52:38 I think this is the mode of being that a lot of people who claim to have ADD are actually experiencing
Ugg6XbBs4IXAa3gCoAEC,Lethal Bizzle,1503284639895,Great video to clean your room to. Seriously though this guy is a hero
Ugjuu5Tmq2aSgngCoAEC,Ryan Plethra,1503284639902,What the fuck was that? 1:41:00
UgjMbgA_BzP1MHgCoAEC,Smart Cat Collar Project,1503284639905,"The sea level rose 3 to 5 meters between 3 and 4,000 years BC... higher temps, google it.  That could explain all those flood stories in different cultures, not only the Bible.

20,000 years ago the climate was in an Ice Age period, and the seal level was more than 100 meters lower than today. Men were already modern Homo sapiens sapiens, not much change until now, so when the temperatures rose again, some 10-12,000 years ago, and the sea rose some 130 meters, the flood must have imprinted the collective memory ! Considering that most people most likely lived near the sea, deltas, big rivers, this must have been an incredible change ! Of course it didn't happen in a day, but at some points the rains and sea rise must have been brutal !

Of course the Bible is mostly about symbols, mind, psychology, but in this case, history and psyche are clearly linked !"
Uggw_AdbNx7nRHgCoAEC,Coal Dust XIII,1503284644150,Crowdsourcing as one of the pillars of the institution you propose...What system would there need to be if people are wanting to pick the easier questions (meaning to mitigate this issue)?
Ugh7Q02LlLhlfXgCoAEC,Dwayne Eutsey,1503284644157,"Although I wish I had been able to benefit from these talks about 10 or 20 years ago, they still showed up in my life when I needed them most. Thanks, Prof. Peterson."
Ugi6JcPMTiEFsXgCoAEC,mathew hill,1503284644166,1:15:50
Ugiw6-a7OqGqsXgCoAEC,Артём Белозёров,1503284644173,"I have a very bad feeling, that a lot of people in the audience perceive Mr. Peterson as entertainer, in other words, not as seriuos as they should. There is no doubt, Jordan puts some humor in his lectures, but these are very deep stuff. However, maybe I'm to serious about it."
Ugg3zYBbN-NvTXgCoAEC,Ruth Giles,1503284644189,This is amazing. I don't want to go to work - I'd rather watch your lectures all day.
UghsIPGj-IhNR3gCoAEC,Felix Rubér,1503284644196,LISTEN GERMANY 🇩🇪 In the comment section of the last episode I saw hell of a lot Germans or people living in Germany replying to the 'Where are you from'-comment. Would you like to connect? I'm very eager to meet actual human beings who listen to JPB and appreciate his work.
UggtQf2odvOrpngCoAEC,Felix Rubér,1503284644205,I'm already exited just listening to the intro. Thank you JPB.
UgglmMzDmf0-pHgCoAEC,agentssith,1503284644246,"1:10:00 derivatives are powerful abstractions where you can make a lot of money. Well,  that is the problem isn't it? Value is not something that ought to be derivatized or leveraged in this way, in purely an abstract sense. It is the very definition of gaming the system. And extremely risky with OTHER PEOPLE'S  livelihood. Come on Jordan. You can do better than this."
UgjPjcCHNGW-r3gCoAEC,k3nny111,1503284644251,"Peterson mixed up his slides and gave one of his Personality lectures instead of a Biblical Series one. Well, interesting anyhow."
UgigZMzHDZB1EXgCoAEC,tadm123,1503284644263,Jordan get Ravi Zacharias and Ben Shapiro in your show.
UgjmyKCmwXKCUXgCoAEC,Esteemed User,1503284644272,"New Orleans isn't in Mississippi, it's in Louisiana. You're Canadian though, so it's cool. I don't know my Vancouvers from my Qubecs."
UghfA5a8gQ-Mp3gCoAEC,Daisy,1503284644282,"Time to clean up your rooms, roughly speaking."
UgjMhv9qFzPGvHgCoAEC,J M,1503284644291,Jordan Peterson 4 PM!
UggM66N4CHgX2XgCoAEC,peanutgallery77,1503284644297,"Wow, 45 minutes in, JP has just finished saying that when people get isolated, out of a routine, they no longer have the social, sanity signals that keep them sane.  This, I think, is so true of the new generation that I count myself as a part of.  A lot of people don't have a routine, we are spending more and more time alone online, instead of getting those sanity signals we need to maintain sanity.  I have noticed, that when people become unemployed, they tend toward an ideology because they ensconce themselves in an echochamber like corner of the internet and end up ""drifting."""
Ugi_zBwNVlIrH3gCoAEC,Brian A. Nichols,1503284644310,This man has earned a full flowing beard.
Ugjm42DSiDgNVHgCoAEC,Moe Ouerghi,1503284644318,"""Beware of wisdom you didn't earn."" He just blew my mind. This is exactly what I think when I hear 20 year old hippies talk about ""being enlightened"" after having a couple of acid trips."
UgjHQHijC82apXgCoAEC,RyeBread1848,1503284644329,"Within the realm of youth slang, Dr. Peterson would best be described as ""woke."""
Ugjgta2cT8F-Y3gCoAEC,Daisy,1503284644338,"JP isn't the dad we deserve, but he's the dad we need."
UgjMwqROrzWr63gCoAEC,yewwowduck,1503284644343,"1:44:00 ""ooooh, good, I wasn't just failing to understand where the flood stuff was"""
UgjH4RcBk9UpdngCoAEC,Zachary Cieszinski,1503284644352,this one hit me pretty hard
UgiqW30eP6w_43gCoAEC,shofforth1,1503284652616,"As a teacher I have had to see the most ridiculous teaching methods and edicts passed down to us by a small politically favoured few. I believe that failure to educate properly is what has happened. I have the post modern crap appear in many of subject areas. I am more than excited at the thought of humanities being taught in a fair ,balanced way and cheap to so many!"
UghN-DaW0wE953gCoAEC,smokinblues74,1503284652623,"Dr. Peterson, a small point, Louisiana was responsible for the levees in New Orleans, not Mississippi. The damage in Mississippi was actually done by the storm itself. But I will grant that Mississippi is probably only slightly less corrupt than Louisiana."
Ugi1U3JAYGa1TngCoAEC,manuel luz,1503284652627,Let's just jump into it
Ugj89baAETAkd3gCoAEC,mark boggs,1503284652632,"Jordan, you need to talk to Graham Hancock about ""The Flood""."
UgidGe2aenK5zHgCoAEC,Yosef Estill,1503284652638,U aight
UgiJcBiQv7WS7ngCoAEC,D1E5ECT,1503284652643,Lot
UgiFSwDgKVDUy3gCoAEC,Mr.E.Shoppa,1503284652648,The gap between discovering a bad career direction and the great flood or creation of the cosmos is (maybe) a little too huge? I don't want to be a party pooper here. The flood seems like it would correlate to bigger stuff - not so much just an individual thing - but I guess that's the way it's meant. Thanks for this fascinating and brilliant lecture!
UgiLNWRtaUe1_HgCoAEC,Verbal Learning,1503284652653,"As someone who is skeptical of the nature of religious experiences i don't think it's necesserily correct to describe the pessimitic view of these drug induced experiences as mentall illness or delusions. I think i'd categorize it a bit more broadly and   say that religious experience is something that can be or is induced by neural chemistry. So if our neuro chemistry is capable of creating these experiences and we can engineer drugs to replicate these effects or create ones that are similar or indistinguishable it suggests to to me at least that if people have religious experiences outside of drugs, it's more likely to be caused by them having somehow managed to get their neuro chemistry into a state that induced said religious experience, as opposed to it being them accessing transcendant knowledge either from god, the universe, or the collective unconcsious etc.

Therefore the most simplest and most logical explanation for the time being is that the experience is rooted in biology and therefore has explainable causational links that are currently too complex for us to answer comprehensively with our knowledge of the brain as it is today. Rather than being proof of some sort of deeper cosmological connection between our brains and the universe. Although i by no means want to close the door on that possiblity, as i think it's too early to make a proper conclusions."
UgiH5vP2KyyHrHgCoAEC,Aleeza Allecra,1503284652660,"Do you think the stories in mythology, are really, metaphors for neurological architecture?"
UgjJTMLD-b3QIXgCoAEC,Burning Daylight,1503284652664,Is there any value in clapping? as it annoys me.  I wonder if Peterson would have an opinion on this..
UgiVwMzRswGLFXgCoAEC,Phillip James,1503284652670,"tell this to my video camera, I'm attending to it everyday, servicing it everyday and still it continues to fall apart. 
strangely I had a water drop symbol come up on the screen for the first time this weekend. it was condensation but it is symbolic of being flooded"
UgjGiN93tiW6PXgCoAEC,Sem Nome,1503284652674,"I have to leave this link here: 
http://www.bbc.com/news/world-us-canada-40480386 

Let's a minute of silence for this poor child's soon to be damaging life."
UgiHd_Wt7EqUTXgCoAEC,13StJimmy,1503284652682,"Being from New Orleans, his metaphor really hits home...
The State and city gov is so messed up, its sad"
Ugg8hYPti815cHgCoAEC,Sorting Myself Out,1503284652690,"Dr. Peterson, you mentioned Timothy Leary - What are your thoughts on his 8 circuit model of consciousness?"
Ughc2n2MKk9jPXgCoAEC,Shankabottomus,1503284652694,"Just has to go head with whole redefinition of truth spiel in the first 5 minutes. 
I just can't seem to even get myself to the plane he's thinking on regarding the ""functionality = truth"" thing.  Truth means what is true. Functional means what works. 
Why conflate two unrelated concepts that are clearly delineated?"
UggzQd1wMF-HGHgCoAEC,Daniel Lassander,1503284652702,"In some ways i see Jordan B Peterson as the solution to the madnesss, and in some other ways he seems to be helping it along. I cant express in words how important he has been to me personally, but from this perspective it seems less of rules to live your life by and more do as you wish. Which is wrong because you need the morality and i dont  see it here."
UghRUyYWoLDHmHgCoAEC,Brendan,1503284652707,"""If you don't have a lofty ambition, than you suffer miserably.""
- Jordan B. Peterson




Another brilliant pearl of wisdom from Dr. Peterson."
UgiUELN0Ws7oRngCoAEC,Both Eyes Open,1503284652713,XOX Thank You
UgiGDAHSqkSDUngCoAEC,Benjamin Wood,1503284652715,"One of the greatest overviews of many aspects of JBP's work that I've encountered, to date. Absolutely gripping lecture."
UgirU6fMYqQZEngCoAEC,Pen Paper,1503284652721,"So I ask my kids to ponder: it's your choice everyday, either nothing matters, and you can comport yourself accordingly or.... everything matters. Which is more probable? You're here, made of matter... so it matters! Nice!
Thanks for making that clear..."
UgiMAx5Z6GODWXgCoAEC,LaNor O'Fronzworth,1503284659665,"Wow, this is some valuable work"
UghlUaQGV6ETRXgCoAEC,menteencoma,1503284659668,"that Entropy analogy is not quite right, is it?"
UgjGspYtE5OH33gCoAEC,Ellie Lowehiem,1503284659674,So are you filling the void that Joseph Campbell left?
UghzPoe4_gInMngCoAEC,Frank Kelly,1503284659680,"On the idea of an online university you should definitely talk to folks like Coursera / EdX and learn about what they have learned.  The one challenge I see though with online university's is they lack the community that typical brick-and-mortar colleges have. And that community results in some ""peer pressure"" as well as a sense of common purpose than can help drive, motivation and keep people on track.

If somehow you could create local communities of ""followers"" (if there's enough of a concentration) as well as online communities (e.g. slack , telegram) for those folks who don't have a large concentration of folks nearby. 

Best of luck with the idea."
Ughej5zhJ5_613gCoAEC,CallTheAmberlamps,1503284659688,GET TO THE FUCKING POINT
UgjtMgfsQDa9dXgCoAEC,Janice Phillips,1503284659693,"ahhhhh. At 37:00ish
I'm a very dedicated wife (22yrs) & mom (17yr old son).
I may sacrifice too much of ME on occasion because I do feel underappreciated which causes feelings of resentment.
I do keep my room clean & pretty and I run very fast. ;)"
UghHkiVLStCQc3gCoAEC,Gabriel BP,1503284659706,I wish they made this louder in post production. Love these lectures though
UgjYRubw0Qtr-3gCoAEC,Hoxton Fitness,1503284659714,THANK YOU MR PETERSON WOOP
