id,user,timestamp,commentText
UgzwGyrNALwShSKnawt4AaABAg,Saurischian Designer,1503284728320,"I think the bible is just a Bronze Age book.... *waits for response*""Good...good let the hate flow through you."""
UgyPkTZtocCq7XGhii94AaABAg,AnUtter Mesh,1503284728330,This is probably quite the long shot to get noticed but I was wondering if Professor Peterson is aware of the works of Harvard Professor Gregory Nagy and the Ancient Greek Hero. Having studied both their bodies of work I find that a lot of parallels can be found within their core dialogue and understanding of the world based on their fields of study.
UgxlJpLD65J0suEu85R4AaABAg,M3TA,1503284728338,https://www.youtube.com/watch?v=3Y6bCqT85Pc
UgzJ2-yF7TSOY4Gom4d4AaABAg,Hieronymus Humble,1503284728341,"If the creeping forces of nihilism decide to shut Peterson down, he ought to pull a Stephen Crowder and join CRTV.  Reading these comments, you can tell that Peterson is already casting pearls before swine. 

Also, that story about Antarctica he mentioned was about an explorer named Shackleton.  Truly an incredible story, there was a documentary on Netflix at some point (called Endurance), worth tracking down and watching for sure."
UgzZ-pYZj98wWiEcPR14AaABAg,Konner Scott,1503284728348,"Seems to me you've inspired an entire generation of rationalist thinkers to reconsider their positions and give some thought to the merit of religious truth. That will not come without resistance, of course, but I just want to thank you for all of the food for thought you've granted your audience and to let you know that it does not go unappreciated."
Ugy-_vDj7jFmh8K4vNJ4AaABAg,dragaoastro69,1503284728354,"Professor Peterson is one of my personal heroes, a men of integrity and intelligence, making us think and wonder. In the West, as things are going, he is a light in the dark. God bless you professor and the ones you love and also all who listen and enjoy this intellectual journey."
UgyhnFDXWCT5L_-dJcx4AaABAg,Jackson Nexhip,1503284733198,damn that question at 2:26:00 was tight
Ugxs-njVakl0ef_4C0t4AaABAg,Jackson Nexhip,1503284733208,2:09:00 bless <3
Ugz1if1NE1P_GRbOf254AaABAg,0mnis14sh,1503284733217,Chuck a compressor on those mics! Whoever's in charge of the gain wont have to react to every persons differing volumes.
UgzaAv4akPM7EWNu7Il4AaABAg,stianchrister,1503284733222,The shit that happened recently at Google made me sell a stock that made me tens of thousands of dollars.
UgxFF_UNgaA0SqJTfit4AaABAg,sodahead 0,1503284733229,47:46
UgyUHBrJEgfY6Kp8CRd4AaABAg,A2D MHB,1503284733238,"2:17:50 : ""I don't think we know what the upper limits of human possibility are.""... But we do know that whatever they are, Christ transcended them."
UgzkOQMHYcBJ847Lvn14AaABAg,A2D MHB,1503284733243,One of Doc P's most heroic moments ever was at 1:58 when he cut off that new age nutter.
UgxlvSsel_MbhxrppGt4AaABAg,Bob Beckel,1503284733250,"I think Professor Peterson said he was cutting his Bible series lectures to once a month.
Did I hear that correctly?  Listening to him talk is therapy for 50,000 people.  I am hoping
it is therapeutic for him as well.  He is such a wealth of knowledge.  I don't care what he
decides to talk about.  Please, just keep talking."
UgxojCViVFIVWV1uHol4AaABAg,Psychedelic Football,1503284733261,@47:03 cracked me up 😂
UgySdO8DFdWE48Dywdp4AaABAg,Brendan Tannam,1503284733268,"The explanation for 'Eli Eli, lamasabachtani' probably relates to Psalm 22:1. The whole psalm is worth reading because it talk of a man who is broken, provoking the wonder of people looking at him in deep trouble, and throwing his hope on God."
UgzJzvqBZGZJ0CiEquZ4AaABAg,Xargxes,1503284733275,1:42:10 What language did he speak? Jouaou? How is this written? I have never heard of that language before..
Ugxuex6l9FZlgtALRO54AaABAg,Marc Jurchak,1503284733282,"On the ""my God my God why have you forsaken me?"" Question, Jesus was quoting a Psalm, which was a hopeful psalm if you read the whole thing."
UgyH-njTTqeSPzxc8AR4AaABAg,SlothyTwoToes,1503284733287,"Google may control a large part of media content but they over play their hand. We are the users and there are billions of us. Without us you don't exist. You cannot take away what good content you have been blessed to be a conduit for and expect us to take your shit. Jordan Peterson, people like him and their ideas are so much bigger than you tools at google and don't think for a second that you can't be replaced."
UgzaRzwnqFw5AXIKqUF4AaABAg,Sandbag64,1503284733296,"I don't like that the people ""asking questions"" are starting to use that time for stating their own theses to the crowd. If you talk when it's time to ask questions, your statements shouldn't be statements and should end with a ? instead of a ."
UgykuHRHFX_Q42cXUSp4AaABAg,Yamikaiba123,1503284733302,"Viewer: ""The people I disagree with are cancer.""

Jordan Peterson: ""Watch your language!"""
Ugys3sMqCCP6o_iaNaB4AaABAg,Thomas Keller,1503284733310,"I think Jordan Peterson will maneuver himself into a corner if he continues unearthing biblically based wisdom. He raises thorny issues with his statements. Where did all that “wisdom” come from? With what certainty can we read back into the stories concepts that haunt us today? Or were they written for our times, and thus in a sense prophetically? He is amazed to see how these texts have been studied for ages. Yes, indeed. Biblical scholarship goes back to the Hebrew scribes, let’s say about the time of the second temple. Since then we have layer upon layer of interpretation. Peterson mentions the biblehub site as an interesting source. Mind you, the commentaries are all dated and of one bend. There is more, much more. Anybody picking up the book and giving it a serious chance will be in for a ride. It is the ultimate clean up your room challenge."
UgyvYYhcHxprt9mxtyR4AaABAg,Jim Mills,1503284733315,"God is love, God tells us the truth, ""love your enemies"" aka tell them the truth. The spirit is truth, ""confess Christ"" means to agree with Him. Try the spirits by seeing which ""truth"" they agree with."
UgxTb6x-39dwfAUn0_J4AaABAg,AudioGardenSlave,1503284733324,"""Screwtape Proposes a Toast."" Someone knew what universities were becoming."
UgygdPlHckLtadiOiHZ4AaABAg,loganj7238,1503284733330,"Jesus' cry of Father, Father why hast thou forsaken me is likely a reference to psalm 22 which prophecies of the coming Messiah, his persecution, complete succumbing to the will of the father, crucifixion from what I've been taught.. I hope that gives better context. https://www.biblegateway.com/passage/?search=Psalm+22"
UgxF3TLDR2IinSTu2qh4AaABAg,fagettiann,1503284733337,47:05 never heard him say fuck before lmao dang I love this guy
Ugx5Yd5Bm6atyGI7wAl4AaABAg,jarrod mifsud,1503284736359,For those of you who don't know Terence mckenna YouTube him and his notion on Christmas
UgyOQQMhsMmbVU2UWcN4AaABAg,Nicole PoPo,1503284736365,You're back on! So good!
UgwWvvJ86OKLfTAXQQx4AaABAg,Paul Anderson,1503284736374,"That question on ""love"" was bordering on the pseudo-scientific. Glad you moved on to another question after she attempted her second ramble."
UgzCqRV2w1n0Vc5m6bp4AaABAg,HopHop,1503284736380,"The ancient testament was written by middle eastern people and heavily commented upon by other middle eastern people for millennia. Then europeans jumped in mainly in the last millennium. The so called ""Western civilization"" should be recognized for the intricate and complex syncretism it is. The term itself is in denial of the complex truth by hinting that all of this was developed in the west. As if Europe where a remote ostracized island.
Great lecture by the way."
UgzMdOejlWmZmsQSICl4AaABAg,Tijana Miljovska,1503284736387,"Thank you very much for this session.  It spoke volumes to me as an art person.  Indeed, it is art that is our best friend during the tough times and I really appreciate you addressing this topic.  Wish you would approach different topics in the future from an art perspective if relevant.  I need to listen to this a few more times."
UgxCd6hmt_FDq2vM3Ex4AaABAg,Isaac Eustice,1503284736391,Love the story about the biker landlord. Success in the strange land...
Ugzqvu3ScxfQYW8WcWd4AaABAg,theblacklighthouse,1503284736399,"Glad he intervened at 1:58:00, it always gets awkward when people start going off on the energy-frequency-vibration tangent. That's not to say I don't have some idea of what they're aiming at, but it's simply too fanciful in its current form to spend much time on. Jordan's excuse was that he needed to give other people the opportunity to ask questions, but I suspect he just didn't want to entertain the New Age speculations."
UgxyL2Me70tru5Xg3Md4AaABAg,John Huckley,1503284736404,"Anthropomorphism is the attribution of human traits onto non-human entities. What is the act of attributing modern knowledge onto ancient mythologies? Contempomorphism? Whatever it's called, that's what we are witnessing here."
Ugwp0wc-k0P_8TQuFnh4AaABAg,Chris Duncan,1503284736410,"""Belt it out, man"" (JP).  This is a new one to me. Pretty good, eh?"
UgzCf3K3rwdwKlnMpvd4AaABAg,Nick Bultman,1503284736417,47:15 JP says the F word
UgzmPvmhQt3yHWhExKd4AaABAg,Michael German,1503284736423,It's by no coincidence that Google has tried to hinder you Jordan. The folks up at Google are run and controlled by these luciferian Jesuits whom goal is to seek and destroy anything associated TRUTH.
Ugw3n6mJYTdkJ53raEN4AaABAg,Michael German,1503284736429,Thank you Jordan for preaching God's word! You have really opened my windows of new perception of the Word of God. I've been Christian for almost an decade and never have I looked at it from the psychological POV. I truly believe the holy spirit is guiding you in your journey for truth and understanding. I'll be praying that YHWH guide you in your every step and that you don't trip over serpents who lie waiting for fresh blood.
UgypWIHqqkesg6nTV094AaABAg,Panos Kalaigidis,1503284736437,"2:24:43 On the subject of sacrifice. What is the son other the potential of the best parts of you, not only being perpetuated, but also improved upon even further, given corporeal form? In that sense, the son is a sacrifice of much higher magnitude and value, especially if you take into consideration that the father has to overcome the emotional bond between him and his son."
UgwoRaEZobOpbjQqj5Z4AaABAg,aussiebear22,1503284736443,"""This might not be a good idea. You might want to think about it.""

=> Dr Peterson's polite way of saying: ""Don't f#@k with me."" :P


Anyway, its interesting to hear of Google becoming an SJW cesspool. I'm not surprised that Conservatives and anyone else being suddenly shut down are suspicious of Google/Youtube. (And it certainly doesn't help when they recently fired that engineer!)"
UgyyxQ6QKWKNuMRpLf14AaABAg,Bill Clough,1503284736451,"In the Dictionary of Cultural Literacy: What every American Needs to Know -- and in the New Dictionary as well, the first section is on the Bible. If you're not familiar with the Bible in a functional way you're not literate in Western Culture. You can't read literature, law, psychology, even understand the philosophy of science if you're not familiar with it. It's a crying shame that Fundamentalism gave us a pathetic caricature of Biblical interpretation which is still widely confused with orthodoxy."
Ugy3Na0SVL0ATnxdUFJ4AaABAg,Black Pill,1503284736459,Is it bad that I binge watched this entire series over 2 days.
UgzyOMjFdqMU7tMc6s14AaABAg,Joe Mills,1503284736463,"Google has is too big and fat, it has become arrogant and complacent, thus competition is needed to bring Google to heel, take heed folks."
UgznXThXLiEyiuesNgF4AaABAg,Anthem Book Review,1503284736472,"Someone help? Peterson at one point talks about the creative class, I went back and can't find. Does anyone know where it starts in lecture?"
UgyH1GXk8uR3xOAE_Yp4AaABAg,Adam Brown,1503284736481,"""life is to be happy! WELL NOW YOU HAVE CANCER."" 😂😂😂"
UgykIpQmywV_tE0ToTV4AaABAg,david selig,1503284736487,Yes.  He's exactly right.
Ugzcp7FizOlT0UCLM094AaABAg,James Biehl,1503284742223,I'm the guy jumping into his seat at the beginning of the lecture! (0:13)
UgzUZtarM5SAn1JUqpd4AaABAg,El Rilla,1503284742232,Ughhh...that first woman with the heart chakras.  I can smell the incense and smelly dreadlocks from here.
Ugy9eG_v7Orv1tGSVCd4AaABAg,Red,1503284742238,"Don't worry, they can choose free speech or they can watch us burn their platform down."
UgwOug4mt9G_lBjAqM14AaABAg,Hein Bosman,1503284742244,2:15:15 Damn good question
UgzW70ImDDJ8TnXwrlB4AaABAg,Mihai Diaconu,1503284742254,"With regard to the Christ on the cross saying: Why has though forsaken me. The following interpretation is the one that rings of truth the most to me (saw it mentioned somewhere else also): 

Since the basic action he is enacting is that of sacrifice, and a complete one at that,  what if that is the moment when the Christ God sacrifices his last and most important  possession, faith itself. Doubt and Despair  seem to be two very defining human experiences and if humanity is to be redeemed then the redemptive act needs to contain these within it's substance. The sacrifice done with unwavering faith is not the same as that done through a loss and then recovery of said faith. There seems to be a qualitative difference there because one, to use Peterson's idea, sort of incorporates the shadow. 

My 2 cents."
UgyXh9tTWks8ET7SJ4R4AaABAg,PattiBowenSolutions,1503284742263,"So sorry Dr. Peterson, that the SWJs who are ruining Google are interfering with your account for no reason.   We hope there is a big spotlight on this to shame Google into freeing up the account or at the very least providing a decent explanation."
UgwUsxHe-XfjDvub-gJ4AaABAg,Rinat Sharifullin,1503284742271,"-Doctor Peterson, is sex good? 
-IT DEPENDS ON HOW YOU DEFINE SEX"
UgxXSFI6vyEdGOjQnXV4AaABAg,Me Too,1503284742288,"Perhaps its the scientist in him, combined with his will to truth as the highest objective of 'existence' which makes Dr P pull back from declaring a belief on the non-psychological (i.e literal) aspects of the Resurrection. It's just not possible to be sure so he remains agnostic for now (and possible for good)"
Ugyx4Qwh7YobBUIE3vx4AaABAg,Me Too,1503284742294,1:49:20 Q&As
Ugyy7v9hrK-oZgv_hdJ4AaABAg,Ian Atkinson,1503284742305,Think about thairs somebody tripping on mushrooms and listening to this stuff all the time now
UgwbvIbqxwKnjHXEQ1R4AaABAg,cooper chauvin,1503284742315,"I love doctor peterson; but on what he mentioned about were we could be if we would get rid of corruption and inversely make ourselves good 122:10 . He suggested tha we could triple our  life expectancy. Very interesting. He mentions alot of things like  abundance of food and health. I find this plausible to a certain degree but I think tripling MAY be far fetched. Unless you consider recent scientific advancements in what you could call ""transhumanism""(nothing to do with transexuals). I would describe it as the discipline that implies ""self-mutation""/""opportunistic development"" and refers to things like heart transplants as a casual example and genetic mutation of humans as a more extreme. Note that all of these would be done with the idea of betering the world. The question is what are your personal view towards this scientific domain? And where should the line be drawn? I would really like to get someone who understands the transhumanistic movement better to give the pro and cons if possible, and a religious viewpoint would also be very interesting. If you made it this far id like to see what you think. I wanna get various points of view on this little discussed very real subject."
UgxK126c4n2TzcZvEI94AaABAg,Lady Rotha,1503284742326,"When 'they' come after you, it means you are telling the Truth! We love you, Doc P."
Ugxy2pjXXQ8rrgNBO0B4AaABAg,Alex Grillparzer,1503284742330,The Nexus-Analogy at 1:04:22 made me burst into tears. This is so profound! I've never seen myself in this sort of light.
UgzYhgRBfvv5yseivmJ4AaABAg,Zeno of Caledonia,1503284742340,"After that woman asked a question Jordan started playing with his wedding ring and it made me uncomfortable. After he had to abruptly end the conversation with her which I think was because he was internally fighting his natural sexual urges and was hard for him to focus on the topic at hand, which is a pity because it restricts female engagement with such an important intellectual. His new influence and fame and everything that come with it must be a real test of character."
UgwlFL8Q8ia8QAk1fHB4AaABAg,Tomáš David,1503284742351,"25:51 
What you learn is in proportion to your willingness to make a sacrifice.
56:49 
If enlightenment is possible why aren't people enlightened?
1:28:42 
Dr. Peterson destroying idea that happiness is purpose of life
1:32:10 
I don't want to screw things up. That seems to be a reasonable goal for people.
2:00:49 
Do something important. Set your sights high. Make a plan. Figure out what you could be."
Ugwkl4lnrkfDmvPZms54AaABAg,Aristho Crat,1503284742361,The other day my wife commented that I seam to have become more  organized. (My middlename is disorderly) I wonder if 30 hours of Jordan Peterson lectures has anything to do with it... :-D
Ugxx40NV2Q6Ey-EJ9Hl4AaABAg,My Name,1503284742369,"Listening to this man feels like I'm cheating at life. 
It almost feels wrong to be able to just sit in my room and reap this wealth without giving anything back.
Though I suppose sorting myself out is a way to give back."
Ugy8TcKSTIEI-fkIdxd4AaABAg,distressed3,1503284742375,Why do so many audience members feel the need to mouth off a spiel when they're supposed to asking a question...
Ugxe-UHaBcQorsQZFUR4AaABAg,Mr. Mild,1503284742382,"sorry for the off topic comment, but does anyone know the name of the piece that the orchestral track at the beginning of the video comes from?"
UgxW6xJTw76pPqIFJMd4AaABAg,Kate,1503284742392,"I know how terrible it feels to be called racist, and sexist, and bigoted. I have a feeling that we are on the right side of history. Now we are silenced but tomorrow we are celebrated."
UgwaYgfNCukLIBtxU-h4AaABAg,Yassine Motaouakkil,1503284747278,Now I see where the trailer park boys taste comes from!
UgzRJgQo_ed-6fWkzTR4AaABAg,Vishal Raj,1503284747286,"Professor Peterson, first let me start off by saying that I am really big fan and agree and try to understand almost all of what you say. I have watched hundreds of hours of your content and it has helped me a lot.

But I have a complaint and criticism, and I would be direct.

The way you have , here and at an other place, tried to evade the question about the resurrection of the 'historical Jesus'so to speak, disheartened me. I know that you might've had your reasons to do that. Sometimes, the faith and belief in the irrational forms the basic substructure of all of our rational arguments and personalities. Maybe ""Jesus as the literal son of the god, or the transcendent"" is that substructure for you or maybe you really want to hold on to the faint possibilities of having life after death, out of body experiences, literal heavens and hell or things like that.. who knows... ?
  
But then I think, then in that case, you could be more straight and forthcoming in your confession about the subject. You should articulate it more directly and try not to hop around it in unconfident strides. It doesn't suit person of your stature, character and intellect ."
UgxqjWXzKBpiKEFM7Ih4AaABAg,Brandon Gable,1503284747295,"I would do some research into their policy that was ""violated"" and see if there may be some ambiguity in the language and see if you can connect some dots. It's probably a situation that some got offended about the religious talk. Namely that Jordan is absolutely on point and that's scary for some people because he is an awesome person."
UgztwNyB8FnNC7fR58N4AaABAg,charles ellis,1503284747302,"Surely someone has brought up the 22nd Psalms "" Oh my God why has thou forsaken me...It describes the situation at the crucifixion. Read it it made my hair stand up.Every educated Jew would have recognized the reference"
UgwtxPzSXlIKgq0kU6R4AaABAg,David Rapalyea,1503284747310,The Google Matriarchy struck back and fired Damore!  Women went home with vapors then xanax kicked in and justice was visited upon the wicked.
Ugy-Ltup0ngdeQoUARt4AaABAg,MrFastfinan,1503284747316,"They will not lessen, to  corrupt! crazy brains! but Thank you for trying save humanity"
UgyOp_HOAWf8UI5pt7x4AaABAg,Johannes Böckmann,1503284747326,"I find ""I don't know what I believe“ to be a very good answer, because it's true for most people and couragous because most people will not admit it. Even I often wouldn't."
Ugz95VWqEaG4HAGlAkR4AaABAg,ThompsonDB,1503284747332,"Regarding the last question, it seems apparent to me that most parents would consider their children more valuable than them. So Peterson suggesting that the highest sacrifice is yourself is true, unless you have children. It's something like a clear demonstration that you'd be willing to sacrifice what you most care for as a sort of contract with God that ensures the favour returned. Maybe also that unless you are God you cannot be expected to actually sacrifice your child for the good, that it's a truly divine act that doesn't work for mere mortals. Children represent the future, so if a human in linear time sacrifices the future it doesn't work out because that's game over, but God being outside of linear time allows for sacrifice outside of our parameters, our willingness to game over ourselves is an intimation of our link and divine heritage."
UgyFDdSt7qDDx7FobbZ4AaABAg,Just B. Cause,1503284747342,Simple answer to a complex problem: How do you be a good person? Don't let evil cause you to lose faith in humanity.
UgwFSPQ9ZAsMBimr_vx4AaABAg,Evren Sener,1503284747351,"Started off with Maps of meaning & Personality lectures and followed in to the Biblical series. JBP, your kermit voice has become a balm that soothes the  discomforts that accumulate throughout the week as I push through to remain sane another day. I can never thank you and your family enough."
UgxKl7uWt-2chyI0cbh4AaABAg,Jake Patterson,1503284747359,"Regarding that last question about Christ being the sacrificed son, and how difficult that is to conceive, here is my thought in my best JBP language: The son is of the offspring of the father (obviously) or he is what is produced by the ideal. Okay, so what does the ideal produce? If you achieved your ideal, you reached perfection. Jesus is regarded as ""perfect"" by Christians, so the idea fits. But this brings us back to the walled garden that we emerged from in the earliest stories. So is the sacrifice of Christ, from a JBP perspective, symbolic of humankind's absolute rejection of the of complacency, or rejecting the idea of dwelling in paradise? Institutionally, we had achieved Rome, the greatest civilization, and the Jews couldn't stop themselves from breaking themselves against it. I think that as a symbol, given the time period in which it occurs, this suggestion works pretty well. We'll see what the Master Mind says in future installments."
Ugz20SlnOQ-sSylrVgx4AaABAg,mike bustamante,1503284747365,"To the questioner at the end: 
The ""my God my God why have you forsaken me"" is the first line of one of the psalms.  The end of which talks about victory over the enemy.  So Jesus on the cross says the opening line,  kind of like saying ""I pledge allegiance to the flag..."" and the rest of the saying is brought to mind and it's meaning without actually having to quote it all. Plus you can't talk easily while being crucified."
Ugz-nUJObDCMbSvLRWh4AaABAg,Sue Riley,1503284747374,"At about 3:00 Jesus cried out in a loud voice, ""Eli Eli, lema sabachthani "" which means, ""My God, my God, why have you forsaken me?"" At the climax of his suffering, Jesus cried out the first words of Psalm 22--not a cry of despair, but a hymn of hope.  This Psalm is important in the New Testament. It's opening words occurs on the lips of the crucified Jesus and several other verses are quoted , or at least alluded to in the accounts of Jesus' passion.  (source: NABRE exegesis, St. Joseph edition)"
UgyZIFlz3MsaevBqPqN4AaABAg,Azlorn Magus,1503284747384,"Ah, fuck yes."
UgxLd4RMtcSVU059ap94AaABAg,Cássio Domingues,1503284747388,"Oh boy, this intro is just so epic"
UgxbeFxwFphphx24iCB4AaABAg,Ghost FacedNinja,1503284747398,"Really loving the lecture series. Sadly I only really have time to listen to them in work, and for that I must pre download them. I have been using iTunes and Soundcloud for this. Sad to say tho, they seem to be way way behind the youtube channel in terms of current content? This is lecture 10, but those other platforms only have up to lecture 6 currently. Any idea if this is standard? Or how long it'll take for content to go up there as well as here if at all?"
UgyGtjBsNsfo4mkEo0R4AaABAg,Даяна Гарис,1503284747404,Maybe sacrificing his son means he's sacrificing his future?
UgwkVRlcr5IFy7laHpZ4AaABAg,Bagels Truth,1503284747411,I think were alone now
