id,user,timestamp,commentText
UgzNLl5jxgJpuWq_qUR4AaABAg,Vic Martinez,1534561460219,Does anyone remember the book on trust written by the Harvard professor?
UgyCdC8BN5kxAmQqujt4AaABAg,flip twista,1534215860224,"1:20:07 
je sounded like rick from rick & morty
da dat da dat da da da dat"
UgyZ3nnfM8C0fI59CB94AaABAg,Sadida Satri,1534215860232,Woow the covenant is dharma
UgzOO2qs0nnxl56-ZLN4AaABAg,Anthony Dargay,1534215860235,You are a wonderful orator.  Love your stories you fit into your lessons.
Ugwxv-3wl0x_7dkP8jp4AaABAg,Bobbly Wobbly,1534215860244,"If Christianity is not what it is accepted to be which many reports about rejection and destruction or exclusion of female gospels and the poor approach of Christianity towards women, I don't think it's right to conflate the diminution of Christianity and therefore the attack on masculine values with the post-modernist etc.. ideas. They may have occurred at the same time but I can't see how given the limitations placed upon women by the exclusion in the pantheon that the two are directly connected. Perhaps the war on the male mentality is a natural but obviously less than ideal symptom but I am not sure it's right to state that religion's diminution is directly responsible and as such that religion is the answer. Ultimately it's a conception of the universe which predicates a belief in not just the unproven but also the illogical and irrational. It may have value in itself as a lifestyle/psychological text but God is still lingering and in that sense it can't be given too much power, but I agree that unchecked opposite swing might not be good either and the attack on the all things male is not culturally beneficial. As he says ""I don't know"" It's problematic I suppose because then if one is dealing with a good and evil diametric then the last thing we need is to identify those opposites as male female oppositions. I am sure I am looking at this simplistically and that ultimately the good is reason buttressed by whatever (faith, emotion?) and the bad is intolerance or despotism. Both sides and have been capable of both which makes it a bit more complicated. Perhaps it's just about intelligence vs stupidity. Maturity vs irresponsibility. The old Biblical go to values. I suppose they are culturally timeless and repeated throughout the ages which is why the whole Christian God thing irks me a bit, it demonstrates a lack of perspective and historical awareness. Functionally beneficial though I don't doubt."
UgxF1-h2XrlibhCfjkJ4AaABAg,Dick S. Ding,1533611060247,Jordan Peterson was right! (radical leftist alexia)
UgzD0FHIkcPRGAUUu7F4AaABAg,Super GANjaH LEaf,1533611060256,"My God thiz man iz fkn brilliant.  He speakz about life sooner or later having cataztrophiez.  And how a life of purpouze doez not mean forever happinezz,  but rather  voluntarily taking up a challange (chaoz) that one can conquer, he givez the example of worrizome parentz being evidence of a happinezz without child and how wrong that theory iz becauze of the virtue of nobility involved being a selflezz act.   And becauze of thiz paradox of life that iz alzo and alwayz part of Dr. Peterson's  hypotheziz, I began to think about the suffering in my life.  I began to think about how lucky I am that in my family I havent suffered a painful death of a family member.  I was really young when my grandparentz pazt away.  But holding true iz the lecture of Dr. Peterzon becauze all though I have my loved onez with me I alzo at timez live the dread that awaitz.  Hence why I am enetrnaly greatfull for thiz man.  Becauze of him i've been able to quiet thoze voicez some,  and get back to living life with suffering and joy,  which iz in ezzence of why adventure callz life, or elze we wouldn't be conciouz of our exiztence."
Ugy_dq2-2CjZWgKkiet4AaABAg,Ian Witucki,1533006260259,People need to simplfy their questions and not give their 2 cents.
Ugz5gEZfH-A9VEjQyKh4AaABAg,Marc Jackson,1533006260267,"Can yáll stop asking about JBP's beliefs please. For the two reasons he stated:

1) It's none of damn business.
2) What he means by belief or God, etc. are almost definitely completely different to everybody elses.

But there's a third reason - It's not useful to any body else what he believes and can only serve as a way of labelling him, of pidgeon holing him, putting him in a box and saying ""oh, he's one of them"". As soon as that happens we stop listening."
Ugwd2wsZktlNfGys4lh4AaABAg,jim Corrao,1533006260269,"Jordan has moved me to a complete re-examination of my own inadequacies. In doing so, I realized I'm a larger wreak than I imagined. So onward and upward as they say. Thank you, Mr Peterson, for being alive."
UgxNCivmR6OA78yTeWl4AaABAg,Austin James,1533006260277,Bible Hub must love JBP
Ugyadsa4INNqFjFgtfh4AaABAg,Austin Paragas,1533006260281,Still waiting for “sloop” to be edited
UgzsdrKnz_nG0xPZHhN4AaABAg,D MatLeo,1532401460289,1:57:00 (bm)
Ugyx8vNfASk3VmQZVp14AaABAg,Elton Mascarenhas,1532142260295,"I have not come across ANYONE who speaks with THIS much passion!
A man driven by the Love for Truth and Knowledge.
Listening to him puts a smile on my face and brings a tear to my eye. 

He enriches lives and speaks truth.
He is careful and intricate with his words.

Thank God for Jordan Peterson!"
UgwFGlfM_9TJclnTLZd4AaABAg,Nick R,1532142260301,I believe conservatives aren t creative because we have no bottled up soul & angst from which to derive from: we say what we mean and we mean what we say.
UgwMizeH9uoUiK0_GXl4AaABAg,Tell Me Why I Cry When I feel It,1532142260307,1:28:50
UgwaCYspW5P7huUj2eR4AaABAg,Kranti Jasper,1532142260313,37:21
UgyRL5eWd4BVLNvmT6F4AaABAg,Asphalt Pilgrim,1532142260321,Surely from the thumbnail that is Abraham: Pimp Daddy of Nations
UgxswtobPE08MDkuSqx4AaABAg,Sophrosynicle,1532142260325,"This lecture is the most beautiful, transcendent one I ever heard. I'm highly critical and moderately disagreeable and I find it hard (almost useless), in this soothing but energized sewing, to find fault (except for ""Sangrita"" Familia f.e.) to the point of breaking or losing the thread."
UgwaQMSIKRqe1viyuk14AaABAg,Mike Kanis,1532142260332,46:45 lol
Ugz9Ht2R5PsObuDHKP14AaABAg,jepkratz,1532142267093,Q: How can you tell who's Abraham? A: He's the one with the funny hat.
Ugw2K5mz8sm7cmAIWA94AaABAg,Jacobs Travels,1532142267098,"@1:36:08 - Hes referring to Sir Ernest Shackleton who got stranded in Antarctica and left his men at the ship frozen in ice to seek help. 

Help finally came for his men 2 years later after he found a Norwegian whaling community on the island of Grytviken in South Georgia and sent back for help.

What an amazing story. I stood at Shackletons grave at Grytviken on the day he passed after having arrived there on a vessel with the exact same name - the Quest."
UgztrsCro8jpsq53Cml4AaABAg,Willem van Ingen,1532142267107,"It always is the first step,  Dr. Peterson,  to make you silent and to prevent you from sharing your message. The second step is always  isolation from  family, followers and thinkers. The nazi's and the USSR used camps for that called concentration camps, which actually were isolation camps. The third step is killing. That is what Hitler did, and his friends in malevolence Stalin, Mao, 
Franco, Pol Pot and others in Africa recently. 
I've warned for this recently at one of the MIL series. Your life is in danger and you are very much in need of protection. Very soon there will be an idiot, mentally surrounded and supported by the sick leftist,  that will take his change. Be prepared for that  !!"
UgwsYmvoDp0hmlkciCB4AaABAg,Adam Kling,1532142267111,46:55 might be my favorite JBP moment. Lol
Ugx2bHF6DZf0s8DItpV4AaABAg,windsorswebsites chrisarquette,1529550267120,..google/YOUTUBE shut you down to remind you that they own the platform..just like facebook and all the rest... make sure all your video content is on the website you own so it cant be touched ...people need to remember...these social websites are not owned by you...they really can do what they want....
Ugw-dDeWVSp2hBFYGNV4AaABAg,Brain Phelps,1529550267124,"i kinda think Jordan is shoehorning in this sacrificing of the son to represent giving up something u love in order to grow.  A son does not represent a thing that must be given up for growth.  A son is sacrifice, pain, it is a thing you must work very hard to nurture.  If this is meant to represent delaying gratification, Abraham would have been asked to give up a lover or a house, or something or other, but definitely not a son."
UgwFX_TkTOn95RYpEDZ4AaABAg,truthordarequestions,1529550267133,"If Abraham was the Father of Nations, the Salem priest of the most high, the King of kings, was the first source and center of all nations.  You should really brush up on your history Jordan before making such misguided and uneducated claims. Like so many false prophets your Jesuit education has lead you down the wrong path."
Ugx5EgAgGBaAbdyMH3V4AaABAg,cokefudge,1529550267143,The people who ask questions at the end need to realize they're called up there to ask him questions not narrate blog posts
Ugzk15tN75Y_a8MdY2Z4AaABAg,There is only one KEK and Pepe is his prophet,1529550267147,"Well I guess I appreciate art now, damn it."
UgyQ8wik50g2kzkC7bh4AaABAg,Markus Junnikkala,1529550267156,"@2:27:47 ""Under such conditions even God himself would have doubt"".
That's some powerful stuff right there."
UgxdaS81Y6Q5BcNtxol4AaABAg,Biopsychosocial,1529550267165,"Holy cow,  I laughed my butt off when he told the drunk neighbor story."
UgzT1SFy-9BAP2yFvjp4AaABAg,Jeremy Poncy,1529550267168,"I love that Peterson seems to have found such an incredible balance between light and structure, between beauty and order, between liberalism and conservatism. As somebody who has been conservative my entire life and has generally viewed liberalism as useless, largely because I've hardly been introduced to true liberalism at all, I never thought I could have such a profound appreciation for liberalism. Jordan Peterson has made me more liberal and I'm seriously tempted to go buy a bunch of art right now and even to try my hand at some creative endeavor with no other aim than to produce something beautiful. And that is nothing short of a miracle."
Ugy-PohbRCWHO1KkZUx4AaABAg,y a,1529550267178,what is the car part website mentioned @1:15:15?
Ugw7dysluBlz7kYFFgx4AaABAg,Denali 96,1529550267183,"Phenomenal!!  Dr. Peterson is a voice for this age and I am drinking in every insight he pulls from the scripture. But I would contend that  neither the creation story, Noah, Moses, or Abraham, nor the prophecies of Christ, the life of Christ or his sacrificial death establish the true wonder and power of the God Story. Resurrection is the essential hook, as a physical event,  upon which everything hangs.  To relegate resurrection as metaphor is to pull the plug on the entire redemptive epic. I loved watching him wrestle with that question and I look forward to how he will continue to try and resolve resurrection in his mind and heart."
Ugx74eG2J2ctSnD-zdJ4AaABAg,L Z,1529550267225,These lectures are light in a very dark world.  Thanks!
UgyPV2UpjdTjWC4tfEN4AaABAg,Mr. K Dilkington,1529550267232,Same happened me on Twitter
UgxvDiuJDCJhP-V0Lr94AaABAg,hamza rahman,1529550267238,Ramzan mubarak Mr Peterson!
UgyjeO6VoiEoh4npyRp4AaABAg,F Blue Manzanares,1526871867243,U R phenomenal & UR Wisdom has Enlightened ME!! Thank U
UgwKvbuG2sQejeEk6EJ4AaABAg,Sharon Langdon Morthier,1526871867250,"Psalm 22:1, 'My God, My God, why hast Thou forsaken Me?' - Jesus was quoting the Psalms on the Cross."
UgwKMOKheohXkJ3-1Kh4AaABAg,Alexander Kelly,1526871867260,Microwave toaster story funniest thing I've ever heard. Can see peterson buying a toaster😂😂😂😂😂😂😂
UgzcpprU04zSLsmjY2p4AaABAg,Bernard Anderson,1526871870507,Brilliant lecture. (Scary about google. Deep state in action.)
UgzUkVJaBGG3cmooakN4AaABAg,David Barron,1526871870512,"my wife thinks im nuts,in the past 3 days i have watched 10 lectures and now she teases me saying oh your in class...... my mind is opened thanks dr peterson"
UgzKvIyAXS3FXH5l2Cl4AaABAg,Nover Edward,1526871870522,"1:20 


Teared up."
UgzEMBtZhbGegvbprhJ4AaABAg,Nathan Lapp,1526871870531,"I think the answer that Jordan Peterson is looking to own would look something like this. "" Do you believe in the physical resurrection of Jesus Christ? "" Then, "" Yes. "" Then, "" Why? "" "" Because I choose to. "" It is simple, it can not be attacked from any point of logic and it is a behavior that strongly reflects the decision you made when you got married. You could not logically justify such a risk, but you did it anyway because things in your nature urged you to. In the same way you can not justify logically becoming a believer but things in you urge you to. So you do it, and the rewards are endless."
Ugzw0N3Y3zaPKaTgOAZ4AaABAg,Anime Manga,1526871870539,Holy crap at the end when there taking about the sacrifice of the son. I thought what if it means the sacrifice of the embodiment of what you could be. With Abraham as a parent you always see people trying to make there children better then themselves or into what they wanted to be and With Jesus it would be even the sacrifice of the embodiment of the best you could possibly be to god for god and humanity to have that connection of that there's always something to be subservant to. I was thinking about this because I was thinking about how people sabotage themselves for fear of success or fear of failure and then I was thinking about monks who just give of everything as a sacrifice and I thought the sacrifice of the self I thought wasnt noble enough lol sure they serve as a logo to be inspirational to people like a priest but how can you really help other people without having enough to help them with and then I thought about how dr. Peterson is always saying aim for the highest good or truth or goal and work towards that. And then I thought if you actually could reach that goal then you would have more power to help more people and make a bigger difference through sacrifice like the idea of having alot of money or being rich but not living that way and using you resources to better humanity. The embodiment of the sacrifice of the best you could possibly be. Its just an idea though lol so dont hate me. Or it could just be another test thing. With Abraham sacrificing his son would be sacrificing the very thing god had given him to test him as his descendents would have the nations. And for jesus it would be god showing you the way and then taking that way away so that now it's up to us to pick up the responsibility of making the world a better place with the light already having been shined on the general ideas and directions taught and left in the bible through the morals and lessons another test I guess. P.s. I havnt read the bible so what the hell do I know. Lol.
UgzyEUxnhjtRqtCzm7t4AaABAg,Marcus Middleton,1526871870545,Sometimes I honestly can’t deal with JP calling me out on my bs. It burns my soul. I know it’s burning off the bad stuff in a way but it still burns
UgzLHGrF25HqQygCbSh4AaABAg,MC cashMax,1526871870552,22:00
UgyyDBHOvXsJyTGPoYV4AaABAg,Andrew MENDEZ,1526871870558,"ReaD Tve  BIBLE  YOURSEVlES PEOPLE... IT IS NOT IMPOSSIBLE... IT WAS MEANT FOR EVERYSINGLE ONE OF YOU TO UNDERSTAND...... God bless



Hes just explaining what ""Heee"" learned🙄😞😊

WHAT IF YOU  CHANGE ALL OF THE SUDDEN 🤗🤔"
UgywIJcjmZRxqvKm7Y14AaABAg,M- cat,1524279870566,An old music teacher once told me singing is like praying twice.
Ugxx4hqckjGhm3-G2jd4AaABAg,MC cashMax,1524279870573,those first 7 minutes were so damn interesting
UgybqU5Fa6cofpxDO2N4AaABAg,Mitnichten,1524279870578,"Q&A
1:51:20  [...]
1:58:19 How to overcome procrastination?
2:01:44 About solving the University problem
2:09:15 Comment about orthodox Christianity
2:12:44 Psychoanalytic attempt on atheism
2:14:46 In context of a quote, on the question of the resurrection of Christ, why is your answer to your own question ""I don't know"" instead of ""probably not""?
2:21:03 Why did Christ says on the cross""my god, why have you forsaken me?"" and about similarities between Isaac and Christ and difference of direction in sacrifice"
UgzBKNTm3n2XmLteeZt4AaABAg,Joel Gordon,1524279870583,"I'm not very good at expressing things in general so forgive me please... but the last question regarding Jesus saying, Father, why hast thou forsaken me is more about the atonement than anything else, I think. Christ came to earth to atone for the sins of all mankind. One of the more severe sins, if not the most severe, is closing yourself off from our Father In Heaven and shutting Him out. God had to withdraw completely in order for the atonement to be what it needs to be before Jesus died."
UgyEqko9afv2LCE6Dlx4AaABAg,Voltaren Istanbul,1524279870590,"the way i look at it,  the reason why they have Abraham lying to his wife, is because there are situations where lying is the only option. I know Dr. Peterson has a rule that says tell the truth, or at least do not lie, and I agree to the most part, but what if you are harbouring Jews during the Nazi Germany reign and they knock on your door and ask ""Are you harbouring Jews?"" . Well of course in that case you have to Lie. So that is how I see it . and the Brothers Karamazov is the greatest book ever."
UgxH58tnK5Fcd3hgeIB4AaABAg,sirfer6969,1524279870596,damn that was intense
UgyEjhTVopPAFgK_DF14AaABAg,Michael Pearson,1524279870600,"25:30 You have to be willing to sacrifice to be ready to learn something
45:00 beauty
1:57:00 NF theorizing"
UgzH5KRhECAb-srEAi54AaABAg,Terrel Armstrong,1524279870606,44:34
Ugz0uU3qYrepUuofZVJ4AaABAg,kickchick1974,1524279870613,"Sometimes during his Q&A part, I just want to throttle the people who waste their opportunity on the microphone by blabbing on and on and on without actually getting to the point.  Thank god he stopped that woman at 1:58... I think it would have been an incredibly long night had she kept going."
UgyXvI-yIXOaNRfqg0Z4AaABAg,Ben Leininger,1524279870620,Jesus that first question
UgwaYFJI2BKO4wsUE_Z4AaABAg,joel olivares,1524279870625,1:31:50
Ugx2Ccy3oNXswF0D5FN4AaABAg,joel olivares,1524279870634,"Ishmael = current day Islam = Iran, Syria, Iraq, Pakistan etc 
Isaac = current day Jew and Christian = USA and Israel 
= Brother against brother"
UgyjaGMuA7tmmO-xNvV4AaABAg,joel olivares,1524279877447,1:20:00
UgzRmb47RwwDq5wSYzh4AaABAg,Michael McCain,1524279877453,"5:07 Mark Zuckerberg testified before congress yesterday that this was in fact Facebook's plan.
Peterson is a prophet."
Ugzo9AOWUmYdDpi1LNZ4AaABAg,mrtheblr,1524279877459,"A few possible answers for the last question of Jesus being apparently abandoned by God: Either he takes on the sin of humanity becoming unholy, causing God the Father who is the embodiment of perfect holiness to be forced to turn away, or God the father cant bear to witness the death of his son, or the act of killing Jesus is the ultimate sin, and so God is entirely absent in that moment, or my favorite interpretation, which is that Jesus is making reference to Psalm 22, which can be seen as a sort of prophecy. Read Psalm 22, it’s relevance is quite profound."
UgyZy3x2QslEQOPacwx4AaABAg,FineFlu,1524279877467,🐸
Ugz8ltCZKPM4s1_9aNh4AaABAg,Justin W,1524279877501,people like artwork that they are told is good. thats it.
Ugzc0vuXU6t4VfOMzWF4AaABAg,Alina Rizea,1524279877509,"Dr.Peterson-  the words Christ say on the cross are the first line from Psalm 22- Jesus was quoting the psalm that best prophecise about Him. He was always teaching. We know the resurrected Christ explained the Scriptures concerning Himself to the Apostles. And also that in pre-Cross months He had already started making open references to prophecies regarding the need of the sacrifice. It just makes sense that He would mention the psalm that actually describes the scene that was going on.
In making this prayer his own, Jesus was not expressing a sentiment unique to himself. He was, rather, identifying himself with every human being who has ever felt himself to be at a great distance from God. Perhaps this prayer best expresses what we mean when we speak of “the days of his flesh” (Hebrews 5:7). It was in this deep sense of dereliction that we perceive that “the Word became flesh and dwelt amongst us” (John 1:14)…"
UgzC6xdSqNgrV7O7ykt4AaABAg,Tracy Greenwood,1524279877517,"47:08 first time I've ever heard him drop the F bomb. Listening to Peterson, I get self-conscious about the way I speak. He's the model of a great speaker and a great example of how to get your point across without a lot of profanity."
UgxOuynr5L4W23HXI3l4AaABAg,mikecorbeil,1524279877523,"You come to refer to a character who you name something like Metostophelese.  This is around or just a few seconds after 1:53:00.  And since you mention Faust as author, you clearly mean https://en.wikipedia.org/wiki/Mephistopheles; not Mephistophelese, but Mephistopheles, which normally shouldn't be pronounced as if it ends with ""ese"", not in English anyway.  Anyway, quote, "" Mephistopheles (/ˌmɛfɪˈstɒfɪˌliːz/, German pronunciation: [mefɪˈstɔfɛlɛs]; also Mephistophilus, Mephostopheles, Mephistophilis, Mephisto, Mephastophilis, and other variants) is a demon featured in German folklore. He originally appeared in literature as the demon in the Faust legend, and he has since appeared in other works as a stock character.  ... "". Note that none of the variants end with ""ese"".  Getting the pronunciation correct is helpful.  It aids with doing Web searches.

Update:  And later, you come to pronounce Metostophelese more like Mephostophelese.  It'd be good to add such thingsto the videos, so show, rather than only say, the words.  It isn't at all necessary for most of what you say, but it'd be helpful for soe ""things""."
UgzhavQTHlDhWUy5Fpp4AaABAg,mikecorbeil,1524279877530,"Friedrich Nietzsche , aka Friedrich Wilhelm Nietzsche, https://en.wikipedia.org/wiki/Friedrich_Nietzsche :  His last or family name is Nietzsche and not Nietzscha, so it shouldn't be pronounced in the latter manner.  I'd prefer to pronounce it as if it was spelled as Nietzsch or else (my preference) Nietzsché, emphasizing that the name ends with an 'e' and also as if the ending 'e' was assigned the French accent making that 'e' sound acute  rather than grave (like with 'è' and 'à', f.e.) or what I often call flat (flat for sound only and not the form of the accent character occasionally placed above vowels of some words in French), or silent, say.  I often say sharp instead of acute, and flat instead of grave; just a habit that formed, for ... some reason  probably related to music, for I learned and played a piano style accordion for several years and there're flat and sharp sounding keys, plus ""buttons"")  Anyway, pronouncing his name as if it ends with acute 'e', é, makes it verbally clear that the name ends with an 'e' rather than no vowel at all; as well as the fact that the name ends with a vowel and that it's pronounced clearly enough that the ending vowel can't be confused or confounded with any other vowel.  Search Wikipedia for ""Nietzscha"" and all you'll get are links for or about Nietzsche, even when 'e' (regardless of accentuation) never sounds like 'a', not in French anyway; or not afaik."
